,Original_Text,Class_String,Class_Number,Neuron_7
54," LONDON (Reuters) - The dollar dipped to a four-week low  against the euro on Monday before rising slightly on  profit-taking, but steep oil prices and weak U.S. data  continued to fan worries about the health of the world's  largest economy.",Business,3,1.486901
56,AFP - India's Tata Iron and Steel Company Ltd. took a strategic step to expand its Asian footprint with the announcement it will buy the Asia-Pacific steel operations of Singapore's NatSteel Ltd.,World,1,1.4116077
58," NEW YORK (Reuters) - U.S. Treasury debt prices slipped on  Monday, though traders characterized the move as profit-taking  rather than any fundamental change in sentiment.",Business,3,1.4014302
82, LONDON (Reuters) - The dollar held steady near this week's  four-week low against the euro on Tuesday with investors  awaiting a German investor confidence survey and U.S. consumer  inflation numbers to shed light on the direction.,Business,3,1.4021969
93,"NEW YORK (CNN/Money) - Money managers are growing more pessimistic about the economy, corporate profits and US stock market returns, according to a monthly survey by Merrill Lynch released Tuesday. ",Business,3,1.4512287
97," NEW YORK (Reuters) - Staples Inc. &lt;A HREF=""http://www.investor.reuters.com/FullQuote.aspx?ticker=SPLS.O target=/stocks/quickinfo/fullquote""&gt;SPLS.O&lt;/A&gt;, the top U.S.  office products retailer, on Tuesday reported a 39 percent jump  in quarterly profit, raised its full-year forecast and said it  plans to enter the fast-growing Chinese market, sending its  shares higher.",Business,3,1.48888
101,"Rising fuel prices, a bugbear for most of the retail sector, are helping Home Depot (HD:NYSE - news - research), the remodeling giant that reported a surge in second-quarter earnings Tuesday and guided the rest of the year higher. ",Business,3,1.3693428
106,"NEW YORK - Stocks rose for a second straight session Tuesday as a drop in consumer prices allowed investors to put aside worries about inflation, at least for the short term.    With gasoline prices falling to eight-month lows, the Consumer Price Index registered a small drop in July, giving consumers a respite from soaring energy prices...",World,1,1.4183224
147, TOKYO (Reuters) - The dollar moved in tight ranges on  Wednesday as most investors shrugged off lower-than-expected  U.S. inflation data and stuck to the view the U.S. Federal  Reserve would continue raising rates.,Business,3,1.457662
161,USATODAY.com - The Securities and Exchange Commission is expected to vote Wednesday to prohibit mutual fund companies from funneling stock trades to brokerage firms that agree to promote their funds to investors.,Business,3,1.4564933
180," NEW YORK (Reuters) - Kroger Co., the top U.S. grocer, on  Tuesday posted a 29 percent rise in quarterly profit due to  cost controls, but price cuts to lure shoppers caused earnings  to miss Wall Street estimates and shares fell.",Business,3,1.4541477
194," CHICAGO (Reuters) - Medtronic Inc. &lt;A HREF=""http://www.investor.reuters.com/FullQuote.aspx?ticker=MDT.N target=/stocks/quickinfo/fullquote""&gt;MDT.N&lt;/A&gt; on Wednesday  said its quarterly earnings rose amid brisk demand for devices  that manage irregular heart beats and products used to treat  the spine.",Business,3,1.4099056
198," CHICAGO (Reuters) - Medtronic Inc. &lt;A HREF=""http://www.investor.reuters.com/FullQuote.aspx?ticker=MDT.N target=/stocks/quickinfo/fullquote""&gt;MDT.N&lt;/A&gt; on Wednesday  said its quarterly earnings rose on brisk demand for devices  that manage irregular heart beats and products used to treat  the spine.",Business,3,1.3804705
216,"Health care and consumer products maker Johnson  amp; Johnson (JNJ.N: Quote, Profile, Research) is in negotiations to acquire medical-device maker Guidant Corp.",Business,3,1.45936
224,Credit Suisse Group announced plans to merge its Credit Suisse First Boston Securities unit with the rest of the company #39;s operations and cut as many as 300 jobs.,Business,3,1.4057616
228,"Hurricane Charley, the worst storm to hit the US in over a decade, will cost insurers just \$7.4bn, one insurance expert estimates.",Business,3,1.4586436
232,Bank of America Corp. yesterday laid off hundreds of workers at Fleet bank branches across the Northeast as the North Carolina bank began to implement its brand of ...,Business,3,1.339405
236,"WASHINGTON -- The price of oil charged to a new high above \$47 a barrel yesterday amid nagging concerns about instability in Iraq, the uncertain fate of Russian petroleum giant Yukos, and the world's limited supply cushion.",Business,3,1.3340636
254,"A closely watched measure of future economic activity fell in July for the second consecutive month, reinforcing evidence that the nation's financial recovery is slackening.",Business,3,1.3388035
256," NEW YORK (Reuters) - Colgate-Palmolive Co. &lt;A HREF=""http://www.investor.reuters.com/FullQuote.aspx?ticker=CL.N target=/stocks/quickinfo/fullquote""&gt;CL.N&lt;/A&gt; will cut  about 4,400 jobs, or 12 percent of its work force, and close  nearly a third of its factories under a restructuring, the  consumer products company said on Tuesday.",Business,3,1.345375
301," &lt;A HREF=""http://www.investor.reuters.com/FullQuote.aspx?ticker=RSE.N target=/stocks/quickinfo/fullquote""&gt;RSE.N&lt;/A&gt; jumped before the bell after General Growth  Properties Inc. &lt;A HREF=""http://www.investor.reuters.com/FullQuote.aspx?ticker=GGP.N target=/stocks/quickinfo/fullquote""&gt;GGP.N&lt;/A&gt;, the No. 2 U.S. shopping mall owner, on  Friday said it would buy Rouse for \$7.2 billion.",Business,3,1.5630616
405,"TOKYO - Japan #39;s benchmark Nikkei stock index briefly recovered to the 11,000 level Monday morning on widespread buying prompted by advances in US shares last Friday.",Business,3,1.3969982
422, LONDON (Reuters) - The dollar bounced off recent four-week  lows against the euro and yen on Monday in thin August trade  with investors focusing on U.S. data and a speech by the  Federal Reserve chief later in the week.,Business,3,1.3568727
426," NEW YORK (Reuters) - Retailer Kmart Holdings Corp. &lt;A HREF=""http://www.investor.reuters.com/FullQuote.aspx?ticker=KMRT.O target=/stocks/quickinfo/fullquote""&gt;KMRT.O&lt;/A&gt;  on Monday said it finalized a deal to sell 18 of its stores to  Home Depot Inc. &lt;A HREF=""http://www.investor.reuters.com/FullQuote.aspx?ticker=HD.N target=/stocks/quickinfo/fullquote""&gt;HD.N&lt;/A&gt; for \$271 million.",Business,3,1.6376095
452," NEW YORK (Reuters) - U.S. blue chips were near the  unchanged mark on Monday as a disappointing sales forecast from  retailer Wal-Mart Stores Inc. &lt;A HREF=""http://www.investor.reuters.com/FullQuote.aspx?ticker=WMT.N target=/stocks/quickinfo/fullquote""&gt;WMT.N&lt;/A&gt; dampened sentiment,  offsetting the benefit of easing oil prices.",Business,3,1.5467284
479," TOKYO (Reuters) - The dollar held on to the previous day's  gain on Tuesday, supported by a retreat in oil prices and  upbeat comments on the U.S. economy from Federal Reserve  officials.",Business,3,1.3926675
494,Beleaguered Russian energy giant Yukos has warned that it will not produce as much oil as expected this year. It blames bailiffs who are draining its bank accounts to pay its potentially ruinous tax bill.,Business,3,1.4460937
520,"Sumitomo Mitsui Financial Group Inc. laid out a \$29 billion bid for UFJ Holdings on Tuesday, challenging a rival offer by Mitsubishi Tokyo Financial Group to form the world #39;s biggest bank.",Business,3,1.3717092
522,"Hollinger Inc., th #39;e Toronto-based holding company controlled by disgraced media baron Conrad Black, lost an independent director Tuesday when a former general in Canada #39;s armed forces resigned from its board.",Business,3,1.367019
562,"Toronto Dominion Bank (TD.TO: Quote, Profile, Research) said on Wednesday that it is in talks with US-based Banknorth Group (BNK.N: Quote, Profile, Research) about a possible deal, in line with the Canadian bank #39;s push for ",Business,3,1.4407715
598,"WELLINGTON (Dow Jones)--New Zealand #39;s Auckland International Airport Ltd. (AIA.NZ) Thursday posted double digit annual profit growth, buoyed by a surge in passenger travel, and said it expects to meet market consensus for the 2005 fiscal year earnings.",Business,3,1.4033339
615,"Singapore Airlines Ltd., Asia #39;s most profitable carrier, is betting new planes will help it lure passengers from Emirates and Cathay Pacific Airways Ltd.",Business,3,1.4759686
628," NEW YORK (Reuters) - BlackRock Inc. &lt;A HREF=""http://www.investor.reuters.com/FullQuote.aspx?ticker=BLK.N target=/stocks/quickinfo/fullquote""&gt;BLK.N&lt;/A&gt;, one of the  largest U.S. fixed income managers, on Thursday said it will  buy its far smaller competitor State Street Research    Management Co., marking the biggest takeover in the asset  management business this year.",Business,3,1.3899843
634," NEW YORK (Reuters) - Freddie Mac &lt;A HREF=""http://www.investor.reuters.com/FullQuote.aspx?ticker=FRE.N target=/stocks/quickinfo/fullquote""&gt;FRE.N&lt;/A&gt; said on Thursday  its mortgage investments, or retained portfolio, grew at an  annualized rate of 20.8 percent in July, compared with a 19.4  percent increase in June.",Business,3,1.4261945
640,"NEW YORK, August 26 (New Ratings) - BlackRock Inc (BLK.NYS), a leading US-based fixed-income asset management company, has reportedly agreed to buy State Street Research  amp; Management Company, a unit of MetLife Inc, for \$375 million in a cash and stock ",Business,3,1.40562
649," NEW YORK (Reuters) - GlaxoSmithKline Plc &lt;A HREF=""http://www.investor.reuters.com/FullQuote.aspx?ticker=GSK.L target=/stocks/quickinfo/fullquote""&gt;GSK.L&lt;/A&gt; has agreed  to release all clinical studies of its drugs to settle a  lawsuit that accused it of withholding negative information  about the antidepressant Paxil, the New York Attorney General's  office said on Thursday.",Business,3,1.3514781
651,"CHICAGO (CBS.MW) - Discount retailer Dollar General reported a 19 percent rise in fiscal second-quarter earnings, helped by higher sales and lower charges.",Business,3,1.5173404
663,The cost of a barrel of oil in London has dipped below \$40 as energy prices have continued to slide. The price of Brent crude in London fell to a three-week low of \$39.,Business,3,1.3727999
667,"Merck  amp; Co. faces a dual threat from health insurers and patients #39; lawyers, after a US study suggested its Vioxx arthritis drug carries a greater risk than rival medicines.",Business,3,1.4624454
710, NEW YORK (Reuters) - U.S. stock futures were nearly  unchanged on Friday as investors awaited key data on the  economy that could determine the market's early direction.,Business,3,1.4532641
711,"LONDON, August 27 (New Ratings) - Belgian brewing giant, Interbrew SA (ITK.ETR), has received the approval of its shareholders for its proposed acquisition of the Brazilian brewer, AmBev.",Business,3,1.3564354
712,"Thai Airways has agreed to buy six Airbus A380s, becoming the 13th airline to order the new  quot;superjumbo, quot; the European aircraft maker said Friday.",Business,3,1.4286937
728," WASHINGTON (Reuters) - The U.S. economy slowed more sharply  in the second quarter than first thought as oil prices rose and  the trade gap swelled, the government said on Friday in a  report that confirmed momentum faltered in the spring.",Business,3,1.3643677
729,"The US economy slowed more sharply in the second quarter than first thought as oil prices rose and the trade gap swelled, the government said on Friday in a report that confirmed momentum faltered in the spring.",Business,3,1.3702534
730," WASHINGTON (Reuters) - The U.S. economy slowed more sharply  in the second quarter than first thought as oil prices rose and  the trade gap swelled, the government said on Friday in a  report that confirmed momentum faltered in the spring.",Business,3,1.3643677
745,Thai Airways International plans to buy six Airbus A380 double-decker aircraft that will be delivered in 2008 and 2009. The airline is also ordering two additional A340 aircraft.,Business,3,1.4207046
746," BRUSSELS/SAO PAULO (Reuters) - Shareholders gave their  blessing on Friday for Belgium's Interbrew &lt;A HREF=""http://www.investor.reuters.com/FullQuote.aspx?ticker=INTB.BR target=/stocks/quickinfo/fullquote""&gt;INTB.BR&lt;/A&gt; to buy  Brazil's AmBev &lt;A HREF=""http://www.investor.reuters.com/FullQuote.aspx?ticker=AMBV4.SA target=/stocks/quickinfo/fullquote""&gt;AMBV4.SA&lt;/A&gt;&lt;ABV.N&gt; in a \$9.7 billion deal that  will create the world's largest brewer.",Business,3,1.5417067
865, TOKYO (Reuters) - Japanese stocks were flat in mid-morning  trade on Monday with confidence in the domestic economic  outlook failing to offset profit-taking that hit recent gainers  such as insurers and real estate stocks.,Business,3,1.5718594
890,Description: A flurry of corporate bankruptcies in the past few years leaves a public agency strapped for cash: the Pension Benefit Guaranty Corporation.,Business,3,1.3405591
895,"PERTH (Dow Jones)--Sons of Gwalia Ltd. (SGW.AU), Australia #39;s second-biggest gold producer, has fallen into administration over aA\$348 million hedge book liability.",Business,3,1.373485
914," NEW YORK (Reuters) - U.S. oil prices fell more than \$1 on  Monday on continued profit-taking as producer-group OPEC eyed  increases in the coming months in its tight spare capacity,  countering worries over stumbling Iraqi oil exports.",Business,3,1.5155103
922,AP - An unsettling report on consumer incomes set off a spate of profit-taking on Wall Street Monday as investors worried that a tepid economy would erode companies' third-quarter earnings. Another drop in oil prices failed to shake the gloom from the market.,Business,3,1.4174213
963,"The European Union, Japan and Brazil won World Trade Organization backing to impose tariffs on US imports after Congress failed to end illegal corporate subsidies worth \$850 million since 2001.",Business,3,1.3709264
965," NEW YORK (Reuters) - Hartford Financial Services Group Inc.  &lt;A HREF=""http://www.investor.reuters.com/FullQuote.aspx?ticker=HIG.N target=/stocks/quickinfo/fullquote""&gt;HIG.N&lt;/A&gt; on Tuesday became the latest insurer to issue a profit  warning tied to Hurricane Charley, the strongest storm to hit  Florida in a dozen years.",Business,3,1.3950002
970,"Albertsons Inc. (ABS.N: Quote, Profile, Research) , the No. 2 US grocer, on Tuesday reported a substantial drop in its quarterly profit as heavy promotions ",Business,3,1.4099712
980,"Credit Suisse Group, Switzerland #39;s second-largest bank, said Tuesday it will combine its US-based Credit Suisse First Boston investment unit with its retail and private banking business within two years.",Business,3,1.4013717
991,"NEW YORK -- Just a year ago this week, New York Attorney General Eliot L. Spitzer shook the financial services industry -- and investor confidence -- by revealing that four big-name mutual fund companies had cut secret deals allowing a New Jersey hedge fund to profit from short-term trading at the expense of ordinary investors.",Business,3,1.4515505
1000,Persistent economic sluggishness and continued fallout from the Southern California labor dispute slashed second quarter profits 36 percent for Albertsons Inc.,Business,3,1.4114645
1010," NEW YORK (Reuters) - Verizon Communications Inc. &lt;A HREF=""http://www.investor.reuters.com/FullQuote.aspx?ticker=VZ.N target=/stocks/quickinfo/fullquote""&gt;VZ.N&lt;/A&gt; is  near an agreement to sell its Canadian telephone directory  business to private equity firm Bain Capital, the New York Post  said on Wednesday.",Business,3,1.3458347
1012,"First Albany Capital on Wednesday raised SuperGen Inc. #39;s (SUPG.O: Quote, Profile, Research) stock rating to  quot;buy quot; from  quot;neutral, quot; following its cancer-drug deal with MGI Pharma Inc.",Business,3,1.3533037
1025,Crude oil futures surged Wednesday as the US Energy Department reported US oil supplies fell more than expected. Crude oil for October delivery rose 1.68 dollars to 43.,Business,3,1.4775356
1044,"Another disappointing sales month at General Motors Corp. and Ford Motor Co. led the nation #39;s two largest automakers to cut planned vehicle production in the fourth quarter, which could hurt profits.",Business,3,1.4051403
1077,Shares of US Airways Group Inc. rose more than 9 Thursday morning after the airline #39;s pilots union said it may agree on a plan to cut wages and benefits.,Business,3,1.4016304
1083,"OSCOW, Sept. 2- World oil prices rose on Thursday after Russia #39;s largest oil producer, Yukos, said a court ruling  quot;paralyzes #39; #39; the company #39;s operations.",Business,3,1.5397997
1097,"Oil prices briefly bolted above \$45 a barrel yesterday, then retreated toward \$44, in a volatile day of trading after Russian oil giant Yukos said its output could suffer because of a court ruling that froze some of its assets.",Business,3,1.3858756
1116,"MOSCOW: Russias tax ministry said on Friday that it had raised its back tax claims against oil major Yukos by a fifth for 01, to 119.",Business,3,1.4421206
1223,TOKYO - Japan #39;s benchmark Nikkei stock index hit a five-week closing high Monday on upbeat capital spending figures for the April-June quarter by Japanese companies.,Business,3,1.3556567
1235,"Confidence in service firms has been hit by rising oil prices and interest rates but manufacturers have seen the best rate of orders for nine years, two surveys show.",Business,3,1.3541595
1275,DUBLIN (Dow Jones)--Ireland #39;s banking union said Monday it #39;ll write to the Irish Competition Authority and European Commission expressing concern over the prospective sell-off of National Australia Bank Ltd.,Business,3,1.4527875
1293,"British oil and gas firm Cairn Energy has seen profits drop 40, but reports strong reserves in its Indian oil fields.",Business,3,1.4416893
1305,"Challenger survey finds most job cuts in 6 months; seasonal hiring by retailers lifts new jobs. NEW YORK (CNN/Money) - Employers increased both hiring and layoff plans in August, according to a survey released Tuesday by an outplacement firm.",Business,3,1.3372856
1318,"US Airways Group Inc. (UAIR.O: Quote, Profile, Research) issued a general appeal on Tuesday to the carrier #39;s 3,000 pilots after their union #39;s leaders rejected ",Business,3,1.4013572
1330,A decline in the price of oil helped lift US stocks to their highest level in two-months on Tuesday. The dollar declined against its major rivals as investors took profits ,Business,3,1.4447851
1334,"The Organization of Petroleum Exporting Countries, which supplies a third of the world #39;s crude oil, can raise production capacity by 1 million barrels a day by year-end, OPEC President Purnomo Yusgiantoro said.",Business,3,1.4053979
1336, SINGAPORE (Reuters) - Asian stocks edged lower on Wednesday  as profit taking set in after two days of gains and the dollar  firmed ahead of comments from Fed chief Alan Greenspan that are  expected to cement the case for further U.S. rate rises.,Business,3,1.3665351
1366, NEW YORK (Reuters) - U.S. stocks were flat on Wednesday  after Federal Reserve Chairman Alan Greenspan said the economy  had recovered from its soft patch and a number of companies  warned about their earnings.,Business,3,1.3731142
1372," WASHINGTON (Reuters) - The U.S. economy is pulling out of  its recent soft patch and appears to be picking up steam,  Federal Reserve chief Alan Greenspan said on Wednesday in  remarks economists saw as cementing a September rate rise.",Business,3,1.3559788
1380,The chairman of Amvescap said Wednesday that the company planned to wrap its US mutual fund businesses into one following a \$450 million settlement with regulators over improper trading.,Business,3,1.423593
1395,"londonBritish Airways Plc, Europe #39;s second-biggest airline, will sell its 18 per cent stake in Qantas Airways Ltd. worth 427 million or about \$980 million (Canadian) to cut debt ahead of possible acquisitions in Europe.",Business,3,1.5253575
1398,"WILMINGTON, Del. -- A Delaware corporate law judge Wednesday heard a plea from attorneys for former Walt Disney Co. president Michael Ovitz that asks to remove Ovitz from the list of defendants in a shareholder ",Business,3,1.3916976
1411,A sharp drop in initial unemployment claims and bullish forecasts from Nokia and Texas Instruments sent stocks slightly higher in early trading Thursday.,Business,3,1.3725337
1415,US Treasury debt prices cut early gains but remained narrowly higher after the government said that new claims for jobless insurance fell in the latest week.,Business,3,1.5208253
1469,Oil prices held firm on Friday after leaping almost \$2 a day earlier on news US crude stocks sank to a five-month low last week and distillate fuels barely grew ahead of winter.,Business,3,1.429528
1476,"NEW YORK (CNN/Money) - Wall Street took a wait-and-see approach to the final day of the trading week, looking for more information on inflation, trade, oil and a report of Michael Eisner #39;s 2006 departure from Disney.",Business,3,1.4882487
1480," NEW YORK (Reuters) - Michael Eisner plans to step down as  Walt Disney Co.'s chief executive when his contract expires in  September 2006, the Wall Street Journal said on Friday.",Business,3,1.3799157
1500,"WASHINGTON (CBS.MW) -- Prices of US wholesale goods and services fell 0.1 percent in August, the Labor Department said Friday. The core producer price index -- adjusted to exclude food and energy goods -- also fell 0.1 percent.",Business,3,1.5157455
1530,"Here #39;s where some of the largest US and Canadian airlines stand in terms of restructuring their operations: - Air Canada: Will emerge from bankruptcy protection by end of September, with a smaller workforce, a reduced fleet, a focus on the no-frills ",Business,3,1.3675365
1561,BOSTON (CBS.MW) -- A lot of people got excited when Fidelity Investments announced recently that it was cutting fees on five index mutual funds.,Business,3,1.612987
1602, SINGAPORE (Reuters) - U.S. oil prices climbed above \$43 on  Monday as energy companies operating in the Gulf of Mexico  braced for possible widespread output disruptions from a  powerful hurricane and Iraq saw some of the bloodiest violence  in weeks.,Business,3,1.4433844
1611,"US Airways Group Inc., the nation #39;s seventh-largest airline, filed for bankruptcy protection Sunday for the second time in two years.",Business,3,1.347726
1622,Finance minister tells FT that asset sales to pay off tax debt will be market-oriented. MOSCOW (Reuters) - Russian Finance Minister Alexei Kudrin has promised that asset sales to pay off the tax debts of troubled ,Business,3,1.5126177
1628,European Union finance ministers considered the ever-strengthening euro against the dollar Monday amid appeals for Washington to rein in its budget and current account deficits to stop the slide of the US currency.,Business,3,1.50318
1635,"Wal-Mart Stores Inc. (WMT.N: Quote, Profile, Research) on Monday maintained its September sales forecast and said back-to-school demand picked up for key categories including electronics and clothing after a sluggish start.",Business,3,1.3635293
1657,Disgruntled former Disney directors Roy Disney and Stanley Gold told Disney #39;s board Monday that CEO Michael Eisner should hit the road by early 2005 at the latest.,Business,3,1.3383338
1661," HOUSTON (Reuters) - Enron Corp. will pay \$321 million from  the proceeds of its sale of its pipeline arm to fund pension  plans for thousands of former employees, a government pension  agency said on Monday.",Business,3,1.3776388
1665, TOKYO (Reuters) - Tokyo's Nikkei share average was up 0.56  percent in early morning trade on Tuesday as another jump in  U.S. technology shares encouraged investors to step up buying  in local counterparts such as Advantest Corp.,Business,3,1.3572907
1681,"US Airways said yesterday it can emerge from bankruptcy a stronger airline, but acknowledged it needs deeper wage concessions from its pilots - something it has failed to get after two years of trying.",Business,3,1.3384155
1691,"BERLIN - German investor confidence dropped sharply in September, a key economic indicator released Tuesday showed amid concerns about the impact of high oil prices on consumer demand and the outlook for the global economy.",World,1,1.4096067
1692," NEW YORK (Reuters) - Office Depot Inc. &lt;A HREF=""http://www.investor.reuters.com/FullQuote.aspx?ticker=ODP.N target=/stocks/quickinfo/fullquote""&gt;ODP.N&lt;/A&gt;, the No. 2  U.S. office supply retailer, on Tuesday forecast third-quarter  and full-year profits below Wall Street estimates due to  disruptions from recent hurricanes.",Business,3,1.3930349
1694," NEW YORK (Reuters) - Kroger Co. &lt;A HREF=""http://www.investor.reuters.com/FullQuote.aspx?ticker=KR.N target=/stocks/quickinfo/fullquote""&gt;KR.N&lt;/A&gt;, the largest U.S.  grocer, on Tuesday reported a 25 percent drop in quarterly  profit, hurt by debt redemption costs.",Business,3,1.5899998
1714,"McDonald #39;s (MCD) Tuesday raised its annual dividend by 38, a move the world #39;s largest restaurant chain said is another sign of its revitalization.",Business,3,1.3804281
1718,"Worries that Hurricane Ivan will hurt oil production in the Gulf of Mexico boosted oil prices Tuesday. In mid-morning New York trading, oil for future delivery hit \$44.",Business,3,1.5961103
1735,"INFLATION fell again in August, slipping further below the governments 2 per cent target, driven down by clothing and footwear retailers failing to raise prices after a poor summer.",Business,3,1.3506484
1752,MORE than 5000 building workers and asbestos victims have rallied outside a general meeting for embattled building products company James Hardie in central Sydney today.,Business,3,1.3651315
