,Original_Text,Class_String,Class_Number,Neuron_38
5848,"Reuters - Sony BMG, the world's No. 2 record\label, is in early talks with file-sharing network Grokster in\what could lead to a legalized Internet music service, its\chairman said on Tuesday.",Sci/Tech,4,1.4664372
5850,"American Express is suing Visa and MasterCard plus eight US banks, claiming anti-competitive tactics kept it out of the market. The litigation is the latest setback for Visa and MasterCard, which last month ",Business,3,1.4415188
5851,Electronic Data Systems Corp. finally settled a dispute with outside auditors and reported a third-quarter loss of \$153 million due to the write-down of a huge contract to build a computer network for the Navy.,Business,3,1.4489232
5854,"Nokia has developed a prototype handset that supports Mobile IPv6 (Internet Protocol version 6), a version of the protocol that will help to improve the quality of VoIP (voice over IP), streaming video and other applications delivered to wireless devices.",Sci/Tech,4,1.5347612
5857,"Sony on Tuesday announced plans to release a new dual-format DVD burner that is compatible with Macintosh computers. The external double-layer DVD drive, dubbed the DRX-710UL-T, is designed to record up to ",Sci/Tech,4,1.4041693
5860,"NewsFactor - Yahoo (Nasdaq: YHOO) has beefed up e-mail storage for users of its free e-mail service from 100 megabytes to 250 MB. The Internet giant also unveiled an anti-spam authentication technology called DomainKeys, which curtails messages sent from spoofed addresses.",Sci/Tech,4,1.40339
5861,IBM announced today that it was driving the initiative to use the worlds vast untapped computer power for useful things (like playing games and shopping online isn #39;t useful!,Sci/Tech,4,1.4689529
5866,A Motorola acquisition and an expected deal from Nortel show the market for mobile ad hoc network equipment is hot.,Sci/Tech,4,1.4068648
5867,Reuters - Hewlett-Packard Co.  on\Tuesday said quarterly profit topped its own lowered\expectations as the computer and printer maker saw record\revenues in every business and every region.,Business,3,1.4916695
5869,"SAN FRANCISCO, - Shares of Google Inc. fell as much as 6.5 percent Tuesday, as selling restrictions were lifted on 39 million shares held by employees and early investors in the newly public Web search company.",Business,3,1.652013
5871,"CHICAGO - Motorola Inc. is acquiring MeshNetworks Inc., developer of a Wi-Fi based technology that is expected to help land more contracts for its growing government contracting business.",Business,3,1.5938182
5876,Last year we explored the question of Microsoft #39;s potential liability for software flaws exploited by viruses and other forms of malware.,Sci/Tech,4,1.4731643
5896,"Google Inc. stock dropped more than 6 percent Tuesday as tens of millions of new shares held by early investors and employees of the search engine giant became available for sale for the first time..&lt;br&gt;&lt;FONT face=""verdana,MS Sans Serif,arial,helvetica"" size=""-2"" color=""#666666""&gt;&lt;B&gt;-The Washington Post&lt;/B&gt;&lt;/FONT&gt;",Sci/Tech,4,1.6099795
5899,update Microsoft founder Bill Gates on Tuesday detailed his company #39;s plan for computer management software and announced a long-awaited Windows update tool.,Sci/Tech,4,1.6886352
5901,Burst.com asked a US judge to penalize Microsoft for destroying e-mails it says the world #39;s largest software company should have preserved as evidence in antitrust suits.,Business,3,1.5465581
5906,"Microsoft, the behemoth Redmond, Wash., software company lurking over the computing world, Nov. 11 released a  quot;beta, quot; or test, version of its online search service.",Sci/Tech,4,1.5965639
5923,"The Audit Bureau of Circulations released the long-awaited results of its audit of the Tribune Company #39;s scandal-tarred Newsday on Tuesday, confirming the magnitude of the discrepancies uncovered by the company #39;s recent internal audit.",Business,3,1.3802999
5924,Microsoft Corp. last week released a preview version of its new Internet search engine. It will be available in its final form early next year.,Sci/Tech,4,1.4104159
5930,"&lt;a href=""http://www.hardwareanalysis.com/content/article/1755/""&gt;GeForce 6600GT AGP, as good as it gets?&lt;/a&gt; &lt;font size=-1 color=#6f6f6f&gt;&lt;nobr&gt;Hardware Analysis&lt;/nobr&gt;",Sci/Tech,4,1.4320762
5944," WASHINGTON (Reuters) - SBC Communications &lt;A HREF=""http://www.reuters.co.uk/financeQuoteLookup.jhtml?ticker=SBC.N qtype=sym infotype=info qcat=news""&gt;SBC.N&lt;/A&gt; will use  Microsoft Corp. &lt;A HREF=""http://www.reuters.co.uk/financeQuoteLookup.jhtml?ticker=MSFT.O qtype=sym infotype=info qcat=news""&gt;MSFT.O&lt;/A&gt; technology to launch video services  over upgraded high-speed data lines, the companies said  Wednesday.",Sci/Tech,4,1.4799358
5983,SL: Seagate Technology has announced that it will begin shipping the world #39;s highest capacity PC hard drive to retail stores and resellers.,Sci/Tech,4,1.4178257
6001,SBC is teaming up with Microsoft to provide consumers with a new way to view television -- a move that puts it in direct competition with the cable TV industry.,Business,3,1.462751
6003,"America Online (Quote, Chart) is bundling existing security features along with new ones for the Thursday launch of its AOL 9.0 software client, security edition.",Sci/Tech,4,1.610548
6005, NEW YORK (Reuters) - Oracle Corp. on Thursday said in a  letter to PeopleSoft Inc. stockholders that it would withdraw  its hostile takeover bid if less than half of PeopleSoft shares  were tendered by the offer's deadline.,Business,3,1.460988
6008,"JACKSONVILLE, FL -- The online search engine leader Google has unveiled a new tool for scholarly research. The new service is aimed at making better sense of all the scholarly work stored on the web and it ",Sci/Tech,4,1.4821987
6011,"washingtonpost.com - Careful followers of search-engine giant Google surely took note this morning of reports that the company is reiterating an earlier warning that its future growth could fall below expectations.  As the BBC News reported, the company ""has warned that fiercer competition is set to hit sales growth. The firm, which had a successful share flotation earlier this year, said its rate of growth from the second quarter to the third may not be sustainable.""",Sci/Tech,4,1.5331209
6013,Shares of Google Inc. slipped in pre-market trading Thursday after the world #39;s most popular Internet search engine warned for the second time in a week that its fourth-quarter revenue growth rate is likely to slow from previous quarters.,Business,3,1.5316466
6016,"Last Thursday, MSN announced the official beta launch of their search engine. Although a preview had been available on their sandbox site, the launch marked the official unveiling of the company #39;s proprietary search technology to the general public.",Sci/Tech,4,1.4012961
6017,Google Inc. on Thursday formally launched a new search service aimed at scientists and academic researchers. Google Scholar is a free beta service that allows users to search for scholarly literature ,Sci/Tech,4,1.5838691
6018,"Bill Gates might not use AOL, but he's definitely got mail. The Microsoft Corp. chairman receives millions of Internet messages a day, said Steve Ballmer, the company's chief executive. ""Bill literally receives 4 million pieces of e-mail per day, most of it spam,"" Ballmer said Thursday.",Sci/Tech,4,1.4896369
6020,"AOL has added a range of features to ward off computer viruses, intrusive spyware programs and spam to a special edition of its internet access package, AOL 9.0 Security Edition.",Sci/Tech,4,1.5248625
6022,"SAN ANTONIO SBC Communications and Yahoo are expanding their high-speed Internet service partnership to link video, wireless phone, Internet and other services.",Business,3,1.6828021
6023,"Shares of Claire #39;s Stores (CLE:NYSE - news - research) were among the NYSE #39;s losers Thursday, falling 15 after the company posted third-quarter results that missed analysts #39; expectations and warning about the fourth quarter.",Business,3,1.4041754
6026,"Google has launched Google Scholar, a search service aimed specifically at the academic community. The search tool will help scientists and academic researchers locate papers, theses and ",Sci/Tech,4,1.5035734
6030,"Shares of Google slipped after the search engine warned, for the second time in a week, that its fourth-quarter revenue growth rate is likely to slow from previous quarters.",Sci/Tech,4,1.5080031
6031,"Apple Computer confirmed Thursday it plans to open two additional Apple retail stores in the United Kingdom in 2005 - one in Birmingham, northwest ",Sci/Tech,4,1.4559543
6034,Home theater company to help users digitally convert audio CDs and store songs on a DVD or player.,Sci/Tech,4,1.4223065
6035,"CRM software maker Epiphany Inc. this week is rolling out new analytical software, including two new products and vertical-specific bundles aimed at the communications and retail finance industries.",Sci/Tech,4,1.6277773
6038,"The Motion Picture Association of America is in talks with the Internet2 research consortium, hoping both to test next-generation video delivery projects and to monitor peer-to-peer piracy on the ultrahigh-speed network.",Sci/Tech,4,1.4269836
6055,"IBM (IBM.N: Quote, Profile, Research) said on Thursday its workhorse commercial computers have smashed the industry #39;s most demanding tests, which analysts said creates ",Sci/Tech,4,1.4347869
6059,The U.S. Air Force tomorrow plans to announce an enterprisewide Microsoft software initiative that some analysts see as a prime example of how users can leverage their spending power to force vendors to deliver more secure products.,Sci/Tech,4,1.4609056
6078,SINGAPORE : Microsoft #39;s chief executive Steve Ballmer warned Asian governments on Thursday that they could face patent lawsuits for using the Linux operating system instead of Windows.,Sci/Tech,4,1.5603662
6083,"Hours after his close associate Howard Stern addressed a teeming crowd about the benefits of Sirius Satellite Radio, former Viacom Chief Operating Officer and President Mel Karmazin announced that he has signed onto the fledgling company as CEO.",Business,3,1.3911177
6084,Yahoo and SBC Communications have agreed to collaborate to extend some of the online services and content they currently provide to PC users to mobile phones and home entertainment devices.,Business,3,1.6266309
6091,Company will report preliminary count of its \$8.8B hostile bid for PeopleSoft after 1 am ET. NEW YORK (Reuters) - Oracle Corp. said it would report preliminary results of its \$8.8 billion hostile tender offer ,Business,3,1.4541191
6094,"Reuters - TheStreet.com Inc. , the\financial news and commentary Web site, may be up for sale,\according to a report in Business Week, sparking a 7 percent\rise in its shares.",Sci/Tech,4,1.5882887
6097,"Google has rolled out a new search tool called, Google Scholar. Google Scholar enables you to search specifically for scholarly literature, including peer-reviewed papers, theses, books, preprints, abstracts ",Sci/Tech,4,1.4539241
6101,"NEW YORK, November 19 (newratings.com) - Analysts at Stifel Nicolaus  amp; Company reiterate their  quot;outperform quot; rating on Sirius Satellite Radio (SIRI.",Business,3,1.486185
6105,"NOVEMBER 19, 2004 (IDG NEWS SERVICE) - The California Employees #39; Retirement System (Calpers) is tendering its 1.5 million PeopleSoft Inc.",Business,3,1.4609653
6126,"BANGALORE, INDIA - Peer-to-peer (P2P) sharing would never have gathered momentum if the music industry had adopted models for distribution over the Internet, said Intel Corp. Chief Executive Officer Craig Barrett, addressing IT executives in India Friday.",Sci/Tech,4,1.479949
6137,"Consumers won #39;t have to pay a tax to log on to the Internet until at least 2007, after Congress voted Friday to renew a recently lapsed ban on Internet taxation.",Business,3,1.4706755
6138,"By all appearances, Steven Woghin was a lawyer at the top of his game. After years in government service, the former Justice Department attorney had worked his way up to a comfortable six-figure salary and the chief legal job at software maker Computer Associates International Inc.",Business,3,1.4372914
6141,A glitch leaves customers of HSBC bank unable to use its internet services as well as cash machines.,Sci/Tech,4,1.4654113
6154,"NASA #39;s Swift satellite successfully launched today aboard a Boeing Delta 2 rocket at 12:16 pm EST from Launch Complex 17A at the Cape Canaveral Air Force Station, Fla.",Sci/Tech,4,1.4174743
6192,"Shares of Taser International Inc. (TASR.O: Quote, Profile, Research) have jumped 20 percent since early last week as the stun gun maker issued a slew of announcements ",Business,3,1.4179173
6207,"Bolstered by investors, Oracle Corp. appears destined to complete its long-sought takeover of PeopleSoft Inc. unless its rival becomes more profitable and proves it #39;s worth more than the \$9.2 billion bid currently on the table.",Business,3,1.4142504
6208,Google founders Larry Page and Sergey Brin have announced plans to sell millions of shares in the web search company they launched in 1998.,Business,3,1.5450232
6220," quot;NVIDIA and Intel Corporation announced that the companies have signed a broad, multi-year patent cross-license agreement spanning multiple product lines and product generations.",Sci/Tech,4,1.489285
6222," Human Genome Sciences Inc. plans to announce today that it has hired a 20-year product development veteran from Abbott Laboratories Inc. as chief executive. H. Thomas Watkins, 51, will face the challenge of completing the Rockville company's makeover from gene hunter to drug marketer.",Business,3,1.4765708
6231,"Users with Symbian-based mobile phones have been hit by malicious code that disables smartphone features. Skulls, a Trojan horse program that poses as gaming software, is one of the first examples of malicious code to successfully infect mobiles.",Sci/Tech,4,1.4788429
6235,Swiss firm Xstrata relaunches a takeover bid for Australian mining company WMC Resources by appealing directly to its shareholders.,Business,3,1.4307342
6240,Microsoft Corp. on Friday said that together with Dell Inc. it will provide the Air Force with software and related support services to simplify the acquisition process in an agreement worth up to \$500 million over six years.,Sci/Tech,4,1.4852065
6241,AstraZeneca intends to invest over 120m in Cambridge Antibody Technology (CAT) through an innovative five-year research collaboration and a 75m equity ,Business,3,1.4374682
6247,Reuters - Shares of GenCorp Inc.  fell 5.6\percent before the opening bell on Monday after investment fund\Steel Partners withdrew its proposal to acquire the aerospace\and real estate company.,Sci/Tech,4,1.561673
6259,"AP - French technology company Thomson SA said Monday it was joining Microsoft Corp. and Time Warner Inc.'s proposed venture to make anti-piracy software, a move that could relieve European Union concerns about the pending deal.",Sci/Tech,4,1.47403
6260,Thomson joined Microsoft and Time Warner on Monday in trying to take control of U.S. digital rights management (DRM) company ContentGuard Holdings.,Sci/Tech,4,1.5806521
6262,Google Founders Selling Off Stock\\Is this a sign that Google stack is overpriced? Or does it just mean that since there is so much interest in Google and its shares right now that the founders decided to sell off a big part of their holdings with the search engine. Dow ...,Sci/Tech,4,1.551625
6268,"Hackers may be using banner ad servers to multiply the impact of the Internet Explorer virus, security experts warn.",Sci/Tech,4,1.4205287
6272," NEW YORK (Reuters) - U.S. stocks rose on Monday as a higher  price target for shares of Apple Computer Inc. &lt;A HREF=""http://www.investor.reuters.com/FullQuote.aspx?ticker=AAPL.O target=/stocks/quickinfo/fullquote""&gt;AAPL.O&lt;/A&gt;  prompted enthusiasm for technology stocks and a rally in crude  oil stalled.",Business,3,1.38418
6273,"TiVo Inc.(TIVO.O: Quote, Profile, Research) , maker of digital television recorders, on Monday said its quarterly net loss widened as it boosted spending to acquire customers, but subscribers to its fee-based TV service rose ",Business,3,1.5112894
6278,PeopleSoft executives said over the weekend that they won't discuss a sale to Oracle at a price of \$24 per share but would consider an offer at a higher price.,Sci/Tech,4,1.405304
6280,"Reuters - Alamosa Holdings Inc.  said\on Monday it made an unsolicited bid for AirGate PCS Inc.\ worth about  #36;380 million, which would create one of\the largest sellers of wireless telephone service under the\Sprint  brand.",Sci/Tech,4,1.5167693
6282,"Computer Associates is set to name a recently departed IBM executive as its new chief executive officer, The Wall Street Journal reported online on Monday.",Sci/Tech,4,1.562364
6288,"A prehistoric neck bone found 12 years ago by amateur fossil hunters in Britain belongs to the biggest dinosaur ever discovered in the UK and possibly Europe, a report published in the Cretaceous Research Journal said today.",Sci/Tech,4,1.4398996
6297,"An adult publishing company sued Google last week, alleging a dozen counts of copyright infringement. Perfect 10, a Beverly Hills, CA-based publisher of an adult-oriented magazine and Web sites, asserts that ",Sci/Tech,4,1.4893143
6300,The war of words between Mylan Laboratories Inc. and the company #39;s largest shareholder over Mylan #39;s \$4 billion deal to acquire King Pharmaceuticals Inc.,Business,3,1.4856644
6310,The insurance company has agreed to pay about \$80 million to settle investigations into insurance sales that were used by companies to manipulate their earnings.,Business,3,1.4370632
6313,"Reuters - Cingular Wireless will cut about 7,000\jobs, or 10 percent of its work force, to cut costs as it\integrates recently purchased AT T Wireless, the company said\on Tuesday.",Sci/Tech,4,1.5416507
6315,"Arnold Schwarzenegger married a Kennedy. Michael Jackson married a Presley. And Kazaa married an Internet phone company. Beginning Monday, the latest version of the embattled file sharing companys software ",Sci/Tech,4,1.5649879
6318,"AP - A unique subspecies of fox that is about the size of a house cat is back from the brink of extinction on Santa Catalina Island and can survive on its own thanks to a captive breeding program, the head of a nonprofit group that manages most of the island said Tuesday.",Sci/Tech,4,1.4336197
6320,"Cingular Wireless LLC, the nation's largest cell phone company, will cut about 10 percent of its 68,000 jobs over the next 12 to 18 months as it combines operations with the recently acquired AT T Wireless, Cingular's chief executive said Tuesday.",Sci/Tech,4,1.5296081
6336,"Nortel Networks Corp. (NT.TO: Quote, Profile, Research) said on Wednesday that a far-reaching revision of its faulty financials will not require accounting changes for sales of certain fiber optic equipment.",Business,3,1.5540296
6350,"InfoWorld - Online phishing schemes increased significantly in October as financial institutions struggled to combat attempts to steal private account information from online consumers, according to the Anti-Phishing Working Group (APWG).",Sci/Tech,4,1.4725575
6351,"ICQ, an IM service provider owned by America Online, and Mail2World Inc., a provider of messaging and collaboration services, this week revealed a free upgrade to the ICQmail service that ",Sci/Tech,4,1.4487473
6357,The Securities and Exchange Commission and Time Warner Inc. are nearing agreement on a deal in which the media giant would pay about \$750 million to settle wide-ranging allegations ,Business,3,1.4428976
6363,"The judge who presided over the Securities and Exchange Commission #39;s fraud suit against MCI, the long-distance telephone company, threatened to punish the company yesterday for ignoring his ",Business,3,1.3974549
6370,"PETALING JAYA: Virus experts at British software security firm Sophos Plc have advised customers not to panic, following media reports of a Trojan horse which infects cellphones.",Sci/Tech,4,1.428011
6378,The UK's largest supermarket - Tesco - says strong petrol sales aided a rise in third quarter sales across all parts of its business.,Business,3,1.4549115
6381,"After writing about hundreds of individual and class-action lawsuits that have been filed on behalf of consumers who developed cancer, suffered heart attacks or other medical problems from hormone replacement therapy drugs and Vioxx, an FDA employee now ",Business,3,1.458934
6382,A federal court Wednesday barred No. 2 US long-distance carrier MCI Inc. from making further payments to cover more than \$25 million in unauthorized expenses related to bankruptcy of predecessor WorldCom.,Business,3,1.4609146
6388,SiliconValley.com - Intel is making a big push to help personal computer makers in China and India offer the Linux operating system on machines powered by the company's chips.,Sci/Tech,4,1.4638383
6393,AP - Nintendo Co. returned to profit in the first half of the fiscal year from a loss a year ago as the Japanese video-game maker erased foreign exchange losses and turned more profit with game-software sales.,Sci/Tech,4,1.3995241
6397,"25/11/2004 - The first in a completely new class of drug for multiple sclerosis has been approved in the US, opening up a new avenue of treatment for sufferers of the debilitating diseases and potential blockbuster revenues for developers Elan and Biogen ",Business,3,1.479878
6406,The head of the Senate Finance Committee called on the US Department of Health and Human Services to launch a probe of allegations that the US Food and Drug Administration went out of its way to discredit a whistleblower.,Business,3,1.4106205
6436,"The Massachusetts Institute of Technology is developing mobile phones designed to learn users #39; daily habits so that they can predict what users will do, reports The Register.",Sci/Tech,4,1.493461
6453,The next chapter in the global legal battle between the recording industry and file-sharing services is due to unfold here Monday when the owners of the hugely popular Kazaa software go on trial on civil copyright infringement charges.,Sci/Tech,4,1.4861759
6460,"Business India: Mumbai, Nov 26 : The much talked about family feud over the control of Reliance Industries, India #39;s largest industrial house, is set to turn into a full-fledged boardroom battle that may entail a revamp of the company #39;s management.",Business,3,1.4602711
6463,"Zastrossi writes  quot;According to the Anti-Phishing Working Group, phishing sites--the practice of making sites that look and act like popular sites such as banks in order to steal personal information from customers--rose from 543 sites in September to ",Sci/Tech,4,1.4062115
6493,"Little Rock-based Alltel will expand its wireless phone service in Connecticut, Kentucky, Mississippi, Oklahoma and Texas in a \$170 million deal with Cingular Wireless.",Business,3,1.4358125
6513,SAN ANTONIO - Forget about PlayStation 2 - Texas entrepreneur wants to kick computer gaming up to the next level by offering players a chance at some real-live killing via mouse and modem.,Sci/Tech,4,1.4000962
6560,"Google wants to help you effectively access the piles of information you store in the documents, e-mail messages, Web pages, and contact lists stuffed on your PC.",Sci/Tech,4,1.5721301
6565,Denmark #39;s leading telecoms operator TDC says it will launch a low-budget mobile telephone operator dubbed  quot;easyMobile quot; with mobile network operator T-Mobile in Britain in March 2005.,Business,3,1.5435606
6567,"IBM, Sony Corp. and Toshiba Corp. on Monday unveiled some key details on the powerful new  quot;Cell quot; processor the three are jointly producing to run next-generation computers, game consoles and TVs.",Sci/Tech,4,1.442083
6571,"Major movie studious Paramount, Universal Pictures, Warner Bros., and New Line Cinema all said today that they have adopted the new high definition DVD disc format (HD-DVD), and will begin issuing movie titles in the new format in 2005.",Sci/Tech,4,1.39083
6572,"com November 29, 2004, 8:33 AM PT. Wired  amp; Wireless continues its reign as the top IT priority among IT managers due to widespread IP telephony deployment and other network infrastructure upgrades.",Business,3,1.5804912
6574,"Halsey Minor, CEO of hosted integration provider grand central Communications, has a powerful message for IT: In four years, ... basically the whole notion of enterprise application software is going to be dead. He believes application functionality will instead be available as hosted, pay-per-use services delivered by companies such as Salesforce.com. Putting his money where his mouth is, Minor has recently launched a \$50 million venture capital fund with his own money to fuel on-demand startups. For its part, Grand Central will handle data and process integration between enterprises and multiple on-demand services.",Business,3,1.5119665
6575,"Mamma Search is Buying Copernic\\Mamma.com Inc., the paid search company, and Copernic Technologies Inc. announced that Mamma has signed a letter of intent where they will acquire all of the shares of Copernic Technologies for a combination of cash and shares of Mamma.com Inc. The closing of the acquisition will ...",Sci/Tech,4,1.5850018
6582,"Telekom Austria, Austrias largest telecoms operator, obtained access to the relatively underdeveloped East European mobile services market by winning the right to purchase the Bulgarian mobile operator MobilTel for 1.6billion (\$2.12billion).",Business,3,1.5762627
6592,"Reuters - IBM , Sony Corp. (6758.T) and\Toshiba Corp. (6502.T) on Monday revealed their plans for the\powerful new ""Cell"" processor the three are jointly producing\to run next-generation computers, game consoles and\televisions.",Business,3,1.3827856
