,Original_Text,Class_String,Class_Number,Neuron_43
4380,"AP - The United States could cut its forces in Afghanistan next summer if Taliban militants accept an amnesty to be drawn up by President Hamid Karzai and neighboring Pakistan, the senior U.S. commander here said Sunday.",World,1,0.8839026
4385,Suicide bombers killed at least 22 members of Iraq #39;s fledgling security forces yesterday amid a spate of insurgent attacks across the country that also ,World,1,0.8597956
4403,"KABUL, Afghanistan -- A Taliban suicide fighter killed himself and wounded at least seven others, including three members of a NATO-led peacekeeping force, in a grenade attack on a busy shopping street in central Kabul yesterday.",World,1,0.8268817
4414,ISRAEL killed two Islamic Jihad militants in the Gaza Strip yesterday as Ariel Sharon and his cabinet finalised a bill to withdraw from Gaza.,World,1,0.9556113
4416,"An American woman, believed to be a civilian, and a young Afghan girl died from their wounds after a suicide bomb attack in a busy shopping street in the Afghan capital.",World,1,0.8821733
4419,"Two Iraqis were killed and four others wounded in clashes that broke out between US troops and insurgents in Samarra, north of Baghdad, police said on Sunday.",World,1,0.9641142
4422,"A US security official, assigned to the US Embassy in Baghdad, was killed on Sunday by a mortar attack on a US Army base near Baghdad International Airport, US Secretary of State Colin Powell said.",World,1,0.86579156
4452,The corpses of 50 soldiers of Iraq #39;s new army have been discovered northeast of the capital Baghdad. Interim Iraqi interior ministry spokesman Adnan Abd al-Rahman said the troops were believed to have been ,World,1,0.87610716
4463," GAZA (Reuters) - Israeli tanks and troops backed by  helicopter gunships stormed Khan Younis refugee camp, a Gaza  militant stronghold, on Monday, killing 10 Palestinians  including an 11-year-old boy, medics and witnesses said.",World,1,0.9396751
4466, BEIJING (Reuters) - Secretary of State Colin Powell urged  China on Monday to exert its influence over North Korea to  resume stalled talks on scrapping its nuclear weapons programs  and pressed Beijing to accept a Taiwan offer of talks.,World,1,0.852934
4495,"AFP - The group loyal to Al-Qaeda-linked militant Abu Mussab al-Zarqawi claimed to have bombed an Australian convoy in Baghdad, in a statement posted on an Islamist website.",World,1,0.85003114
4497,Reuters - The chief negotiator in the rebel-held\Iraqi town of Falluja said Monday the government had canceled\indefinitely talks to avert a military assault on the town.,World,1,0.819307
4541,"Israeli MPs have resumed a debate on Prime Minister Ariel Sharon #39;s disengagement plan, which is expected to culminate in a historic vote in favour of a pull-out of troops and settlers from the Gaza Strip.",World,1,0.9715071
4558,"JERUSALEM Israel #39;s Parliament appeared poised Tuesday to approve Prime Minister Ariel Sharon #39;s Gaza pullout plan, clearing the way for a withdrawal of Jewish settlers from Palestinian territory for the first time in history.",World,1,0.8315092
4570,"AFP - Germany and France both support inviting to European Union membership talks at a summit in December in Brussels, Chancellor Gerhard Schroeder said.",World,1,0.834782
4589, JERUSALEM (Reuters) - Israeli Finance Minister Benjamin  Netanyahu said on Tuesday he and three other cabinet members  from Ariel Sharon's Likud would quit unless the prime minister  agreed to hold a referendum on a pullout from Gaza.,World,1,0.93999076
4590," BAGHDAD (Reuters) - Iraq's U.S.-backed government said on  Tuesday that ""major neglect"" by its American-led allies led to  a massacre of 49 army recruits at the weekend.",World,1,0.89261764
4598,Reuters - Israeli military police on Tuesday\arrested a commander accused by comrades of riddling the body\of a Palestinian schoolgirl with bullets after fellow soldiers\killed her.,World,1,0.8545601
4616,The group led by wanted terrorist Abu Musab al-Zarqawi has said it has abducted a member of Japan #39;s armed forces and is threatening to behead him if the Japanese government does not withdraw its troops from Iraq within 48 hours.,World,1,0.829124
4624,"India responded coolly yesterday to suggestions by the Pakistani president, Pervez Musharraf, on how to solve the Kashmir dispute between the two countries.",World,1,0.82084954
4639, JERUSALEM (Reuters) - Israeli leader Ariel Sharon rejected  calls from within his divided cabinet on Wednesday for a  referendum on leaving Gaza after winning parliament's support  to uproot settlements from land claimed by Palestinians.,World,1,0.8764139
4647," THE HAGUE (Reuters) - Former Yugoslav President Slobodan  Milosevic's two court-assigned defense lawyers have asked to be  withdrawn from his case, The Hague war crimes tribunal said  Wednesday.",World,1,0.8507055
4654,"_ Nearly 800 British forces left their base in southern Iraq on Wednesday, heading north toward Baghdad to replace US troops who are expected to take part in an offensive against insurgent strongholds.",World,1,0.93365353
4668,British troops have rolled north from Basra to take over a deadly area near Baghdad and free up US troops for a widely expected attack on the rebel-held city of Falluja.,World,1,0.93798065
4679,"AFP - Kidnapped Briton Margaret Hassan made a new appeal for the withdrawal of British troops from Iraq, Al-Jazeera television said, showing her in a video.",World,1,0.8402369
4692,Hundreds of villagers besieged a Thai military camp Wednesday demanding to know whether their relatives were among at least 78 Muslim men who officials said suffocated ,World,1,0.83792305
4699,KUALA LUMPUR: Malaysia has conveyed to Thai Prime Minister Thaksin Shinawatra its concern over the latest incident of violence in southern Thailand.,World,1,0.8477951
4711,"Reuters - At least five miners were killed and 14\injured in a blast in a coal mine in Russia's Siberia, the\Emergencies Ministry said on Thursday.",World,1,0.82276475
4736,"An elite contingent of 50 Nigerian soldiers left Nigeria on Thursday for Darfur, the first stage in the deployment of 3,000 extra African Union (AU) troops to monitor a shaky cease-fire in the western Sudanese region.",World,1,0.907999
4748,"Unknown armed men in military uniform kidnapped three staff of the United Nations in the Afghan capital city at broad daylight Thursday, Afghan officials confirmed.",World,1,0.928502
4752,"AP - A bomb exploded Thursday evening outside a bar in southern Thailand, the scene of a campaign of violence blamed on Islamic separatists, injuring at least 15 people, police said.",World,1,0.89612234
4757,"A bomb has exploded in southern Thailand, killing one person and injuring about 20, in what could be the first reaction to the deaths of 85 Muslim protesters earlier this week.",World,1,0.84046096
4761,"JERUSALEM, Oct 28 (AFP) - Israel will not bar ailing Palestinian leader Yasser Arafat from returning to the West Bank if he were to leave for medical treatment, senior government spokesman Raanan Gissin told AFP Thursday.",World,1,0.87351155
4788," BAGHDAD (Reuters) - Militants piled more pressure on  Washington's military allies in Iraq on Thursday, seizing an  Iraqi-Polish woman and holding a Japanese man under threat of  death.",World,1,0.90964806
4799,"Nine British tourists, two Jordanians and an Egyptian have been killed in a bus accident in southern Jordan, civil defence sources and diplomats say.",World,1,0.8729177
4812,AP - The militant Palestinian group Hamas said Friday it was setting aside its differences with ailing Palestinian leader Yasser Arafat and called for a united Palestinian leadership to work toward general elections.,World,1,0.9454307
4838,"A French military jet believed to be carrying the Palestinian leader landed today at an airfield outside Paris, witnesses said.",World,1,0.88202465
4841,"Sudanese rebel leaders #39; demand that Islam be kept out of government in the war-torn region of Darfur, has been rejected by government negotiators.",World,1,0.8585317
4873,AFP - President George W. Bush called on the star power of actor-turned-California-governor Arnold Schwarzenegger to boost his campaign appeal as Democratic challenger John Kerry shifted his attack from missing explosives in Iraq to domestic economics.,World,1,0.84657633
4874,"Description: In Cambodia, Norodom Sihamoni who accedes to the throne with an elaborate coronation, following the abdication of his father King Norodom Sihanouk.",World,1,0.89477664
4886,"BANGKOK : Thai Prime Minister Thaksin Shinawatra said the government would prosecute 300 Muslims detained at a riot this week that led to the deaths of 87 protesters, while another 900 would be released.",World,1,0.8487993
4890,"A militant group is threatening to kill three UN hostages kidnapped in Afghanistan, including a British woman, unless all Taliban prisoners are released.",World,1,0.96209127
4897,"KUWAIT CITY - Iraqi President Ghazi al-Yawar arrived in Kuwait on Saturday for a two-day official visit, an AFP correspondent reported.",World,1,0.8372054
4910,"Japan has confirmed that the headless body found in Baghdad on Saturday is of the Japanese being held captive in Iraq. An armed group in Iraq had on Tuesday threatened to behead Shosei Koda, 24, within 48-hours unless Japan pulled its troops out of Iraq.",World,1,0.9106635
4922,has passed a bill obliging the government to continue efforts to develop a nuclear energy programme. Uranium enrichment can be used both for nuclear power and to make atomic bombs.,World,1,0.856305
4923,Militants holding three UN workers hostage in Afghanistan have offered to consider extending a three-day deadline for their beheading.,World,1,0.9174461
4937,"BAGHDAD: Fifteen people were killed and eight others injured in an explosion that hit a hotel last night in the northern Iraqi city of Tikrit, police and hospital officials said.",World,1,0.83591896
4971,ABUJA (AFP) - African Union mediators met separately with Sudanese government envoys and the leaders of the uprising in the strife-torn region of Darfur in a bid to hammer out a deal on demilitarising the conflict.,World,1,0.8347385
4990,Palestinian sources said on Tuesday that Palestinian leader Yasser Arafat #39;s younger brother Fatehy Arafat was transferred to a hospital in Cairo to be treated for intestines cancer.,World,1,0.83558196
4992,"A car bomb exploded outside the Education Ministry in central Baghdad Tuesday, killing at least six people and wounding about eight, the Interior Ministry said.",World,1,0.852964
5008,"A car bomb exploded outside the education ministry in central Baghdad on Tuesday, killing at least six people and wounding about eight, the interior ministry said.",World,1,0.85484266
5012,"An unknown militant group holding Iraqi-British hostage Margaret Hassan in Iraq has threatened to turn her over to a group led by al Qaeda ally Abu Musab al-Zarqawi if its demands are not met, Al Jazeera television says.",World,1,0.886769
5014,"BAGHDAD, Iraq -- The kidnappers of aid worker Margaret Hassan threatened to turn her over to an al-Qaida affiliated group within 48 hours if the British government refuses to pull its troops from Iraq, Al-Jazeera television reported Tuesday.",World,1,0.89280444
5039,"Gunmen abducted a Lebanese-American contractor who worked with the US Army from his Baghdad home, Iraqi officials said Wednesday, while four Jordanian truck drivers were seized by assailants in a separate kidnapping.",World,1,0.8570982
5042,An Iraqi security official said gunmen abducted a Lebanese-American contractor who worked with the US Army in Iraq. Officials said gunmen snatched him when he answered the door at his Baghdad home overnight.,World,1,0.8519182
5068,"Speaking from France, Palestinian officials say leader Yasser Arafat took a turn for the worse late Wednesday. Citing officials who spoke on condition of anonymity, The Associated Press reports that Arafat #39;s ",World,1,0.8480494
5082,"Palestinian leader Yasser Arafat has been in a coma for several hours and now in critical condition, Arafat #39;s senior aides said on Thursday.",World,1,0.9148494
5121,A letter left on the body of murdered film-maker Theo van Gogh reportedly threatens the life of a liberal politician.,World,1,0.8497331
5125," CAIRO (Reuters) - Israel released six Egyptian students  from prison on Sunday as part of a deal which includes freedom  for Israeli businessman and convicted spy Azzam Azzam, Egyptian  security sources said.",World,1,0.86042863
5207,Pakistani President General Pervez Musharraf on his visit after the landmark presidential polls in Afghanistan congratulated his Afghan counterpart Hamid Karzai for his victory Saturday afternoon.,World,1,0.939767
5230,Militants threatening to kill three UN hostages said yesterday that talks with Afghan and UN officials had been postponed for another day.,World,1,0.9100709
5235," KABUL (Reuters) - Afghan militants holding three U.N.  workers hostage began talks with the government and the United  Nations on Sunday and the kidnappers have dropped some of their  demands, a militant spokesman said.",World,1,0.9017363
5243,The Iraqi government declared a state of emergency for 60 days as U.S. and Iraqi forces prepared for an expected assault on rebels in Fallujah.,World,1,1.0182467
5245, BAGHDAD (Reuters) - Iraq's interim government declared a  state of emergency for 60 days on Sunday to quell violence  gripping the country ahead of January elections.,World,1,0.927567
5247,"JERUSALEM -- Former US envoys say that the passing of Yasser Arafat would open up new opportunities for Mideast peace, especially if new, pragmatic Palestinian leaders emerge.",World,1,0.8962097
5249," PARIS (Reuters) - Yasser Arafat, critically ill in a Paris  hospital, has suffered liver failure, a Palestinian official  said on Sunday as Arafat's subordinates decided in his absence  to enforce a law and order plan in Palestinian areas.",World,1,0.8727335
5251,"KABUL (AFP) - Militants claiming to hold three foreign UN workers met Afghan officials on Sunday and gave them a list of 26 prisoners whom they want to swap for their hostages, a spokesman for the group said.",World,1,0.8322268
5254," SKOPJE (Reuters) - A referendum bid to block a law that  gives Macedonia's Albanian minority more rights failed on  Sunday, upholding a Western-brokered peace plan which ended  ethnic fighting in 2001.",World,1,0.8293812
5255,Militants holding three foreign United Nations workers in Afghanistan said that they had held negotiations with officials from the Afghan government and the United ,World,1,0.8721773
5263,"AFP - A little known radical Islamic group has threatened to kill Indian cricketers when they tour Bangladesh from Tuesday, the Indian High Commission told AFP.",World,1,0.85277545
5286,Militants holding hostage three foreign UN workers in Afghanistan said they negotiated yesterday with Afghan government and UN officials in southern Afghanistan but that the meeting ended without results.,World,1,0.82068354
5287, ABIDJAN (Reuters) - Ivory Coast President Laurent Gbagbo  appealed for an end to the anti-French violence which erupted  after France destroyed most of the country's air force in  retaliation for the killing of nine French peacekeepers.,World,1,0.9091975
5320,"Two years after French forces arrived to restore order in turmoil-torn Ivory Coast, a peace agreement between Ivorian rebels and the government of President Laurent Gbagbo is in ",World,1,0.84337723
5358,"U.S. Army and Marine units thrust into the heart of the insurgent stronghold of Fallujah on Tuesday, fighting fierce street battles and conducting house-to-house searches on the second day of a major assault to retake the city from Islamic militants.",World,1,0.9225508
5360," KATHMANDU (Reuters) - A bomb tore through a government  building under construction in the Nepali capital on Tuesday,  wounding at least 38 people in an attack police suspect was  carried out by Maoist rebels.",World,1,0.87104315
5429,"AFP - An Italian aid worker walked free from the southern Philippines jungle, a day after he was abducted by local gunmen.",World,1,0.8487207
5441,"Iran will pull out of the nuclear Non-Proliferation Treaty (NPT) and develop its atomic programme in secret if Western nations threaten or put pressure on Tehran, a senior Iran diplomat was quoted as saying on Wednesday.",World,1,0.86216927
5445,"France and the United Nations began evacuating thousands of French and other expatriates Wednesday trapped at U.N. offices and a French military base amid days of anti-foreigner rampages in Ivory Coast's largest city, French and U.N. officials said.",World,1,0.8746348
5471,"BEIRUT, Lebanon - Yasser Arafat promised Palestinians he would return them to the homes they lost when Israel was founded in 1948.",World,1,0.92090774
5487,"AP - U.S. troops, on the verge of gaining control of the city, fought pockets of resistance in this former militant stronghold Wednesday and uncovered what the Iraqi commander said were ""hostage slaughterhouses"" in which foreign captives had been killed.",World,1,0.8372577
5510,The fragile relations between Tokyo and Beijing were further weakened yesterday when a suspected Chinese nuclear submarine was chased out of Japanese territorial waters.,World,1,0.84129626
5516,"A car bomb exploded near a police patrol in busy central Baghdad on Thursday, killing 17 people and wounding 20, police said. A police source said the blast missed a convoy ",World,1,0.87502587
5520,"Yasser Arafat, who triumphantly forced his peoples plight into the world spotlight but failed to achieve his lifelong quest for Palestinian statehood, died today, aged 75, Palestinian Cabinet minister Saeb Erekat confirmed.",World,1,0.8804309
5527,Description: Dutch police arrest three suspects after a counterterror operation in The Hague. The murder of filmmaker Theo van Gogh by a suspected Islamic extremist has heightened concern about terrorism in the Netherlands.,World,1,0.8455583
5544,The body of late Palestinian President Yasser Arafat has arrived in Cairo from Paris for a military funeral which presidents and other dignitaries from around the world are due to attend.,World,1,0.83758134
5550,AP - Dutch lawmakers accused the government Thursday of underestimating the threat from Islamic terrorists and failing to protect a filmmaker slain by a suspected Muslim radical.,World,1,0.92382354
5564,The death of Palestinian leader Yasser Arafat is deeply dividing an already torn Middle Eastern country. As Palestinians mourn the loss of their leader ,World,1,0.9492221
5566," JAKARTA (Reuters) - An earthquake measuring 6.0 on the  Richter scale shook an island in eastern Indonesia on Friday,  killing six people and injuring at least six more, a government  official said.",World,1,0.87627983
5568,"The Israeli prime minister, Ariel Sharon, yesterday said the death of his long-time rival, Yasser Arafat, could prove to be  quot;a historic turning point in the Middle East quot;.",World,1,0.84987825
5607,US and Iraqi forces are pushing deeper south into the city of Fallujah on the fifth day of a joint offensive to drive out insurgents.,World,1,0.84050494
5630,"Tens of thousands of civilians are confined to their houses in Fallujah and may be in need of humanitarian aid as US and Iraqi forces battle insurgents for control of the city, according to Iraq #39;s Islamic Party.",World,1,0.9362454
5641,Palestinians pay their last respects to Yasser Arafat after chaotic scenes at his burial in Ramallah.,World,1,0.9095462
5647," TEHRAN (Reuters) - Iran's negotiations with the European  Union over a deal which would spare Tehran from possible U.N.  sanctions over its nuclear program are in their final stages,  Iran said Saturday.",World,1,0.84899086
5655," NANO, Pakistan (Reuters) - Pakistani forces are driving al  Qaeda-linked militants out of mountains near the Afghan border  but attacks such as a bomb that wounded soldiers on Saturday  could not be ruled out, a commander said.",World,1,0.87050253
5682,"After days of speculation and a chase by Japanese destroyers and a surveillance plane, it has finally been determined that the nuclear submarine that intruded into Japanese territorial water between Okinawa and Taiwan was Chinese.",World,1,0.8350682
5700,"Northern Ireland #39;s main pro-British paramilitary group, The Ulster Defence Association (UDA), has pledged to end all violence and work towards complete disarmament.",World,1,0.82925415
5710,"AP - Iran has agreed to fully suspend uranium enrichment and linked activities that Washington asserts are part of a nuclear weapons program, diplomats said Sunday.",World,1,0.91594654
5716,"AP - Mahmoud Abbas, the temporary successor to Yasser Arafat, escaped unharmed Sunday when militants firing assault rifles burst into a mourning tent for the deceased Palestinian leader, killing two security guards and wounding six other people.",World,1,0.89382124
5743,"WASHINGTON -- Iran pledged yesterday to temporarily suspend its uranium enrichment program in an attempt to ease suspicions that it is trying to develop nuclear weapons. The move could defuse a longstanding showdown with the United States over Iran's nuclear activities, diplomats said.",World,1,0.8432606
5770,"Iran has agreed to suspend its uranium enrichment programme in an attempt to ease concerns that its nuclear programme is aimed at developing weapons, a Western diplomat close to the United Nations said today.",World,1,0.82570714
5778,Fierce battles between insurgents and US and Iraqi forces killed at least 27 people today in Baqouba and south of Baghdad as US forces move against the last remaining pockets of resistance in Fallujah.,World,1,0.93024087
5799,"Islamabad, Nov. 16 (NNN): Pakistans leading newspaper, Dawn, finds the timing of the Indian announcement on reduction of troops in Kashmir as significance.",World,1,0.83401954
5805,A rebel counteroffensive swept through central and northern Iraq on Monday as American troops struggled to flush the remaining insurgents from the rubble-strewn streets of Falluja.,World,1,0.958584
5827,"On the eve of a high-profile UN Security Council visit to Nairobi, members are split over a draft resolution on atrocities in Sudan #39;s western Darfur region.",World,1,0.94310266
5833, ABIDJAN (Reuters) - Supporters of Ivory Coast's President  Laurent Gbagbo criticized on Tuesday a United Nations decision  to impose an arms embargo on the world's top cocoa grower but  rebel leaders welcomed the move.,World,1,0.82030267
5878,"ARIEL SHARON, the Israeli Prime Minister, made his first conciliatory gesture towards Palestinians after the death of Yassir Arafat when he said that he would consider co-ordinating the dismantling of Jewish settlements in the Gaza Strip with a new ",World,1,0.86077553
5897,"Australia #39;s Foreign Minister, Alexander Downer, says the apparent murder in Iraq of aid worker, Margaret Hassan, is a heinous and inexcusable crime.",World,1,0.8655665
5913,"MOSUL, Iraq -- US and Iraqi troops stormed insurgent-held police stations and neighborhoods in this northern city Tuesday, retaking a number of sites seized last week by gunmen who rose up in support of militants in Fallujah.",World,1,0.91762626
5938,"AP - Homemade bombs exploded in two Buenos Aires banks Wednesday, killing a security guard, police said.",World,1,0.85395133
5951,"UN Security Council members have arrived in Nairobi for a two-day meeting devoted to the conflicts engulfing Sudan, including the western Darfur region.",World,1,0.8629342
5961,THE Palestinian Authority is to set up an official commission of inquiry into Yasser Arafats death amid increasing rumours among the Palestinian public that he was poisoned by Israel.,World,1,0.92485815
5984,"An Israeli tank has opened fire and killed three Egyptian troops on the sensitive border between the two countries, mistaking them for Palestinian militants on the way to carry out an attack, Israeli media says.",World,1,0.82496387
5989,"JERUSALEM A preliminary Israeli army investigation has found that Israeli troops apparently killed three Egyptian soldiers by mistake, thinking they were Palestinian militants along the Gaza-Egypt border.",World,1,0.9896164
5991,"An Israeli tank has opened fire and killed three Egyptian troops in a border zone near the Gaza Strip after mistaking them for Palestinian arms smugglers, Israeli security sources say.",World,1,0.9549715
5992,"AFP - Three Egyptian policemen were killed overnight by Israeli tank fire on the tense border between Egypt and the Gaza Strip when they were mistaken for Palestinian arms smugglers, officials said.",World,1,0.9482083
6002,"President Thabo Mbeki has urged all countries, including Ivory Coast #39;s neighbours, to immediately enforce a United Nations arms embargo on government and rebel forces in Ivory Coast.",World,1,0.89472026
6032,"The Israeli prime minister, Ariel Sharon, apologized to Egypt today after an Israeli army tank crew fired on an Egyptian patrol near the border with Gaza, killing three Egyptian police officers.",World,1,0.93947023
6048,Sponsors of an internationally backed Mideast peace plan will send their foreign ministers to the region next week in hopes of restarting Israeli-Palestinian talks in the wake of Yasser Arafat #39;s death.,World,1,0.8757236
6075,"JERUSALEM -- Israeli troops mistook three Egyptian police officers for Palestinian militants and shot them dead yesterday along the Gaza Strip's border with Egypt, increasing tensions between the neighbors.",World,1,0.8675652
6107,"AFP - Pakistani security forces have arrested a key Al-Qaeda operative wanted in connection with attacks on Christian targets and a failed bid to kill President Pervez Musharraf, an official said.",World,1,0.9407454
