,Original_Text,Class_String,Class_Number,Neuron_5
3830,The Intel Corporation said on Thursday that it was canceling its plans to market a faster version of its Pentium 4 chip for personal computers to focus on products with  quot;more bang for the buck.,Sci/Tech,4,1.9150076
3835,"The Intel Corporation said that it was canceling plans to market a faster version of its Pentium 4 chip to focus on products with ""more bang for the buck.""",Sci/Tech,4,1.8701885
3862," NEW YORK (Reuters) - Delta Air Lines Inc. &lt;A HREF=""http://www.investor.reuters.com/FullQuote.aspx?ticker=DAL.N target=/stocks/quickinfo/fullquote""&gt;DAL.N&lt;/A&gt; on Friday  forecast a much wider third-quarter loss than Wall Street had  estimated, citing weak domestic fares and a spike in fuel  costs, sending its shares down nearly 6 percent.",Business,3,1.8292412
3864,INDIANAPOLIS - ATA Airlines announced temporary layoffs Thursday throughout its system amid speculation that the struggling airline was in merger talks.,Business,3,1.8162546
3887,Reuters - Video chain Blockbuster Inc on\Friday said it would lower the price of its online DVD rentals\to undercut a similar move by Netflix Inc. that sparked a stock\a sell-off of both companies' shares.,Sci/Tech,4,2.113064
3934,"When Greenville County in South Carolina borrowed \$800 million two years ago to expand its public schools, insurance broker Marsh  amp; McLennan Cos.",Business,3,1.9242675
3945,"OCTOBER 14, 2004 (REUTERS) - SAN FRANCISCO -- Sun Microsystems Inc. today posted a narrower quarterly loss as revenue rose year over year for the second consecutive quarter after three years of declines, sending shares slightly higher.",Sci/Tech,4,1.9607786
3954," NEW YORK (Reuters) - Price declines for U.S. consumer  electronics accelerated in August, fueled by discounted price  cuts for the popular iPod digital music player and traditional  DVD players, according to an industry study prepared for  Reuters.",Sci/Tech,4,1.9061639
3968,"The findings come in a report from the newly formed Consumer Spyware Initiative, a joint effort by Dell and the non-profit Internet Education Foundation that aims to increase awareness of spyware.",Business,3,1.8713372
3970,"SAN FRANCISCO -- At virtually every turn, Intel Corp. executives are heaping praise on an emerging long-range wireless technology known as WiMAX, which can blanket entire cities with high-speed Internet access.",Business,3,1.7628888
3975,"Ireland #39;s state-owned carrier, Aer Lingus, has asked the government for a grant worth euro200 million to euro300 million (US\$250 million to US\$375 million) to begin buying 10 or more long-haul aircraft from either Boeing or Airbus.",Business,3,1.7869431
3983,"Already the search tool so popular its name has become a verb, Google has been quietly adding important features in the background since it became a public company.",Sci/Tech,4,1.841396
3989,Microsoft confirms that a pirated copy of Halo 2 for Xbox in the PAL video format and French language started circulating on the Internet this week over newsgroups and piracy sites.,Sci/Tech,4,1.8057938
3991,"Tough times often make for strange bedfellows, and the explosion of viruses, computer worms and spyware programs on the Internet is producing unique alliances among top technology firms. &lt;FONT face=""verdana,MS Sans Serif,arial,helvetica"" size=""-2"" color=""#666666""&gt;&lt;B&gt;-washingtonpost.com&lt;/B&gt;&lt;/FONT&gt;",Sci/Tech,4,1.7664211
4005,"OCTOBER 18, 2004 (COMPUTERWORLD) - IBM and Borland Software Corp. last week separately brought out upgrades to their development tool lines that executives said add support for heterogeneous environments and ",Sci/Tech,4,1.8319533
4016,PC World has posted a news article claiming that the highly anticipated game Halo 2 for the Xbox has been released on the net.  quot;Microsoft confirms that a pirated copy of Halo 2 for Xbox in the PAL video format ,Sci/Tech,4,1.8528594
4020,"Texas Instruments Inc. (TXN.N: Quote, Profile, Research) , the largest maker of chips for cellular phones, on Monday said quarterly profit rose about 26 percent on demand from handset ",Business,3,2.0314727
4021,"IBM recently unveiled the TotalStorage DS6000, a roughly VCR-size system aimed at mid-size businesses. The new DS8000 series system features IBM Power5 microprocessors and IBM #39;s Virtualization ",Sci/Tech,4,1.863072
4023,"OCTOBER 18, 2004 (COMPUTERWORLD) - Microsoft Corp. #39;s move to a monthly patch-release cycle one year ago this month has made it easier to install security updates for Windows and other products, IT managers said last weekeven as they were greeted with a ",Sci/Tech,4,1.8109454
4025," NEW YORK (Reuters) - U.S. stocks closed higher on Monday  after a drop in oil prices eased worries about corporate  profits, although disappointing earnings from diversified  manufacturer 3M Co. &lt;A HREF=""http://www.investor.reuters.com/FullQuote.aspx?ticker=MMM.N target=/stocks/quickinfo/fullquote""&gt;MMM.N&lt;/A&gt; limited gains on the blue-chip Dow.",Business,3,1.8896813
4026," CHICAGO (Reuters) - Kraft Foods Inc. &lt;A HREF=""http://www.investor.reuters.com/FullQuote.aspx?ticker=KFT.N target=/stocks/quickinfo/fullquote""&gt;KFT.N&lt;/A&gt; on Monday  posted a 3.8 percent drop in quarterly profit, weighed down by  higher marketing spending and increased costs for cheese,  coffee and other materials.",Business,3,1.773428
4030,"NEW YORK - IBM Corp. posted quarterly results on Monday showing 9 percent revenue growth from last year and slight earnings growth, despite a \$320 million charge it took during the quarter to settle some claims in a lawsuit over its pension plan.",Sci/Tech,4,1.8768351
4047,"AP - People who use public or workplace computers for e-mail, instant messaging and Web searching have a new privacy risk to worry about: Google's free new tool that indexes a PC's contents for quickly locating data.",Sci/Tech,4,1.8911188
4049,"Telecommunications firm MCI Inc. on Monday said it will take a hefty \$3.5 billion charge in the third quarter to impair property, equipment and intangible assets related to its consumer phone business.",Business,3,2.032618
4052,"Boeing Co. received at least \$49 million in excessive profits on a \$1.2 billion contract to supply explosives-detection systems to hundreds of the nation #39;s airports, the Department of Homeland ",Business,3,1.8628311
4063,WASHINGTON -- Interest rates on short-term Treasury bills rose in yesterday's auction to the highest levels in 30 months.,Business,3,1.8217138
4069,Microsoft and Cisco Systems will collaborate to make their emerging products for network security compatible. The vendors had been working independently in the area of PC access to networks but say customers ,Sci/Tech,4,1.9430094
4070,"Linux distributor Red Hat Inc has appointed a vice president of desktop infrastructure technologies, a new position demonstrating its renewed commitment to Linux as a desktop operating system.",Sci/Tech,4,1.8041537
4072,"Technology India: New York, Oct 19 : The world #39;s leading computer chipmaker Intel has jumped off the chip speed roller coaster by yanking its four giga hertz (4 GHz) Pentium 4 processor off the drawing board.",Sci/Tech,4,1.8836422
4073,"Trust Digital Inc., a McLean software company, is getting a new chief executive and \$3.1 million in new investments as it tries to expand its business making security software for wireless devices. &lt;FONT face=""verdana,MS Sans Serif,arial,helvetica"" size=""-2""\ color=""#666666""&gt;&lt;B&gt;-The Washington Post&lt;/B&gt;&lt;/FONT&gt;",Sci/Tech,4,1.9860177
4078,"Constellation Brands Inc., the world #39;s largest winemaker, offered \$1.3 billion in cash to acquire Robert Mondavi Corp., maker of lower-price Woodbridge wines.",Business,3,1.896936
4082,Users and developers anxious to get their hands on Microsoft SQL Server 2005 will have wait a little longer. Since early this year Microsoft said to expect the finished version of the product in the first half of 2005.,Sci/Tech,4,1.7650654
4083,"Customers that use the dual-core processors that Intel Corp. and Advanced Micro Devices Inc. (AMD) are expected to begin shipping next year will not need to buy extra licenses for Microsoft Corp. software, the software maker will announce Tuesday.",Sci/Tech,4,1.9794225
4084,"Advanced Micro Devices Inc. (AMD) is expected to unveil its most powerful desktop processors to date on Tuesday, a few days after rival Intel Corp. disclosed changes to its desktop processor road map.",Sci/Tech,4,1.786593
4090,Symbol Technologies Tuesday launched a line of enterprise-class handheld devices aimed at mobile professionals such as retail managers and supply chain management professionals.,Sci/Tech,4,1.9287648
4093,"Sprint Corp. (FON.N: Quote, Profile, Research) on Tuesday reported a larger third-quarter loss due to a \$3.5 billion write-down in the value of its long-distance assets.",Business,3,1.8642659
4096,"J Sainsbury will take a 550 million (\$991 million) hit to profits this year as it invests to boost sales and reverse falling market share, Britain #39;s third-biggest supermarket chain said Tuesday.",Business,3,1.7857573
4098," NEW YORK (Reuters) - Wells Fargo   Co. &lt;A HREF=""http://www.investor.reuters.com/FullQuote.aspx?ticker=WFC.N target=/stocks/quickinfo/fullquote""&gt;WFC.N&lt;/A&gt;, the No. 4  U.S. bank, on Tuesday said third-quarter profit rose a  lower-than-expected 12 percent after a downturn in home  mortgage lending.",Business,3,1.860293
4105,"OCTOBER 19, 2004 (IDG NEWS SERVICE) - Customers that use the dual-core processors Intel Corp. and Advanced Micro Devices Inc. expect to ship next year won #39;t need to buy extra licenses for Microsoft Corp.",Sci/Tech,4,1.984705
4116,The plunge in US insurance stocks widened to include companies such as Aetna Inc. and Humana Inc. on concern New York Attorney General Eliot Spitzer #39;s probe of the industry will drag down profits.,Business,3,1.9588724
4119," LOS ANGELES (Reuters) - No. 1 video game maker Electronic  Arts Inc on Tuesday reported higher quarterly profits on strong  demand for titles like Madden NFL 2005, but its stock price  fell after a holiday forecast fell short of Wall Street  expectations.",Business,3,2.0650792
4123,"OT quot; gt; Motorola, the world #39;s second-largest maker of cellphones, said yesterday that its profit more than quadrupled in the third quarter and revenue jumped 26 percent compared with the quarter ",Business,3,1.8481426
4136,"Lucent Technologies' population of retired workers has grown so large over the years, there are four retirees for every active employee on its payroll. With health insurance costs soaring, Lucent now is saying that it's time for retirees to help pay for the benefit.",Business,3,1.8901645
4138,A Colorado man who placed a  quot;transplant wanted quot; ad on a Massachusetts-based Internet site is expected today to receive a kidney donated by a total stranger who simply wanted to do  quot;something big. quot; The transaction marks the first time an organ transplant has been brokered by a commercial web company.,Business,3,1.9555837
4148,"Motorola Inc., the world's No. 2 maker of cell phones, on Tuesday said its quarterly profit\more than tripled, as sales rose 26 percent, driven in part by a host of new handset models and cost controls.",Sci/Tech,4,1.9759524
4160,"Northwest Airlines Corp. posted a third-quarter loss on Wednesday, compared with profits a year ago, due to rising fuel costs and low-fare competition.",Business,3,1.8674492
4161,"In effort to expand market share, firm says it will invest \$100M in Disney #39;s money-losing business. NEW YORK (Reuters) - Children #39;s Place Retail Stores Inc.",Business,3,1.9704967
4164,Service engine maker Cummins Inc. on Wednesday said that third-quarter profits more than quadrupled - beating both its own guidance and Wall Street estimates - and full-year earnings would also exceed previous expectations.,Business,3,1.9052924
4177,"The Istanbul technology is meant to replace MSN chat and Windows Messenger. Microsoft has not released much information on the technology, which may not reach market until next year or even later.",Sci/Tech,4,1.8591924
4181," NEW YORK (Reuters) - Countrywide Financial Corp. on  Wednesday posted a 47 percent drop in quarterly earnings and  cut its outlook as mortgage refinancings fell and rates  climbed, sparking a broad sell-off in mortgage-company stocks.",Business,3,1.8916632
4191,The Securities and Exchange Commission said Wednesday that accounting firm KPMG LLP will pay \$10 million to Gemstar-TV Guide International shareholders to settle allegations it committed improper conduct in Gemstar #39;s audit.,Business,3,1.7692595
4194,Apple Computer (NASDAQ: AAPL) recently launched its Apple iTunes Store in Canada. But is a website really a store when all the company appears to be doing is charging different rates in each country?,Sci/Tech,4,1.9035945
4195,"Customers who use the dual-core processors that Intel and Advanced Micro Devices are expected to begin shipping next year will not need to buy extra licenses for Microsoft software, the software maker will announce next week.",Sci/Tech,4,1.9344738
4201,"Ten years after it unveiled its first dream house, Microsoft has a new demonstration home showcasing technology that Microsoft is betting will become commonplace within a few years.",Sci/Tech,4,1.9565854
4210,The steady decline in distillate fuel inventories comes as traders remain jittery about the world's strong demand and limited crude oil supply cushion.,Business,3,1.9844662
4214,"Three top Citigroup Inc. executives, including Vice Chairman Deryck Maughan, are leaving the financial services giant in the wake of a scandal at its Japanese private banking unit.",Business,3,1.9194285
4216,"By Bloomberg News. Cingular Wireless, which is buying AT amp;T Wireless, said yesterday that third-quarter sales rose 4.9 percent, to \$4.",Business,3,2.0653214
4219,"Lucent Technologies yesterday posted higher fiscal fourth- quarter earnings, helping lift the telecommunications equipment maker to its first profitable year since 2000.",Business,3,1.8842194
4222,"They #39;re bold, brash and break most rules of business -- so why are the Google guys multi-billionaires? GOOGLE Inc had plenty to celebrate at its recent annual summer picnic -- its debut as a public company ",Sci/Tech,4,1.9421893
4223,California #39;s top insurance regulator said Wednesday he will file a civil suit shortly in the widening scandal over insurance industry sales practices.,Business,3,1.9494861
4230,"USATODAY.com - Organized crime rings and petty thieves are flocking to the Internet like start-ups in the go-go '90s, establishing a multibillion-dollar underground economy in just a few years. The Internet's growth as an economic engine, particularly for financial transactions, is feeding the felonious frenzy.",Sci/Tech,4,1.8616099
4242,"AT amp;T Corp. swung to a third-quarter loss of \$7.12 billion after recording huge charges related to the company #39;s retreat from traditional telephone services, which has included at least 7,500 more job cuts ",Business,3,1.806537
4244,"Texas Instruments Inc. today announced development of the wireless industry #39;s first digital TV on a single chip for cell phones, code-named  quot;Hollywood.",Sci/Tech,4,1.884112
4249,"Athletic shoe and apparel maker Reebok International Ltd. (RBK) on Thursday posted better-than-expected quarterly earnings, helped by improved sales due to acquisitions and the weak dollar.",Business,3,2.020791
4254,Don #146;t let less-than-perfect credit prevent you from driving the car you want. Fill out a free loan application at Auto Net Financial and we #146;ll pre-arrange financing at a dealer near you.,Business,3,1.7989783
4256," CHICAGO (Reuters) - Chocolate maker Hershey Foods Corp.  &lt;A HREF=""http://www.investor.reuters.com/FullQuote.aspx?ticker=HSY.N target=/stocks/quickinfo/fullquote""&gt;HSY.N&lt;/A&gt; on Thursday posted a higher-than-expected 16 percent  rise in quarterly profit and said it will get into the cookie  business.",Business,3,1.8604422
4263," SEATTLE (Reuters) - Microsoft Corp. &lt;A HREF=""http://www.investor.reuters.com/FullQuote.aspx?ticker=MSFT.O target=/stocks/quickinfo/fullquote""&gt;MSFT.O&lt;/A&gt;, the world's  largest software maker, on Thursday said its first quarter  profit climbed as personal computer sales and business demand  fueled higher sales.",Business,3,2.1587405
4264,"The Motley Fool - The lure of bundling services has been hanging over the communications industry for the past six years or so, although many companies have been unable to perfect a winning strategy. Bundling brings together services such as wired (local and long distance) and wireless phone service, Internet access, and satellite or cable television services.",Sci/Tech,4,2.0782845
4269,"Disney and Viacom agreed to a fine of \$1.5 million from the Federal Communications Commission over claims their children #39;s cable television networks violated advertising restrictions, the FCC said Thursday.",Business,3,1.8575227
4278,"At Gartner Symposium ITXPO, Microsoft Chief Executive, Steve Ballmer touched on quite a few topics that are targeted towards Microsoft #39;s end consumers.",Sci/Tech,4,1.9399686
4284,"REDMOND, Washington, Oct 21 (AFP) - The world #39;s biggest software company, Microsoft Corp, said Thursday that its first quarter profits swelled to 2.9 billion dollars as consumers and businesses pumped up demand for new computers.",Business,3,2.1122806
4292,WASHINGTON (CBS.MW) -- Qwest Communications on Thursday said it #39;s agreed to pay \$250 million to end a federal probe of allegedly fraudulent accounting practices used by former executives.,Business,3,1.9928454
4297,Thursday #39;s agreement between Qwest Communications and federal regulator settles allegations of  quot;massive financial fraud quot; at a price of \$250 million.,Business,3,1.8591442
4304,Connecticut is going to join California amid New York Attorney General Eliot Spitzers probe over the US insurance industry scandal.,Business,3,1.7840279
4306,"Microsoft and Swatch announced a new line of wireless data watches named Paparazzi. The watches offer news, sports, weather and stock quotes, among other snippets of content, via Microsoft #39;s MSN Direct wireless data service.",Sci/Tech,4,1.7904216
4308," NEW YORK (Reuters) - Citigroup Inc. &lt;A HREF=""http://www.investor.reuters.com/FullQuote.aspx?ticker=C.N target=/stocks/quickinfo/fullquote""&gt;C.N&lt;/A&gt; on Friday said  U.S. securities regulators may recommend enforcement  proceedings against the former head of Citigroup Global  Investment Management.",Business,3,1.9521168
4311,"Primaris Airlines Inc. has announced plans to buy 20 Boeing 7E7-8 Dreamliners and 20 737-800s, a deal worth \$3.8 billion at list prices, the new low-cost business carrier and the Boeing Co.",Business,3,2.0110474
4316,"There is a strong trend for consumers to move away from using fixed-line phones in concert with mobiles to use mobile handsets for all or most of their voice calls, according to a study conducted for Finnish mobile handset maker Nokia by UK market ",Sci/Tech,4,1.9331185
4323,"OCTOBER 22, 2004 (IDG NEWS SERVICE) - Amazon.com Inc. fell a penny short of analysts #39; per-share earnings expectations, while reporting net sales of \$1.",Sci/Tech,4,1.8951874
4327," NEW YORK/SAN FRANCISCO (Reuters) - Shares of Google Inc.  rose as much as 20 percent on Friday, to trade at more than  twice the level of its cut-price IPO, after the Web search  leader posted strong quarterly results in its first reported  quarter as a public company.",Business,3,2.1009731
4335,US Treasury prices rose on Friday as a potent combination of record high oil prices and slumping stocks kept market participants jittery about the potential for slower growth.,Business,3,1.8414593
4346,"The \$41 billion merger between Cingular Wireless LLC and AT T Wireless Services Inc. won approval from the Federal Communications Commission Friday, according to federal sources close to the agency. &lt;BR&gt;\&lt;FONT face=""verdana,MS Sans Serif,arial,helvetica"" size=""-2""\ color=""#666666""&gt;&lt;B&gt;-The Washington Post&lt;/B&gt;&lt;/FONT&gt;",Sci/Tech,4,1.9761904
4349,Stock prices were pummeled by a toxic combination of still-rising oil prices and anxiety surrounding Eliot Spitzer #39;s probe of the insurance industry.,Business,3,2.051894
4354,"Delta Air Lines Inc. (DAL.N: Quote, Profile, Research) could file for Chapter 11 bankruptcy protection as soon as next week, the Washington Post reported in its Saturday edition, citing an unnamed source familiar with the situation.",Business,3,1.8099115
4356,"Delta Air Lines Inc. could file for Chapter 11 bankruptcy protection as soon as next week, a source familiar with the matter said yesterday.",Business,3,1.8680232
4359,"NEW YORK Oct. 18, 2004 - People who use public or workplace computers for e-mail, instant messaging and Web searching have a new privacy risk to worry about: Google #39;s free new tool that indexes a PC #39;s contents for quickly locating data.",Business,3,1.9242603
4363,"Bankrupt US Airways is giving flight attendants, machinists and passenger service workers three weeks to reach consensual cost-cutting pacts before the airline asks ",Business,3,1.8822942
4381,MAJOR Japanese computer maker Toshiba aimes to sell laptop computers that are loaded with its next generation DVD drive by next year.,Sci/Tech,4,1.8831514
4388,"Shareholders in Kidde, the fire protection group, have indicated they would be prepared to sell out if United Technologies Corporation (UTC), the US industrial conglomerate ",Business,3,1.8459462
4390,"Nextel Communications, the nation #39;s fifth-largest wireless provider, said yesterday that its profit jumped 69 percent in the third quarter from the period last year.",Business,3,1.8585861
4392," In finance, a process that requires a company to estimate the expected future value of a company #39;s pension assets and the expected cost of fulfilling pension and health care obligations to current and retired employees.",Business,3,1.9242134
4437,"MG Rover, the ailing British carmaker, has signed a binding agreement to hand over technology and know-how to the Shanghai Automotive Industry Corporation (SAIC).",Business,3,1.8525373
4441,"Federal regulators will formally approve Cingular Wireless #39;s \$41 billion purchase of AT amp;T Wireless today, company officials briefed on the matter said over the weekend.",Sci/Tech,4,1.851793
4442,I.B.M. plans to begin releasing a monthly report of threats to computer networks in an effort to establish an indicator similar to the federal governments Homeland Security Advisory System.,Sci/Tech,4,1.8323116
4451,"The \$41 billion merger between Cingular Wireless LLC and AT amp;T Wireless Services Inc. won approval from the Federal Communications Commission yesterday, according to federal sources close to ",Sci/Tech,4,2.0289586
4473," NEW YORK (Reuters) - U.S. stock futures pointed to a lower  market open on Monday, as oil prices hit another record,  fueling worries that soaring energy costs will bite into  corporate profits.",Business,3,1.8926497
4477,"The office of New York Attorney General Eliot Spitzer has uncovered evidence of improper business practices at Aon Corp., the world #39;s second-largest insurance broker, according to a published report.",Business,3,1.8593049
4478," NEW YORK (Reuters) - Ryder System Inc. &lt;A HREF=""http://www.investor.reuters.com/FullQuote.aspx?ticker=R.N target=/stocks/quickinfo/fullquote""&gt;R.N&lt;/A&gt; on Monday  reported an increase in quarterly net profit amid increased  demand for transport services, especially in its fleet  management division.",Business,3,1.8252288
4481,AP - South Korea's Hynix Semiconductor Inc. said Monday its third-quarter net profit more than tripled from same period last year thanks to steady global prices for memory chips.,World,1,1.7706008
4486,A privately-owned Dutch steelmaker headed by billionaire Lakshmi Mittal is buying US-based International Steel Group Inc. for about \$4.,Business,3,1.9214324
4493,"washingtonpost.com - Think your PC is safe? Think again. A new study indicates your home computer is likely bogged down with spyware, viruses and other scourges wrought by hackers and PC pranksters. Ignorance may be bliss for some people, but for computer users, not knowing can be costly and inefficient.",Sci/Tech,4,1.8266845
4496,"Texas power company TXU Corp. (TXU.N: Quote, Profile, Research) on Monday raised its dividend by 350 percent, boosted its earnings forecast and increased its share buyback program ",Business,3,1.9701828
4498,"\\Found this  via BoingBoing this morning:\\""The new Treo 650 is out today -- and as a long-time fan of the Treo, I've been\looking forward to it. I've asked in the past for ""one with everything"" -- a\phone with all the features I could want in one device, without\compromises. It looks like PalmOne delivered, with a 320x320 screen, removable\battery, upgraded OS, a better camera, and Bluetooth.""\\""Oops -- not quite! TreoCentral is reporting that the Sprint version of the\Treo 650 doesn't allow you to use Bluetooth for dial-up networking through\your computer. Apparently other carriers will, but not Sprint.""\\""You see, Sprint sells connection cards, which are PCCards that allow you to\dial up y ...\\",Sci/Tech,4,1.8114126
4501,"United Online Inc., a California-based provider of low-cost Internet subscription services, has agreed to buy Internet networking company Classmates Online Inc.",Business,3,2.1282966
4503,IBM on Monday plans to begin releasing a monthly report of threats to computer networks in an effort to establish an indicator similar to the US government #39;s Homeland Security Advisory System.,Sci/Tech,4,1.8229933
