,Original_Text,Class_String,Class_Number,Neuron_63
4358,"Reuters - U.S. planes bombed targets in\Iraq's rebel-held city of Falluja, killing two people, and the\U.S. military said it had captured a lieutenant of its\deadliest Islamist enemy in Iraq in a raid early on Saturday.",World,1,0.8468878
4374,"Insurgents launched strikes on Saturday at United States and Iraqi outposts across Iraq, killing at least a dozen Iraqi police officers and national guardsmen ",World,1,0.8803267
4380,"AP - The United States could cut its forces in Afghanistan next summer if Taliban militants accept an amnesty to be drawn up by President Hamid Karzai and neighboring Pakistan, the senior U.S. commander here said Sunday.",World,1,0.9197753
4403,"KABUL, Afghanistan -- A Taliban suicide fighter killed himself and wounded at least seven others, including three members of a NATO-led peacekeeping force, in a grenade attack on a busy shopping street in central Kabul yesterday.",World,1,0.84089744
4414,ISRAEL killed two Islamic Jihad militants in the Gaza Strip yesterday as Ariel Sharon and his cabinet finalised a bill to withdraw from Gaza.,World,1,0.96339554
4419,"Two Iraqis were killed and four others wounded in clashes that broke out between US troops and insurgents in Samarra, north of Baghdad, police said on Sunday.",World,1,0.92044914
4452,The corpses of 50 soldiers of Iraq #39;s new army have been discovered northeast of the capital Baghdad. Interim Iraqi interior ministry spokesman Adnan Abd al-Rahman said the troops were believed to have been ,World,1,0.8401572
4463," GAZA (Reuters) - Israeli tanks and troops backed by  helicopter gunships stormed Khan Younis refugee camp, a Gaza  militant stronghold, on Monday, killing 10 Palestinians  including an 11-year-old boy, medics and witnesses said.",World,1,0.9427287
4541,"Israeli MPs have resumed a debate on Prime Minister Ariel Sharon #39;s disengagement plan, which is expected to culminate in a historic vote in favour of a pull-out of troops and settlers from the Gaza Strip.",World,1,0.968474
4589, JERUSALEM (Reuters) - Israeli Finance Minister Benjamin  Netanyahu said on Tuesday he and three other cabinet members  from Ariel Sharon's Likud would quit unless the prime minister  agreed to hold a referendum on a pullout from Gaza.,World,1,0.9235148
4616,The group led by wanted terrorist Abu Musab al-Zarqawi has said it has abducted a member of Japan #39;s armed forces and is threatening to behead him if the Japanese government does not withdraw its troops from Iraq within 48 hours.,World,1,0.8507712
4639, JERUSALEM (Reuters) - Israeli leader Ariel Sharon rejected  calls from within his divided cabinet on Wednesday for a  referendum on leaving Gaza after winning parliament's support  to uproot settlements from land claimed by Palestinians.,World,1,0.83461004
4647," THE HAGUE (Reuters) - Former Yugoslav President Slobodan  Milosevic's two court-assigned defense lawyers have asked to be  withdrawn from his case, The Hague war crimes tribunal said  Wednesday.",World,1,0.8328034
4654,"_ Nearly 800 British forces left their base in southern Iraq on Wednesday, heading north toward Baghdad to replace US troops who are expected to take part in an offensive against insurgent strongholds.",World,1,0.88750225
4668,British troops have rolled north from Basra to take over a deadly area near Baghdad and free up US troops for a widely expected attack on the rebel-held city of Falluja.,World,1,0.8948398
4736,"An elite contingent of 50 Nigerian soldiers left Nigeria on Thursday for Darfur, the first stage in the deployment of 3,000 extra African Union (AU) troops to monitor a shaky cease-fire in the western Sudanese region.",World,1,0.9187743
4748,"Unknown armed men in military uniform kidnapped three staff of the United Nations in the Afghan capital city at broad daylight Thursday, Afghan officials confirmed.",World,1,0.87359816
4752,"AP - A bomb exploded Thursday evening outside a bar in southern Thailand, the scene of a campaign of violence blamed on Islamic separatists, injuring at least 15 people, police said.",World,1,0.8396945
4761,"JERUSALEM, Oct 28 (AFP) - Israel will not bar ailing Palestinian leader Yasser Arafat from returning to the West Bank if he were to leave for medical treatment, senior government spokesman Raanan Gissin told AFP Thursday.",World,1,0.8857289
4788," BAGHDAD (Reuters) - Militants piled more pressure on  Washington's military allies in Iraq on Thursday, seizing an  Iraqi-Polish woman and holding a Japanese man under threat of  death.",World,1,0.86359805
4812,AP - The militant Palestinian group Hamas said Friday it was setting aside its differences with ailing Palestinian leader Yasser Arafat and called for a united Palestinian leadership to work toward general elections.,World,1,0.95833683
4874,"Description: In Cambodia, Norodom Sihamoni who accedes to the throne with an elaborate coronation, following the abdication of his father King Norodom Sihanouk.",World,1,0.8589643
4890,"A militant group is threatening to kill three UN hostages kidnapped in Afghanistan, including a British woman, unless all Taliban prisoners are released.",World,1,0.88294226
4910,"Japan has confirmed that the headless body found in Baghdad on Saturday is of the Japanese being held captive in Iraq. An armed group in Iraq had on Tuesday threatened to behead Shosei Koda, 24, within 48-hours unless Japan pulled its troops out of Iraq.",World,1,0.9278891
5012,"An unknown militant group holding Iraqi-British hostage Margaret Hassan in Iraq has threatened to turn her over to a group led by al Qaeda ally Abu Musab al-Zarqawi if its demands are not met, Al Jazeera television says.",World,1,0.85502744
5014,"BAGHDAD, Iraq -- The kidnappers of aid worker Margaret Hassan threatened to turn her over to an al-Qaida affiliated group within 48 hours if the British government refuses to pull its troops from Iraq, Al-Jazeera television reported Tuesday.",World,1,0.90444946
5042,An Iraqi security official said gunmen abducted a Lebanese-American contractor who worked with the US Army in Iraq. Officials said gunmen snatched him when he answered the door at his Baghdad home overnight.,World,1,0.8741664
5068,"Speaking from France, Palestinian officials say leader Yasser Arafat took a turn for the worse late Wednesday. Citing officials who spoke on condition of anonymity, The Associated Press reports that Arafat #39;s ",World,1,0.8404485
5082,"Palestinian leader Yasser Arafat has been in a coma for several hours and now in critical condition, Arafat #39;s senior aides said on Thursday.",World,1,0.8520837
5207,Pakistani President General Pervez Musharraf on his visit after the landmark presidential polls in Afghanistan congratulated his Afghan counterpart Hamid Karzai for his victory Saturday afternoon.,World,1,0.9691175
5235," KABUL (Reuters) - Afghan militants holding three U.N.  workers hostage began talks with the government and the United  Nations on Sunday and the kidnappers have dropped some of their  demands, a militant spokesman said.",World,1,0.892825
5243,The Iraqi government declared a state of emergency for 60 days as U.S. and Iraqi forces prepared for an expected assault on rebels in Fallujah.,World,1,0.95077515
5245, BAGHDAD (Reuters) - Iraq's interim government declared a  state of emergency for 60 days on Sunday to quell violence  gripping the country ahead of January elections.,World,1,0.88217974
5247,"JERUSALEM -- Former US envoys say that the passing of Yasser Arafat would open up new opportunities for Mideast peace, especially if new, pragmatic Palestinian leaders emerge.",World,1,0.86799294
5249," PARIS (Reuters) - Yasser Arafat, critically ill in a Paris  hospital, has suffered liver failure, a Palestinian official  said on Sunday as Arafat's subordinates decided in his absence  to enforce a law and order plan in Palestinian areas.",World,1,0.8657529
5287, ABIDJAN (Reuters) - Ivory Coast President Laurent Gbagbo  appealed for an end to the anti-French violence which erupted  after France destroyed most of the country's air force in  retaliation for the killing of nine French peacekeepers.,World,1,0.8784065
5358,"U.S. Army and Marine units thrust into the heart of the insurgent stronghold of Fallujah on Tuesday, fighting fierce street battles and conducting house-to-house searches on the second day of a major assault to retake the city from Islamic militants.",World,1,0.9322266
5441,"Iran will pull out of the nuclear Non-Proliferation Treaty (NPT) and develop its atomic programme in secret if Western nations threaten or put pressure on Tehran, a senior Iran diplomat was quoted as saying on Wednesday.",World,1,0.86306715
5471,"BEIRUT, Lebanon - Yasser Arafat promised Palestinians he would return them to the homes they lost when Israel was founded in 1948.",World,1,0.8770285
5520,"Yasser Arafat, who triumphantly forced his peoples plight into the world spotlight but failed to achieve his lifelong quest for Palestinian statehood, died today, aged 75, Palestinian Cabinet minister Saeb Erekat confirmed.",World,1,0.8801436
5550,AP - Dutch lawmakers accused the government Thursday of underestimating the threat from Islamic terrorists and failing to protect a filmmaker slain by a suspected Muslim radical.,World,1,0.8499268
5564,The death of Palestinian leader Yasser Arafat is deeply dividing an already torn Middle Eastern country. As Palestinians mourn the loss of their leader ,World,1,0.895393
5630,"Tens of thousands of civilians are confined to their houses in Fallujah and may be in need of humanitarian aid as US and Iraqi forces battle insurgents for control of the city, according to Iraq #39;s Islamic Party.",World,1,0.9381913
5655," NANO, Pakistan (Reuters) - Pakistani forces are driving al  Qaeda-linked militants out of mountains near the Afghan border  but attacks such as a bomb that wounded soldiers on Saturday  could not be ruled out, a commander said.",World,1,0.8586298
5710,"AP - Iran has agreed to fully suspend uranium enrichment and linked activities that Washington asserts are part of a nuclear weapons program, diplomats said Sunday.",World,1,0.83831716
5716,"AP - Mahmoud Abbas, the temporary successor to Yasser Arafat, escaped unharmed Sunday when militants firing assault rifles burst into a mourning tent for the deceased Palestinian leader, killing two security guards and wounding six other people.",World,1,0.8785023
5743,"WASHINGTON -- Iran pledged yesterday to temporarily suspend its uranium enrichment program in an attempt to ease suspicions that it is trying to develop nuclear weapons. The move could defuse a longstanding showdown with the United States over Iran's nuclear activities, diplomats said.",World,1,0.8613994
5778,Fierce battles between insurgents and US and Iraqi forces killed at least 27 people today in Baqouba and south of Baghdad as US forces move against the last remaining pockets of resistance in Fallujah.,World,1,0.89502174
5805,A rebel counteroffensive swept through central and northern Iraq on Monday as American troops struggled to flush the remaining insurgents from the rubble-strewn streets of Falluja.,World,1,0.9120649
5827,"On the eve of a high-profile UN Security Council visit to Nairobi, members are split over a draft resolution on atrocities in Sudan #39;s western Darfur region.",World,1,0.90983707
5878,"ARIEL SHARON, the Israeli Prime Minister, made his first conciliatory gesture towards Palestinians after the death of Yassir Arafat when he said that he would consider co-ordinating the dismantling of Jewish settlements in the Gaza Strip with a new ",World,1,0.8734486
5913,"MOSUL, Iraq -- US and Iraqi troops stormed insurgent-held police stations and neighborhoods in this northern city Tuesday, retaking a number of sites seized last week by gunmen who rose up in support of militants in Fallujah.",World,1,0.87209004
5961,THE Palestinian Authority is to set up an official commission of inquiry into Yasser Arafats death amid increasing rumours among the Palestinian public that he was poisoned by Israel.,World,1,0.8639456
5989,"JERUSALEM A preliminary Israeli army investigation has found that Israeli troops apparently killed three Egyptian soldiers by mistake, thinking they were Palestinian militants along the Gaza-Egypt border.",World,1,0.9713371
5991,"An Israeli tank has opened fire and killed three Egyptian troops in a border zone near the Gaza Strip after mistaking them for Palestinian arms smugglers, Israeli security sources say.",World,1,0.9313774
5992,"AFP - Three Egyptian policemen were killed overnight by Israeli tank fire on the tense border between Egypt and the Gaza Strip when they were mistaken for Palestinian arms smugglers, officials said.",World,1,0.97319794
6002,"President Thabo Mbeki has urged all countries, including Ivory Coast #39;s neighbours, to immediately enforce a United Nations arms embargo on government and rebel forces in Ivory Coast.",World,1,0.8387165
6032,"The Israeli prime minister, Ariel Sharon, apologized to Egypt today after an Israeli army tank crew fired on an Egyptian patrol near the border with Gaza, killing three Egyptian police officers.",World,1,0.9446784
6048,Sponsors of an internationally backed Mideast peace plan will send their foreign ministers to the region next week in hopes of restarting Israeli-Palestinian talks in the wake of Yasser Arafat #39;s death.,World,1,0.85779566
6075,"JERUSALEM -- Israeli troops mistook three Egyptian police officers for Palestinian militants and shot them dead yesterday along the Gaza Strip's border with Egypt, increasing tensions between the neighbors.",World,1,0.87203586
6107,"AFP - Pakistani security forces have arrested a key Al-Qaeda operative wanted in connection with attacks on Christian targets and a failed bid to kill President Pervez Musharraf, an official said.",World,1,0.9387175
6166,"BAGHDAD, IRAQ - Insurgents continued to strike against coalition targets in Iraq Saturday, resulting in the deaths of one US soldier and four government employees in Baghdad.",World,1,0.88017905
6213,US Secretary of State Colin Powell has launched a new Middle East peace drive by saying he will press both Israeli and Palestinian leaders for steps to help Palestinians elect a successor to Yasser Arafat.,World,1,1.0094512
6305," GAZA (Reuters) - Israeli soldiers shot dead five  Palestinians in north Gaza on Tuesday after mortar fire from  Palestinian militants wounded two people in a nearby Jewish  settlement, medics on both sides said.",World,1,0.9084696
6413,"DAMASCUS, Syria - Syrian President Bashar Assad is ready to resume peace talks with Israel  quot;without conditions, quot; a top UN envoy said yesterday.",World,1,0.83606887
6434,"A lieutenant of Iraq's most feared insurgent leader, Abu Musab Zarqawi, was captured this week, the country's national security minister said Thursday.",World,1,0.8395225
6556,"The Palestinians will not accept an interim settlement with Israel, Palestine Liberation Organization chief Mahmoud Abbas told the Arab League during a visit to Egypt yesterday.",World,1,0.8537929
6579, JERUSALEM (Reuters) - Prime Minister Ariel Sharon on Monday  narrowly survived three parliamentary no-confidence votes  sponsored by opposition parties over deepening poverty in  Israel.,World,1,0.9093153
6632,"Reuters - A car bomb exploded near a U.S.\military patrol in the town of Baiji, north of Baghdad, on\Tuesday, killing at least seven Iraqis and wounding 20 people,\including two U.S. soldiers, doctors and the military said.",World,1,0.9020697
6833,"AP - There is no reason to hold a meeting of Iraq's neighbors planned for this week in Amman, an Iranian envoy said Monday in a further sign of strained relations following accusations by Jordan's King Abdullah that Tehran wanted to influence the Iraqi elections.",World,1,0.8803249
6948," SAMARRA, Iraq (Reuters) - Three Iraqis were killed on  Wednesday when a suicide car bomber attacked a U.S. convoy in  the northern city of Samarra, a local police official said.",World,1,0.8600426
7029,"MOSUL, Iraq, Dec 9 (AFP) - Six Iraqi national guardsmen and 10 civilians were wounded in two bomb attacks in the northern city of Mosul on Thursday, police said.",World,1,0.8972696
7086," JERUSALEM (Reuters) - Israeli Prime Minister Ariel Sharon  on Friday invited the opposition Labour Party to begin talks to  form a unity government, a move that would avoid early  elections and pave the way for a withdrawal from Gaza.",World,1,0.8516512
7101,Darfur #39;s rebel leaders held preliminary talks with African Union mediators in Abuja on Friday ahead of the latest round of peace negotiations on the crisis in the western Sudanese region.,World,1,0.8830128
7118,"LAST MONTH the United States and its allies signaled a change in Sudan policy. Rather than pressuring Sudan #39;s government to halt its genocidal attacks against civilians in the western province of Darfur, they ",World,1,0.86385924
7170,Israel #39;s opposition Labour party began talks with Prime Minister Ariel Sharon #39;s Likud party yesterday about joining its coalition - a partnership aimed at promoting a military withdrawal from Gaza.,World,1,0.8733953
7195,BUCHAREST: Romanians voted for a new president on Sunday with fighting corruption and joining the EU the main themes in a run-off round pitting Prime Minister Adrian Nastase against Bucharest Mayor Traian Basescu.,World,1,0.85225827
7197,"RAFAH, Gaza Strip (AFP) - Four Israeli soldiers were killed when Palestinian militants blew up a tunnel under an army post in Gaza, as jailed intifada leader Marwan Barghuti pulled out of the Palestinian elections.",World,1,1.0396261
7200,YASSER Arafat is dead. A so-called moderate is now chairman of the Palestine Liberation Organization. Elections to choose a Palestinian Authority president are scheduled in the West Bank and Gaza for early January.,World,1,0.8322577
7245,"AP - Spain's prime minister, heckled Monday by opposition lawmakers, angrily denied his Socialist party instigated anti-government rallies on the eve of a general election to reap political benefit from the Madrid train bombings.",World,1,0.84942144
7253,"Army reinforcements sent to bolster the Democratic Republic of Congo #39;s fragile border region with Rwanda have clashed with former rebel units within the army, a local military commander said on Sunday.",World,1,0.8339492
7264,Officials in Iraq say at least 10 Iraqis have been killed and several others wounded in separate insurgent attacks across the country.,World,1,0.83510506
7320,"Iraq may begin war crimes trials for senior members of Saddam Hussein #39;s former regime as soon as next week, Iraqi Prime Minister Ayad Allawi said.",World,1,0.91184795
7356,"KANDAHAR, Afghanistan, Dec 14 -- Afghan forces have captured two top figures of the deposed Taliban government, including the personal security chief of leader Mohammad Omar, provincial officials said Tuesday.",World,1,0.8327431
7375,"The kidnapped Turkish engineer was found dead in Kunar province in east Afghanistan on Wednesday, one day after he was abducted by unknown gunmen, the Afghan Interior Ministry said.",World,1,0.9260776
7382,North Korea has warned Japan that it will treat economic sanctions as a  quot;declaration of war quot; and threatens to try to exclude Tokyo from six-party talks on Pyongyang #39;s nuclear arms programs.,World,1,0.849753
7390,"Hijackers who took as many as 26 people hostage on a commuter bus on the outskirts of Athens released five of the captives. Police are in negotiations to free the remaining hostages, a spokeswoman said.",World,1,0.84593695
7396,"ANKARA, Dec 15 (AFP) - The Turkish ambassador in Afghanistan has confirmed the death of a Turkish engineer kidnapped Tuesday in Afghanistan #39;s eastern Kunar province, the Anatolia news agency reported Wednesday.",World,1,0.8712544
7419,"AFP - An Italian national working for a British non-governmental organisation has been taken hostage in Iraq, the Italian news agency ANSA reported, quoting Italian intelligence sources.",World,1,0.8653756
7534,BAGHDAD (AFP) - The United States failed win a promise from the United Nations to increase its staff in Iraq ahead of elections as Washington stepped up its charges that Damascus was sheltering insurgent leaders.,World,1,0.8625049
7560," JERUSALEM (Reuters) - Israel's opposition Labour party has  clinched a deal with Prime Minister Ariel Sharon's Likud party  to join his coalition, a move that could push forward his Gaza  pullout plan, Israeli media reported on Friday.",World,1,0.8467302
7578,"CAIRO, Dec 17 (AFP) -- One of the two main rebel groups in Sudan #39;s war-torn Darfur region said that the government had launched an offensive on rebel-held towns in southern Darfur, denouncing it as a truce violation.",World,1,0.8495494
