,Original_Text,Class_String,Class_Number,Neuron_22
6,"\\""Sven Jaschan, self-confessed author of the Netsky and Sasser viruses, is\responsible for 70 percent of virus infections in 2004, according to a six-month\virus roundup published Wednesday by antivirus company Sophos.""\\""The 18-year-old Jaschan was taken into custody in Germany in May by police who\said he had admitted programming both the Netsky and Sasser worms, something\experts at Microsoft confirmed. (A Microsoft antivirus reward program led to the\teenager's arrest.) During the five months preceding Jaschan's capture, there\were at least 25 variants of Netsky and one of the port-scanning network worm\Sasser.""\\""Graham Cluley, senior technology consultant at Sophos, said it was staggeri ...\\",Sci/Tech,4,0.6331311
10," LOS ANGELES (Reuters) - A group of technology companies  including Texas Instruments Inc. &lt;TXN.N&gt;, STMicroelectronics  &lt;STM.PA&gt; and Broadcom Corp. &lt;BRCM.O&gt;, on Thursday said they  will propose a new wireless networking standard up to 10 times  the speed of the current generation.",Sci/Tech,4,0.6250571
11, LOS ANGELES (Reuters) - Apple Computer Inc.&lt;AAPL.O&gt; on  Tuesday began shipping a new program designed to let users  create real-time motion graphics and unveiled a discount  video-editing software bundle featuring its flagship Final Cut  Pro software.,Sci/Tech,4,0.68088424
12," AMSTERDAM (Reuters) - Free Record Shop, a Dutch music  retail chain, beat Apple Computer Inc. to market on Tuesday  with the launch of a new download service in Europe's latest  battleground for digital song services.",Sci/Tech,4,0.6728718
16,"Jet Propulsion Lab -- Scientists have discovered irregular lumps beneath the icy surface of Jupiter's largest moon, Ganymede. These irregular masses may be rock formations, supported by Ganymede's icy shell for billions of years...",Sci/Tech,4,0.6436444
17,"European Space Agency -- ESAs Mars Express has relayed pictures from one of NASA's Mars rovers for the first time, as part of a set of interplanetary networking demonstrations.     The demonstrations pave the way for future Mars missions to draw on joint interplanetary networking capabilities...",Sci/Tech,4,0.644415
43,"FT.com - Shares in Sohu.com, a leading US-listed Chinese internet portal, fell more than 10 per cent on Friday after China's biggest mobile phone network operator imposed a one-year suspension on its multimedia messaging services because of customers being sent spam.",Sci/Tech,4,0.66496176
63,"NewsFactor - Oracle (Nasdaq: ORCL) has revamped its sales-side CRM applications in version 11i.10 of its sales, marketing, partner relationship management and e-commerce application.",Sci/Tech,4,0.6392599
70,"Red Flag Software Co., the company behind China's leading Linux client distribution, plans to focus more on its server operating system and enterprise customers, the company's acting president said.",Sci/Tech,4,0.71351427
71,"AOL Properties Sign Girafa For Thumbnail Search Images\\Girafa.com Inc. announced today that the CompuServe, Netscape, AIM and ICQ properties of America Online, Inc., have signed an agreement with Girafa to use Girafa's thumbnail search images as an integrated part of their search results.\\Using Girafa's thumbnail search service, search users can ...",Sci/Tech,4,0.7064144
83,"SAN FRANCISCO -- In the latest of a series of product delays, Intel Corp. has postponed the launch of a video display chip it had previously planned to introduce by year end, putting off a showdown with Texas Instruments Inc. in the fast-growing market for high-definition television displays.",Business,3,0.6320003
89,"A proposal backed by a coalition of telephone carriers would cut billions of dollars in fees owed by long-distance companies to regional phone giants but would allow the regional companies to make up some of the difference by raising monthly phone bills for millions of consumers. &lt;FONT face=""verdana,MS Sans Serif,arial,helvetica"" size=""-2""\ color=""#666666""&gt;&lt;B&gt;-The Washington Post&lt;/B&gt;&lt;/FONT&gt;",Sci/Tech,4,0.71728677
111,"IBM said Tuesday it has acquired a pair of Danish IT services firms as part of its effort to broaden its presence in Scandinavia. As a result of the moves, IBM will add about 3,700 IT staffers to its global head count. Financial terms of ...",Sci/Tech,4,0.6366843
124,"NewsFactor - IBM (NYSE: IBM) has -- again -- sought to have the pending legal claims by The SCO Group dismissed. According to a motion it filed in a U.S. district court, IBM argues that SCO has no evidence to support its claims that it appropriated confidential source code from Unix System V and placed it in Linux.",Sci/Tech,4,0.677514
233,"TechWeb - Customers are decoupling storage from server purchases, which explains why EMC and NetApp earnings were up and why Sun and HP were flat or down, Warmenhoven says.",Sci/Tech,4,0.65302515
243,"MacCentral - Market research company Ipsos-Insight on Tuesday announced the results of TEMPO, a quarterly survey of digital music behaviors. According to the report, consumers aged 12 and older in the United States were as likely to be aware of Apple Computer Inc.'s iTunes Music Store and Napster 2.0 when it came to recognizing digital music download brands -- each music service registered 20 percent of what TEMPO refers to as ""top-of-mind"" awareness.",Sci/Tech,4,0.6795433
257, NEW YORK (Reuters) - Pharmacy chain CVS Corp. on Thursday  said it would offer the world's first disposable digital camera  with a bright color viewing screen that allows consumers to  instantly preview pictures.,Sci/Tech,4,0.6444827
283,"In a dramatic ending that marks a beginning in scientific research, NASA's Genesis spacecraft is set to swing by Earth and jettison a sample return capsule filled with particles of the Sun that may ultimately tell us more about the genesis of our solar system.",Sci/Tech,4,0.6309284
292,"In a major setback for the music and movie industries, a federal appeals court upholds a lower court's decision in the infamous Grokster case, ruling peer-to-peer services Morpheus and Grokster are not liable for the copyright infringement of their users. By Katie Dean.",Sci/Tech,4,0.6290129
293,"The producer of ads featuring PC users who switched to Macs is applying the same tactic to political commercials. This time, he'll focus on former backers of President Bush, recruited online, who've changed their political allegiance. By Louise Witt.",Sci/Tech,4,0.65356976
306,"Understanding Google AdWords\\Unlike many search engines Google, to its credit, clearly denotes search listings that are paid placement. In fact, Google AdWords appear in a separate section down the left side of the screen.\\Google AdWords provide an inexpensive advertising venue for businesses to advertise products or services to a targeted ...",Sci/Tech,4,0.6242315
423,"New antispam technology standards are on the way that promise to hit spammers where it hurts the most--their wallets. At issue is the ability to authenticate the original source of e-mail messages, a major ",Sci/Tech,4,0.63210064
447,Terra Lycos SA introduced two search tools on its Lycos U.S. Internet site on Monday as part of a recently announced strategy to focus on services that allow users to connect with others.,Sci/Tech,4,0.69338715
454,"Wi-Fi is going sky-high thanks to a deal forged between enterprise Internet service provider iPass and Connexion by Boeing. Under the deal, iPass #39;s 528,000-plus Wi-Fi enterprise customers will ",Sci/Tech,4,0.63548285
471,"Network equipment giant Cisco Systems (Quote, Chart) is buying IP platform specialist P-Cube for \$200 million in cash and stock. P-Cube #39;s technology helps telecom carriers, cable operators and ISPs manage ",Sci/Tech,4,0.6299093
531,"SAN JOSE, Calif.Cisco Systems Inc. said it has agreed to acquire P-Cube for \$200 million in stock and cash to enable service providers to further control and manage such advanced Internet Protocol services ",Sci/Tech,4,0.69229174
539,"Reuters - Playboy magazine on Tuesday\posted to its Web site an unpublished portion from its\interview with Google's founders, which raised regulatory\eyebrows not for what it revealed, but for its timing -- just\before the Internet search engine's much-anticipated initial\public offering.",Sci/Tech,4,0.6246618
559,"The United Nations, through its International Open Source Network (IOSN) will organize the first annual Software Freedom Day on Saturday in an effort to educate Asian users about the benefits of Free and Open Source Software (FOSS) and encourage its wider use in the region.",Sci/Tech,4,0.6347566
567,"In an attempt to stem the growing tide of online scams, identity theft and the proliferation of junk e-mail, the Justice Department and state law enforcement officials have initiated what seems to be the largest dragnet yet against spammers, so-called ""phishers"" and other Internet con artists. &lt;FONT face=""verdana,MS Sans Serif,arial,helvetica"" size=""-2"" color=""#666666""&gt;&lt;B&gt;-washingtonpost.com&lt;/B&gt;&lt;/FONT&gt;",Sci/Tech,4,0.7754267
586,"Server shipments and revenue increased in the second quarter, with low-cost servers based on Linux or the Windows operating system growing faster than their Unix counterparts, according to research firm Gartner Inc.",Sci/Tech,4,0.67885214
594,"Customers will be able to download film clips, audio and video, interactive multiplayer games, multimedia music tracks,  quot;push-to-watch quot; services, as well as access large e-mail attachments.",Sci/Tech,4,0.6726855
597,"The FBI seized computers, software and equipment as part of an investigation into illegal sharing of copyrighted movies, music and games over an Internet ""peer-to-peer"" network, Attorney General John Ashcroft announced Wednesday.",Sci/Tech,4,0.6564233
602,"Sales of server systems rose 7.7 percent globally in the second quarter to \$11.55 billion as demand for Information Technology remained strong after a three year downturn, market research firm Gartner said in a statement.",Sci/Tech,4,0.6398828
627,Enterprises seeking higher security for their growing number of mobile devices may be interested in new encryption technology that Nokia Corp. is deploying in its smart phone products.,Sci/Tech,4,0.6473081
630,"Microsoft Corp. is starting to ramp up distribution of its massive security update for the Windows XP operating system, but analysts say they still expect the company to move at a relatively slow pace to avoid widespread glitches.",Sci/Tech,4,0.6308604
632,"Understanding Search Engine Models\\To understand search engines and search engine marketing, one must first understand the search engine model. There are two fundamentally different types of search engine back ends: site directories and spidering search engines. Site directory databases are built by a person manually inputting data about websites. Most ...",Sci/Tech,4,0.6703665
645,Reuters - Intel Corp. (INTC.O) on Thursday\said it has upgraded the wireless networking capabilities of\its Centrino line of notebook computer chips to allow broader\network access with improved security.,Sci/Tech,4,0.64337355
661,"NewsFactor - IBM (NYSE: IBM) has said it will purchase Venetica, a privately held firm that provides content-integration software to unstructured data sources.",Sci/Tech,4,0.62431777
744,"The computer-hardware giant, best known for products such as PCs and printers, on Friday laid out its plan to become a brand-name in consumer electronics products such as flat-screen TVs, music players and the devices that move content between them.",Business,3,0.63592297
748,"The US space agency, NASA, continues work on improving the safety of the space shuttle, before the fleet of orbiters resumes its visits to the international space station next year.",Sci/Tech,4,0.64282215
763,"Microsoft says it plans to broadly release the long-awaited update to its flagship Windows operating system, dubbed  #39;Longhorn #39;, in 2006.",Sci/Tech,4,0.6335553
783,"An asteroid the size of a large storage shed came within 4,100 miles of Earth this spring, making it the closest near miss ever recorded, US astronomers said this week.",Sci/Tech,4,0.64209396
791,"If my car died tomorrow, I'd have a lot less angst picking its successor than I would if my TV conked out. &lt;FONT face=""verdana,MS Sans Serif,arial,helvetica"" size=""-2""\ color=""#666666""&gt;&lt;B&gt;-Rob Pegoraro&lt;/B&gt;&lt;/FONT&gt;",Sci/Tech,4,0.6399533
859,Microsoft is shaking up its plans for the next version of Windows to get the software off the drawing board and into PCs by the end of 2006.,Sci/Tech,4,0.6257378
880,"This article discusses Network Access Quarantine Control in Windows Server 2003, which allows administrators to quarantine mobile users and verify their security posture before giving them full access to the network. Part 2 of 2.",Sci/Tech,4,0.65798116
887,"SAN MATEO, Calif. -- The promise of Internet-based video has long been hamstrung by copyright and piracy worries, slow dial-up connections, technical challenges, and consumer disdain for watching blotchy videos on their home computers.",Business,3,0.6260786
920,The growing threat of hackers and viruses has prompted Microsoft to roll out a billion- dollar upgrade of its Windows computer operating system to strengthen security.,Sci/Tech,4,0.6676345
921,"Juniper Networks (Quote, Chart) has launched a new initiative designed to improve interoperability of popular third-party antivirus and firewall measures with its own Secure Socket Layer (define) Virtual Private Network (define) appliances.",Sci/Tech,4,0.67512304
934,AT amp;T is attracted to Voice over IP because Internet telephony is cheaper to offer to businesses and consumers and requires less upfront investment than the old copper wire and traditional switching networks.,Sci/Tech,4,0.64212596
957,Novell is reorganising its business to focus on two key areas - Linux and identity management. The networking software firm #39;s Nterprise and Linux operations will be folded into a Platform and Application Services group CRN reports.,Sci/Tech,4,0.68220556
977,"Microsoft said Friday that it is delaying the release of a new data-storage technology, named WinFS, from the next version of Windows, code-named Longhorn, in order to deliver the operating system by 2006.",Sci/Tech,4,0.66765046
1015,There #39;s a remarkable graph on Google #39;s Zeitgeist site showing the meteoric rise of Microsoft Internet Explorer 6 use and equally catastrophic decline of all other competing browsers.,Sci/Tech,4,0.62225443
1027," quot;Whether companies roll out Windows XP immediately or replace their older operating systems with Windows XP when purchasing new PCs, companies now have to ensure XP SP2 compliancy by determining ",Sci/Tech,4,0.69588023
1059,"This service leverages new Windows Media 10 technologies to enable Napster subscribers to download music to portable devices, a technology called Janus.",Sci/Tech,4,0.6486224
1071,"Cue the music: Microsoft has officially thrown its headphones into the ring in the contest to bring legal music downloads to the masses. &lt;FONT face=""verdana,MS Sans Serif,arial,helvetica"" size=""-2""\ color=""#666666""&gt;&lt;B&gt;-washingtonpost.com&lt;/B&gt;&lt;/FONT&gt;",Sci/Tech,4,0.7538438
1078,"SiliconValley.com - Microsoft makes its long-anticipated entry into the online music market today, marking the first serious challenge to Apple Computer's popular iTunes service.",Sci/Tech,4,0.65981674
1085,SOFTWARE FIRM Microsoft seems to have agreed to bend to the will of the open source community on its anti-spam technology sender ID.,Sci/Tech,4,0.66815203
1118,"The adapters can overheat and cause damage to the circuit board, according to a safety agency. WASHINGTON: IBM will recall about 225,000 AC power adapters for several models of its laptop computer because ",Sci/Tech,4,0.62585187
1119,"EMC has hired a former IBM veteran to be its chief technology officer, in what appears to be the latest step in EMC #39;s evolution from a data storage hardware specialist to a more comprehensive computing company.",Sci/Tech,4,0.6610348
1154,"Never content with the simple things in life, Microsoft is apparently on a mobile media crusade with the deceptively unassuming announcement of the companies MSN Music service.",Sci/Tech,4,0.6489452
1167,"com. The Apache Software Foundation, developers of the popular open-source Apache web server, said on Thursday that it wouldn #39;t support the proposed anti-spam standard Sender ID, because the licensing terms set by Microsoft Corp.",Sci/Tech,4,0.64921194
1211,"Those who are engaged in the profit-oriented production and dissemination of pornographic materials through the Internet, mobile communication terminals and  quot;phone-sex quot; services in China are subject to punishment as severe as life imprisonment, according ",Sci/Tech,4,0.63901675
1257,A space capsule set to plunge into Earth #39;s atmosphere with a piece of the Sun this Wednesday has spawned additional projects ranging from spacecraft design to the detection of dangerous asteroids.,Sci/Tech,4,0.62268525
1265,Microsoft last week warned Windows XP users to scour their systems for spyware before downloading Service Pack 2. An Associated Press report quoted Microsoft executives saying some spyware could cause computers to freeze upon installation.,Sci/Tech,4,0.65205294
1268,"Contradicting fears that the semiconductor industry #39;s pace of development is slowing, Intel Corp has announced that it has achieved a milestone in shrinking the size of transistors that will power its next-generation chips.",Sci/Tech,4,0.6260233
1294,"New research from NOP, shows that more of the UK Internet population are progressing to broadband - with usage at 41 per cent up from 27 per cent just six months ago, and an increase in females using the internet.",Sci/Tech,4,0.6419235
1331," 2004-09-07  Samsung Electronics, the world #39;s third-largest handset maker, recently announced its plans to launch the first mobile phone with a stamp-sized hard disc drive that would expand the memory capacity by 15 times.",Sci/Tech,4,0.6406079
1360,"SAN FRANCISCO -- Intel Corp. on Tuesday provided a few more details about future plans for its enterprise server processors, but the company maintained its silence on its plans for an upcoming dual-core Xeon processor, which it has promised as the next major follow-up to the Nocona chip it launched in August.",Sci/Tech,4,0.65629154
1370,"In a bid to expand the customer base for its database software, Sybase Inc. released on Tuesday a free, limited version of its software for deployment on Linux systems.",Sci/Tech,4,0.68090713
1392,"Microsoft announced on Wednesday five new mice and keyboards: Wireless Optical Desktop, which comes with a wireless mouse and keyboard; Wireless Notebook Optical Mouse; Digital Media Pro Keyboard; and Standard Wireless Optical Mouse.",Sci/Tech,4,0.6788918
1401,"The machine has a 400GB hard disk drive, is capable of zapping video elsewhere in a home, and is designed to let consumers program recording remotely over the Internet--including via cell phones.",Sci/Tech,4,0.64664984
1433,"RealNetworks Inc. has sold about 3 million songs online during a three- week, half-price sale designed to promote an alternative to Apple Computer Inc.",Sci/Tech,4,0.6236912
1444,BOSTON - Computer viruses and worms will have to share the stage with a new challenger for the attention of attendees at a conference of antivirus researchers: spam e-mail.,Sci/Tech,4,0.66745746
1446,"IBM (Quote, Chart) is looking to get a leg up on the competition with the October 15 launch of eServer 326, a rack-mounted server that supports AMD #39;s (Quote, Chart) upcoming dual-core 64-bit processor.",Sci/Tech,4,0.64169884
1457,"Investor's Business Daily - With Philadelphia's recent proposal to install a citywide broadband wireless network, will there be brotherly love between the city and its broadband service providers?",Sci/Tech,4,0.63749874
1512,A Pennsylvania law requiring Internet service providers to block Web sites deemed by the state's prosecuting attorneys to be child pornography has been reversed by a U.S. federal court on free-speech grounds.,Sci/Tech,4,0.6222458
1542,"Hitachi Global Storage Technologies and Intel are pushing the development of an interface technology that they hope will smooth the adoption of compact hard drives into mobile phones, PDAs, and digital music players, the companies say.",Sci/Tech,4,0.6937028
1550,"Matsushita Electric Industrial Co., better known for its Panasonic brand, will soon start international sales of a high-end DVD recorder that offers network connectivity, the company said Wednesday.",Sci/Tech,4,0.6352338
1618,"IBM will push its Power5 line of servers down into the low end of the market, taking Linux with it, when it unwraps an aggressively priced series of Linux-only systems on Monday that will go up against the offerings of Sun Microsystems and Hewlett-Packard ",Sci/Tech,4,0.6539879
1641,"SEPTEMBER 13, 2004 (COMPUTERWORLD) - Cisco Systems Inc. tomorrow plans to announce an all-new line of branch-office routers that integrate basic routing capabilities with IP voice support, security tools and other functionality.",Sci/Tech,4,0.64873993
1667,Virus writers have created a piece of malware that  #39;talks #39; to victims. The Amus email worm uses Windows Speech Engine (which is built-in to Windows XP) to deliver a curious message to infected users.,Sci/Tech,4,0.6644039
1676,Internet hardware giant Cisco Systems is said to be preparing to launch a new family of routers that can manage both voice and data applications.,Sci/Tech,4,0.6758431
1709,"Novell Inc. has completed its conversion to Linux by launching an attack on Microsoft Corp., claiming that the company has stifled software innovation and that the market will abandon Microsoft Windows at some point in the future.",Sci/Tech,4,0.63958555
1711,"In case you have not heard, Microsoft just upped the ante in the digital music war when it launched its Windows Media Player 10 and its beta online music store this month.",Sci/Tech,4,0.6377988
1717,"Sony Japan has released a new Clie for the Japanese market only. The Clie PEG-VZ90 is a Palm OS multimedia Clie handheld, that features a large OLED screen, slider hidden buttons, plentiful memory and WiFi.",Sci/Tech,4,0.6241267
1724,Microsoft Corp. has made fingerprint biometric technology an integral part of its keyboard and mouse peripherals with new products that mark the company #39;s first foray into biometric devices.,Sci/Tech,4,0.6488914
1762,"Reuters - The launch of a Russian rocket scheduled\to blast off to the International Space Station next month has\been postponed because of problems with the docking system,\Russia's space agency said on Wednesday.",Sci/Tech,4,0.62367916
1773,"Apple Computer Corp. is charging its British iTunes customers 17 percent more per download than its European customers, a consumer watchdog group said on Wednesday.",Sci/Tech,4,0.65285647
1795,"Microsoft, which recommended immediate updates, said the newly discovered vulnerability could allow remote code execution of code thanks to a buffer-overrun vulnerability in the processing of JPEG image formats.",Sci/Tech,4,0.6583451
1814,"BTG, a London-based firm that focuses on intellectual property and technology commercialization, filed suit against Amazon.com, Barnesandnoble.com and two other Internet companies for infringing on patents related to the tracking of users online.",Sci/Tech,4,0.681501
1831,"Shareholders approved Aether Systems Inc.'s sale of one of its two remaining operating divisions Wednesday, a deal that will take the Owings Mills company out of the wireless business and nearly complete its transformation into a mortgage investment fund.&lt;BR&gt;\&lt;FONT face=""verdana,MS Sans Serif,arial,helvetica"" size=""-2""\ color=""#666666""&gt;&lt;B&gt;-The Washington Post&lt;/B&gt;&lt;/FONT&gt;",Sci/Tech,4,0.6885528
1833,New PCs will ship with a chip designed to thwart hackers--a hardware approach that's said to be safer than software.,Sci/Tech,4,0.6366991
1854,Iomega Corp. is soon expected to ship its first network-attached storage (NAS) device based on wireless networking technology.,Sci/Tech,4,0.6339723
1868,"(CP) - SONY has introduced it #39;s Clie PEG-VZ90, an entertainment multimedia handheld using Palm OS 5.2.1. The unit boasts the world #39;s largest 480x320 pixels organic electroluminescent (EL) display, which many regard as a next-generation technology capable ",Sci/Tech,4,0.656638
1898,"Add America Online Inc. to the growing list of companies and organizations shunning a spam-fighting proposal from Microsoft Corp. AOL cited  quot;tepid support quot; for Microsoft #39;s so-called Sender ID technology, which ",Sci/Tech,4,0.6619156
1922,"Russia may have to delay October #39;s planned launch of the next International Space Station crew by up to 10 days to fix a problem on the spacecraft that is to carry them into orbit, Russian news agencies reported.",Sci/Tech,4,0.6246833
1923,"The FTC gave limited endorsement to the notion of cash rewards for people who help track down e-mail spammers, but suggested that the measure might work in fewer circumstances than had been pushed by some anti-spam activists. &lt;br&gt;&lt;FONT face=""verdana,MS Sans Serif,arial,helvetica"" size=""-2"" color=""#666666""&gt;&lt;B&gt;-The Washington Post&lt;/B&gt;&lt;/FONT&gt;",Sci/Tech,4,0.668299
1954,The Web console -- to be made available specifically to corporate and enterprise licensees of Norton AntiVirus software -- will allow administrators to distribute virus definitions and product updates on demand.,Sci/Tech,4,0.6710151
