,Original_Text,Class_String,Class_Number,Neuron_37
4122," TOKYO (Reuters) - Japan's Toshiba Corp. &lt;A HREF=""http://www.reuters.co.uk/financeQuoteLookup.jhtml?ticker=6502.T qtype=sym infotype=info qcat=news""&gt;6502.T&lt;/A&gt; will  introduce laptop computers with HD DVD technology in December  2005, aiming to pressure rivals in the battle over formats for  next-generation DVDs, the Nihon Keizai daily said on Wednesday.",Sci/Tech,4,0.9293661
4152,"AMD is expected to unveil its most powerful desktop processors to date this week, a few days after rival Intel disclosed changes to its desktop processor road map.",Sci/Tech,4,0.8533007
4159,Ziff Davis - Panelists at SoftSummit point to emerging alternatives to perpetual licensing but say the transition won't be easy.,Sci/Tech,4,0.8841582
4184,"Tabbed browsing, one of the more popular features built into alternative Web browsers, contains a security flaw that puts users at risk of spoofing attacks, research firm Secunia warned on Wednesday.",Sci/Tech,4,0.9160642
4203,"CAPE CANAVERAL, Fla. -- A new crew is aboard the International Space Station Wednesday preparing to take over command of the orbiting outpost.",Sci/Tech,4,0.8509111
4248,"roundup Plus: SGI works on Linux performance software...Good Technology supported by HP, Samsung...RealNetworks loss widens on litigation.",Sci/Tech,4,0.8868323
4259,NewsFactor - Microsoft (Nasdaq: MSFT) has hooked up with Swatch to deliver the latest in a line of smart wristwatches using the software giant's MSN Direct wireless content-delivery technology.,Sci/Tech,4,0.99929816
4266," SAN FRANCISCO (Reuters) - Intel Corp. &lt;A HREF=""http://www.reuters.co.uk/financeQuoteLookup.jhtml?ticker=INTC.O qtype=sym infotype=info qcat=news""&gt;INTC.O&lt;/A&gt; on Thursday  said it has scrapped plan to enter the digital television chip  business, marking a major retreat from its push into consumer  electronics.",Sci/Tech,4,0.8533223
4305,"An experiment using two orbiting satellites has proved that as the Earth turns it drags space and time around itself, like a spinning top in treacle.",Sci/Tech,4,0.8813127
4312,"The move won #39;t have raised many eyebrows. Security is a hot market in which Cisco already has a strong grip in the enterprise space, and the vendor giant has already bolstered its security portfolio through ",Sci/Tech,4,0.84694064
4318,It bought Stata Labs and apparently plans to incorporate Stata technology in an e-mail client that could compete with Google #39;s Gmail.,Sci/Tech,4,0.92750823
4322,"roundup Free-roaming source code breeds new Netsky pest. Also: From IE to Opera, browsers are a likely prey.\",Sci/Tech,4,0.889847
4324,"Lacie today introduced a new series of external harddrives with SATA interface at the SMAU trade show in Milan, Italy. The drives are available in capacities up to 400 GByte.",Sci/Tech,4,0.92609715
4351,"\\The blogs  are buzzing  that the Treo 650 will be released on Monday.\\From Gizmodo:\\""Not only have they announced special ""news"" next Monday at the CTIA Wireless\Conference in San Francisco, earlier this week someone with PalmOne\accidentally sort of, you know, told me. I told them I'd keep quiet as long as\they did, but if they're going to go and announce it with a wink and a nod, I\think I've done my part.""\\If they do this right I'll be sporting a Treo 650 soon! \\Of course if this is true:\\""File it under hoping I'm wrong. Several reports have filtered in from people\who have had hands-on time with pre-release Sprint versions of the upcoming\Treo 650. These reports say that the Treo wi ...\\",Sci/Tech,4,0.89855725
4467,American astronaut Mike Fincke and Russian commander Gennady Padalka descended to Earth in remote Kazakstan late Saturday aboard a Soyuz space capsule.,Sci/Tech,4,0.9464183
4480,Stata Labs previously sold two products Bloomba and SAproxy Pro which have now been withdrawn from sale. Saproxy was an anti-spam product whilst Bloomba was an email management system which allows users to ,Sci/Tech,4,0.9980149
4483,Mobility will take center stage this week as San Francisco plays host to the Cellular Telecommunications   Internet Association's (CTIA) Wireless I.T.   Entertainment 2004 fall conference.,Sci/Tech,4,0.91888756
4489,"SAN FRANCISCO - After removing the 2006 ""Kodiak"" release of Exchange Server from its product road map earlier this year, Microsoft Corp.'s plans for the messaging software have gotten even cloudier.",Sci/Tech,4,0.8838524
4491,"The PalmOne Treo 650 Smartphone with high-resolution screen, Bluetooth, swappable battery and extended multimedia capabilities was officially announced today.",Sci/Tech,4,0.8830054
4494,"Sony Europe has launched two tiny 512MB and 1GB MP3 players, the NW-E95 and NW-E99 Network Walkman. Both play MP3 (Sony has officially bit the mp3 bullet) and ATRAC3plus compressed files and have a small blue backlit LCD screen.",Sci/Tech,4,0.95421594
4502,One of the first pieces of malicious code targeting Apple's Mac OS X operating system has been discovered.\,Sci/Tech,4,0.88761705
4508,"The Federal Trade Commission won an important victory last week in its fight to protect consumers from spyware, the software that tracks unsuspecting Web surfers, bombards them with advertisements and sometimes even steal login information and passwords.",Business,3,0.88132805
4515,"Adobe Systems Inc. ADBE.O and Yahoo Inc. YHOO.O on Monday said they have signed a deal to combine Adobe services, like its widely used document-sharing program, with Yahoo #39;s Web search functions.",Sci/Tech,4,0.8440852
4546,"Since it arrived at Saturn in mid-2004, Cassini has already sent us back fascinating images of Titan, Saturn #39;s largest satellite.",Sci/Tech,4,0.8876721
4594,"NASA #39;s Cassini spacecraft streaked by Saturn #39;s smoggy moon Titan today, targeted to pass within just 750 miles of the planet-sized satellite to give scientists their first ",Sci/Tech,4,0.9440121
4597,AP - The U.S.-European spacecraft Cassini hurtled Tuesday toward its closest encounter yet with Saturn's giant moon Titan.,Sci/Tech,4,0.91577643
4600,U.S. District Judge Joseph A. DiClerico Jr. ordered Sanford Wallace and his companies to remove any software scripts from their Web sites that exploit security vulnerabilities in some versions of Internet Explorer.,Sci/Tech,4,0.8786949
4610,AP - Apple Computer Inc. on Tuesday introduced a new larger-capacity iPod with a color display as well as a first-of-its-kind digital compendium of the rock band U2's songs.,Sci/Tech,4,0.8741659
4617,"The company has just announced the release of two flash-memory-based devices, the Walkman NW-E99 and NW-E95, in Europe. The music players can play songs in MP3 and Sony #39;s own Atrac file format.",Sci/Tech,4,0.9912175
4643,"IOWA CITY, Iowa A NASA scientist has charged that the Bush administration is subverting science and misleading the public by trying to suppress or alter evidence on the dangers of global warming.",Sci/Tech,4,0.893847
4665,PC World - IFire aims to displace LCD TVs with its lower-cost display technology.,Sci/Tech,4,0.8466961
4674,"Dell (Quote, Chart) officials announced Wednesday an agreement with Linux distributor Novell (Quote, Chart) to distribute and support SUSE Enterprise Server 9 on its single- and dual-processor line of servers.",Sci/Tech,4,0.86775213
4694,"OCTOBER 27, 2004 (TECHWORLD.COM) - Linux distributor Suse has warned of one of the most serious security holes to date in version 2.6 of the Linux kernel, which could allow attackers to shut down a system running 2.6-based software.",Sci/Tech,4,0.9771703
4721,"Companies that provide federal agencies with network integration and payroll accounting technologies are benefiting from a government trying to bolster its defenses against terrorism, experts say. &lt;br&gt;&lt;FONT face=""verdana,MS Sans Serif,arial,helvetica"" size=""-2""\ color=""#666666""&gt;&lt;B&gt;-The Washington Post&lt;/B&gt;&lt;/FONT&gt;",Sci/Tech,4,0.86483544
4740,"Novell has given its recently acquired Linux distro, SuSE, a push, by signing an agreement with Dell to offer SuSE Linux Enterprise Server (SLES) 9 on select PowerEdge servers worldwide.",Sci/Tech,4,0.9514052
4775,com Staff. NASA once again postponed the launch of the Demonstration of Autonomous Rendezvous Technology (DART) spacecraft Thursday due to the discovery of contamination inside the fairing of its Pegasus launch vehicle.,Sci/Tech,4,0.95145607
4791,"Games, graphic ring tones and other services dominate the showroom floor. Also: Yahoo battles Google for the cell phone.",Sci/Tech,4,0.89825577
4796,LOS ANGELES - The recording industry on Thursday filed another round of copyright infringement lawsuits against people it said were illegally distributing songs over the Internet.,Sci/Tech,4,0.90339863
4803,"Open source software proponents received a potential boost from the UK government Thursday with a release of a report citing the well-documented advantages on the server side, but also growing maturity on the desktop front.",Sci/Tech,4,0.88818884
4818,"A volley of lawsuits was launched against alleged spammers on Thursday by the four major US Internet service providers. This includes a case brought by AOL against twenty individuals accused of spimming, or ",Sci/Tech,4,0.84324014
4860,"Reuters - The surface of Saturn's moon Titan\may be covered by thick drifts of combustible organic ""snow""\floating on lakes of liquid methane or water and ammonia ice\flows, NASA scientists said on Friday.",Sci/Tech,4,0.9618922
4870,"Seabirds called prions, which mate for life, find their nests by sniffing out their partners, scientists say.",Sci/Tech,4,0.84652567
4872,"WASHINGTON - The first radar images of Titan, the cloud-shrouded moon of Saturn, revealed a relatively young, active surface, NASA said Friday (Oct. 29).",Sci/Tech,4,0.93563217
4883,HOUSTON -- The NASA turbojet notoriously known as the  quot;vomit comet quot; for its use in training astronauts for weightlessness made its final flight Friday.,Sci/Tech,4,0.8922748
4885,"Photographs and radar surveys from the Cassini spacecraft #39;s Tuesday-night flyby of Saturn #39;s mysterious moon Titan are raising more questions than they #39;re answering, say NASA scientists.",Sci/Tech,4,0.9934423
4904,"China shut 1,600 Internet cafes between February and August and imposed \$12.1 million worth of fines for allowing children to play violent or adult-only games and other violations, state media said.",Sci/Tech,4,0.91825145
4936,"Earlier this year Microsoft released a major security update for Windows XP, which was designed to strengthen the operating systems defences against attack from viruses and hackers.",Sci/Tech,4,0.8442349
4965,"Today #39;s new word, for all you dictionary freaks, is  quot;spim quot;. Spam  IM (Instant Messaging) = Spim. IM Spam. And for many IM companies it is the bane of their existence requiring increasingly aggressive filtering and block list capabilities.",Sci/Tech,4,0.85066634
5036,"Nokia has launched its first product that supports Near Field Communication (NFC), an emerging radio frequency identification (RFID) technology that could have significant implications for mobile commerce.",Sci/Tech,4,0.9783826
5091,Movie studios and the Motion Picture Association of America said on Thursday they would sue individuals suspected of illegally distributing movies over the Internet.,Sci/Tech,4,0.8826621
5093,"Nov. 4, 2004 - A rare alignment of Jupiter #39;s three largest moons across the planet #39;s face was captured on film by the Hubble Space Telescope.",Sci/Tech,4,0.9532527
5100,"NASA #39;s Hubble Space Telescope (HST) captured an alignment of three of Jupiter #39;s largest moons: Io, Ganymede, and Callisto.",Sci/Tech,4,0.9404686
5111,"Washington - A man convicted of violating anti-spam laws by sending out tens of thousands of unsolicited emails using fake addresses faces nine years in prison in Virginia, authorities said on Thursday.",Sci/Tech,4,0.8979533
5123,"AP - NASA is aiming for a mid-May launch of the first shuttle flight since the Columbia tragedy almost two years ago. The launch date was the latest of several set by the space agency, and just as subject to change.",Sci/Tech,4,0.902912
5147,"Reuters - The world's most advanced\military powers are using the Internet to spy on their enemies\and prepare digital attacks against rogue targets, a leading\cyber security expert said on Friday.",Sci/Tech,4,0.92178434
5161,Scientists have been baffled by a mysterious boost in power to one of its two robotic rovers which are exploring the surface of the Red Planet.,Sci/Tech,4,0.86538684
5171,"AP - Advance copies of the aliens-versus-space marines video game ""Halo 2"" have already fetched as much as  #36;265 on Internet auction site eBay, days before the official launch.",Sci/Tech,4,0.90835744
5177,"Tiger Telematics acquired Integra SP, a UK company that produces software allowing real-time streaming of data and applications to handheld devices.",Sci/Tech,4,0.8934295
5179,Adobe quietly begins testing the waters to increase its involvement in desktop Linux. Also: Open-source Web browsers Mozilla and Firefox post gains over Microsoft's Internet Explorer.,Sci/Tech,4,0.99699485
5182,"Webmaster World's World of Search Conference Features 70 Speakers\\The WebmasterWorld of Search Conference scheduled for November 16-18 in Las Vegas has published a final speaker roster and announced over 24 sessions with more than 70 industry-leading speakers. The line up features speakers from such companies as Google, Yahoo, Kanoodle, Ask ...",Sci/Tech,4,0.8528772
5189,AP - The new lava lobe inside Mount St. Helens' crater has sprouted a piston-like protrusion the size of a 30-story building  #151; glowing red at night.,Sci/Tech,4,0.89678276
5190,"Global warming is causing the Arctic ice-cap to melt at such an unprecedented rate that by the summer of 2070 it may have no ice at all, according to the most comprehensive study carried out on global climate change in the region.",Sci/Tech,4,0.86139834
5238,"washingtonpost.com - First Apple put some color on the iPod, when it offered the iPod mini in a palette of pastel hues, and now it has put some color inside it, in the form of the new iPod Photo.",Sci/Tech,4,0.9276968
5264,"Solution providers last week said they do not expect the sudden departure of Novell vice chairman Chris Stone, who engineered the company #39;s aggressive Linux push, to slow its Linux initiative.",Sci/Tech,4,0.84753007
5298,ATI Technologies today announced the availability of its new Radeon Xpress 200 series of core logic chipsets for the AMD K8 desktop platform.,Sci/Tech,4,0.92468536
5307,"""Halo 2"" appears to be one of the most hotly hyped and heavily anticipated video games ever, and Microsoft is planning a Tuesday release that may rival the best of Hollywood's movie glitz. &lt;FONT face=""verdana,MS Sans Serif,arial,helvetica"" size=""-2""\ color=""#666666""&gt;&lt;B&gt;-washingtonpost.com&lt;/B&gt;&lt;/FONT&gt;",Sci/Tech,4,0.9904138
5311,Machines that only a few years ago seemed to be the stuff of fantasy are slowly but surely reaching the mainstream. &lt;br /&gt; Photos: IBM's Blue Gene/L &lt;br /&gt; Photos: Barcelona's big blade,Sci/Tech,4,0.94690144
5318,"Summary - (Nov 8, 2004) NASA #39;s Cassini spacecraft took this image of Titan as it sped past the moon on Oct. 26, 2004. It was taken from an altitude of 2,500 km (1,553 miles) using the spacecraft #39;s aperture ",Sci/Tech,4,0.8956272
5340,"ATI Technologies on Monday delivered the Radeon Xpress 200, a new chipset for desktops using Advanced Micro Devices #39; Athlon 64 and other eighth-generation processors.",Sci/Tech,4,0.9472151
5347,"A new spacecraft is being readied to make the fastest, most detailed study yet of the fleeting gamma ray bursts emanating from deep in space.",Sci/Tech,4,0.87631303
5354,Computer Associates (CA) has integrated an anti-spyware product with its eTrust Security Management portfolio. The integrated product called eTrust PestPatrol Anti-Spyware r5 includes faster detection and removal and an enhanced graphical interface.,Sci/Tech,4,1.0517178
5367,"SUNNYVALE, Calif. and SINGAPORE--(BUSINESS WIRE)9 Novembre 2004--Chartered adopte la fabrication de prcision automatise d #39;AMD et prvoit de fabriquer des processeurs AMD64 en 2006.",Sci/Tech,4,0.93546015
5372,"Perhaps Microsoft was hoping for all eyes to be on the much-ballyhooed launch Tuesday of its ""Halo 2"" video game, but the company's efforts to clean up its lawsuit headaches can't be overshadowed by virtual gunslinging.  &lt;FONT face=""verdana,MS Sans Serif,arial,helvetica"" size=""-2""\ color=""#666666""&gt;&lt;B&gt;-washingtonpost.com&lt;/B&gt;&lt;/FONT&gt;",Sci/Tech,4,1.0030824
5386,"Today, the Mozilla Foundation #39;s Firefox browser officially launched -- welcome, version 1.0. In a way, it #39;s much ado about nothing, seeing how it wasn #39;t that long ago that we reported on how Mozilla had set ",Sci/Tech,4,0.9086554
5387,"Computer Associates is releasing eTrust PestPatrol Anti-Spyware r5, aimed at consumers and small businesses, and based on technology CA obtained when it bought anti-spyware provider PestPatrol two months ago.",Sci/Tech,4,0.8744434
5388,"DALLAS - A month before the video game #39;s scheduled release this coming Tuesday, illegal copies of the hot sci-fi action title  quot;Halo 2 quot; were already circulating on the Internet.",Sci/Tech,4,0.8924231
5427,"With temperatures in the Arctic rising at twice the rate of elsewhere, the ice cover there will within the next 100 years completely disappear in summer and the biodiversity will change dramatically, according to a scientific study published this week.",Sci/Tech,4,0.90656555
5452,"Hewlett-Packard showed off 14 new imaging and printing products during an event in Frankfurt, Germany this week. HP executives showcased the HP LaserJet 4345mfp multifunction copier, which they say can crank ",Sci/Tech,4,0.9212732
5455,"Summary - (Nov 10, 2004) The countdown has begun for the launch of the Planetary Society #39;s Cosmos 1 spacecraft; the first ever to be powered by a solar sail.",Sci/Tech,4,0.8807937
5461,Three-year project will back programmers' effort to build Linux software support for the high-speed networking technology.,Sci/Tech,4,0.93896174
5464,"AP - Web surfing has belonged almost exclusively to Microsoft Corp.'s Internet Explorer ever since it buried Netscape's pioneering browser. That doesn't seem to have bothered the developers of the Mozilla Firefox, a feisty new kid on the block that's worth a serious look.",Sci/Tech,4,0.8476547
5469,"IBM's new Lotus Web Conferencing Service, expected to be offered next month, requires that users simply register an account and have an Internet connection, a Web browser and a phone.",Sci/Tech,4,0.8953908
5482,"Early Thursday, Microsoft will begin revving its engines squarely in Googles direction with the Beta launch of the new MSN Search engine.",Sci/Tech,4,0.85899734
5486,"Software giant, Microsoft Corp., has decided to release beta versions of its updated MSN search engine earlier today. The company hopes to compete against leading search engines such as Google and Yahoo by ",Sci/Tech,4,0.84780526
5508,"European researchers can now turn to a new supercomputing network for help in their scientific endeavors.  quot;We have just completed testing, quot; said David Henty with the Edinburgh Parallel Computing Centre, a ",Sci/Tech,4,0.8869239
5514,"In the second of a two-part interview, Open Systems Development Labs chief Stuart Cohen gives his views on Linux security, desktops, the Domino effect towards Linux, and why Microsoft will eventually port to Linux.",Sci/Tech,4,0.89909756
5515,"Microsoft has released bulletin MS04-039 reporting a security vulnerability in Internet Security and Acceleration (ISA) Server 2000 and in Proxy Server 2.0, and has also announced the availability of the patches to resolve these issues.",Sci/Tech,4,0.9516575
5551,"Europes first lunar spacecraft is set to go into orbit around the Moon on Monday. SMART-1 has already reached the gateway to the Moon, the region where its gravity starts to dominate that of the Earth.",Sci/Tech,4,0.94288003
5556,"The open-source Firefox browser is chipping away at Internet Explorer #39;s market dominance, and analysts are saying that Internet sites should add it to their test list.",Sci/Tech,4,0.8524085
5558,A new kid on the block promises to give offshore outsourcing a run for its money--by routing technology work to rural America. Outsourcing Blog,Sci/Tech,4,0.9085346
5565,A EUROPEAN spacecraft powered by a Star Trek-style thruster has flown through a lunar gateway that puts it on course to reach the Moon on Monday.,Sci/Tech,4,0.91790044
5587,"The discovery also sheds light on the ancestry of modern brown bears, which has long puzzled researchers. A genetic analysis of the skull fragment indicates its owner was closely related to the brown bears ",Sci/Tech,4,0.85545343
5598,p2pnet.net News:- Xbox add-ons that let users run items not produced by Microsoft have been out there almost since Day One.  quot;Hackers who equip their Xboxes with mod chips and other upgrades such as bigger ,Sci/Tech,4,0.90386385
5603,"HP (Quote, Chart) deepened its relationship with open source software concern JBoss, agreeing to become a major source of support for its application server and Linux.",Sci/Tech,4,0.9151177
5604,NASA #39;s X-43A scramjet will on Monday undergo its third test flight during which scientists will attempt to push the vehicle to Mach 10.,Sci/Tech,4,0.8772834
5611,"Europes first mission to the moon is just days away from its goal after taking the slow boat from Earth more than a year ago. The spacecraft, dubbed SMART-1, will make its first close pass by the moon on the evening of Nov.",Sci/Tech,4,0.9455109
5616,"NewsFactor - While Firefox wins rave reviews for its browser technology and appears ready to chip away at Microsoft's (Nasdaq: MSFT) dominant Internet Explorer market share, the open-source browser is probably a long way off from unseating IE in the enterprise.",Sci/Tech,4,0.89531624
5662,Hewlett-Packard Co. and open-source middleware vendor JBoss Inc. on Friday said that HP will now provide first-line support for JBoss #39; open-source Java application server.,Sci/Tech,4,0.9600356
5698,"Instead of playing Halo 2 as intended, a filmmaker and a crew of machinima peers exploit the game's software quirks to create their online comedy series, Red vs. Blue, within Halo's virtual world.",Sci/Tech,4,0.8415633
5718,"WASHINGTON: NASA will today conduct the final and fastest test flight of its pilotless X-43A hypersonic research aircraft, aiming to send it zooming across the Pacific Ocean at about 10 times the speed of sound -- almost 3.2 kilometers (two miles) per ",Sci/Tech,4,0.8496196
5727," WASHINGTON (Reuters) - EarthLink Inc. &lt;A HREF=""http://www.reuters.co.uk/financeQuoteLookup.jhtml?ticker=ELNK.O qtype=sym infotype=info qcat=news""&gt;ELNK.O&lt;/A&gt; and Yahoo  Inc. &lt;A HREF=""http://www.reuters.co.uk/financeQuoteLookup.jhtml?ticker=YHOO.O qtype=sym infotype=info qcat=news""&gt;YHOO.O&lt;/A&gt; said on Monday they would begin tests of a new  anti-spam technology that encodes digital signatures into  customers' e-mail as a way to separate legitimate messages from  unwanted spam.",Sci/Tech,4,0.9480272
5733,"The first Halo game sold quite a few Xboxes (we know a few Xbox owners who don't appear to play any other titles on their consoles), and Halo 2 has already clocked \$125 million in sales -- on its first day in stores.",Sci/Tech,4,0.89637613
5747,Operating system to come at no charge for servers with x86 processors. But the bug fixes will cost you.,Sci/Tech,4,0.8776111
5772,"Liquid Machines today announced the release of Email Control Version 6.0, an e-mail policy and security messaging software package designed for enterprise networks.",Sci/Tech,4,0.8771666
5774," quot;The biggest danger to HP and IBM is a price war, quot; said John Enck of Gartner.  quot;Blades are still premium-priced products from IBM and HP.",Sci/Tech,4,0.8668359
5782,"Acer America Corp. on Monday introduced a notebook based on the 64-bit mobile processor from Advanced Micro Devices Inc. The Ferrari 3400, which runs on the Mobile AMD Athlon 64 for thin and ",Sci/Tech,4,0.88748026
5787,"Many users are celebrating Mozilla #39;s release of Firefox 1.0, its open-source Web browser. The beta version was downloaded some 8 million times.",Sci/Tech,4,0.9551703
5788,"Yahoo announced enhancements to its e-mail service, implementing search, more storage and its DomainKeys sender authentication technology, which is also being deployed by Internet service provider EarthLink in a test roll-out.",Sci/Tech,4,0.9246823
5793,"InfoWorld - Dell Computer re-energized its enterprise-class blade server strategy on Monday, rolling out a new architecture that supports as many as 10 servers in a seven-unit chassis that can fit into a standard-size rack.",Sci/Tech,4,0.8693868
5794,NASA scrubbed its mission Monday to launch a pilotless plane that is capable of flying at 10 times the speed of sound. The launch of the X-43A was canceled due to technical problems.,Sci/Tech,4,0.96093166
5816,SEOUL: South Korea #39;s LG Electronics Inc announced that it has developed the world #39;s first mobile handset capable of receiving terrestrial digital multimedia broadcasts (DMB).,Sci/Tech,4,0.9235824
5825,"Acer has announced the newest addition to the Ferrari line of notebooks, the Ferrari 3400. The notebook is based on the latest Mobile AMD Athlon 64 processor 3000 for thin and light notebooks.",Sci/Tech,4,0.97072345
5826,"Advanced Micro Devices (AMD) plans to build security and virtualisation features into its server processors by 2006, the company said Friday during its annual analyst event.",Sci/Tech,4,0.8451921
