,Original_Text,Class_String,Class_Number,Neuron_42
6579, JERUSALEM (Reuters) - Prime Minister Ariel Sharon on Monday  narrowly survived three parliamentary no-confidence votes  sponsored by opposition parties over deepening poverty in  Israel.,World,1,0.88164157
6632,"Reuters - A car bomb exploded near a U.S.\military patrol in the town of Baiji, north of Baghdad, on\Tuesday, killing at least seven Iraqis and wounding 20 people,\including two U.S. soldiers, doctors and the military said.",World,1,0.8545928
6833,"AP - There is no reason to hold a meeting of Iraq's neighbors planned for this week in Amman, an Iranian envoy said Monday in a further sign of strained relations following accusations by Jordan's King Abdullah that Tehran wanted to influence the Iraqi elections.",World,1,0.82036775
6948," SAMARRA, Iraq (Reuters) - Three Iraqis were killed on  Wednesday when a suicide car bomber attacked a U.S. convoy in  the northern city of Samarra, a local police official said.",World,1,0.80323225
7029,"MOSUL, Iraq, Dec 9 (AFP) - Six Iraqi national guardsmen and 10 civilians were wounded in two bomb attacks in the northern city of Mosul on Thursday, police said.",World,1,0.8703903
7053,"KEY talks between the government of Sudan and rebels in the troubled Darfur region tomorrow could fail because of a new surge of violence, the UN #39;s envoy to the country said.",World,1,0.7869416
7086," JERUSALEM (Reuters) - Israeli Prime Minister Ariel Sharon  on Friday invited the opposition Labour Party to begin talks to  form a unity government, a move that would avoid early  elections and pave the way for a withdrawal from Gaza.",World,1,0.7711643
7101,Darfur #39;s rebel leaders held preliminary talks with African Union mediators in Abuja on Friday ahead of the latest round of peace negotiations on the crisis in the western Sudanese region.,World,1,0.79076684
7118,"LAST MONTH the United States and its allies signaled a change in Sudan policy. Rather than pressuring Sudan #39;s government to halt its genocidal attacks against civilians in the western province of Darfur, they ",World,1,0.79104036
7167,"The health records of Yasser Arafat, who died at Percy Military hospital near Paris last month, have been submitted to Palestinian authorities.",World,1,0.8655645
7170,Israel #39;s opposition Labour party began talks with Prime Minister Ariel Sharon #39;s Likud party yesterday about joining its coalition - a partnership aimed at promoting a military withdrawal from Gaza.,World,1,0.8289671
7195,BUCHAREST: Romanians voted for a new president on Sunday with fighting corruption and joining the EU the main themes in a run-off round pitting Prime Minister Adrian Nastase against Bucharest Mayor Traian Basescu.,World,1,0.78148305
7197,"RAFAH, Gaza Strip (AFP) - Four Israeli soldiers were killed when Palestinian militants blew up a tunnel under an army post in Gaza, as jailed intifada leader Marwan Barghuti pulled out of the Palestinian elections.",World,1,0.96101713
7200,YASSER Arafat is dead. A so-called moderate is now chairman of the Palestine Liberation Organization. Elections to choose a Palestinian Authority president are scheduled in the West Bank and Gaza for early January.,World,1,0.80337083
7226, TAIPEI (Reuters) - Taiwan President Chen Shui-bian is under  pressure to find ways to work with an opposition-dominated  parliament after his party suffered a surprise setback in  weekend legislative elections.,World,1,0.7701225
7237," KHARTOUM (Reuters) - Two employees of a British charity  were killed in Sudan's troubled Darfur region on Sunday when  their convoy came under fire, the aid agency said on Monday.",World,1,0.76915973
7244,"Eight of 11 detainees briefly refuse food over prisoner rights including family visits, access to media. BAGHDAD - The US army said eight of toppled Iraqi leader Saddam Hussein #39;s jailed lieutenants had briefly ",World,1,0.7922367
7253,"Army reinforcements sent to bolster the Democratic Republic of Congo #39;s fragile border region with Rwanda have clashed with former rebel units within the army, a local military commander said on Sunday.",World,1,0.80367804
7264,Officials in Iraq say at least 10 Iraqis have been killed and several others wounded in separate insurgent attacks across the country.,World,1,0.8317191
7320,"Iraq may begin war crimes trials for senior members of Saddam Hussein #39;s former regime as soon as next week, Iraqi Prime Minister Ayad Allawi said.",World,1,0.91221344
7356,"KANDAHAR, Afghanistan, Dec 14 -- Afghan forces have captured two top figures of the deposed Taliban government, including the personal security chief of leader Mohammad Omar, provincial officials said Tuesday.",World,1,0.7857909
7375,"The kidnapped Turkish engineer was found dead in Kunar province in east Afghanistan on Wednesday, one day after he was abducted by unknown gunmen, the Afghan Interior Ministry said.",World,1,0.87854195
7382,North Korea has warned Japan that it will treat economic sanctions as a  quot;declaration of war quot; and threatens to try to exclude Tokyo from six-party talks on Pyongyang #39;s nuclear arms programs.,World,1,0.8210302
7390,"Hijackers who took as many as 26 people hostage on a commuter bus on the outskirts of Athens released five of the captives. Police are in negotiations to free the remaining hostages, a spokeswoman said.",World,1,0.7833043
7396,"ANKARA, Dec 15 (AFP) - The Turkish ambassador in Afghanistan has confirmed the death of a Turkish engineer kidnapped Tuesday in Afghanistan #39;s eastern Kunar province, the Anatolia news agency reported Wednesday.",World,1,0.8021473
7419,"AFP - An Italian national working for a British non-governmental organisation has been taken hostage in Iraq, the Italian news agency ANSA reported, quoting Italian intelligence sources.",World,1,0.83585215
7512,"Israel withdraws from Khan Younis refugee camp in the Gaza Strip, after a four-day operation that left 11 dead.",World,1,0.82411397
7533,"Israel will not attend a Middle East conference in London early next year but backs its stated aim of fostering Palestinian reform in pursuit of peace after Yasser Arafat #39;s death, a senior official says.",World,1,0.77803135
7534,BAGHDAD (AFP) - The United States failed win a promise from the United Nations to increase its staff in Iraq ahead of elections as Washington stepped up its charges that Damascus was sheltering insurgent leaders.,World,1,0.823175
7560," JERUSALEM (Reuters) - Israel's opposition Labour party has  clinched a deal with Prime Minister Ariel Sharon's Likud party  to join his coalition, a move that could push forward his Gaza  pullout plan, Israeli media reported on Friday.",World,1,0.78744197
7578,"CAIRO, Dec 17 (AFP) -- One of the two main rebel groups in Sudan #39;s war-torn Darfur region said that the government had launched an offensive on rebel-held towns in southern Darfur, denouncing it as a truce violation.",World,1,0.7837428
