,Original_Text,Class_String,Class_Number,Neuron_22
5480,"PC World #39;s first tests of NVidia #39;s just announced high-end mobile graphics chip, the GeForce Go 6800, show that it is one of the first notebook graphics components to support performance rivaling that of desktop boards.",Sci/Tech,4,0.66479087
5486,"Software giant, Microsoft Corp., has decided to release beta versions of its updated MSN search engine earlier today. The company hopes to compete against leading search engines such as Google and Yahoo by ",Sci/Tech,4,0.6995031
5514,"In the second of a two-part interview, Open Systems Development Labs chief Stuart Cohen gives his views on Linux security, desktops, the Domino effect towards Linux, and why Microsoft will eventually port to Linux.",Sci/Tech,4,0.6285381
5515,"Microsoft has released bulletin MS04-039 reporting a security vulnerability in Internet Security and Acceleration (ISA) Server 2000 and in Proxy Server 2.0, and has also announced the availability of the patches to resolve these issues.",Sci/Tech,4,0.6430508
5545,"Redmond-based Microsoft Corp. on Thursday launched a test version of its new MSN Search service, hoping to compete with Google and other major Web search services.",Sci/Tech,4,0.69233155
5603,"HP (Quote, Chart) deepened its relationship with open source software concern JBoss, agreeing to become a major source of support for its application server and Linux.",Sci/Tech,4,0.68019366
5605,"NOVEMBER 12, 2004 (COMPUTERWORLD) - Microsoft Corp. yesterday said it is investigating claims that several new vulnerabilities have been found in Windows XP Service Pack 2 by security firm Finjan Software Inc.",Sci/Tech,4,0.665471
5616,"NewsFactor - While Firefox wins rave reviews for its browser technology and appears ready to chip away at Microsoft's (Nasdaq: MSFT) dominant Internet Explorer market share, the open-source browser is probably a long way off from unseating IE in the enterprise.",Sci/Tech,4,0.636186
5639,"Microsoft Corp.'s software platform for personal digital assistants took over the market lead from PalmSource Inc. for the first time in the third quarter, according to market research released Friday.",Sci/Tech,4,0.65781575
5652,"NTT Communications, T-Mobile USA, Telstra, StarHub, and Maxis Communications have joined to establish roaming arrangements that allow customers to use wireless broadband services from Internet access points -- called hotspots quot; -- in their countries ",Sci/Tech,4,0.6435782
5662,Hewlett-Packard Co. and open-source middleware vendor JBoss Inc. on Friday said that HP will now provide first-line support for JBoss #39; open-source Java application server.,Sci/Tech,4,0.6951063
5681,"That should have been said a long time ago. After Microsoft cemented a monopoly of the Web-browser market, it let Internet Explorer go stale, parceling out ho-hum updates that neglected vulnerabilities ",Sci/Tech,4,0.62854475
5691,"Microsoft Corp., worlds largest software maker, increased its market shares of Windows CE, operating system for handheld devices, in the third quarter of this year, stated a research study conducted by Gartner, Inc.",Sci/Tech,4,0.6597752
5704,"Aoraki Mt Cook Ski Planes and New Zealand Tourism Online are turning their backs on Microsoft #39;s Internet Explorer. Both companies are among the early adopters of Firefox, a free  quot;open source quot; Web browser.",Sci/Tech,4,0.6589515
5719,"The Firefox browser offers superior security features over Internet Explorer -- and as long as IE drives more than 90 percent of the world #39;s computers, hackers will continue to make it a target.",Sci/Tech,4,0.6233865
5727," WASHINGTON (Reuters) - EarthLink Inc. &lt;A HREF=""http://www.reuters.co.uk/financeQuoteLookup.jhtml?ticker=ELNK.O qtype=sym infotype=info qcat=news""&gt;ELNK.O&lt;/A&gt; and Yahoo  Inc. &lt;A HREF=""http://www.reuters.co.uk/financeQuoteLookup.jhtml?ticker=YHOO.O qtype=sym infotype=info qcat=news""&gt;YHOO.O&lt;/A&gt; said on Monday they would begin tests of a new  anti-spam technology that encodes digital signatures into  customers' e-mail as a way to separate legitimate messages from  unwanted spam.",Sci/Tech,4,0.63514954
5736,"Yahoo Inc. is more than doubling its limits on free e-mail storage in its latest move to combat two of its biggest rivals, Google Inc. and Microsoft Corp.",Sci/Tech,4,0.6237448
5737,"Metier Ltd. of the District won a one-year, \$2 million contract for software and services for the FBI's Enterprise IT Portfolio Management Program. The new initiative will improve oversight of the FBI's information-technology systems, applications and assets by the agency's IT management and staff, the company said.",Sci/Tech,4,0.63904864
5753,"Windows CE has become the most popular PDA operating system, passing the Palm OS for the first time. Worldwide shipments of PDAs using Microsoft #39;s system were just under ",Sci/Tech,4,0.62446535
5759,"Two years after launching its first blade server, Dell Inc. on Monday is set to launch a follow-up product: the PowerEdge 855, a server based on Intel Corp.",Sci/Tech,4,0.65010774
5762,AP - Dell Inc. and Microsoft Corp. promised big savings on the billions of dollars companies spend on system maintenance as they unveiled jointly developed software Monday that manages and upgrades servers in one mouse-click.,Sci/Tech,4,0.6362372
5772,"Liquid Machines today announced the release of Email Control Version 6.0, an e-mail policy and security messaging software package designed for enterprise networks.",Sci/Tech,4,0.64240026
5782,"Acer America Corp. on Monday introduced a notebook based on the 64-bit mobile processor from Advanced Micro Devices Inc. The Ferrari 3400, which runs on the Mobile AMD Athlon 64 for thin and ",Sci/Tech,4,0.63369834
5788,"Yahoo announced enhancements to its e-mail service, implementing search, more storage and its DomainKeys sender authentication technology, which is also being deployed by Internet service provider EarthLink in a test roll-out.",Sci/Tech,4,0.62427485
5800,"Network Appliance has announced what it terms a key milestone in its Storage Grid vision with the release of its Data ONTAP 7G enterprise storage software, which the company is touting as bringing newer functionality and lower costs to the concept of ",Sci/Tech,4,0.6655025
5831,Researchers from the Indiana University School of Medicine are trying to determine whether violent video games such as Grand Theft Auto can make players more prone to violent behavior.,Sci/Tech,4,0.62226
5854,"Nokia has developed a prototype handset that supports Mobile IPv6 (Internet Protocol version 6), a version of the protocol that will help to improve the quality of VoIP (voice over IP), streaming video and other applications delivered to wireless devices.",Sci/Tech,4,0.6872278
5857,"Sony on Tuesday announced plans to release a new dual-format DVD burner that is compatible with Macintosh computers. The external double-layer DVD drive, dubbed the DRX-710UL-T, is designed to record up to ",Sci/Tech,4,0.6378193
5860,"NewsFactor - Yahoo (Nasdaq: YHOO) has beefed up e-mail storage for users of its free e-mail service from 100 megabytes to 250 MB. The Internet giant also unveiled an anti-spam authentication technology called DomainKeys, which curtails messages sent from spoofed addresses.",Sci/Tech,4,0.6625456
5876,Last year we explored the question of Microsoft #39;s potential liability for software flaws exploited by viruses and other forms of malware.,Sci/Tech,4,0.64226645
5896,"Google Inc. stock dropped more than 6 percent Tuesday as tens of millions of new shares held by early investors and employees of the search engine giant became available for sale for the first time..&lt;br&gt;&lt;FONT face=""verdana,MS Sans Serif,arial,helvetica"" size=""-2"" color=""#666666""&gt;&lt;B&gt;-The Washington Post&lt;/B&gt;&lt;/FONT&gt;",Sci/Tech,4,0.6878307
5899,update Microsoft founder Bill Gates on Tuesday detailed his company #39;s plan for computer management software and announced a long-awaited Windows update tool.,Sci/Tech,4,0.62663895
5906,"Microsoft, the behemoth Redmond, Wash., software company lurking over the computing world, Nov. 11 released a  quot;beta, quot; or test, version of its online search service.",Sci/Tech,4,0.6835493
5924,Microsoft Corp. last week released a preview version of its new Internet search engine. It will be available in its final form early next year.,Sci/Tech,4,0.62266535
5944," WASHINGTON (Reuters) - SBC Communications &lt;A HREF=""http://www.reuters.co.uk/financeQuoteLookup.jhtml?ticker=SBC.N qtype=sym infotype=info qcat=news""&gt;SBC.N&lt;/A&gt; will use  Microsoft Corp. &lt;A HREF=""http://www.reuters.co.uk/financeQuoteLookup.jhtml?ticker=MSFT.O qtype=sym infotype=info qcat=news""&gt;MSFT.O&lt;/A&gt; technology to launch video services  over upgraded high-speed data lines, the companies said  Wednesday.",Sci/Tech,4,0.6660379
6003,"America Online (Quote, Chart) is bundling existing security features along with new ones for the Thursday launch of its AOL 9.0 software client, security edition.",Sci/Tech,4,0.66941535
6008,"JACKSONVILLE, FL -- The online search engine leader Google has unveiled a new tool for scholarly research. The new service is aimed at making better sense of all the scholarly work stored on the web and it ",Sci/Tech,4,0.6250063
6017,Google Inc. on Thursday formally launched a new search service aimed at scientists and academic researchers. Google Scholar is a free beta service that allows users to search for scholarly literature ,Sci/Tech,4,0.6840012
6018,"Bill Gates might not use AOL, but he's definitely got mail. The Microsoft Corp. chairman receives millions of Internet messages a day, said Steve Ballmer, the company's chief executive. ""Bill literally receives 4 million pieces of e-mail per day, most of it spam,"" Ballmer said Thursday.",Sci/Tech,4,0.69548327
6020,"AOL has added a range of features to ward off computer viruses, intrusive spyware programs and spam to a special edition of its internet access package, AOL 9.0 Security Edition.",Sci/Tech,4,0.69028544
6022,"SAN ANTONIO SBC Communications and Yahoo are expanding their high-speed Internet service partnership to link video, wireless phone, Internet and other services.",Business,3,0.6761484
6026,"Google has launched Google Scholar, a search service aimed specifically at the academic community. The search tool will help scientists and academic researchers locate papers, theses and ",Sci/Tech,4,0.67730296
6038,"The Motion Picture Association of America is in talks with the Internet2 research consortium, hoping both to test next-generation video delivery projects and to monitor peer-to-peer piracy on the ultrahigh-speed network.",Sci/Tech,4,0.6336265
6059,The U.S. Air Force tomorrow plans to announce an enterprisewide Microsoft software initiative that some analysts see as a prime example of how users can leverage their spending power to force vendors to deliver more secure products.,Sci/Tech,4,0.6727728
6078,SINGAPORE : Microsoft #39;s chief executive Steve Ballmer warned Asian governments on Thursday that they could face patent lawsuits for using the Linux operating system instead of Windows.,Sci/Tech,4,0.6679794
6084,Yahoo and SBC Communications have agreed to collaborate to extend some of the online services and content they currently provide to PC users to mobile phones and home entertainment devices.,Business,3,0.6873099
6097,"Google has rolled out a new search tool called, Google Scholar. Google Scholar enables you to search specifically for scholarly literature, including peer-reviewed papers, theses, books, preprints, abstracts ",Sci/Tech,4,0.6303482
6231,"Users with Symbian-based mobile phones have been hit by malicious code that disables smartphone features. Skulls, a Trojan horse program that poses as gaming software, is one of the first examples of malicious code to successfully infect mobiles.",Sci/Tech,4,0.66879267
6268,"Hackers may be using banner ad servers to multiply the impact of the Internet Explorer virus, security experts warn.",Sci/Tech,4,0.6285535
6288,"A prehistoric neck bone found 12 years ago by amateur fossil hunters in Britain belongs to the biggest dinosaur ever discovered in the UK and possibly Europe, a report published in the Cretaceous Research Journal said today.",Sci/Tech,4,0.64173913
6294,"NOVELL Inc has announced the availability of the Novell Linux Desktop 9, powered by SuSE Linux. Backed by Novells extensive enterprise-level support, training and consulting services, Novell Linux Desktop ",Sci/Tech,4,0.63679546
6297,"An adult publishing company sued Google last week, alleging a dozen counts of copyright infringement. Perfect 10, a Beverly Hills, CA-based publisher of an adult-oriented magazine and Web sites, asserts that ",Sci/Tech,4,0.6433085
6318,"AP - A unique subspecies of fox that is about the size of a house cat is back from the brink of extinction on Santa Catalina Island and can survive on its own thanks to a captive breeding program, the head of a nonprofit group that manages most of the island said Tuesday.",Sci/Tech,4,0.6523454
6350,"InfoWorld - Online phishing schemes increased significantly in October as financial institutions struggled to combat attempts to steal private account information from online consumers, according to the Anti-Phishing Working Group (APWG).",Sci/Tech,4,0.6457505
6351,"ICQ, an IM service provider owned by America Online, and Mail2World Inc., a provider of messaging and collaboration services, this week revealed a free upgrade to the ICQmail service that ",Sci/Tech,4,0.62221056
6388,SiliconValley.com - Intel is making a big push to help personal computer makers in China and India offer the Linux operating system on machines powered by the company's chips.,Sci/Tech,4,0.6549815
6436,"The Massachusetts Institute of Technology is developing mobile phones designed to learn users #39; daily habits so that they can predict what users will do, reports The Register.",Sci/Tech,4,0.62746555
6453,The next chapter in the global legal battle between the recording industry and file-sharing services is due to unfold here Monday when the owners of the hugely popular Kazaa software go on trial on civil copyright infringement charges.,Sci/Tech,4,0.63421655
6463,"Zastrossi writes  quot;According to the Anti-Phishing Working Group, phishing sites--the practice of making sites that look and act like popular sites such as banks in order to steal personal information from customers--rose from 543 sites in September to ",Sci/Tech,4,0.6272233
6466,"In an attempt to become more useful, US researchers are developing new smartphone software which watches users calling and usage patterns and tries to learn how best to help.",Sci/Tech,4,0.6231847
6513,SAN ANTONIO - Forget about PlayStation 2 - Texas entrepreneur wants to kick computer gaming up to the next level by offering players a chance at some real-live killing via mouse and modem.,Sci/Tech,4,0.6390206
6560,"Google wants to help you effectively access the piles of information you store in the documents, e-mail messages, Web pages, and contact lists stuffed on your PC.",Sci/Tech,4,0.6384478
6567,"IBM, Sony Corp. and Toshiba Corp. on Monday unveiled some key details on the powerful new  quot;Cell quot; processor the three are jointly producing to run next-generation computers, game consoles and TVs.",Sci/Tech,4,0.65157473
6572,"com November 29, 2004, 8:33 AM PT. Wired  amp; Wireless continues its reign as the top IT priority among IT managers due to widespread IP telephony deployment and other network infrastructure upgrades.",Business,3,0.6457077
6574,"Halsey Minor, CEO of hosted integration provider grand central Communications, has a powerful message for IT: In four years, ... basically the whole notion of enterprise application software is going to be dead. He believes application functionality will instead be available as hosted, pay-per-use services delivered by companies such as Salesforce.com. Putting his money where his mouth is, Minor has recently launched a \$50 million venture capital fund with his own money to fuel on-demand startups. For its part, Grand Central will handle data and process integration between enterprises and multiple on-demand services.",Business,3,0.6738467
6594,"\\Interesting data  this morning (thanks Dan ) on weblogs:\\""Blog readership shoots up 58 in 2004 6 million Americans get news and\information fed to them through RSS aggregators But 62 of online Americans do\not know what a blog is""\\Read the PDF  for more stats (man I hate PDF).\\""27 of internet users say they read blogs, a 58 jump from the 17 who told us\they were blog readers in February. This means that by the end of 2004 32\million Americans were blog readers. Much of the attention to blogs focused on\those that covered the recent political campaign and the media. And at least\some of the overall growth in blog readership is attributable to political\blogs. Some 9 of internet users ...\\",Sci/Tech,4,0.63012844
6599,"Sun Microsystemshas agreed to purchase Ashburn, Virginia, IT services company SevenSpace, the companies announced Monday. With the purchase, Sun takes a further step away from its traditional focus on supporting only its Solaris operating system platform and beefs up its support for competing operating systems like Windows, HP-UX and AIX.",Sci/Tech,4,0.6733986
6604,"Not to be left out of desktop search, two search vendors on Monday leaped into the growing space for managing e-mail, documents and other hard-drive data.",Sci/Tech,4,0.63366765
6610,"TOKYO - Japan #39;s top cell phone operator NTT DoCoMo Inc. and major British mobile carrier mm02 plc reached an agreement that will allow mobile telephone users in Britain, Germany, and Ireland to surf the Internet on the handsets, DoCoMo said Tuesday.",Sci/Tech,4,0.6441775
6614,"US scientists had made a breakthrough in their quest to make low-cost hydrogen, a technology key to finding new sources of energy to end US dependence on foreign oil, they said.",Sci/Tech,4,0.635613
6617,Initial versions of PlayStation 3 chip will not be produced with a cutting-edge chip-making technology. The four companies developing the Cell consumer electronics microprocessor released a few more details ,Sci/Tech,4,0.62417054
6651,"Microsoft watched a software deal with China go bust less than two weeks into the contract. And Beijing is pushing its government IT officials to buy local. But China remains a vibrant market where tech firms have to stay in play. &lt;FONT face=""verdana,MS Sans Serif,arial,helvetica"" size=""-2"" color=""#666666""&gt;&lt;B&gt;-washingtonpost.com&lt;/B&gt;&lt;/FONT&gt;",Sci/Tech,4,0.7668063
6656,"Sharman Networks, the company behind the Kazaa peer-to-peer file sharing software, began its defense in a Sydney court room on Tuesday against charges by members of the music industry that the company aided music piracy and copyright infringement.",Sci/Tech,4,0.6694771
6679,"Mobile phones running Symbian's Series 60 operating system are the target of a new strain of the Skulls Trojan horse program. The new Trojan comes with the Cabir.B worm, which, unlike the first version of the virus, can spread to other phones within reach of Bluetooth broadcasting range.",Sci/Tech,4,0.6539633
6701,"Early next year, the computer maker will begin selling software designed to slow the spread of viruses from its ProLiant servers and ProCurve networking equipment, an HP executive said on Tuesday.",Sci/Tech,4,0.6783519
6720,"Microsoft has sued eight US computer resellers who it says bought or sold counterfeit Certificate of Authenticity labels or genuine labels that had been separated from their related software, all in breach of copyright and trade mark laws.",Sci/Tech,4,0.7044699
6730,Hewlett-Packard has developed a software program that could slow the spread of computer viruses and worms by acting as a  quot;throttle quot; on unauthroized network activity.,Sci/Tech,4,0.641714
6731,"com. America Online Inc. on Wednesday launched new features in its Singingfish search site for audio and video on the Web. AOL, a division of Time Warner Inc.",Sci/Tech,4,0.63101107
6748,"Intel is preparing a marketing strategy that will brand desktop PCs with a similar label that made its Centrino notebook technology a household name, according to sources familiar with the company's plans.",Business,3,0.63833964
6752,"Microsoft #39;s MSN has introduced a beta version of its new blogging tool, MSN Spaces, which it expects will eventually be supported by advertising.",Sci/Tech,4,0.6244151
6774,"With broadband and desktop media fueling consumer interest in digital media content, video and audio search provider Singingfish has launched an improved search portal to help the world find more multi-media online.",Sci/Tech,4,0.673591
6782,"Business and education leaders in Northern Virginia are working hard to lure biotechnology companies. But for a daunting reminder of how far they need to go, all they have to do is look at neighboring Maryland. &lt;FONT face=""verdana,MS Sans Serif,arial,helvetica"" size=""-2"" color=""#666666""&gt;&lt;B&gt;-The Washington Post&lt;/B&gt;&lt;/FONT&gt;",Sci/Tech,4,0.6656925
6820,"In a short time, in a public way -- while on Metro, or in line at Starbucks, or inside a movie theater -- ring tones signal who you are. Or who you want people to think you are.&lt;FONT face=""verdana,MS Sans Serif,arial,helvetica"" size=""-2"" color=""#666666""&gt;&lt;B&gt;-The Washington Post&lt;/B&gt;&lt;/FONT&gt;",Sci/Tech,4,0.67706
6828,Four Hollywood studios this week embraced a new high-definition DVD format from electronics giant Toshiba - raising many questions for video lovers who have driven sales of pre-recorded DVDs to new heights.,Sci/Tech,4,0.64874446
6838,"One of the hottest holiday gifts this year is the Apple iPod, the digital-age equivalent of the Sony Walkman. The iPod, which stores music files downloaded from a computer ",Sci/Tech,4,0.6671474
6841,"DECEMBER 02, 2004 (IDG NEWS SERVICE) - Lycos Europe NV is caught in a tit-for-tat struggle with spammers just days after releasing a free screen saver program that uses computer downtime to swamp Web sites associated with spam campaigns.",Sci/Tech,4,0.6622041
6864,"BusinessWeek Online - Had Scott G. Kriens stayed at StrataCom Inc. for a few more weeks in 1996, he would have ended up working for fast-rising networking star Cisco Systems Inc. , which bought StrataCom that April.  But rather than take a ride on the Cisco rocketship, Kriens left to run tiny Juniper Networks Inc.  Now, Kriens and  Juniper are the highfliers. Over the past year, Juniper has handed its Silicon  Valley neighbor a string of defeats in  the market for gear used to shuttle  e-mail, videos, and Internet phone calls between cities and continents. ...",Sci/Tech,4,0.6706549
6873,"Microsoft today announced the availability of the second Community Technology Preview (CTP) for Microsoft SQL Server 2005 and the technical preview availability of SQL Server 2005 Express Manager, a new, free database management tool.",Sci/Tech,4,0.65292424
6877,IBM is reportedly in talks to sell its personal computer business. It would mark the end of an era for the company that brought the computer into the mainstream when it began selling its desktop PC to corporations and consumers in 1981.,Business,3,0.62209177
6903,"NewsFactor - Sprint (NYSE: FON) will spend US #36;3 billion over the next three years to upgrade its U.S. wireless network, including the development of high-speed Internet services.",Sci/Tech,4,0.62963897
6908,"Version 1.0 of the Mozilla Thunderbird email client is finally available for download, according to an announcement from the Mozilla Foundation.",Sci/Tech,4,0.6255317
6956,"Intel #39;s products for the digital home and digital office in 2005 will give consumers and IT managers more capabilities than just raw performance, and the company plans to highlight those products as it did with its Centrino mobile technology, Intel ",Sci/Tech,4,0.6834819
6958,"Hoping to prove that grid computing can work in the business world, Dell, EMC, Intel and Oracle have announced a joint effort designed to show business users how to use the distributed computing technology.",Sci/Tech,4,0.6779515
6971,"Oracle, Dell, EMC and Intel have joined with other tech companies to create an industry standard for enterprise grid systems.  quot;Project MegaGrid quot; will help maximize the use of computing resources, according to the group.",Sci/Tech,4,0.6720137
7000,"When it comes to touting his company's software, Oracle CEO Larry Ellison is never one to mince words. But when it's the principle of free speech versus the almighty dollar, the bad boy of Silicon Valley is a veritable shrinking violet. Missing Links",Sci/Tech,4,0.634176
7003,"com December 8, 2004, 2:48 PM PT. Several flaws in common Linux code used to process graphics in the GNOME desktop environment could allow an attacker to compromise a computer that ",Sci/Tech,4,0.6316399
7038,"&lt;p&gt;\&lt;/p&gt;&lt;p&gt; By Lisa Baertlein&lt;/p&gt;&lt;p&gt; SAN FRANCISCO (Reuters) - A former White House Web security\chief predicted on Wednesday that technology companies and law\enforcers could soon stamp out most Internet ""phishing"" scams\that aim to trick people into giving away personal and\financial information.&lt;/p&gt;",Sci/Tech,4,0.62289625
7048,"PalmSource today promised a Linux version of its operating system, together with a cut-down offering for use in budget mobiles, after buying mobile phone developer China Mobilesoft.",Sci/Tech,4,0.6397548
7055," NEW YORK (Reuters) - T-Mobile USA, the U.S. wireless unit  of Deutsche Telekom AG &lt;A HREF=""http://www.reuters.co.uk/financeQuoteLookup.jhtml?ticker=DTEGn.DE qtype=sym infotype=info qcat=news""&gt;DTEGn.DE&lt;/A&gt;, does not expect to offer  broadband mobile data services for at least the next two years,  its chief executive said on Thursday.",Sci/Tech,4,0.6284006
