,Original_Text,Class_String,Class_Number,Neuron_37
1,"SPACE.com - TORONTO, Canada -- A second\team of rocketeers competing for the  #36;10 million Ansari X Prize, a contest for\privately funded suborbital space flight, has officially announced the first\launch date for its manned rocket.",Sci/Tech,4,0.8651364
2,"AP - A company founded by a chemistry researcher at the University of Louisville won a grant to develop a method of producing better peptides, which are short chains of amino acids, the building blocks of proteins.",Sci/Tech,4,0.85306466
17,"European Space Agency -- ESAs Mars Express has relayed pictures from one of NASA's Mars rovers for the first time, as part of a set of interplanetary networking demonstrations.     The demonstrations pave the way for future Mars missions to draw on joint interplanetary networking capabilities...",Sci/Tech,4,0.9186055
70,"Red Flag Software Co., the company behind China's leading Linux client distribution, plans to focus more on its server operating system and enterprise customers, the company's acting president said.",Sci/Tech,4,0.85097057
72,"AP - NASA's Cassini spacecraft has spied two new little moons around satellite-rich Saturn, the space agency said Monday.",Sci/Tech,4,0.99273217
74,"AP - A Nobel laureate in medicine said Monday the Bush administration's limits on funding for embryonic stem cell research effectively have stopped the clock on American scientists' efforts to develop treatments for a host of chronic, debilitating diseases.",Sci/Tech,4,0.86413175
114,"Reuters - Two new moons were spotted around\Saturn by the Cassini space probe, raising the total to 33\moons for the ringed planet, NASA said on Monday.",Sci/Tech,4,1.0025747
117,"Newsday #146;s Stephen Williams reports on seeing Sony #146;s NW-HD1 audio player in a store:  #147; #145;How #146;s it compare to the iPod? #146; I asked a salesman.  #145;Battery life is a lot longer, up to 30 hours, #146; he said.  #145;The LCD readout is kind of dim, #146; I said.   #146;Battery life is a lot longer, #146; he said.  #145;I understand it can #146;t play MP3 files, #146; I said.  #145;Battery life is a lot longer, #146; he said. #148; Aug 17",Sci/Tech,4,0.89115095
186,"Six months before NASA plans to return the shuttle to space, officials think they #39;ve essentially solved the problem that doomed Columbia in 2003 -- debris coming off its fuel ",Sci/Tech,4,0.8914431
190,"CHICAGO - Hewlett-Packard(HP) has moved its Active Counter Measures network security software into beta tests with a select group of European and North American customers in hopes of readying the product for a 2005 release, an HP executive said at the HP World conference here in Chicago Wednesday.",Sci/Tech,4,0.90035754
200,"Single mothers, poverty were big factors in school performance    HealthDayNews -- American teenagers who live with poor single mothers are more likely to get into trouble at school and have poor marks and are less likely to think they'll go to college, says a Rice University study.    Holly Heard, an assistant professor of sociology, analyzed data from thousands of teens who took part in the National Longitudinal Study of Adolescent Health...",Sci/Tech,4,0.84858984
233,"TechWeb - Customers are decoupling storage from server purchases, which explains why EMC and NetApp earnings were up and why Sun and HP were flat or down, Warmenhoven says.",Sci/Tech,4,0.84785086
246,"While the total number of home internet users has reached a plateau in the US, those who do use the internet are adopting broadband at a rapid pace, according to Marc Ryan, senior director of analysis at the audience measurement company. ",Sci/Tech,4,0.89481586
276,AP - A team of scientists is traveling a 600-mile stretch of the Inside Passage this month to study the effects of cruise ship waste and other contaminants in Southeast Alaska waters.,Sci/Tech,4,0.89570856
283,"In a dramatic ending that marks a beginning in scientific research, NASA's Genesis spacecraft is set to swing by Earth and jettison a sample return capsule filled with particles of the Sun that may ultimately tell us more about the genesis of our solar system.",Sci/Tech,4,0.928089
306,"Understanding Google AdWords\\Unlike many search engines Google, to its credit, clearly denotes search listings that are paid placement. In fact, Google AdWords appear in a separate section down the left side of the screen.\\Google AdWords provide an inexpensive advertising venue for businesses to advertise products or services to a targeted ...",Sci/Tech,4,0.8749763
328,"The affected batteries could overheat, posing a fire hazard. Apple received four reports of these batteries overheating. No injuries have been reported.",Sci/Tech,4,0.88304085
424," TOKYO (Reuters) - Eyeing up that juicy steak but worried  about your waistline? Japanese electronics maker Sharp Corp.  &lt;A HREF=""http://www.reuters.co.uk/financeQuoteLookup.jhtml?ticker=6753.T qtype=sym infotype=info qcat=news""&gt;6753.T&lt;/A&gt; says it has developed a new fat-busting microwave oven  that can melt some of your worries away.",Sci/Tech,4,0.8762428
462,"MOSCOW (AFP) -- A new Russian-US team for the International Space Station (ISS) will take off from the Baikonur space station in the former Soviet republic of Kazakhstan in October, Russian space officials said.       The three-person team, due to be approved on Thursday, will leave for the ISS on board a Russian Soyuz TMA-5 spacecraft, Russia's Federal Space Agency, Roskosmos said on its website...",Sci/Tech,4,0.9611844
491,"A molecular switch known to regulate fat metabolism appears to prevent obesity and turns laboratory mice into marathon runners, a Salk Institute study has found.",Sci/Tech,4,0.9581665
499,One thing that #39;s always irritated those who don #39;t choose to use Internet Explorer is finding a website that requires IE. Such complaints seem to have grown all the more passionate now security concerns are driving more users to consider IE alternatives.,Sci/Tech,4,0.9708
507,A team retracing the route of a group of Victorian Arctic explorers have found parts of their 172-year-old ship.,Sci/Tech,4,0.8740023
536,WLAN kit makers Linksys and Netgear have rolled out consumer and small-business oriented wireless access points with integrated Voice over IP (VoIP) support.,Sci/Tech,4,0.9718485
537,"A tiny telescope has spotted a giant planet circling a faraway star, using a technique that could open a new phase of planetary discovery, scientists say.",Sci/Tech,4,0.95393556
548,"LOS ANGELES, CA -- Officials from ASCAP today indicated they intend to pursue music royalties from the organizers of Burning Man, an artist's gathering and celebration held over the Labor Day holiday near Reno, NV.   The unconventional event, held annually since 1986, has never paid fees for any of the music played at the event, says ASCAP.  ""We intend to pursue all available avenues to get this issue resolved,"" said Tony Wilcox, ASCAP spokesperson.",Sci/Tech,4,0.8834989
567,"In an attempt to stem the growing tide of online scams, identity theft and the proliferation of junk e-mail, the Justice Department and state law enforcement officials have initiated what seems to be the largest dragnet yet against spammers, so-called ""phishers"" and other Internet con artists. &lt;FONT face=""verdana,MS Sans Serif,arial,helvetica"" size=""-2"" color=""#666666""&gt;&lt;B&gt;-washingtonpost.com&lt;/B&gt;&lt;/FONT&gt;",Sci/Tech,4,0.99376714
572,"WASHINGTON - A tiny telescope has spotted a giant planet circling a faraway star, using a technique that could open a new phase of planetary discovery.",Sci/Tech,4,0.8556823
581,"Best Softwarelaunched this week an overhaul of its Act contact management software, adding to the product line a second version with more scalability and advanced functionality.",Sci/Tech,4,0.8894041
622,"Hawaii #39;s Keck Observatory has confirmed the existence of a Jupiter-sized planet orbiting a distant star, the first one spotted by a network of astronomers using telescopes no larger than the ones you can buy in stores.",Sci/Tech,4,0.89004916
633,Electronic Jihad Internet Attack Rumored For Today\\Is the Electronic Jihad attack happening today or is it just stirred up rumors? Yevgeny Kaspersky has raised concerns of a major attack on the internet today. Kaspersky has been widely quoted as saying that there would be a major online attack against Israeli ...,Sci/Tech,4,0.85114616
645,Reuters - Intel Corp. (INTC.O) on Thursday\said it has upgraded the wireless networking capabilities of\its Centrino line of notebook computer chips to allow broader\network access with improved security.,Sci/Tech,4,0.87332606
671,"Recreational anglers may be responsible for landing nearly 25 percent of over-fished salt water species caught off US coasts, a study released on Thursday suggests.",Sci/Tech,4,0.8599051
702,"PC World - First TVs, new printers, long-lasting inks, and projectors are targeted\ at living room and office.",Sci/Tech,4,0.85437167
715,"By SARA LEITCH     BRUNSWICK, Maine (AP) -- Astronauts spend years training before they can lift off into space. They learn to operate shuttles, perform experiments in zero-gravity, and eat bugs if they must...",Sci/Tech,4,0.95116216
778,"For the past few years, viruses have attacked Microsoft #39;s operating system, Web browser or e-mail programs seemingly on a weekly basis.",Sci/Tech,4,0.8424381
791,"If my car died tomorrow, I'd have a lot less angst picking its successor than I would if my TV conked out. &lt;FONT face=""verdana,MS Sans Serif,arial,helvetica"" size=""-2""\ color=""#666666""&gt;&lt;B&gt;-Rob Pegoraro&lt;/B&gt;&lt;/FONT&gt;",Sci/Tech,4,0.99653256
845,"If you always forget to scan for viruses, update virus protection, run Disk Defragmenter, or run any other system tool, look to the Task Scheduler for help.",Sci/Tech,4,0.89611936
866,"AP - China on Sunday launched a satellite that will carry out land surveying and other scientific projects for several days and return to Earth, government media reported.",Sci/Tech,4,0.89649343
910,"pinkUZI writes  quot;Intel will announce that it has crammed 500 million transistors on to a single memory chip, shrinking them in size by 30.",Sci/Tech,4,0.8971564
960,"AFP - Apple Computers launched the newest version of its iMac model, which at two inches thick, is the world's thinnest desktop computer, the company said.",Sci/Tech,4,0.9619921
968," PARIS (Reuters) - Apple Computer unveiled, after a  two-month delay, its new iMac desktop computer on Tuesday which  integrates disk drives and processors into a flat display less  than two inches thick.",Sci/Tech,4,0.8995515
969,"PARIS Apple Computer engineered another design coup on Tuesday, unveiling a new iMac here that incorporates all of the personal computer #39;s innards into a flat-panel screen that balances on an aluminum stand.",Sci/Tech,4,0.8435434
971,"MANHASSET, NY - Philips Electronics and Samsung Electronics have entered into a deal that will enable Samsung to deploy cellular devices using Philips #39; near-field communications chip and technology.",Sci/Tech,4,0.91239035
977,"Microsoft said Friday that it is delaying the release of a new data-storage technology, named WinFS, from the next version of Windows, code-named Longhorn, in order to deliver the operating system by 2006.",Sci/Tech,4,0.855175
982,Upgraded version of this encryption app adds plenty of tools for networked users.,Sci/Tech,4,0.87565213
985,"Skype for Windows, Skype for Pocket PC and Skype for Linux -- Skype for Mac OS X is free. Skype users can control their online presence and ",Sci/Tech,4,1.0193812
988,Microsoft will ship its next Windows client code-named Longhorn in 2006 as originally promised -- but without the next-generation file system known as WinFS.,Sci/Tech,4,0.87525684
998,"AMD has demonstrated the company #39;s first dual-core microprocessors. Dual-core processors offer improved performance over single-core chips, especially in multithreaded applications.",Sci/Tech,4,0.92444485
1002,TechWeb - Availability of Entellium's code could speed development of industry-specific CRM products.,Sci/Tech,4,0.8666022
1005,Kaiju Big Battel -- a multimedia event in which costumed combatants spew toxic ooze on audience members -- is growing in popularity. There are already dedicated websites and a DVD series. Coming next: a book and TV pilot. By Xeni Jardin.,Sci/Tech,4,0.9195725
1009,"SiliconValley.com - Attempting to capitalize on iPod mania, Apple Computer Tuesday unveiled a fast new version of the iMac that it all but touted as a smart accessory for the sexy music players.",Sci/Tech,4,0.90225154
1013,"Researchers behind the study speculate that other life-forms may have already sent us messages, perhaps even as organic material embedded in asteroids that have struck Earth.",Sci/Tech,4,0.85587424
1014,An alert posted on the company #39;s Web site outlined the patches that should be posted to fix numerous security holes in a number of applications.,Sci/Tech,4,0.8969615
1071,"Cue the music: Microsoft has officially thrown its headphones into the ring in the contest to bring legal music downloads to the masses. &lt;FONT face=""verdana,MS Sans Serif,arial,helvetica"" size=""-2""\ color=""#666666""&gt;&lt;B&gt;-washingtonpost.com&lt;/B&gt;&lt;/FONT&gt;",Sci/Tech,4,1.01595
1075,"TOKYO -- Microsoft Corp.'s Japanese arm will begin giving away more than a million CD-ROMs of the company's latest security update, Windows XP Service Pack 2 (SP2) from 27,500 locations during September and October, the company said on Thursday.",Sci/Tech,4,0.86930335
1085,SOFTWARE FIRM Microsoft seems to have agreed to bend to the will of the open source community on its anti-spam technology sender ID.,Sci/Tech,4,0.8490464
1107,"With today's expected announcement, hardware vendors will get access to the BladeCenter specifications by signing a seven-page licensing agreement, which grants users the right to license the specifications for certain types of products.",Sci/Tech,4,0.8480235
1140,"Reuters - Take 15 million armchair athletes,\add a steady stream of statistics and mix in a healthy dollop\of trash talk. Post it all on the Internet and you've got a  #36;3\billion industry built around imaginary sports teams.",Sci/Tech,4,0.84759766
1323,"AP - The director of the hurricane-ravaged Kennedy Space Center refused to speculate Tuesday whether the damage will thwart plans to resume shuttle flights next spring, but his words offered little hope of an on-time launch.",Sci/Tech,4,0.8463459
1346,"A space capsule holding atoms collected from solar wind was en route to a tricky rendezvous with Earth, offering scientists the first material NASA has brought back from space in nearly three decades.",Sci/Tech,4,0.94902617
1354,A San Francisco startup plans to boldly go where no game developer has gone before with an online game based on the cult TV series  quot;Star Trek.,Sci/Tech,4,0.8808288
1363,"The Genesis space capsule, which had orbited the sun for more than three years in an attempt to find clues to the origin of the solar system, crashed to Earth on Wednesday after its parachute failed to deploy.",Sci/Tech,4,0.9714965
1425,Big Blue will use AMD's chip in a high-performance server but isn't yet planning a general-purpose Opteron system.,Sci/Tech,4,0.87594557
1426,"Prosecutors in Verden, Germany, indicted an 18-year-old student on Wednesday for allegedly creating the Sasser worm that crashed hundreds of thousands of computers worldwide after spreading at lighting speed over the Internet.",Sci/Tech,4,0.88681024
1428,"Google Toolbar Using Keywords Function\\Looks like Google is trying to assure placement within the browser one step at a time. The latest update of the Google toolbar includes ""browse by keyword,"" meaing if I type in ""how do I kill this hangover"" into my IE URL field, I will get ...",Sci/Tech,4,0.8868917
1429,"German student, Sven Jaschan, has been formally charged with computer sabotage, data manipulation and disruption of public systems by German prosecutors.",Sci/Tech,4,0.844489
1433,"RealNetworks Inc. has sold about 3 million songs online during a three- week, half-price sale designed to promote an alternative to Apple Computer Inc.",Sci/Tech,4,0.85699725
1443,"The Net needs a new layer of abilities that will deal with imminent problems of capacity, security and reliability, Intel's CTO says.",Sci/Tech,4,0.91898704
1444,BOSTON - Computer viruses and worms will have to share the stage with a new challenger for the attention of attendees at a conference of antivirus researchers: spam e-mail.,Sci/Tech,4,0.9167681
1471,Software allows users of personal digital assistants to make free calls using Wi-Fi networks.,Sci/Tech,4,0.84521246
1498,"By Ed Edelson, HealthDay Reporter    HealthDayNews -- Could electric light pose a cancer threat?    It might seem like the wildest of paranoid beliefs, but a growing number of scientists suspect it might be true. The reason: Turning on the lights after dark may affect a small number of ""clock genes"" that play a major role in controlling how cells live, die and function, these researchers suggest...",Sci/Tech,4,0.8858532
1499,By LAURAN NEERGAARD    WASHINGTON (AP) -- Could that ancient practice of bleeding patients really have done some good? A scientist says new research on how germs thrive in the body suggests it just may have - for some people.    Bacteria need iron to cause infections...,Sci/Tech,4,0.8512315
1507,"Some material has been found still intact inside the crashed Genesis space capsule, say Nasa scientists.",Sci/Tech,4,1.015314
1516,"SAN FRANCISCOSun Microsystems Inc. next week will roll out two new servers featuring its UltraSPARC IV processors, a Sun executive said Friday.",Sci/Tech,4,0.87887514
1526,"The earliest editions of Shakespeare #39;s plays provide a fascinating insight into how the playwright reworked his masterpieces over time, but until now, due to their age and ",Sci/Tech,4,0.8727454
1542,"Hitachi Global Storage Technologies and Intel are pushing the development of an interface technology that they hope will smooth the adoption of compact hard drives into mobile phones, PDAs, and digital music players, the companies say.",Sci/Tech,4,0.87136436
1606,THE WRITERS of the MyDoom viruses are encoding job applications into the latest variants of the bug. According to Sophos the plea for work was found when its boffins were stripping the code of the MyDoom-U and MyDoom-V variants.,Sci/Tech,4,0.8975279
1610,Ziff Davis - Commtouch's anti-spam software update halts spam by tracking e-mail server sending patterns.,Sci/Tech,4,0.9465088
1618,"IBM will push its Power5 line of servers down into the low end of the market, taking Linux with it, when it unwraps an aggressively priced series of Linux-only systems on Monday that will go up against the offerings of Sun Microsystems and Hewlett-Packard ",Sci/Tech,4,0.8451317
1620,"Did the famous screensaver, SETIhome, uncover the first strong evidence for an extraterrestrial signal? The SETI Institute's Seth Shostak discusses how hyperbole can misrepresent the last addition to a list of stellar candidates.",Sci/Tech,4,0.86597365
1641,"SEPTEMBER 13, 2004 (COMPUTERWORLD) - Cisco Systems Inc. tomorrow plans to announce an all-new line of branch-office routers that integrate basic routing capabilities with IP voice support, security tools and other functionality.",Sci/Tech,4,0.9812588
1666,"ORLANDO, Fla.Microsoft Corp. announced another edition of its upcoming development tools family, releasing information on Visual Studio 2005 Standard Edition at the VSLive!",Sci/Tech,4,0.87104756
1667,Virus writers have created a piece of malware that  #39;talks #39; to victims. The Amus email worm uses Windows Speech Engine (which is built-in to Windows XP) to deliver a curious message to infected users.,Sci/Tech,4,0.8907638
1669,"Though the release is technically a preview, the 1.0 version is a significant milestone for the open-source browser software, which has already won an enthusiastic following as an alternative to Microsoft #39;s Internet Explorer.",Sci/Tech,4,0.879605
1683,The eServer OpenPower 720 is aimed at the entry-level market for 64-bit Linux-based servers and runs various configurations of what IBM calls the Power5 at 1.5 and 1.65GHz.,Sci/Tech,4,0.92483556
1717,"Sony Japan has released a new Clie for the Japanese market only. The Clie PEG-VZ90 is a Palm OS multimedia Clie handheld, that features a large OLED screen, slider hidden buttons, plentiful memory and WiFi.",Sci/Tech,4,0.9012206
1728,"To expand the capabilities of SD memory cards in mobile devices, the SD Card Association has recently formed a Mobile Phone Task Force.",Sci/Tech,4,0.9174354
1762,"Reuters - The launch of a Russian rocket scheduled\to blast off to the International Space Station next month has\been postponed because of problems with the docking system,\Russia's space agency said on Wednesday.",Sci/Tech,4,0.9394163
1784,"p2pnet.net News:- It #39;s Apple vs Apple again - that #39;s to say Steve Jobs #39; Apple versus The Beatles #39; Apple. Apple-B claims Apple-J infringes its trade mark and the latter,  quot;is likely to be forced into a multimillion ",Sci/Tech,4,0.8511954
1795,"Microsoft, which recommended immediate updates, said the newly discovered vulnerability could allow remote code execution of code thanks to a buffer-overrun vulnerability in the processing of JPEG image formats.",Sci/Tech,4,0.9204508
1802,Two high-tech communications players have completed the first phase in a series of tests to show how a next-generation IP data and communications infrastructure works.,Sci/Tech,4,0.8901927
1823,Federal prosecutors announced on Wednesday that they had cracked a global cartel that had illegally fixed prices of memory chips in personal computers and servers for ,Business,3,0.8492987
1835,"AP - Migrant smugglers are skirting heightened security along the border by using small boats to shuttle people from the under-supervised Baja coast into Southern California marinas and harbors, already jammed with legal commercial ships and pleasure boat traffic.",World,1,0.85264623
1854,Iomega Corp. is soon expected to ship its first network-attached storage (NAS) device based on wireless networking technology.,Sci/Tech,4,0.88406086
1863,IBM attorneys argued that Utah-based SCO Group has failed to provide any evidence that IBM allowed proprietary Unix code to enter the freely distributed Linux operating system and its \$5 billion suit making that claim should be dismissed.,Sci/Tech,4,0.86055785
1914,"The battering that the hurricanes of the last month has inflicted on NASA centers could strain an already tight schedule for resuming shuttle flights, but it is too early to tell how badly, experts said Thursday.",Sci/Tech,4,0.93358785
1922,"Russia may have to delay October #39;s planned launch of the next International Space Station crew by up to 10 days to fix a problem on the spacecraft that is to carry them into orbit, Russian news agencies reported.",Sci/Tech,4,0.84870696
1923,"The FTC gave limited endorsement to the notion of cash rewards for people who help track down e-mail spammers, but suggested that the measure might work in fewer circumstances than had been pushed by some anti-spam activists. &lt;br&gt;&lt;FONT face=""verdana,MS Sans Serif,arial,helvetica"" size=""-2"" color=""#666666""&gt;&lt;B&gt;-The Washington Post&lt;/B&gt;&lt;/FONT&gt;",Sci/Tech,4,0.98573786
1941,It was a Holy Grail looming on the personal electronics horizon: a pocket-sized device with a workhorse battery and the capacity to hold hours of audio and video.,Sci/Tech,4,0.90632194
1964,The Beaverton-based Open Source Development Labs announced this week it is combining some efforts with another open source group to further the adoption of Linux.,Sci/Tech,4,0.9289486
1984," #147;The single most effective way to avoid viruses and spyware is to simply chuck Windows altogether and buy an Apple Macintosh, #148; writes Walt Mossberg in the Wall Street Journal.  #147;There has never been a successful virus written for Mac OS X, and there is almost no spyware that targets the Mac. Plus, the Mac is invulnerable to viruses and spyware written for Windows. Not only is it more secure, but the Mac operating system is more capable, more modern and more attractive than Windows XP, and just as stable. #148; Sep 17",Sci/Tech,4,0.8414584
1986,"Record labels and Microsoft are in discussions about ways that the next generation of the Windows operating system, code-named Longhorn, can support copy-protected CD technology.",Sci/Tech,4,0.9090821
1996,"A new generation of smaller, sleeker and cheaper MP3 players from the likes of Sony, Rio, Creative and Rave MP are hitting the market this fall, and they all have Apple Computer #39;s white-hot digital music player in their sights.",Sci/Tech,4,0.8912898
2009,"Berlin - A German teenager accused of creating the Sasser worm that infected millions of computers around the world is being taught to become a security software programmer, the company that hired him said on Friday.",Sci/Tech,4,0.896093
2034,"AP - A 20-year-old man has been arrested in England in the theft of the proprietary software blueprints used by Cisco Systems Inc.'s networking equipment, police and the company confirmed.",Sci/Tech,4,0.9503341
2070,"washingtonpost.com - RFID tags, the dime-sized devices that can track inventory from the factory to the store, are being embraced as one of the hottest of new technologies. But Patrick J. Sweeney II likens most available applications of RFID, or radio frequency identification, to the user-unfriendly personal computers of the 1980s: a blank screen and a command prompt.",Sci/Tech,4,0.8925093
