,Original_Text,Class_String,Class_Number,Neuron_43
6143,"UN Secretary General Kofi Annan has praised the release of several political prisoners in Myanmar, the BBC reported Saturday. Annan also said he hoped others still behind ",World,1,0.8246987
6166,"BAGHDAD, IRAQ - Insurgents continued to strike against coalition targets in Iraq Saturday, resulting in the deaths of one US soldier and four government employees in Baghdad.",World,1,0.89099216
6211,"PARIS - Nasser al-Kidwa, nephew of the deceased Palestinian leader Yasser Arafat, arrived in Paris from Cairo Sunday to pick up a copy of Arafat #39;s medical records.",World,1,0.85709363
6213,US Secretary of State Colin Powell has launched a new Middle East peace drive by saying he will press both Israeli and Palestinian leaders for steps to help Palestinians elect a successor to Yasser Arafat.,World,1,1.0238746
6233,Iran on Monday froze sensitive nuclear work including uranium enrichment in a move likely to thwart US efforts to report the Islamic state to the UN Security Council for possible sanctions.,World,1,0.8386401
6239,\US and Afghan forces raid houses in Kabul as part of a hunt for three UN workers kidnapped last month.,World,1,0.8542044
6254,"CBN.com - (CBN News) -ERUSALEM  -h the death of Yasser Arafat behind them, the Palestinians and Israelis are now facing an historic opportunity to move forward in peace.",World,1,0.9153325
6263,An Israeli military court has charged an army officer with illegally using his weapon when he allegedly shot a Palestinian girl who was already dead.,World,1,0.8566659
6305," GAZA (Reuters) - Israeli soldiers shot dead five  Palestinians in north Gaza on Tuesday after mortar fire from  Palestinian militants wounded two people in a nearby Jewish  settlement, medics on both sides said.",World,1,0.9095138
6334," SEOUL (Reuters) - North Korea gave a visiting U.N. official  a ""very positive message"" about resuming stalled six-way talks  on its nuclear programs, the South Korean Unification Ministry  said Wednesday.",World,1,0.84273756
6343,"AP - Iran sought on Wednesday to partially roll back its commitment to freeze all uranium enrichment programs, demanding the right to run some equipment that can be used to produce nuclear arms.",World,1,0.86470217
6377,"QUETTA, Pakistan - A bomb fixed to a bicycle killed one man and injured 15 people in southwestern Pakistans restive desert province of Baluchistan on Thursday, police said.",World,1,0.8986746
6383,"MOSCOW, November 25 (Itar-Tass) - A special task force unit freed both women who were held hostage by two armed army deserters in the Moscow region.",World,1,0.84496367
6384,UK Foreign Secretary Jack Straw lays a wreath at the grave of former Palestinian Leader Yasser Arafat.,World,1,0.9717345
6401,In a pace-setting adventure next January that could herald a new beginning in the Middle East or spell disaster for all is the election of a Palestinian successor to the charismatic Yasser Arafat and a new Baghdad regime that could bring to an end the ,World,1,0.8329507
6403,Canadian Press - OTTAWA (CP) - Deputy prime minister Anne McLellan has applauded the intervention of Ukraine's supreme court in that country's disputed presidential election.,World,1,0.86804956
6413,"DAMASCUS, Syria - Syrian President Bashar Assad is ready to resume peace talks with Israel  quot;without conditions, quot; a top UN envoy said yesterday.",World,1,0.8746947
6417,"WASHINGTON: A US State Department official who worked with the Iraqi ministers of education and higher education was murdered in Baghdad by a group linked to Abu Musab al-Zarqawi, the group claimed on Thursday.",World,1,0.8903035
6430,One rebel group in Sudan #39;s troubled Darfur region Thursday pledged to fully respect a truce with the Sudanese government amid contradictory statements and international concern about an escalation in fighting.,World,1,0.84484035
6434,"A lieutenant of Iraq's most feared insurgent leader, Abu Musab Zarqawi, was captured this week, the country's national security minister said Thursday.",World,1,0.9127403
6441,Iran #39;s chief negotiator to the United Nations nuclear agency says Tehran is committed to the freeze on uranium enrichment agreed earlier this month.,World,1,0.85051733
6473,"AP - A key U.N. atomic agency meeting adjourned for the weekend, giving Iran time to consider a total freeze of a program that could make weapons grade uranium and for delegates to decide on further steps in policing Tehran's nuclear activities.",World,1,0.82820165
6481,"BAGHDAD (AFP) - Iraq #39;s electoral commission was due to study a call by top leaders to delay the January 30 polls because of violence gripping the country, as US-led troops continued their anti-insurgency crackdown.",World,1,0.82941186
6483,AFP - Southeast Asian foreign ministers said they would encourage Australia and New Zealand to accede to a non-aggression pact with their 10-nation ASEAN group that South Korea signed.,World,1,0.83235776
6497,A former US Army sergeant who defected to North Korea almost 40 years ago - has been released after serving 25 days in military detention in Japan.,World,1,0.81913155
6526,"Reuters - The leader of Sinn Fein, Northern\Ireland's main Catholic party and the political ally of the\Irish Republican Army (IRA), said Sunday he believed his\Protestant rivals were ready to agree to a peace deal.",World,1,0.85987025
6551,"BAGHDAD -- Iraq's most feared terrorist group claimed responsibility yesterday for slaughtering members of the Iraqi security forces in Mosul, where dozens of bodies have been found. The claim raises fears the group has expanded to the north after the loss of its purported base in Fallujah.",World,1,0.82991207
6556,"The Palestinians will not accept an interim settlement with Israel, Palestine Liberation Organization chief Mahmoud Abbas told the Arab League during a visit to Egypt yesterday.",World,1,0.8863873
6579, JERUSALEM (Reuters) - Prime Minister Ariel Sharon on Monday  narrowly survived three parliamentary no-confidence votes  sponsored by opposition parties over deepening poverty in  Israel.,World,1,0.96615005
6615,"AP - A Pentagon spokesman said Monday that Red Cross officials have ""made their view known"" that the indefinite detention of terror suspects at Guantanamo Bay, Cuba, amounts to torture.",World,1,0.8458404
6632,"Reuters - A car bomb exploded near a U.S.\military patrol in the town of Baiji, north of Baghdad, on\Tuesday, killing at least seven Iraqis and wounding 20 people,\including two U.S. soldiers, doctors and the military said.",World,1,0.9223692
6704,"WASHINGTON - November was the bloodiest month for US troops in Iraq since April, with at least 135 losing their lives and more than 50 falling in the two-week battle to evict insurgents from Fallujah.",World,1,0.8514613
6833,"AP - There is no reason to hold a meeting of Iraq's neighbors planned for this week in Amman, an Iranian envoy said Monday in a further sign of strained relations following accusations by Jordan's King Abdullah that Tehran wanted to influence the Iraqi elections.",World,1,0.8656589
6902, JERUSALEM (Reuters) - Israel termed as premature on Tuesday  an Egyptian report that it had agreed in principle with the  Palestinians on proposals to end their conflict but said it  would respond positively if militants ceased attacks.,World,1,0.828665
6948," SAMARRA, Iraq (Reuters) - Three Iraqis were killed on  Wednesday when a suicide car bomber attacked a U.S. convoy in  the northern city of Samarra, a local police official said.",World,1,0.8641462
6949,Washington #39;s top nuclear negotiator arrived in Seoul yesterday from China to brainstorm ways to jump-start the stalled six-nation disarmament talks on the North Korean nuclear standoff.,World,1,0.8465383
6964,The Russian President Vladimir Putin has expressed his doubt that the Iraqi elections will be held at their due time. Putin said during his meeting with the Interim Iraqi prime minister Eyad Allawi that he ,World,1,0.82148224
6983,The UN Security Council on Tuesday condemned reported military actions by Rwanda in the eastern Democratic Republic of Congo (DRC) and demanded the country immediately withdraw any troops it may have in the DRC.,World,1,0.8230286
7029,"MOSUL, Iraq, Dec 9 (AFP) - Six Iraqi national guardsmen and 10 civilians were wounded in two bomb attacks in the northern city of Mosul on Thursday, police said.",World,1,0.9310388
7034,"US appeals to European nations to boost NATO missions in Iraq and Afghanistan have been a success, with the alliance announcing a small expansion of its fledgling military training facility in Baghdad.",World,1,0.86021644
7053,"KEY talks between the government of Sudan and rebels in the troubled Darfur region tomorrow could fail because of a new surge of violence, the UN #39;s envoy to the country said.",World,1,0.8561418
7058,"Reuters - A car bomb that exploded near the\headquarters of Iraqi Prime Minister Iyad Allawi's party in\western Baghdad on Monday targeted a police checkpoint at the\entrance to the road leading to the building, witnesses said.",World,1,0.82107455
7086," JERUSALEM (Reuters) - Israeli Prime Minister Ariel Sharon  on Friday invited the opposition Labour Party to begin talks to  form a unity government, a move that would avoid early  elections and pave the way for a withdrawal from Gaza.",World,1,0.8460147
7101,Darfur #39;s rebel leaders held preliminary talks with African Union mediators in Abuja on Friday ahead of the latest round of peace negotiations on the crisis in the western Sudanese region.,World,1,0.8722574
7118,"LAST MONTH the United States and its allies signaled a change in Sudan policy. Rather than pressuring Sudan #39;s government to halt its genocidal attacks against civilians in the western province of Darfur, they ",World,1,0.8748585
7167,"The health records of Yasser Arafat, who died at Percy Military hospital near Paris last month, have been submitted to Palestinian authorities.",World,1,0.9190636
7170,Israel #39;s opposition Labour party began talks with Prime Minister Ariel Sharon #39;s Likud party yesterday about joining its coalition - a partnership aimed at promoting a military withdrawal from Gaza.,World,1,0.88769627
7179," SEOUL (Reuters) - North Korea will not dismantle its  nuclear programs or improve ties with South Korea until  questions about the South's nuclear experiments are clearly  answered, Pyongyang said on Sunday.",World,1,0.8558168
7195,BUCHAREST: Romanians voted for a new president on Sunday with fighting corruption and joining the EU the main themes in a run-off round pitting Prime Minister Adrian Nastase against Bucharest Mayor Traian Basescu.,World,1,0.83056724
7197,"RAFAH, Gaza Strip (AFP) - Four Israeli soldiers were killed when Palestinian militants blew up a tunnel under an army post in Gaza, as jailed intifada leader Marwan Barghuti pulled out of the Palestinian elections.",World,1,0.99696535
7200,YASSER Arafat is dead. A so-called moderate is now chairman of the Palestine Liberation Organization. Elections to choose a Palestinian Authority president are scheduled in the West Bank and Gaza for early January.,World,1,0.8676883
7226, TAIPEI (Reuters) - Taiwan President Chen Shui-bian is under  pressure to find ways to work with an opposition-dominated  parliament after his party suffered a surprise setback in  weekend legislative elections.,World,1,0.8615429
7228,JAKARTA (Antara): President Susilo Yudhoyono asked Indonesian diplomats on Monday to help the government improve Indonesia #39;s bad image.,Business,3,0.8725369
7237," KHARTOUM (Reuters) - Two employees of a British charity  were killed in Sudan's troubled Darfur region on Sunday when  their convoy came under fire, the aid agency said on Monday.",World,1,0.86589867
7244,"Eight of 11 detainees briefly refuse food over prisoner rights including family visits, access to media. BAGHDAD - The US army said eight of toppled Iraqi leader Saddam Hussein #39;s jailed lieutenants had briefly ",World,1,0.86150974
7245,"AP - Spain's prime minister, heckled Monday by opposition lawmakers, angrily denied his Socialist party instigated anti-government rallies on the eve of a general election to reap political benefit from the Madrid train bombings.",World,1,0.85423225
7253,"Army reinforcements sent to bolster the Democratic Republic of Congo #39;s fragile border region with Rwanda have clashed with former rebel units within the army, a local military commander said on Sunday.",World,1,0.8748766
7264,Officials in Iraq say at least 10 Iraqis have been killed and several others wounded in separate insurgent attacks across the country.,World,1,0.9300314
7267,"SEOUL North Korea is seriously reconsidering its role in talks on its nuclear programs because of what it sees as a concerted campaign to topple the government in Pyongyang, the North Korean Foreign Ministry said Monday.",World,1,0.8331356
7312,The DUP was last night reconsidering its boycott of talks with the Irish government after Taoiseach Bertie Ahern apologised to party leader Ian Paisley.,World,1,0.85102063
7320,"Iraq may begin war crimes trials for senior members of Saddam Hussein #39;s former regime as soon as next week, Iraqi Prime Minister Ayad Allawi said.",World,1,0.9349284
7356,"KANDAHAR, Afghanistan, Dec 14 -- Afghan forces have captured two top figures of the deposed Taliban government, including the personal security chief of leader Mohammad Omar, provincial officials said Tuesday.",World,1,0.8378506
7375,"The kidnapped Turkish engineer was found dead in Kunar province in east Afghanistan on Wednesday, one day after he was abducted by unknown gunmen, the Afghan Interior Ministry said.",World,1,0.9205008
7382,North Korea has warned Japan that it will treat economic sanctions as a  quot;declaration of war quot; and threatens to try to exclude Tokyo from six-party talks on Pyongyang #39;s nuclear arms programs.,World,1,0.8951399
7390,"Hijackers who took as many as 26 people hostage on a commuter bus on the outskirts of Athens released five of the captives. Police are in negotiations to free the remaining hostages, a spokeswoman said.",World,1,0.8473487
7396,"ANKARA, Dec 15 (AFP) - The Turkish ambassador in Afghanistan has confirmed the death of a Turkish engineer kidnapped Tuesday in Afghanistan #39;s eastern Kunar province, the Anatolia news agency reported Wednesday.",World,1,0.85591614
7419,"AFP - An Italian national working for a British non-governmental organisation has been taken hostage in Iraq, the Italian news agency ANSA reported, quoting Italian intelligence sources.",World,1,0.90854543
7436,"AP - Sudan is prepared to halt military operations in the Darfur region if rebels withdraw from some positions they captured earlier this year, government negotiators said Wednesday.",World,1,0.8222946
7443," BAGHDAD (Reuters) - A suicide car bomb hit a bus carrying  Iraqi National Guards on Sunday, killing 22 people in the  deadliest attack of its kind in nearly four months on Iraqis  cooperating with U.S. forces to secure a Jan. 30 election.",World,1,0.81915873
7474,"BEIJING: Chinas improving relations with India will not come at the expense of Pakistan, Chinese Premier Wen Jiabao said in his meeting with Prime Minister Shaukat Aziz here on Wednesday.",World,1,0.83049756
7502,Prime Minister Ariel Sharon said that his government would implement his proposal to dismantle all the Israeli settlements in Gaza and four small ones in the West Bank on schedule.,World,1,0.820723
7512,"Israel withdraws from Khan Younis refugee camp in the Gaza Strip, after a four-day operation that left 11 dead.",World,1,0.9012812
7533,"Israel will not attend a Middle East conference in London early next year but backs its stated aim of fostering Palestinian reform in pursuit of peace after Yasser Arafat #39;s death, a senior official says.",World,1,0.8587735
7534,BAGHDAD (AFP) - The United States failed win a promise from the United Nations to increase its staff in Iraq ahead of elections as Washington stepped up its charges that Damascus was sheltering insurgent leaders.,World,1,0.8693771
7560," JERUSALEM (Reuters) - Israel's opposition Labour party has  clinched a deal with Prime Minister Ariel Sharon's Likud party  to join his coalition, a move that could push forward his Gaza  pullout plan, Israeli media reported on Friday.",World,1,0.8549433
7578,"CAIRO, Dec 17 (AFP) -- One of the two main rebel groups in Sudan #39;s war-torn Darfur region said that the government had launched an offensive on rebel-held towns in southern Darfur, denouncing it as a truce violation.",World,1,0.86980265
