,Original_Text,Class_String,Class_Number,Neuron_13
6146,Lou Holtz wanted his South Carolina players to focus on their game against Clemson. They suddenly have a lot more on their minds. Holtz will retire as coach at South Carolina ,Sports,2,1.0881952
6151,Police launched an investigation on Saturday into an extraordinary mass brawl involving players and fans at a game between the Detroit Pistons and Indiana Pacers.,Sports,2,1.1524551
6156,"Houston, TX (Sports Network) - World No. 1 Roger Federer of Switzerland and third-seeded Lleyton Hewitt each posted straight-set wins and advanced to Sunday #39;s final at the lucrative 2004 Tennis Masters Cup.",Sports,2,1.1901653
6163,"Debuts are rarely pretty, especially for rookies such as Giants quarterback Eli Manning, who will make his first start Sunday.",Sports,2,1.1132476
6171,"AP - LeBron James scored 25 points, Jeff McInnis added a season-high 24 and the Cleveland Cavaliers won their sixth straight, 100-84 over the Charlotte Bobcats on Saturday night.",Sports,2,1.1878842
6174,Annika Sorenstam could only manage a level-par 72 on day three of the ADT Tour Championship in Florida but it was enough to maintain a one-stroke lead.,Sports,2,1.1292416
6194,"Football coaches, especially those at Michigan, continually stress the importance of preventing the big play. A lot of players didn #39;t get the message on Saturday.",Sports,2,1.1019821
6214,AP - Philadelphia 76ers guard Allen Iverson didn't travel with the team for Sunday's game against Miami because of a bruised right elbow.,Sports,2,1.138528
6223,CINCINNATI - Jerome Bettis ran for 129 yards and the Pittsburgh Steelers #39; blitzing defense created havoc in the second half in a 19-14 win over the Cincinnati Bengals yesterday.,Sports,2,1.1730473
6304,USC vs. Oklahoma in the Orange Bowl appears to be three victories away - two by USC and one by the Sooners. USC and Oklahoma held the top two spots in the Bowl Championship ,Sports,2,1.1605613
6326,Three men were arrested Tuesday night for trying to extort \$3 million from Denver Nuggets star Carmelo Anthony. Joubert Santos and Jason Pabon of the Bronx ,Sports,2,1.1076128
6330,"(Columbia-AP) Nov. 24, 2004 - Friends and colleagues of South Carolina #39;s new coach Steve Spurrier say he is a family man who jokes around and likes to play golf, just like his predecessor Lou Holtz .",Sports,2,1.0731074
6360,"Jacksonville, FL (Sports Network) - Jacksonville Jaguars quarterback Byron Leftwich participated in practice Wednesday and is expected to start this week against the Minnesota Vikings.",Sports,2,1.1240386
6390,"Defending champion France surged into the Fed Cup final, completing a 5-0 sweep of Spain on Thursday behind singles victories by Nathalie Dechy and Tatiana Golovin.",Sports,2,1.148561
6408,A SOCCER fan was fined \$2400 and banned from soccer grounds for the maximum five years yesterday when he pleaded guilty to racially abusing Birmingham City striker Dwight Yorke.,Sports,2,1.0991825
6419,Arsenal striker Thierry Henry is doubtful for Sundays Barclays Premiership trip to Liverpool with a calf injury. The Frenchman aggravated the problem during Wednesday nights ill-tempered Champions League ,Sports,2,1.0975975
6433,AP - California quarterback Aaron Rodgers will skip his senior season to enter the NFL draft.,Sports,2,1.179808
6499,"New York Knicks #39; Jamal Crawford puts up a shot against the Toronto Raptors during the second quarter Saturday, Nov. 27, 2004. Crawford scored 30 points in the Knicks #39; 108-102 win.",Sports,2,1.1909969
6502,Backup quarterback Robert Lane has 205 total yards with a touchdown pass and a touchdown run in Mississippi's 20-3 win over Mississippi State on Saturday.,Sports,2,1.142931
6528,Patrick Ramsey makes his first second start of the season as the Redskins face the AFC North-leading Steelers at a sloppy Heinz Field in Pittsburgh.,Sports,2,1.1914004
6533,AP - Tennessee Titans quarterback Steve McNair hinted Sunday that his 10th season in the NFL could be his last.,Sports,2,1.1249676
6534,"Drew Bledsoe went all the way home to Washington state to help the Buffalo Bills collect a rare road win. Willis McGahee had 116 yards rushing and four touchdowns, leading Buffalo to a 38-9 win over Seattle ",Sports,2,1.0804064
6538,At about the moment a melee broke out on the Giants #39; sideline Sunday - after Eagles linebacker Jeremiah Trotter hit Giants quarterback Eli Manning out of bounds ,Sports,2,1.234944
6546,"Sandora Irvin had 23 points and 17 rebounds and TCU upset a ranked team for the second night in a row, beating Michigan State (No.",Sports,2,1.1375492
6548,"EAST RUTHERFORD, NJ - The Philadelphia Eagles won a fourth consecutive NFC East title by making Eli Manning look very much like a rookie.",Sports,2,1.1690964
6553,"Serie A leader Juventus wasted a two-goal lead in the second half and was held to a 2-2 draw by Inter Milan at San Siro on Sunday, losing ground to defending champion AC Milan.",Sports,2,1.1522193
6590,Bolton #39;s El-Hadji Diouf has been charged by the Football Association for spitting at Portsmouth #39;s Arjan de Zeeuw in Saturday #39;s 1-0 win for Pompey.,Sports,2,1.0735829
6600,Six players from both Clemson and South Carolina will be suspended for one game next season for their participation in a brawl near the end of the rivalry game November 20th.,Sports,2,1.0600625
6608,AP - Earl Boykins scored 22 points to help the Denver Nuggets overcome the absence of Carmelo Anthony and defeat the New Orleans Hornets 76-67 on Monday night.,Sports,2,1.1964985
6616," NEW YORK (Reuters) - Advertisers may have been bitten once  by an indecency scandal at the 2004 Super Bowl, but they are  not shy about getting back into the game for the next U.S.  football championship.",Sports,2,1.1091859
6620, NEW YORK (Reuters) - Brett Favre celebrated his 200th  consecutive start by throwing three touchdown passes as the  Green Bay Packers destroyed the St. Louis Rams 45-17 at Lambeau  Field Monday.,Sports,2,1.1422367
6628,"David Dubois scored a game-high 17 points as Maine held on for a 58-52 men's basketball victory over Dartmouth last night at Hanover, N.H.",Sports,2,1.1312052
6675,"FORMER Rangers, Everton and Scotland captain Richard Gough has been appointed as the new manager of troubled Scottish Premier League outfit Livingston.",Sports,2,1.1269648
6688,"BEREA, Ohio (Ticker) - One day after admitting that his shaky job status was a  quot;distraction quot; to his players, Butch Davis resigned as coach of the Cleveland Browns on Tuesday.",Sports,2,1.1616439
6727,The Palace in Auburn Hills bans two men from events for their involvement in last month's brawl between the Pistons and Indian Pacers.,Sports,2,1.075617
6735," PROVO, Utah (Sports Network) - Gary Crowton has resigned  from his position as the head football coach at Brigham Young.",Sports,2,1.2088493
6740,David Bellion scored 19 seconds after the opening kickoff as Manchester United #39;s backup team edged Arsenal #39;s youngsters 1-0 on Wednesday to reach the semifinal of the English League Cup.,Sports,2,1.1645894
6769, NEW YORK (Reuters) - Eddy Curry registered 18 points and 10  rebounds and Tyson Chandler added 18 rebounds and 10 points as  the Chicago Bulls stunned the Los Angeles Lakers 92-84  Wednesday.,Sports,2,1.1063483
6799,"Hubie Brown, 71, got to retire as coach of the Memphis Grizzlies of own volition, drawing accolades for transforming a franchise that never won more than 23 games into a 50-victory team in less than two seasons.",Sports,2,1.0686862
6802,"University of Notre Dame officials are apparently prepared to interview Utah football coach Urban Meyer as early as tonight, only two days after the school fired coach Tyrone Willingham after three seasons.",Sports,2,1.1461393
6825," ST. LOUIS, Mo., (Sports Network) - St. Louis Rams running  back Marshall Faulk has been downgraded from probable to  questionable for Sunday's game against the San Francisco 49ers  with a bruised left knee.",Sports,2,1.118442
6859,Bode Miller won for the fourth time this season Friday and Daron Rahlves was second -- the first 1-2 finish for US men in a World Cup downhill.,Sports,2,1.1112223
6861," BEAVER CREEK, Colorado (Reuters) - American Bode Miller won  a men's World Cup Alpine skiing downhill on Friday for his  phenomenal fourth victory in five races.",Sports,2,1.1216589
6871,"Knoxville, TN (Sports Network) - Tennessee Titans offensive tackle Michael Munoz underwent successful surgery Friday on his injured right shoulder.",Sports,2,1.071648
6888,"The Patriots' Adam Vinatieri and Cleveland's Phil Dawson formed a productive practice pair in 1998. Vinatieri scored a personal-high 127 points in '98, his third NFL season, while Dawson performed as a practice squad player.",Sports,2,1.1259116
6918,"Ruud van Nistelrooy will miss Manchester United #39;s last Champions League Group D game away to Fenerbahce on Wednesday because of a calf injury, the Premier League club said.",Sports,2,1.065616
6928,"Kylan Loney had five 3s among her 23 points, and Arizona State used 24 turnovers by 11th-ranked Georgia to win 67-57 Tuesday night.",Sports,2,1.0952092
6932,Dirk Nowitzki scored 23 of his 34 points in the second half as the Dallas Mavericks snapped the Minnesota Timberwolves #39; five-game winning streak 97-87.,Sports,2,1.2107505
6963,"While the list has dwindled in the search to replace David Cutcliffe as the Ole Miss football coach, one name has risen to the top.",Sports,2,1.1200911
6978,AP - Utah defensive coordinator Kyle Whittingham was hired as the school's football coach to replace Urban Meyer.,Sports,2,1.1691979
6994,"AP - Six-time All-Star catcher Sandy Alomar Jr. agreed Wednesday to a  #36;550,000, one-year contract with the Texas Rangers to be a part-time player next season.",Sports,2,1.1574619
7069,AP - The Washington Wizards suspended Kwame Brown for one game Thursday for his actions during the previous night's game against Denver.,Sports,2,1.0833449
7078,Massachusetts made sure its first home game against a defending national champion was one to remember. The Minutemen stunned seventh-ranked Connecticut 61-59 on Rashaun Freeman #39;s layup with 4.3 seconds to play Thursday night.,Sports,2,1.0956904
7105,Buffalo Bills offensive coordinator Tom Clements has emerged on a short list of candidates whom Notre Dame has targeted for its head coaching vacancy.,Sports,2,1.2502614
7107," ANAHEIM, Calif. (Sports Network) - The Anaheim Angels have  reportedly agreed to a contract with veteran free-agent  outfielder Steve Finley.",Sports,2,1.2050827
7128,HOUSTON Yao Ming #39;s 21 points and nine rebounds led the Houston Rockets to an 89-to-81 victory over the hapless New Orleans Hornets.,Sports,2,1.1323807
7150,"CBC SPORTS ONLINE - Steve Finley will remain on the West Coast, but he #39;s decided to return to the American League after 14 seasons.",Sports,2,1.07622
7155,"LONDON, England -- Portsmouth chairman Milan Mandaric has reportedly put former Southampton manager Gordon Strachan at the top of a list of possible targets for the English Premier League club #39;s vacant managerial position.",Sports,2,1.1524218
7160,"As Arsenal are preparing to play Chelsea in the big game of the weekend, Gunners #39; manager Frenchman Arsene Wenger is still deciding in the build-up to Sunday #39;s Premier League showdown.",Sports,2,1.1094319
7161,Paolo Guerrero scored the equalizer and set up another goal to allow Bayern Munich to spend the winter break in first place in the Bundesliga with a 2-2 draw against Stuttgart on Saturday.,Sports,2,1.158907
7169,"ANAHEIM, Calif. There #39;s a chance John Smoltz could return to the Atlanta Braves #39; rotation if the team finds another closer.",Sports,2,1.1065181
7193,"Irving, TX (Sports Network) - Dallas Cowboys running back Eddie George was inactive for Sunday #39;s game against New Orleans as a healthy scratch and missed a game for the first time in his NFL career.",Sports,2,1.0717331
7199,AP - Erin Lawless scored a career-high 26 points and grabbed seven rebounds and No. 21 Purdue beat Western Michigan 74-42 on Sunday.,Sports,2,1.1608635
7201,Free agent first baseman Richie Sexson appears to be at the top of the Orioles' wish list after a meeting at the team's suite on Saturday.,Sports,2,1.1463249
7211,"AP - Royce Clayton and the Arizona Diamondbacks reached a preliminary agreement Sunday on a  #36;1.3 million, one-year contract.",Sports,2,1.0782387
7212,Shelden Williams collects 18 points and 15 rebounds to give Duke an 82-54 triumph over Toledo and Coach Mike Krzyzewski his 700th career win on Sunday.,Sports,2,1.2270195
7243,Puzzling is the best word to describe Notre Dames attempt to find a new head football coach after dumping Tyrone Willingham unceremoniously two weeks ago.,Sports,2,1.1597762
7287,"Fulham manager Chris Coleman was delighted with his side #39;s second-half performance, which brought them a hard-earned point in a 1-1 draw against Manchester United at Craven Cottage.",Sports,2,1.0945009
7317, NEW YORK (Reuters) - Trent Green hit Eddie Kennison with a  nine-yard touchdown pass with 37 seconds left to give the  Kansas City Chiefs a wild 49-38 win over the Tennessee Titans  in Nashville Monday.,Sports,2,1.0892504
7326,"Electronic Arts announced an exclusive licensing relationships with the National Football League and PLAYERS INC to develop, publish and distribute interactive football games.",Sports,2,1.1995906
7345,Rangers manager Alex McLeish has criticised the punishment handed out to Nacho Novo by the Scottish Football Association. Novo and Celtic striker Henri Camara were both given one-match bans ,Sports,2,1.0859672
7402,Valencia say they do not plan to appeal against the seven-match ban given to midfielder Miguel Angel Angulo by UEFA for his behaviour during last week #39;s Champions League match against Werder Bremen.,Sports,2,1.1964576
7424,"Memphis, TN (Sports Network) - The Memphis Grizzlies on Wednesday activated point guard Jason Williams from the injured list, while placing guard Antonio Burks on the IL.",Sports,2,1.0640264
7428,AP - Pittsburgh athletic director Jeff Long plans to interview at least three candidates to replace football coach Walt Harris.,Sports,2,1.0897923
7457,"PASADENA, Calif. -- The first football meeting between Michigan and Texas in yesterday's Rose Bowl brought together two coaching legends -- Bo Schembechler and Darrell Royal .",Sports,2,1.0940822
7486,"Atlanta, GA (Sports Network) - The Atlanta Braves announced Thursday that the team has come to terms with longtime pitcher John Smoltz to a new two-year contract with a club option for the 2007 season.",Sports,2,1.1031148
7500,"Reuters - The Atlanta Braves have acquired\standout righthander Tim Hudson from the Oakland Athletics in\exchange for outfielder Charles Thomas, right-handed pitcher\Juan Cruz and left-handed pitcher Dan Meyer.",Sports,2,1.1676142
7571,Olympic silver medalist Hans Knauss tests positive for the steroid nandrolone after a World Cup race last month.,Sports,2,1.0912946
7575,"Jose Mourinho, the Chelsea manager, last night talked about how  quot;emotional quot; it will be returning to Barcelona in the last 16, knockout stage of the Champions League.",Sports,2,1.1783987
7586,"Miami, FL (Sports Network) - Shaquille O #39;Neal had 20 points, 10 rebounds, seven assists and three blocks and Dwyane Wade led all scorers with 25 points, as the Miami Heat downed the Denver Nuggets, 107-100.",Sports,2,1.0851892
