,Original_Text,Class_String,Class_Number,Neuron_35
2637,THE HAGUE: President General Pervez Musharraf Monday described the killing of Amjad Farooqi as big achievement by security forces and said  quot;important terrorist has been eliminated.,World,1,1.1457037
2695,"Under international pressure to disarm and disband Arab militias in troubled Darfur, Sudan #39;s government is instead reportedly moving hundreds, possibly thousands, of the fighters from Darfur to remote areas of southern Sudan.",World,1,1.2266533
2720,"(CBS/AP) As US forces continued to bombard the restive city of Fallujah and clashed with militants in the streets of Baghdad, there was unrest in the normally quiet British-patrolled city of Basra.",World,1,1.1165512
2725,Palestinian gunmen yesterday released a CNN journalist abducted in Gaza City apparently to pressure members of an Arab minority group not to serve in the Israeli army.,World,1,1.1091216
2761," RAMALLAH, West Bank (Reuters) - Lawmakers angered by the  Palestinian leadership's failure to make reforms plan to force  a parliamentary no-confidence vote that could bring down the  government appointed by Yasser Arafat, legislators said.",World,1,1.1113204
2769,AP - The State Department said Monday it is taking seriously allegations that Laotian military forces may have massacred children of the country's Hmong ethnic minority.,World,1,1.1363696
2802,"AFP - Britain has extended full citizenship rights to Gurkha soldiers from Nepal who serve in the British armed forces, Prime Minister Tony Blair has said.",World,1,1.2149441
2824, GAZA (Reuters) - A column of Israeli tanks surged into the  heart of the Jabalya refugee camp in the northern Gaza Strip on  Thursday as the army broadened its sweep for militants behind a  deadly rocket attack on an Israeli town.,World,1,1.1230758
2834,"_ At least three bombs exploded near a US convoy in western Baghdad on Thursday, killing 37 people and wounding more than 50, officials said.",World,1,1.1584133
2840,"BAGHDAD, Iraq - The Arab news network Al-Jazeera showed video Thursday of 10 new hostages seized in Iraq by militants.    Al-Jazeera said the 10 - six Iraqis, two Lebanese and two Indonesian women - were taken by The Islamic Army in Iraq...",World,1,1.2384282
2853," JABALYA, Gaza (Reuters) - Twenty-three Palestinians and  three Israelis were killed Thursday, Gaza's bloodiest day for  more than two years, as Israel's army struck back after a  rocket attack killed two Israeli children in a border town.",World,1,1.0994056
2855,"WASHINGTON, Sept. 30, 2004 -- A series of car bombings in Baghdad today killed one American soldier and wounded 13 others. The bombings also killed at least two Iraqi policemen and reportedly injured scores of other Iraqis.",World,1,1.2066834
2881,"Three bombs exploded at a neighborhood celebration today in western Baghdad, killing 35 children and seven adults, officials said.",World,1,1.1229378
2901,"SAMARRA, Iraq - U.S. and Iraqi forces launched a major assault Friday to regain control of the insurgent stronghold of Samarra, and hospital officials said at least 80 people were killed and 100 wounded...",World,1,1.1963961
2964,The United States welcomed on Friday Sudanese official #39;s announcement to accept a larger AfricanUnion (AU) mission in the western region of Darfur and urged the speedy deployment of AU troops.,World,1,1.1185654
2977," GAZA (Reuters) - The Israeli army killed two militants  Saturday in an air strike in the northern Gaza Strip, bringing  the number of Palestinians Israel has killed in one of its  deadliest Gaza raids to 39.",World,1,1.2517955
2997,Pakistan beefed up security Saturday as minority Shi #39;ite Muslims prepared to bury victims of a suicide bomb attack on a mosque in the eastern town of Sialkot that killed at least 30 people a day earlier.,World,1,1.1124505
3006,"GUWAHATI: A string of powerful bomb blasts rocked Nagaland and Assam on the birth anniversary of Mahatma Gandhi Saturday, killing at least 19 people and injuring more than 50.",World,1,1.1507833
3041,"French security forces have arrested 20 people suspected of being members of the outlawed Basque separatist group, Eta. Most were Spaniards living in the Basque region of south-western France.",World,1,1.1326447
3054,"PORT-AU-PRINCE, Haiti Oct. 3, 2004 - Gunfire erupted in a slum teeming with loyalists of ousted President Jean-Bertrand Aristide on Sunday, sending people scattering through trash-strewn streets following ",World,1,1.181428
3122, BAGHDAD (Reuters) - Islamic militants distributed a video  in Iraq on Monday showing the killings of two men who  identified themselves as an Italian of Iraqi origin and a Turk.,World,1,1.1157674
3132,"Reuters - Israeli soldiers shot and killed a\Palestinian gunman on Monday as he approached a military\outpost near a Jewish settlement in the southern Gaza Strip, a\military source said.",World,1,1.1329229
3143,The UN Security Council called an emergency meeting Monday at the request of Arab nations to consider a resolution demanding an immediate halt to a major Israeli offensive in the northern Gaza Strip.,World,1,1.2675561
3167,"Four soldiers are charged with the murder of an Iraqi general who died in custody in Iraq, the US army says.",World,1,1.1593263
3210,Reuters - The Israeli army said it had attacked\the car of the Palestinian Islamic Jihad militant commander who\was killed in a Gaza City airstrike on Tuesday.,World,1,1.2618313
3226,The United States on Tuesday vetoed an Arab-backed resolution demanding an immediate end to military operations in Gaza and a pullout of Israeli forces.,World,1,1.2533563
3228,"WARSAW - Poland should decide soon when to pull its troops out of Iraq and end a political debate that encourages Al-Qaeda, Prime Minister Marek Belka says.",World,1,1.1846253
3253,"Children collect usable metal parts from the site of a car bomb explosion in Baghdad, Iraq, October 4. AP. BAGHDAD (AFP) - Britain #39;s Foreign Secretary Jack Straw paid a surprise visit to Iraq on Tuesday amid ",World,1,1.1590401
3301,Mutinous soldiers demanding pay for peacekeeping duty abroad killed the commander of Guinea-Bissau #39;s armed forces on Wednesday and seized key buildings in the capital of the former Portuguese colony.,World,1,1.0819546
3311," MULTAN, Pakistan (Reuters) - At least 37 people were killed  and 52 wounded when a car bomb exploded at a rally to  commemorate an assassinated religious leader in the central  Pakistani city of Multan early on Thursday, police said.",World,1,1.1273633
3344,"AP - Two American soldiers were killed and two others were wounded in separate bombings that occurred within hours, the U.S. military said Thursday.",World,1,1.1072298
3353, HANOI (Reuters) - An Asia-Europe forum accepted Myanmar and  12 other new members on Thursday ahead of a summit strained by  Yangon's human rights record and detention of democracy icon  Aung San Suu Kyi.,World,1,1.0858823
3485, GAZA (Reuters) - Israeli troops killed four armed  Palestinians in the Gaza Strip on Saturday as it pressed a  massive 10-day-old offensive that has cost 85 Palestinian lives  in an attempt to stop militants firing rockets.,World,1,1.1539626
3503,"India News  gt; Pattan/Srinagar, Oct.9 : A suicide bomber rammed a car packed with explosives into an army convoy in Kashmir today, killing four soldiers and a civilian and wounding 30 more, police said.",World,1,1.1849706
3510,"JEBALIYA REFUGEE CAMP, Gaza Strip - Israeli soldiers on Saturday shot and killed a Hamas militant whom the military said was responsible for a rocket attack that killed two Israeli preschoolers last week and triggered an army offensive in northern Gaza.    Abed Nabhan, 25, was one of five Palestinians killed Saturday in the continuing Israeli operation in northern Gaza...",World,1,1.1119606
3511,"Troops of Pakistani para-military force check Afghan refugee voters before they enter in polling station to vote in Afghanistan #39;s presidential election at Jallozai camp near Peshawar, Pakistan on Saturday, Oct. 9, 2004.",World,1,1.0959
3513,"AFP - Islamist rebels have attacked a major police patrol and taken a number of hostages in a remote area of northeastern Nigeria near the Cameroon border, the missing officers' commander told AFP.",World,1,1.1977904
3516,Israeli troops killed five armed Palestinians in the Gaza Strip today as it pressed on with a massive offensive aimed at stopping militants firing rockets into Israel.,World,1,1.3123771
3526,A rocket attack and suicide car bombing killed at least four people in Baghdad Sunday as Defense Secretary Donald Rumsfeld began an unannounced visit to Iraq to gauge efforts to calm violence before January elections.,World,1,1.1316904
3545,"PHNOM PENH, Oct. 10. - King Norodom Sihanouk declared on Sunday that his son, Crown Prince Norodom Sihamoni is ready to accept kingship.",World,1,1.173389
3552,"Bombs in Baghdad killed 18 people as the US Defence Secretary, Donald Rumsfeld, declared that America was winning the war against insurgency during a visit to Iraq.",World,1,1.2164009
3579," GAZA (Reuters) - Several explosions rocked the house of an  Islamic Jihad militant leader in a Palestinian refugee camp in  the southern Gaza Strip on Monday, witnesses said.",World,1,1.3405463
3594,"Israel #39;s Ariel Sharon has rejected his army #39;s request to scale back its Gaza offensive, seeking to avoid any show of weakness after deadly bombings in Egyptian resorts crowded with Israelis, security sources said.",World,1,1.1025915
3611,"BAGHDAD: Members of radical cleric Moqtada al-Sadr #39;s militia began handing back their weapons yesterday under a deal with the interim Iraq Government, while two US soldiers were killed in a Baghdad rocket attack.",World,1,1.08144
3705,"US forces stepped up operations yesterday across a wide swath of the Sunni insurgent strongholds northwest of the capital, pounding targets in three urban centers from the air and supporting Iraqi troops in raids on mosques suspected of harboring ",World,1,1.1543077
3727,At least nine Iraqis and four US soldiers are reported to have been killed in renewed violence in Iraq.,World,1,1.1478363
3737,"Roadside bombings killed four American soldiers in Baghdad, the US command said Wednesday, as US and Iraqi troops stepped up pressure on Sunni insurgents before this week #39;s start of the Islamic holy month of Ramadan.",World,1,1.0988048
3749,"Reuters - Israel dealt a double blow to the\Palestinian Islamic group Hamas on Wednesday, arresting a West\Bank leader held responsible for a twin suicide bus bombing\that killed 16 and killing two militants in Gaza air strikes.",World,1,1.268782
3782,"In southeast Pakistan one of two Chinese hostages injured during a rescue operation died of his injuries, military sources said Thursday.",World,1,1.1037879
3810,"Israel says it will not restrict access to the al-Aqsa mosque compound in Jerusalem during the Muslim holy month of Ramadan, that begins on Friday.",World,1,1.1009228
3821,"The United Nations secretary-general, Kofi Annan, has appealed to the European Union to play a bigger role in UN peacekeeping operations.",World,1,1.124081
3844,"KABUL, Afghanistan -- Vote counting started yesterday in Afghanistan's landmark election, widely expected to install US-backed interim leader Hamid Karzai as the war-ravaged country's first popularly chosen president.",World,1,1.2444888
3878,Pakistani President General Pervez Musharraf has arrived in Britain for a visit which will include talks with Prime Minister Tony Blair.,World,1,1.0807917
3886,THE federal government has welcomed the bringing of formal terrorism charges against Indonesian militant cleric Abu Bakar Bashir. A spokesman for Foreign Minister Alexander Downer said the charges reflected ,World,1,1.1394417
3893,"PORT-AU-PRINCE, Haiti - Heavy gunfire erupted yesterday when police streamed into a slum stronghold of ousted President Jean-Bertrand Aristide.",World,1,1.1735713
3897,"Palestinians retrieved belongings from the rubble of dozens of homes and work crews patched up roads and water pipes today - the aftermath of Israels 17-day military offensive, the deadliest in the Gaza Strip in four years of fighting.",World,1,1.122765
3918," JABALYA REFUGEE CAMP, Gaza Strip (Reuters) - Palestinians  sifted through the rubble of dozens of homes in a sprawling  refugee camp on Saturday after Israel ended its most powerful  assault in the Gaza Strip in four years of bloodshed.",World,1,1.1384542
3928,"Secretary of State Colin Powell will visit Tokyo for two days next weekend to discuss security and trade as well as stalled talks aimed at ending North Korea #39;s nuclear ambitions, Japanese officials said on Sunday.",World,1,1.1061199
3931,Critics of the Iraq war have slammed the prime minister following a decision to allow British troops to move into dangerous territory around Baghdad under US military command.,World,1,1.1927981
3958,"LONDON, Oct. 17 -- The US-led war in Iraq has not made the world any safer, UN Secretary General Kofi Annan said in a British television interview aired on Sunday.",World,1,1.118154
3960,AFP - Australia has turned down a diplomatic plea for a contribution to a military force to protect United Nations (UN) personnel in Iraq.,World,1,1.2746572
4076,"AFP - Myanmar's Prime Minister General Khin Nyunt -- among the most reformist of the military regime's leaders -- has been sacked and placed under house arrest for alleged corruption, a Thai government spokesman said.",World,1,1.1483327
4087,Israel's opposition leader warns that the prime minister risks being assassinated over his Gaza disengagement plan.,World,1,1.0875199
4095,"A mortar attack on an Iraqi National Guard headquarters north of Baghdad killed at least four National Guards and injured 80 others, officials said Tuesday.",World,1,1.1812028
4104,"Supporters of Afghan President Hamid Karzai say he is on course to win the presidential elections, with about one-quarter of the votes counted.",World,1,1.105213
4108,BAGHDAD - Iraqi militants threatened to kill an Australian journalist and interrogated him for more than 20 hours after kidnapping him outside a Baghdad hotel.,World,1,1.2220587
4183, JERUSALEM (Reuters) - Israel's parliament took  extraordinary security steps Wednesday for a vote next week on  a Gaza pullout plan expected to spark Jewish settler protests  and heighten death threats against Prime Minister Ariel Sharon.,World,1,1.2414505
4209,"Canadian Press - BEIJING (AP) - A gas explosion in a coal mine in central China killed 56 people and left scores trapped and missing, the government said Thursday.",World,1,1.1537855
4229,At least one Palestinian is shot dead by Israeli troops as he attacked a checkpoint near Gaza City.,World,1,1.2311983
4251,Sudan #39;s government and Darfur rebels are likely to restart talks Thursday as the African Union said it would increase its forces in the restive region.,World,1,1.078252
4282,"GAZA CITY: One of the leaders of Hamas #39; military wing was killed in an Israeli airstrike in Gaza City early today, a Hamas spokesman said.",World,1,1.3177816
4307,AP - A military judge ordered a U.S. Army reservist on Friday to stand trial Jan. 7 in Baghdad for allegedly abusing Iraq inmates at the Abu Ghraib prison outside Baghdad.,World,1,1.2520223
4315,"Religious and political leaders gather at the Umm al-Qura Sunni Muslim mosque outside Baghdad, where clerics called for their followers to boycott Iraq #39;s January elections.",World,1,1.220453
4344,"In line with his pledge made during the election campaign, Indonesian new President Susilo Bambang Yudhoyono stressed the importance of fighting corruption and terror while ",World,1,1.1211252
4353,"AP - A roadside bomb exploded near an American military patrol in Baghdad Saturday, injuring six soldiers, the U.S. command said.",World,1,1.2309784
4358,"Reuters - U.S. planes bombed targets in\Iraq's rebel-held city of Falluja, killing two people, and the\U.S. military said it had captured a lieutenant of its\deadliest Islamist enemy in Iraq in a raid early on Saturday.",World,1,1.164301
4374,"Insurgents launched strikes on Saturday at United States and Iraqi outposts across Iraq, killing at least a dozen Iraqi police officers and national guardsmen ",World,1,1.1974783
4376,"Suspected Algerian Islamic militants killed 16 people in the first attack on civilians since the start of the holy month of Ramadan, officials said on Saturday.",World,1,1.1287799
4378,"KABUL - A man with six grenades strapped to his body killed himself and a 12-year-old girl on a busy street in Kabul Saturday, police said.",World,1,1.1152358
4380,"AP - The United States could cut its forces in Afghanistan next summer if Taliban militants accept an amnesty to be drawn up by President Hamid Karzai and neighboring Pakistan, the senior U.S. commander here said Sunday.",World,1,1.1820209
4385,Suicide bombers killed at least 22 members of Iraq #39;s fledgling security forces yesterday amid a spate of insurgent attacks across the country that also ,World,1,1.1208323
4414,ISRAEL killed two Islamic Jihad militants in the Gaza Strip yesterday as Ariel Sharon and his cabinet finalised a bill to withdraw from Gaza.,World,1,1.2771559
4419,"Two Iraqis were killed and four others wounded in clashes that broke out between US troops and insurgents in Samarra, north of Baghdad, police said on Sunday.",World,1,1.236622
4422,"A US security official, assigned to the US Embassy in Baghdad, was killed on Sunday by a mortar attack on a US Army base near Baghdad International Airport, US Secretary of State Colin Powell said.",World,1,1.1074156
4452,The corpses of 50 soldiers of Iraq #39;s new army have been discovered northeast of the capital Baghdad. Interim Iraqi interior ministry spokesman Adnan Abd al-Rahman said the troops were believed to have been ,World,1,1.1155607
4463," GAZA (Reuters) - Israeli tanks and troops backed by  helicopter gunships stormed Khan Younis refugee camp, a Gaza  militant stronghold, on Monday, killing 10 Palestinians  including an 11-year-old boy, medics and witnesses said.",World,1,1.26355
4466, BEIJING (Reuters) - Secretary of State Colin Powell urged  China on Monday to exert its influence over North Korea to  resume stalled talks on scrapping its nuclear weapons programs  and pressed Beijing to accept a Taiwan offer of talks.,World,1,1.0743176
4495,"AFP - The group loyal to Al-Qaeda-linked militant Abu Mussab al-Zarqawi claimed to have bombed an Australian convoy in Baghdad, in a statement posted on an Islamist website.",World,1,1.1382592
4541,"Israeli MPs have resumed a debate on Prime Minister Ariel Sharon #39;s disengagement plan, which is expected to culminate in a historic vote in favour of a pull-out of troops and settlers from the Gaza Strip.",World,1,1.2643026
4558,"JERUSALEM Israel #39;s Parliament appeared poised Tuesday to approve Prime Minister Ariel Sharon #39;s Gaza pullout plan, clearing the way for a withdrawal of Jewish settlers from Palestinian territory for the first time in history.",World,1,1.0743905
4570,"AFP - Germany and France both support inviting to European Union membership talks at a summit in December in Brussels, Chancellor Gerhard Schroeder said.",World,1,1.0935466
4589, JERUSALEM (Reuters) - Israeli Finance Minister Benjamin  Netanyahu said on Tuesday he and three other cabinet members  from Ariel Sharon's Likud would quit unless the prime minister  agreed to hold a referendum on a pullout from Gaza.,World,1,1.1773992
4590," BAGHDAD (Reuters) - Iraq's U.S.-backed government said on  Tuesday that ""major neglect"" by its American-led allies led to  a massacre of 49 army recruits at the weekend.",World,1,1.1029478
4598,Reuters - Israeli military police on Tuesday\arrested a commander accused by comrades of riddling the body\of a Palestinian schoolgirl with bullets after fellow soldiers\killed her.,World,1,1.0934956
4616,The group led by wanted terrorist Abu Musab al-Zarqawi has said it has abducted a member of Japan #39;s armed forces and is threatening to behead him if the Japanese government does not withdraw its troops from Iraq within 48 hours.,World,1,1.0954942
4639, JERUSALEM (Reuters) - Israeli leader Ariel Sharon rejected  calls from within his divided cabinet on Wednesday for a  referendum on leaving Gaza after winning parliament's support  to uproot settlements from land claimed by Palestinians.,World,1,1.1160069
4647," THE HAGUE (Reuters) - Former Yugoslav President Slobodan  Milosevic's two court-assigned defense lawyers have asked to be  withdrawn from his case, The Hague war crimes tribunal said  Wednesday.",World,1,1.0812837
4654,"_ Nearly 800 British forces left their base in southern Iraq on Wednesday, heading north toward Baghdad to replace US troops who are expected to take part in an offensive against insurgent strongholds.",World,1,1.2121508
4668,British troops have rolled north from Basra to take over a deadly area near Baghdad and free up US troops for a widely expected attack on the rebel-held city of Falluja.,World,1,1.209527
4679,"AFP - Kidnapped Briton Margaret Hassan made a new appeal for the withdrawal of British troops from Iraq, Al-Jazeera television said, showing her in a video.",World,1,1.1090301
4692,Hundreds of villagers besieged a Thai military camp Wednesday demanding to know whether their relatives were among at least 78 Muslim men who officials said suffocated ,World,1,1.1081576
4699,KUALA LUMPUR: Malaysia has conveyed to Thai Prime Minister Thaksin Shinawatra its concern over the latest incident of violence in southern Thailand.,World,1,1.0738561
4736,"An elite contingent of 50 Nigerian soldiers left Nigeria on Thursday for Darfur, the first stage in the deployment of 3,000 extra African Union (AU) troops to monitor a shaky cease-fire in the western Sudanese region.",World,1,1.1799318
4748,"Unknown armed men in military uniform kidnapped three staff of the United Nations in the Afghan capital city at broad daylight Thursday, Afghan officials confirmed.",World,1,1.2603122
4752,"AP - A bomb exploded Thursday evening outside a bar in southern Thailand, the scene of a campaign of violence blamed on Islamic separatists, injuring at least 15 people, police said.",World,1,1.2056003
4757,"A bomb has exploded in southern Thailand, killing one person and injuring about 20, in what could be the first reaction to the deaths of 85 Muslim protesters earlier this week.",World,1,1.0998762
4761,"JERUSALEM, Oct 28 (AFP) - Israel will not bar ailing Palestinian leader Yasser Arafat from returning to the West Bank if he were to leave for medical treatment, senior government spokesman Raanan Gissin told AFP Thursday.",World,1,1.104767
4788," BAGHDAD (Reuters) - Militants piled more pressure on  Washington's military allies in Iraq on Thursday, seizing an  Iraqi-Polish woman and holding a Japanese man under threat of  death.",World,1,1.2069556
4799,"Nine British tourists, two Jordanians and an Egyptian have been killed in a bus accident in southern Jordan, civil defence sources and diplomats say.",World,1,1.1951948
4812,AP - The militant Palestinian group Hamas said Friday it was setting aside its differences with ailing Palestinian leader Yasser Arafat and called for a united Palestinian leadership to work toward general elections.,World,1,1.1930293
4838,"A French military jet believed to be carrying the Palestinian leader landed today at an airfield outside Paris, witnesses said.",World,1,1.1574224
4874,"Description: In Cambodia, Norodom Sihamoni who accedes to the throne with an elaborate coronation, following the abdication of his father King Norodom Sihanouk.",World,1,1.1782199
4886,"BANGKOK : Thai Prime Minister Thaksin Shinawatra said the government would prosecute 300 Muslims detained at a riot this week that led to the deaths of 87 protesters, while another 900 would be released.",World,1,1.081638
4890,"A militant group is threatening to kill three UN hostages kidnapped in Afghanistan, including a British woman, unless all Taliban prisoners are released.",World,1,1.2679622
4910,"Japan has confirmed that the headless body found in Baghdad on Saturday is of the Japanese being held captive in Iraq. An armed group in Iraq had on Tuesday threatened to behead Shosei Koda, 24, within 48-hours unless Japan pulled its troops out of Iraq.",World,1,1.1801013
4922,has passed a bill obliging the government to continue efforts to develop a nuclear energy programme. Uranium enrichment can be used both for nuclear power and to make atomic bombs.,World,1,1.0733278
4923,Militants holding three UN workers hostage in Afghanistan have offered to consider extending a three-day deadline for their beheading.,World,1,1.1979557
4937,"BAGHDAD: Fifteen people were killed and eight others injured in an explosion that hit a hotel last night in the northern Iraqi city of Tikrit, police and hospital officials said.",World,1,1.1128385
4945,Uruguay #39;s leftist candidate Tabare Vazquez won a historic victory in Sunday #39;s presidential elections with more than 50 percent of the ballot.,World,1,1.0747988
4992,"A car bomb exploded outside the Education Ministry in central Baghdad Tuesday, killing at least six people and wounding about eight, the Interior Ministry said.",World,1,1.0863508
5008,"A car bomb exploded outside the education ministry in central Baghdad on Tuesday, killing at least six people and wounding about eight, the interior ministry said.",World,1,1.0896745
5012,"An unknown militant group holding Iraqi-British hostage Margaret Hassan in Iraq has threatened to turn her over to a group led by al Qaeda ally Abu Musab al-Zarqawi if its demands are not met, Al Jazeera television says.",World,1,1.1378003
5014,"BAGHDAD, Iraq -- The kidnappers of aid worker Margaret Hassan threatened to turn her over to an al-Qaida affiliated group within 48 hours if the British government refuses to pull its troops from Iraq, Al-Jazeera television reported Tuesday.",World,1,1.1753973
