,Original_Text,Class_String,Class_Number,Neuron_7
1779,"NEW YORK - Stocks headed lower Wednesday after beverage giant Coca-Cola Co. issued a gloomy forecast, and a lower-than-expected reading on industrial production for August threw the nation's broader economic outlook into question...",World,1,1.5057251
1788,"Brazilian aircraft manufacturer Embraer (EMBR4.SA: Quote, Profile, Research) (ERJ.N: Quote, Profile, Research) on Wednesday said it had suspended aircraft deliveries to US Airways (UAIR.",Business,3,1.4510602
1799,The Organization of the Petroleum Exporting Countries has agreed to increase output by one million barrels a day in a move to lower oil prices.,Business,3,1.3926041
1804,"NEW YORK Sept. 15, 2004 - Millionaire executive Martha Stewart announced Wednesday that she had decided to begin her prison sentence for lying about a stock trade as soon as possible.",Business,3,1.3394723
1825,"Technology shares edged up in Asia on Tuesday, as crude oil prices hovered near \$44 a barrel and the dollar languished ahead of key US economic data.",Business,3,1.5028942
1861," WASHINGTON (Reuters) - U.S. consumer prices inched up just  0.1 percent last month as gasoline and car prices tumbled, the  government said on Thursday in a report suggesting an inflation  spike earlier this year was an aberration.",Business,3,1.3696061
1875,"US consumer prices inched up just 0.1 percent last month as gasoline and car prices tumbled, the government said on Thursday in a report suggesting an inflation spike earlier this year was an aberration.",Business,3,1.3782346
1907,"Corus, the Anglo-Dutch steel maker, celebrated its first ever profit yesterday and said its UK plants had contributed to the turnaround.",Business,3,1.357315
1920,"AP - Consumer prices barely budged in August, suggesting that inflation isn't currently a problem for the economy and Federal Reserve policy-makers can stick with a gradual approach to raising interest rates.",Business,3,1.5301187
1929,"WASHINGTON - Consumer prices barely budged last month, suggesting that inflation isn #39;t currently a problem for the economy and Federal Reserve policymakers can stick with a gradual approach to raising interest rates.",Business,3,1.5559094
1958," NEW YORK (Reuters) - U.S. blue chips advanced on Friday  after Ford Motor Co. &lt;A HREF=""http://www.investor.reuters.com/FullQuote.aspx?ticker=F.N target=/stocks/quickinfo/fullquote""&gt;F.N&lt;/A&gt; raised its earnings forecasts, while  wireless technology provider Qualcomm Inc. &lt;A HREF=""http://www.investor.reuters.com/FullQuote.aspx?ticker=QCOM.O target=/stocks/quickinfo/fullquote""&gt;QCOM.O&lt;/A&gt; limited  gains on the Nasdaq after saying an accounting review may  reduce pretax income.",Business,3,1.4075499
2010,"Coca-Cola Co. (KO.N: Quote, Profile, Research) , which warned earlier this week of lower-than-expected profits this year, said on Friday it will pay Chairman and Chief Executive Neville Isdell \$1.",Business,3,1.4416671
2068,"New Zealand #39;s High Court rejected a proposed alliance between Air New Zealand Ltd., the nation #39;s largest airline, and Australia #39;s Qantas Airways Ltd.",Business,3,1.5791409
2098,"DUBAI Hyundai Heavy Industries, the world #39;s largest shipbuilder, has won a Saudi order for two large oil tankers as OPEC pumps near capacity, lifting supertanker prices.",Business,3,1.3799607
2117,"AFP - The United States should cuts its fiscal and trade deficits, while Europe and Japan should take steps to boost economic growth, IMF managing director Rodrigo Rato revealed.",Business,3,1.3956938
2123,"The Federal Reserve is widely expected to raise the federal funds rate at its policy meeting on Tuesday, Sept. 21, despite recent mixed economic news.",Business,3,1.4110901
2157,"Nike Inc. (NKE.N: Quote, Profile, Research) on Monday reported a 25 percent rise in quarterly profit, topping Wall Street estimates, on strong sales of Converse sneakers ",Business,3,1.5011095
2163,"Nestle confirmed its 2004 guidance on Tuesday, a day after competitors Unilever and Colgate-Palmolive cast doubts over the consumer goods industry #39;s outlook by issuing profit warnings.",Business,3,1.4035412
2175,"Crude hovers around \$46 a barrel amid demand from most populous country, damage reports from Ivan. LONDON (Reuters) - Oil prices held above \$46 a barrel Tuesday as China showed no letup in its strong demand ",Business,3,1.4127719
2182," NEW YORK (Reuters) - U.S. stocks edged up on Tuesday as  investors expected the Federal Reserve to stay on a course of  ""measured"" interest-rate increases, while major Wall Street  investment banks rose on higher profits.",Business,3,1.5776044
2188,"A federal judge ordered Martha Stewart today to surrender for prison by Oct. 8, granting the Ms. Stewart's request to begin serving her sentence for lying about a stock sale.",Business,3,1.41063
2189,TORONTO (CP) - The Ontario Securities Commission is warning four Canadian mutual fund managers of  quot;potential enforcement proceedings quot; for improper trading.,Business,3,1.4759135
2206,"Oil prices hurdled \$47 a barrel Tuesday, with further declines in the nation #39;s supply expected in the short-term as petroleum producers disrupted by Hurricane Ivan continue to regroup.",Business,3,1.3474756
2238,NEW YORK (CBS.MW) -- Dina Dublon is resigning as chief financial officer after 23 years at JP Morgan Chase in a shakeup that further solidifies Jamie Dimon #39;s control at the nation #39;s second-biggest bank.,Business,3,1.3514447
2259," NEW YORK (Reuters) - U.S. investment bank Morgan Stanley  &lt;A HREF=""http://www.investor.reuters.com/FullQuote.aspx?ticker=MWD.N target=/stocks/quickinfo/fullquote""&gt;MWD.N&lt;/A&gt; on Wednesday said quarterly profit dropped 34 percent  amid reduced trading revenue, falling well short of Wall  Street's already-lowered expectations after a summer of  sluggish market activity.",Business,3,1.354568
2263,"Stocks fell on Wednesday after investment bank Morgan Stanley (MWD.N: Quote, Profile, Research) said quarterly profit fell, casting doubt on corporate profit growth, while a brokerage downgrade on Cisco Systems Inc.",Business,3,1.3714764
2307,Reuters - The dollar rose to a five-week high\against the yen on Thursday as rising oil prices hurt Asian\currencies and the market decided that U.S. interest rates were\still on a rising path.,Business,3,1.4128528
2311,"OIL group Shell has pledged to invest \$45bn (25bn) and make major disposals in a shake-up of the business, following its reserves crisis earlier this year.",Business,3,1.4999763
2332," NEW YORK (Reuters) - U.S. stocks appeared set for a modest  rebound at the open on Thursday, as oil prices retreated a day  after spiking to more than \$48 a barrel, a rise that fueled a  sharp slide in stocks on concern that energy prices would hurt  corporate profits and consumer spending.",Business,3,1.4813527
2344,"A proposed bailout of Donald J. Trump #39;s casino company has been shelved, and Trump now says he may take the company private. The company #39;s shares fell 10 percent.",Business,3,1.3866538
2351," NEW YORK (Reuters) - Halliburton Co. &lt;A HREF=""http://www.investor.reuters.com/FullQuote.aspx?ticker=HAL.N target=/stocks/quickinfo/fullquote""&gt;HAL.N&lt;/A&gt; said on  Thursday it would restructure its KBR unit and may shed the  business if the company's stock performance continues to lag  behind peers.",Business,3,1.4134798
2352," NEW YORK (Reuters) - U.S. stocks slipped on Thursday after  Exxon Mobil Corp. &lt;A HREF=""http://www.investor.reuters.com/FullQuote.aspx?ticker=XOM.N target=/stocks/quickinfo/fullquote""&gt;XOM.N&lt;/A&gt; was downgraded by a brokerage and oil  prices rose, raising investor concerns about the health of  corporate profits and economic growth.",Business,3,1.6672463
2363,NEW YORK (CNN/Money) - The federal government said Thursday it plans to loan a limited amount of crude oil from the nation #39;s strategic reserve in a bid to offset shortages caused by Hurricane Ivan.,Business,3,1.3448086
2367,"American Airlines holding company AMR Corp. (AMR: Research, Estimates) on Wednesday said the airline #39;s August revenue was weaker than expected after hurricanes and high fuel prices ",Business,3,1.4734824
2394, TOKYO (Reuters) - Tokyo's Nikkei average dropped 1.65  percent by mid-afternoon on Friday and was on course for a  sixth day of losses as worries over high oil prices and  uncertainty over the U.S. economic and market outlook hit a  broad range of stocks.,Business,3,1.400181
2407,Alitalia signed a deal with eight of nine unions Friday to split the loss-making Italian airline in two - part of the company #39;s plan to stave off bankruptcy.,Business,3,1.3457347
2420,"The head of US aircraft maker Boeing, Harry Stonecipher, said Friday that the recovery in the sector would not be as strong as arch-rival Airbus was anticipating.",Business,3,1.3758876
2425," LONDON (Reuters) - Britain's financial regulator will step  up scrutiny of investment banks' management of conflicts of  interest and risk in the wake of a number of high profile cases  such as WorldCom, Enron and Parmalat.",Business,3,1.3506279
2440," NEW YORK (Reuters) - U.S. securities regulators may file  suit against Morningstar Inc., a provider of mutual fund and  stock research, over incorrect data it published about a mutual  fund, the company said on Friday.",Business,3,1.415362
2445,"US stocks got a mild boost on Friday as government data showed better-than-expected demand in August for durable goods other than transportation equipment, but climbing oil prices limited gains.",Business,3,1.4541519
2466,"US Airways' 28,000 employees waited last night for the airline to file a petition with the judge in its bankruptcy proceeding, seeking to void existing labor contracts and impose a 23 percent pay cut on workers.",Business,3,1.4036608
2469,Oil futures hit a record high Friday as the government began lending oil from emergency reserves to refineries running low on crude after Hurricane Ivan.,Business,3,1.4677365
2470,The fallout from allegations of serious accounting problems at Fannie Mae has rattled investors and could even bump up mortgage rates down the road.,Business,3,1.3796192
2501,BERLIN: Boeing Co. Chief Executive Harry Stonecipher has said the US aircraft makers archrival Airbus was exaggerating the speed of recovery in the commercial airplane market.,Business,3,1.3341872
2535,"Troubled carrier US Airways has asked a US bankruptcy court to impose big wage and cost cuts, warning that otherwise it might fail to survive.",Business,3,1.4066023
2550,"Tokyo stocks shed more than 1 percent Friday, extending declines to a sixth straight session driven by Wall Street #39;s weakness and worries that higher oil prices may crimp corporate profits.",Business,3,1.4991035
2565,"Crude oil prices neared their all-time record high of \$49.40 US as supply fears in Iraq and other key producers pushed up early trade Monday, while the market took stock of hurricane Ivan #39;s impact on oil rigs in the Gulf of Mexico.",Business,3,1.4186729
2573,"SINGAPORE (Dow Jones)--Singapore #39;s industrial output rose a smaller-than-expected 5.3 on year in August, as the production of pharmaceuticals fell sharply from a high base a year ago.",Business,3,1.4615763
2588,"Walgreen Co., the largest US drugstore chain, said fourth-quarter profit rose 18 percent, helped by sales of prescription drugs. Net income had its biggest gain in almost two years, climbing ",Business,3,1.4106544
2599," NEW YORK (Reuters) - U.S. stocks were knocked lower on  Monday, with the Dow dipping briefly below 10,000, as record  high oil prices threatened to hurt corporate profits and a  brokerage downgrade hit semiconductor shares.",Business,3,1.5352331
2609,"ALEXANDRIA, Va. Sept. 27, 2004 - US Airways Group Inc. warned in a bankruptcy court filing that it may have to liquidate by February if a judge does not impose a temporary 23 percent pay cut on its union workers.",Business,3,1.4252691
2614, NEW YORK (Reuters) - Treasury debt prices climbed on Monday  as investors bet oil prices near record highs might dent U.S.  consumption and force the Federal Reserve to slow the pace of  interest rate hikes.,Business,3,1.5260459
2628,"Walgreen Co. (WAG.N: Quote, Profile, Research) , the top US drugstore chain, on Monday said quarterly profit rose 18 percent on strong sales of prescription drugs ",Business,3,1.5210961
2636,Crude oil futures rose above \$50 a barrel in New York on concern rebel attacks in Nigeria may reduce production while US inventories are near a 29-year low because of disruptions caused by Hurricane Ivan.,Business,3,1.3906021
2638,"The blue-chip Dow Jones average closed below 10,000 for the first time in about six weeks on Monday as a spike in oil prices to nearly \$50 a barrel renewed concerns about corporate profits while analysts cutting recommendations hurt ",Business,3,1.3472743
2648,"SAN FRANCISCO (CBS.MW) -- Fueled by new supply worries in the United States and Nigeria, crude-oil futures made history Monday when the price topped \$50 per barrel late Monday and one analyst said additional disruptions could push prices to \$60 per barrel ",Business,3,1.4327614
2652,"Crude oil prices settled at \$49.64 a barrel, up 76 cents as traders expressed concern that recent hurricanes had hurt output in the United States.",Business,3,1.4190751
2658," TOKYO (Reuters) - Japan's Nikkei share average fell 0.4  percent to a six-week closing low on Tuesday, marking an  eight-day losing streak, after oil prices topped \$50 a barrel,  fanning concern over the business outlook for Japanese  companies.",Business,3,1.3378386
2662,"Catalyst Fund General Partner I Inc., a disgruntled shareholder of Hollinger Inc., claimed yesterday that the company #39;s independent board members have demanded the resignations of Conrad Black, his wife and other insiders -- a charge disputed by the ",Business,3,1.348745
2666,"Citigroup Inc., the world #39;s biggest bank, named Sallie Krawcheck chief financial officer and head of strategy, making her the highest-ranking woman on Wall Street and giving her responsibilities outside the brokerage industry.",Business,3,1.4076922
2680," NEW YORK (Reuters) - U.S. stocks opened higher on Tuesday,  with beaten down shares offering bargains to investors and oil  producer stocks bolstered by crude oil prices breaking through  the \$50 a barrel mark.",Business,3,1.5859866
2688,"US economic growth is expected to slow in 2005 due to rising interest rates and high crude oil prices, according to a forecast of participants at a Federal Reserve Bank of Chicago conference released on Monday.",Business,3,1.4187198
2701,"German-American automaker DaimlerChrysler and Canadian transportation company Bombardier have settled a dispute over the 2001 sale of railcar maker Adtranz, the companies said in statements Tuesday.",Business,3,1.3968337
2703,"Bombardier Inc. (BBDb.TO: Quote, Profile, Research) and DaimlerChrysler AG (DCXGn.DE: Quote, Profile, Research) ended a three-year dispute over the Montreal company #39;s acquisition of train ",Business,3,1.3362546
2706," NEW YORK (Reuters) - ConAgra Foods Inc. &lt;A HREF=""http://www.investor.reuters.com/FullQuote.aspx?ticker=CAG.N target=/stocks/quickinfo/fullquote""&gt;CAG.N&lt;/A&gt; on Tuesday  said private equity firm Hicks, Muse, Tate   Furst Inc.  exercised its option to buy the company's minority stake in  Swift Foods, and that ConAgra received \$194 million in the  transaction.",Business,3,1.4567723
2731,"Foreign-exchange trading surged to a record daily average of \$1.9 trillion this year as hedge funds and other money managers increased bets on currencies, according to the Bank for International Settlements.",Business,3,1.4259133
2735," TOKYO (Reuters) - Tokyo's Nikkei fell 0.19 percent by  midday on Wednesday, erasing initial gains and extending losses  into a ninth straight day as worries about high oil prices and  domestic economic uncertainty hit exporters and tech stocks.",Business,3,1.5423476
2741,"SOMERS, NY - Pepsi Bottling Group Inc., the largest bottler of PepsiCo Inc. beverages, Tuesday said its profit for the latest quarter rose 4.4 percent as volume improved.",Business,3,1.3710514
2749," LONDON (Reuters) - European stock markets rose and absorbed  three separate share placings on Wednesday, boosted by Wall  Street's strong finish while oil prices held close to \$50 a  barrel ahead of U.S. oil inventory data.",Business,3,1.3881122
2755,"If Fannie Mae (FNM) is hampered by new limits on its operations, shareholders of the USA #39;s biggest mortgage-investment company are likely to feel the pinch more than the nation #39;s mortgage borrowers.",Business,3,1.3656497
2765, LONDON (Reuters) - Oil prices dropped from record highs  above \$50 a barrel on Wednesday as the U.S. government reported  a surprise increase in crude stocks and rebels in Nigeria's  oil-rich delta region agreed a cease-fire.,Business,3,1.435305
2789, NEW YORK (Reuters) - U.S. stocks ended higher on Wednesday  as investors snapped up semiconductor shares at bargain prices  and bought some blue chips after crude oil retreated from  record high prices.,Business,3,1.4499563
2843," NEW YORK (Reuters) - U.S. blue chips were lower on Thursday  after drug company and Dow component Merck   Co.&lt;A HREF=""http://www.investor.reuters.com/FullQuote.aspx?ticker=MRK.N target=/stocks/quickinfo/fullquote""&gt;MRK.N&lt;/A&gt; said it  was withdrawing a key drug, casting a dark mood over the market  as oil prices remained above \$49 a barrel.",Business,3,1.5112729
2852," OTTAWA (Reuters) - Nortel Networks Corp. &lt;A HREF=""http://www.investor.reuters.com/FullQuote.aspx?ticker=NT.TO target=/stocks/quickinfo/fullquote""&gt;NT.TO&lt;/A&gt; on  Thursday said it would eliminate about 10 percent of its work  force, slightly less than previously estimated, and consolidate  real estate in a cost-cutting plan that will save \$500 million  in 2005.",Business,3,1.4241835
2866,"Global lenders need to offer more grants and debt relief to poor countries and tailor lending toward the private sector, Treasury Secretary John Snow said today.",Business,3,1.3642175
2897,"Federal prosecutors in Washington have opened an investigation into possible wrongdoing at mortgage giant Fannie Mae, just days after regulators accused ",Business,3,1.4484005
2937," DETROIT (Reuters) - Ford Motor Co. &lt;A HREF=""http://www.investor.reuters.com/FullQuote.aspx?ticker=F.N target=/stocks/quickinfo/fullquote""&gt;F.N&lt;/A&gt; posted its fourth  consecutive month of weaker U.S. sales with a 7 percent drop in  September results on Friday, and the automaker doubled its  incentives on some models to kick-start sales this month.",Business,3,1.395204
2974,New York retailing group Saks said Friday it will close 11 stores and shed 700 jobs. The company said it will close down eight Saks Fifth Avenue stores and three Off 5th Avenue ,Business,3,1.3573544
3052,"AP - The Dutch supermarket retailer Ahold, seeking to streamline global operations and reduce debt, said Sunday it will sell its holdings in Spain to Permira Funds for about  #36;849 million.",Business,3,1.3528947
3055,"In a world in which the fortune OF a pharmaceutical company can rise and fall on the strength of a handful of blockbuster drugs, Vioxx was a giant.",Business,3,1.3543464
3096,"Office Depot Inc. (ODP.N: Quote, Profile, Research) on Monday said Chairman and Chief Executive Bruce Nelson resigned  quot;by mutual agreement quot; with the board, after four years at the helm.",Business,3,1.3400947
3104," WASHINGTON (Reuters) - The Supreme Court on Monday let  stand a ruling that the Visa and MasterCard credit card  associations violated federal antitrust law by barring their  member banks from issuing credit and charge cards on the rival  networks of American Express Co. &lt;A HREF=""http://www.investor.reuters.com/FullQuote.aspx?ticker=AXP.N target=/stocks/quickinfo/fullquote""&gt;AXP.N&lt;/A&gt; and Morgan Stanley.  &lt;A HREF=""http://www.investor.reuters.com/FullQuote.aspx?ticker=MWD.N target=/stocks/quickinfo/fullquote""&gt;MWD.N&lt;/A&gt;.",Business,3,1.6216861
3105,"TOKYO: Rising oil prices are unlikely to deal a major blow to global economic growth although the trend may seem  quot;uncomfortable, quot; a researcher with the International Monetary Fund says.",Business,3,1.384831
3112," NEW YORK (Reuters) - SunGard Data Systems Inc. &lt;A HREF=""http://www.investor.reuters.com/FullQuote.aspx?ticker=SDS.N target=/stocks/quickinfo/fullquote""&gt;SDS.N&lt;/A&gt; on  Monday said it would spin off its data recovery business,  sending its stock up 11 percent to a four-month high.",Business,3,1.4527888
3189, SINGAPORE (Reuters) - Oil prices set a new record above \$50  a barrel on Tuesday as a prolonged U.S. production outage  following Hurricane Ivan attracted fresh speculative buying.,Business,3,1.4217927
3201," CHICAGO (Reuters) - Acuity Brands Inc. &lt;A HREF=""http://www.investor.reuters.com/FullQuote.aspx?ticker=AYI.N target=/stocks/quickinfo/fullquote""&gt;AYI.N&lt;/A&gt;, a maker of  lighting products and specialty chemicals, on Tuesday said  quarterly profit rose 87 percent due to improved sales, lower  operating expenses and a lower tax rate.",Business,3,1.5539716
3209,"United Parcel Service Inc. (UPS.N: Quote, Profile, Research) agreed to buy Menlo Worldwide Forwarding, a unit of CNF Inc. (CNF.N: Quote, Profile, Research) , for \$150 million in ",Business,3,1.4618858
3213, NEW YORK (Reuters) - Oil prices hit a new record of more  than \$51 a barrel Tuesday as a prolonged U.S. production outage  following Hurricane Ivan attracted fresh speculative buying.,Business,3,1.3842281
3243,"The Nikkei average was flat in mid-morning trade on Wednesday, bolstered by bargain-hunting of a number of blue-chip stocks after US stocks showed resilience despite a rise in oil prices to new highs.",Business,3,1.5152301
3288,"Will low-income families become innocent victims of the crackdown on Fannie Mae (FNM )? After all, one of Fannie #39;s official missions is to increase the rate of homeownership by expanding the pool of capital available for mortgage loans.",Business,3,1.3908845
3379, LONDON (Reuters) - Oil prices scaled new heights at \$53 for  U.S. crude on Thursday on concerns over tight winter heating  fuel supplies and an unexpected strike at Nigerian oil  terminals.,Business,3,1.367466
3386,European Central Bank president Jean-Claude Trichet has said that today #39;s decision to leave euro interest rates unchanged reflected a broad consensus on the governing council of the bank.,Business,3,1.394007
3390,"European aircraft maker Airbus on Thursday criticised a US move to take a fight about subsidies to the World Trade Organisation (WTO), saying it showed its rivals unwillingness to address its own subsidies.",Business,3,1.3996545
3403,"Alcoa Inc. (AA.N: Quote, Profile, Research) , the world #39;s biggest aluminum producer, posted only slightly better quarterly earnings on Thursday, as higher metal prices were ",Business,3,1.5152727
3410," SINGAPORE (Reuters) - Technology stocks led Asian share  markets lower on Friday after a retreat by their U.S. peers,  with investors cautious amid record-breaking oil prices and  ahead of U.S. jobs data later in the day. ",Business,3,1.3574598
3440,INVESTORS sent stocks sharply lower today as oil prices continued their climb higher and new questions about the safety of arthritis drugs pressured pharmaceutical stocks.,Business,3,1.570006
3445,Soybean futures edged lower Friday in early activity on the Chicago Board of Trade. Grain futures were mixed. Wheat for December delivery rose 1/4 cent to \$3.,Business,3,1.41758
3447,"British Airways, Europe #39;s biggest airline by passenger capacity, has hiked its fuel surcharges by up to UK8 per ticket, a day after oil prices climbed to record levels.",Business,3,1.3890617
3453,NEW YORK - Investors pushed stocks lower Friday as a surprisingly lackluster job creation report deepened Wall Street's pessimism over the health of the economy. A solid earnings report from General Electric Co...,World,1,1.4157418
3471,Newspaper publisher Hollinger International Inc. suffered a setback Friday in its legal battle against ousted CEO Conrad Black and several associates when a federal judge sharply scaled back its effort to ,Business,3,1.337017
3482,New York real estate mogul Donald Trump defended his friend Martha Stewart as the woman who turned home economics into a media empire began her prison term.,Business,3,1.4463148
3575,"Singapore shares ended lower Monday, hurt by below-expected third-quarter economic data that added to ongoing concerns over high oil prices and weakness on Wall Street.",Business,3,1.4169769
3607,"The Senate today passed a far-reaching, \$136 billion corporate tax package that cuts taxes for businesses ranging from film companies to bow-and-arrow makers while closing tax loopholes and bringing US exporters in line with ",Business,3,1.4254974
3624,A top European Union (EU) economic official said on Monday that the current level of the euro against the US dollar posed no threat to the eurozone economic recovery.,Business,3,1.5101099
3658,"Shares of Sonic Automotive Inc. (SAH.N: Quote, Profile, Research) and Asbury Automotive Group Inc. (ABG.N: Quote, Profile, Research) fell sharply on Tuesday after both car dealership ",Business,3,1.4297521
3662,"NEW YORK - Investors sent stocks lower Tuesday as oil prices crossed another milestone, \$54 per barrel. Earnings reports from heavyweights Johnson   Johnson and Merrill Lynch   Co...",World,1,1.4306828
3682," NEW YORK (Reuters) - U.S. stocks ended slightly lower on  Tuesday, but well above their lows, after crude oil retreated  from a record of over \$54 a barrel.",Business,3,1.485516
