,Original_Text,Class_String,Class_Number,Neuron_38
1690,"Microsoft Corp. and Polycom Inc. have struck a multi-year agreement to link Microsoft's Office Live Communications Server with Polycom's conferencing products, the companies plan to announce Tuesday.",Sci/Tech,4,1.5064846
1695,"Novell is putting open source and identity management centre stage at its European user conference this week. The networking firm announced that Novell Open Enterprise Server (OES), which includes Novell #39;s ",Sci/Tech,4,1.4304153
1696,"China #39;s second-largest mobile phone company says it plans to open up to 3,000 Internet cafes by the end of this year. State-controlled China Unicom, which already operates 400 Internet cafes across the country ",Sci/Tech,4,1.454918
1702,What's New With Google News\\Google News has added a whole bunch of features while we weren't lookin'. First off there's a new pull-down menu at the top of the page which easily allows you access to the top stories across all the Google News properties. If you look at that ...,Sci/Tech,4,1.405982
1703,AFP - US computer networking giant Cisco's Indian subsidiary announced the launch of a leasing arm to grab a slice of the growing domestic IT market.,Sci/Tech,4,1.4030857
1705,Fourth quarter hiring in the Buffalo Niagara Falls market is expected to be on the rise according to the latest Manpower Employment Outlook Survey.,Business,3,1.4118359
1709,"Novell Inc. has completed its conversion to Linux by launching an attack on Microsoft Corp., claiming that the company has stifled software innovation and that the market will abandon Microsoft Windows at some point in the future.",Sci/Tech,4,1.5709801
1711,"In case you have not heard, Microsoft just upped the ante in the digital music war when it launched its Windows Media Player 10 and its beta online music store this month.",Sci/Tech,4,1.549894
1713,International Business Machines Corp. and LG Electronics Inc. will end an eight-year alliance that helped expand the US computer maker #39;s presence in the booming South Korean PC market.,Business,3,1.6099471
1717,"Sony Japan has released a new Clie for the Japanese market only. The Clie PEG-VZ90 is a Palm OS multimedia Clie handheld, that features a large OLED screen, slider hidden buttons, plentiful memory and WiFi.",Sci/Tech,4,1.3978554
1720, SAN FRANCISCO (Reuters) - Oracle Corp. on Tuesday reported  a higher quarterly profit as the world's second largest  software company benefited from steady demand for its flagship  database software.,Business,3,1.7223731
1724,Microsoft Corp. has made fingerprint biometric technology an integral part of its keyboard and mouse peripherals with new products that mark the company #39;s first foray into biometric devices.,Sci/Tech,4,1.4644834
1725,AP - Business software giant Oracle Corp. said Tuesday that first-quarter earnings rose 16 percent driven by new database license sales that rose 19 percent.,Sci/Tech,4,1.5839151
1730,"Oracle Corp. (ORCL.O: Quote, Profile, Research) on Tuesday reported a 16 percent rise in quarterly net income as the world #39;s second largest software company benefited ",Business,3,1.538372
1746,"Reuters - Delta Air Lines Inc.'s pilots union on\Tuesday directed its negotiators to work out an agreement to\address the early retirement of a large number of pilots, which\threatens to push the No. 3 U.S. airline into a Chapter 11\bankruptcy filing.",Business,3,1.4263409
1750,"&lt;a href=""http://news.com.com/NokiajoinsSecureDigitalindustrygroup/2100-1039_3-5365922.html""&gt;Nokia joins Secure Digital industry group&lt;/a&gt; &lt;font size=-1 color=#6f6f6f&gt;&lt;nobr&gt;CNET News.com&lt;/nobr&gt;",Sci/Tech,4,1.4994463
1770,"The US information tech sector lost 403,300 jobs between March 2001 and this past April, and the market for tech workers remains bleak, according to a new report.",Business,3,1.4433177
1773,"Apple Computer Corp. is charging its British iTunes customers 17 percent more per download than its European customers, a consumer watchdog group said on Wednesday.",Sci/Tech,4,1.4861836
1790,"HP (Quote, Chart) was awarded a \$290 million, 10-year outsourcing contract with the Defense Logistics Agency #39;s (DLA) Enterprise Data Center (EDC) program, officials announced Wednesday.",Business,3,1.3953004
1792,"Oracle Corp. handed the software industry some positive earnings news after the bell on Tuesday, but investors pulled cash from the sector on concerns that information technology spending has become anemic.",Business,3,1.5502552
1795,"Microsoft, which recommended immediate updates, said the newly discovered vulnerability could allow remote code execution of code thanks to a buffer-overrun vulnerability in the processing of JPEG image formats.",Sci/Tech,4,1.4406378
1814,"BTG, a London-based firm that focuses on intellectual property and technology commercialization, filed suit against Amazon.com, Barnesandnoble.com and two other Internet companies for infringing on patents related to the tracking of users online.",Sci/Tech,4,1.5513979
1820,HONG KONG - There #39;s a new service for men seeking true love. A software company has created an artificial girlfriend that lonely men can download to a mobile phone.,Sci/Tech,4,1.496826
1831,"Shareholders approved Aether Systems Inc.'s sale of one of its two remaining operating divisions Wednesday, a deal that will take the Owings Mills company out of the wireless business and nearly complete its transformation into a mortgage investment fund.&lt;BR&gt;\&lt;FONT face=""verdana,MS Sans Serif,arial,helvetica"" size=""-2""\ color=""#666666""&gt;&lt;B&gt;-The Washington Post&lt;/B&gt;&lt;/FONT&gt;",Sci/Tech,4,1.6660135
1833,New PCs will ship with a chip designed to thwart hackers--a hardware approach that's said to be safer than software.,Sci/Tech,4,1.5415559
1851,"Reuters - Netopia Inc.  a maker of\networking gear, on Thursday said its auditor KPMG LLP\resigned, and said it will restate two years of results and\revise the results in its most recent fiscal quarter.",Sci/Tech,4,1.5161412
1854,Iomega Corp. is soon expected to ship its first network-attached storage (NAS) device based on wireless networking technology.,Sci/Tech,4,1.4924972
1855,Close watchers of the online music business no doubt noted yesterday #39;s announcement of Yahoo! #39;s (Nasdaq: YHOO) purchase of Musicmatch with interest.,Sci/Tech,4,1.471845
1862,"Hurricane Ivan, which slammed into the US Gulf coast today, may cost insurers \$4 billion to \$10 billion, rivaling hurricanes Charley and Frances, Risk Management Solutions Inc.",Business,3,1.3963525
1868,"(CP) - SONY has introduced it #39;s Clie PEG-VZ90, an entertainment multimedia handheld using Palm OS 5.2.1. The unit boasts the world #39;s largest 480x320 pixels organic electroluminescent (EL) display, which many regard as a next-generation technology capable ",Sci/Tech,4,1.4903984
1890,"com September 16, 2004, 1:15 PM PT. This fourth priority #39;s main focus has been improving or obtaining CRM and ERP software for the past year and a half.",Sci/Tech,4,1.4823897
1893,"Reuters - Texas Instruments Inc., the\largest maker of chips for cellular phones, on Thursday said it\plans to buy back  #36;1 billion in stock and boost its quarterly\dividend by more than 17 percent, becoming the latest\technology company to return extra cash to investors.",Sci/Tech,4,1.6118704
1895,AP - Eastman Kodak Co. and International Business Machines Corp. Thursday said they have agreed to develop and make image sensors for digital still cameras and camera phones.,Sci/Tech,4,1.4940735
1897,"Aircraft maker Airbus insisted on Thursday it had no intention of taking sides in a Microsoft antitrust case, even though it filed a brief in an EU court on the software giant #39;s side.",Business,3,1.5118711
1898,"Add America Online Inc. to the growing list of companies and organizations shunning a spam-fighting proposal from Microsoft Corp. AOL cited  quot;tepid support quot; for Microsoft #39;s so-called Sender ID technology, which ",Sci/Tech,4,1.5707299
1900,"Shares of Texas Instruments Inc. (TXN.N: Quote, Profile, Research) rose after the market close on Thursday, after the chip maker said it plans to buy back \$1 billion in stock ",Business,3,1.5544938
1905,"Sun Microsystems (Quote, Chart) may have saved itself from years of costly litigation when it settled with Microsoft over their long-running Java dispute, but a clause in the landmark deal has open source supporters parsing its potential impact.",Sci/Tech,4,1.4275306
1916,"BEIJING, Sept. 17 (Xinhaunet) -- European plane maker Airbus has reported progress in plans to allow passengers to use mobile phones while in flight with a target date of 2006.",Sci/Tech,4,1.4257483
1921,Goldman Sachs Group Inc. may be in talks with the founding family of top Japanese consumer finance firm Takefuji Corp. for a stake of over \$2.,Business,3,1.4382535
1923,"The FTC gave limited endorsement to the notion of cash rewards for people who help track down e-mail spammers, but suggested that the measure might work in fewer circumstances than had been pushed by some anti-spam activists. &lt;br&gt;&lt;FONT face=""verdana,MS Sans Serif,arial,helvetica"" size=""-2"" color=""#666666""&gt;&lt;B&gt;-The Washington Post&lt;/B&gt;&lt;/FONT&gt;",Sci/Tech,4,1.4414632
1949,Qualcomm Inc. on Friday raised its quarterly profit forecast due to strong demand for its mobile phone technology. The San Diego company said it expects earnings per ,Business,3,1.5378586
1954,The Web console -- to be made available specifically to corporate and enterprise licensees of Norton AntiVirus software -- will allow administrators to distribute virus definitions and product updates on demand.,Sci/Tech,4,1.4992719
1958," NEW YORK (Reuters) - U.S. blue chips advanced on Friday  after Ford Motor Co. &lt;A HREF=""http://www.investor.reuters.com/FullQuote.aspx?ticker=F.N target=/stocks/quickinfo/fullquote""&gt;F.N&lt;/A&gt; raised its earnings forecasts, while  wireless technology provider Qualcomm Inc. &lt;A HREF=""http://www.investor.reuters.com/FullQuote.aspx?ticker=QCOM.O target=/stocks/quickinfo/fullquote""&gt;QCOM.O&lt;/A&gt; limited  gains on the Nasdaq after saying an accounting review may  reduce pretax income.",Business,3,1.4511226
1967,NewsFactor - Questions regarding potential patent issues and skepticism from the \open source community relating to Microsoft's (Nasdaq: MSFT) SenderID have prompted global Internet service provider AOL (NYSE: AOL) to drop the anti-spam technology.,Sci/Tech,4,1.5768098
1968,"ATI Technologies announced a technology that reduces the need for dedicated graphics memory, which could lead to lower PC system costs.",Sci/Tech,4,1.5035559
1973,"The flat-panel Atigo T/HB, designed for use in bright outdoor lighting, works as a wearable computer or as a wireless display.",Sci/Tech,4,1.3833442
1978,"Graphics chipmaker ATI (Quote, Chart) unveiled a new technology it said lets its visual chips share system memory for graphics processing.",Sci/Tech,4,1.542436
1983,"Company says it paid for the code that was contributed, against contract, to free Mambo publishing software.",Sci/Tech,4,1.3885458
1984," #147;The single most effective way to avoid viruses and spyware is to simply chuck Windows altogether and buy an Apple Macintosh, #148; writes Walt Mossberg in the Wall Street Journal.  #147;There has never been a successful virus written for Mac OS X, and there is almost no spyware that targets the Mac. Plus, the Mac is invulnerable to viruses and spyware written for Windows. Not only is it more secure, but the Mac operating system is more capable, more modern and more attractive than Windows XP, and just as stable. #148; Sep 17",Sci/Tech,4,1.3892405
1986,"Record labels and Microsoft are in discussions about ways that the next generation of the Windows operating system, code-named Longhorn, can support copy-protected CD technology.",Sci/Tech,4,1.4516698
1988,The US Federal Trade Commission has given its endorsement to a plan that would reward insiders for information leading to the arrest and conviction of people or companies that produce spam.,Sci/Tech,4,1.4164289
1990,"If you can #39;t beat Google, make it better--that seems to be the lesson of A9.com, Amazon #39;s intriguing new search site. For Web searches, A9 simply gives you Google #39;s results, but it does a lot more--for instance ",Sci/Tech,4,1.3841254
1996,"A new generation of smaller, sleeker and cheaper MP3 players from the likes of Sony, Rio, Creative and Rave MP are hitting the market this fall, and they all have Apple Computer #39;s white-hot digital music player in their sights.",Sci/Tech,4,1.3825606
2006,"Apple's latest Form 10-K filing with the Securities and Exchange Commission offers a look at how the company did this past year, how it thinks it's doing and what's to come.",Sci/Tech,4,1.478523
2007,"Industry observers say Linux's similarity to Unix, its lower cost and ability to run on Intel hardware make the Unix market ripe for open-source conquest.",Sci/Tech,4,1.4276587
2025,"How spyware, a program that creeps onto a computers hard drive unannounced, is wrecking the Internet.",Sci/Tech,4,1.3968588
2035,"The triumph last week of the Bic pen over expensive, state-of-the-art steel locks has panicked the bicycling community, and churned Internet rumor mills about how much the lock manufacturer knew and when the company knew it.",Business,3,1.4586662
2061,"Cisco Systems and Microsoft are headed for a collision over network security, with customers caught in the middle. The two companies have each proposed competing  quot;end to end quot; security architectures, marking ",Sci/Tech,4,1.4312129
2082,Microsoft Corp. will allow governments around the world that use its software to have controlled access to the source code for its pervasive Microsoft Office 2003 desktop offerings for the first time.,Sci/Tech,4,1.5405213
2085,"PROSECUTORS HAVE named those charged in one of the biggest pirate software seizures in US history. The two-year investigation, dubbed Operation Digital Marauder, resulted in  quot;one of the largest seizures of ",Sci/Tech,4,1.3844949
2093,"Apple #39;s splashy digital music player has emboldened Microsoft and other technology titans to move quickly to the next frontier in portable entertainment: the video iPod, so to speak.",Sci/Tech,4,1.5171653
2095," WASHINGTON (Reuters) - A pornography bill-processing  company has agreed to forego \$17 million that it billed  computer users in order to settle deceptive-business charges,  the U.S. Federal Trade Commission said on Monday.",Sci/Tech,4,1.4937063
2102,AFP - Indian information technology firm Aztec announced it would acquire software testing company Disha Technologies for 12.1 million dollars.,Sci/Tech,4,1.4094038
2103,"Verity this week will unwrap a software add-on to its search system, designed to make unstructured content more usable in corporate applications. The announcement follows activity from ClearForest, which last month introduced Version 6.0 of its Text Analytics platform for systematically structuring unstructured data so it can be processed with enterprise data in business intelligence systems.",Sci/Tech,4,1.3954501
2104,"Sun Microsystems will hold its quarterly product launch this week, unleashing a raft of new hardware offerings spanning servers to storage.",Sci/Tech,4,1.5647587
2107,"Yahoo Launching Music Download Service This Year\\After its \$160 million aquisition of MusicMatch, Yahoo is expected to be releasing its own music download service at the end of the year. According to ZDNet, Yahoo has been in the development phase of its music download service since last year, working with ...",Sci/Tech,4,1.4170997
2112,"WebEx Communications is expanding its Web conferencing service with an offering designed for sales professionals, the company plans to announce this week.",Sci/Tech,4,1.4328521
2113,"Cisco, IBM, Microsoft and SAP have the most loyal customers in IT, according to a report released today. The fact that they are some of the biggest, most successful IT vendors in ",Sci/Tech,4,1.4523832
2116," NEW YORK (Reuters) - New York Times Co. on Monday forecast  third-quarter and full-year earnings below Wall Street's  average targets on weak revenue so far in September, sending  its shares to two-year lows.",Business,3,1.3948096
2120,"Its official. Microcell Telecommunications Fido wireless service will be the new dog in Rogers Wireless Communications Canadian kennel, and that puppy wasnt cheap.",Business,3,1.4937576
2124,"Looking for new ways to boost its revenue, America Online is launching an online shopping service that won #39;t require an AOL account to access.",Business,3,1.6172574
2127,"BOSTON (CBS.MW) - Pharmaceutical powerhouse Pfizer is buying a 5 percent stake in biotechnology researcher Medarex under their newly signed collaboration deal, according to Medarex Chief Executive Donald Drakeman.",Business,3,1.4005979
2133,"AP - After years of battling Microsoft Corp., Sun Microsystems Inc. has set its sights on Linux vendors, seeking to jump into a low-end but high-volume market it's been accused of ignoring.",Sci/Tech,4,1.5035402
2139,The chipmaker announces a chip that combines VoIP (voice over Internet Protocol) and Wi-Fi into a single chip.,Sci/Tech,4,1.4384145
2143,"JBoss, the self-proclaimed Professional Open Source company, released JBoss Application Server 4.0 today. The announcement follows closely behind the announcements of JBossCache 1.1 and the company #39;s new partnership with Sleepycat Software.",Sci/Tech,4,1.4232135
2145,"com September 20, 2004, 6:13 PM PT. This fourth priority #39;s main focus has been improving or obtaining CRM and ERP software for the past year and a half.",Sci/Tech,4,1.4823897
2151,"The European Space Agency says data collected by its probe, Mars Express, has provided new evidence in the search for life on Mars.",Sci/Tech,4,1.5245594
2165,"Apple Computer #39;s rack-mounted storage system received a vote of confidence Monday, with database giant Oracle endorsing the Xserve RAID as part of an initiative to cut storage costs.",Sci/Tech,4,1.4294987
2169,"SAN FRANCISCO -- Hoping to emerge from the shadow of its more popular rivals, Ask Jeeves Inc. is adding new tools for visitors to save and organize links to Web pages they find through the company's online search engine.",Business,3,1.5184155
2170,AP - Sony Corp. on Tuesday showed a smaller book-size PlayStation 2 going on sale worldwide next month that will help the Japanese electronics and entertainment giant cut costs as video-game consoles continue to drop in price.,Sci/Tech,4,1.5242323
2176,"Ask Jeeves Inc. has made three significant enhancements to its search engine, as the Emeryville, California company continues to take aim at its much larger competitors ",Sci/Tech,4,1.4974394
2177,"Internet advertising revenues jumped 40 percent in the first half of this year, driven largely by the growing popularity of keyword ads tied to search results.",Sci/Tech,4,1.4410889
2178,"By Ed Edelson, HealthDay Reporter    HealthDayNews -- Children who are abused or neglected grow up to be adults with a significantly greater risk of heart disease, a new study says.    It's the first study to show a direct link between a wide range of childhood problems and ischemic heart disease -- blockage of the arteries that leads to heart attacks and other major problems, said Maxia Dong, a medical epidemiologist at the U.S...",Sci/Tech,4,1.4035273
2179,"Paychecks stay the same for the top two, but compensation changes for other Microsoft workers as stock grants replace options.",Sci/Tech,4,1.3857613
2180,"Bill Gates and Steve Ballmer each received total compensation of \$901,667 in Microsoft Corp.'s 2004 fiscal year, up 4.4 percent from \$863,447 one year ago.",Sci/Tech,4,1.489355
2181,"PC World - Despite Intel's support of the emerging wireless technology, some doubt its potential.",Sci/Tech,4,1.3831278
2186,"Online holiday shoppers this year are making cash registers jingle and meeting analysts #39; expectations as they spent \$8.8 billion in November, researchers said Monday.",Business,3,1.423971
2199,"Repairs to the oxygen generator onboard the International Space Station seemed to work, but then failed the following day. Astronauts are again limited to backup oxygen supplies. By Amit Asaravala.",Sci/Tech,4,1.451447
2202,"From the 1950 #39;s until the present, one of the dominant companies in the world #39;s computer industry. Offers a variety of data processing hardware systems, system and application software, and information technology services.",Sci/Tech,4,1.6763964
2204," SAN FRANCISCO (Reuters) - Contract electronics manufacturer  Jabil Circuit Inc. &lt;A HREF=""http://www.investor.reuters.com/FullQuote.aspx?ticker=JBL.N target=/stocks/quickinfo/fullquote""&gt;JBL.N&lt;/A&gt; on Tuesday posted a higher quarterly  profit on stronger demand for computers, cellphones and other  electronic products.",Business,3,1.5069959
2207,"SEPTEMBER 21, 2004 (IDG NEWS SERVICE) - With 15,000 attendees at PeopleSoft Inc. #39;s Connect 2004 user show waiting to hear how the company would handle Oracle Corp.",Business,3,1.5443395
2211,"Put RSS Feeds On Your Web Page\\If you're interested in putting RSS feeds on your Web page but you don't have a lot of server/programming expertise, you might want to try the RSS Digest tool at http://www.bigbold.com/rssdigest/ . This tools has some nice extras on it, though at the moment ...",Sci/Tech,4,1.3911443
2222,"WASHINGTON - Representatives of wireless telephone carriers planning a telephone directory service told a U.S. Senate committee Tuesday that legislation to protect their customers' privacy isn't needed, because their plan already does.",Sci/Tech,4,1.451762
2223,Apple will be getting some stiff competition in the coming year. A slew of manufacturers will soon offer players utilizing small 1 quot; hard drives that help propel the iPod and allow them to compete more favorably in the market.,Sci/Tech,4,1.464605
2225,Cisco Systems unveiled two SAN products that it says will help companies evade or recover quickly from disasters affecting corporate data.,Sci/Tech,4,1.4605765
2227,"NEW YORK - US internet ad revenue jumped to a record US\$2.37 billion (\$3.5 billion) in the second quarter, surpassing the highest levels of the dotcom era.",Business,3,1.4777651
2245,"Sony on Tuesday showed a smaller, book-sized PlayStation 2 that will go on sale worldwide next month and help the Japanese electronics giant cut costs as video-game consoles continue to drop in price.",Sci/Tech,4,1.5062551
2252,"SiliconValley.com - There's been a lot of innovation in online publishing lately, but regular Internet users might be scratching their heads at some of the lingo. Social software, blogs and RSS technology? What does it all mean?",Sci/Tech,4,1.5085875
2253,Vodafone has unveiled plans for 10 new third-generation handsets for Christmas to help shore up its struggling Japanese unit. Vodafone VOD.,Business,3,1.4056535
2256,"PeopleSoft Inc. is deepening its ties with IBM Corp., announcing on Tuesday a sales and development partnership it called the most significant enterprise applications alliance in the companies' history.",Sci/Tech,4,1.5566449
2258,"As the threat of a hostile takeover by Oracle rumbles on, PeopleSoft has announced a \$1bn partnership with IBM. Speaking at PeopleSoft #39;s user conference in San Francisco yesterday, the company #39;s chief executive ",Business,3,1.5594401
2260,"WASHINGTON -- Verizon Wireless, the nation #39;s largest wireless carrier, clashed with other cellular carriers on Tuesday, telling a US Senate committee that a proposal for a national wireless telephone directory is a  quot;terrible idea quot; and that the proposal ",Business,3,1.5097694
2263,"Stocks fell on Wednesday after investment bank Morgan Stanley (MWD.N: Quote, Profile, Research) said quarterly profit fell, casting doubt on corporate profit growth, while a brokerage downgrade on Cisco Systems Inc.",Business,3,1.4872322
2269,Cape Clear Software and Neon Systems Inc. on Wednesday announced they are working together to integrate their respective technologies and allow users to quickly integrate mainframe applications and data through the use of Web services.,Sci/Tech,4,1.5227245
2270,"In an effort to stop scams that cause unwitting Internet users to be charged premium rates for calls placed by software surreptitiously installed on their PCs, Ireland is going to block outgoing calls to 13 countries.",Sci/Tech,4,1.4323409
2272,"NetManage (Quote, Chart) agreed to acquire privately held Librados for an undisclosed sum. The deal would give NetManage application adapters to help its Host Services Platform server applications via service ",Sci/Tech,4,1.5133876
2282,"NewsFactor - With its Internet-based phone service well established, AT T (NYSE: T) now is \focusing on establishing common ground among the broad array of technology\providers that help the operator deliver VoIP to businesses and\consumers.",Sci/Tech,4,1.3986783
2286,"Sales of portable digital-audio players are booming, and IDC predicts the market will generate \$58 billion by 2008. The research firm says Apple #39;s iPod will continue to be a major participant ",Sci/Tech,4,1.4346097
2287,"com September 22, 2004, 12:36 PM PT. This fourth priority #39;s main focus has been improving or obtaining CRM and ERP software for the past year and a half.",Sci/Tech,4,1.4823897
2292,"Flood of data interrupts Authorize.net's credit card processing for Internet merchants, leaving the company scrambling.",Sci/Tech,4,1.3986217
2294,"AP - For six years, iMacs have set the standard for the PC industry with eye-popping designs, clever utilization of space and leaps forward in usability. Lately, though, Apple Computer Inc. seems to be making more waves with iPod music players than its venerable consumer PCs.",Sci/Tech,4,1.5342855
