,Original_Text,Class_String,Class_Number,Neuron_20
3486,"I applaud Burt Rutan and the SpaceShipOne team for their miraculous achievement of winning the Ansari X Prize. As an astronaut, I understand well the challenges they faced in reaching suborbital space.",Sci/Tech,4,1.3407108
3512,"The Department of Homeland Security has named an acting US cybersecurity chief as Congress weighed whether to give the position greater clout to fight hackers, viruses and other online threats.",Sci/Tech,4,1.2528943
3535,"Microsoft has suspended the beta testing of the next version of its MSN Messenger client because of a potential security problem, a company spokesperson says.",Sci/Tech,4,1.2417245
3588,"Putting some truth to the rampant rumours that Google was getting into the instant messaging business, the company has announced the beta test release of Google SMS, the mobile phone equivalent of IM.",Sci/Tech,4,1.3086705
3602,"Computer users could stop most viruses and cyber attacks by fixing a small number of common flaws, according to new research. Viruses, spam and distributed denial of service attacks could ",Sci/Tech,4,1.2982697
3610,"About 4.4 million AC adapters sold worldwide with Dell notebooks between September 1998 and February 2002 were recalled on Friday because of a risk of overheating, which could lead to a fire or electrical shock, according to Dell.",Sci/Tech,4,1.2638156
3617,"PARIS The open-source computer system known as Linux won a tough battle over Microsoft earlier this year when the city of Munich decided to change the operating software of 14,000 government computers, despite the personal intervention of Steve Ballmer ",Business,3,1.2571764
3623,Ziff Davis - Silicon Graphics Inc. will ship a new ultra high performance Intel Itanium-based Linux workstation designed for scientific and medical applications.,Sci/Tech,4,1.3459406
3655,"Court documents show federal prosecutors have told lawyers for former WorldCom Inc. chief executive Bernard J. Ebbers that they plan to argue he lied about the telecommunications giant's financial condition in order to get personal loans. &lt;FONT face=""verdana,MS Sans Serif,arial,helvetica"" size=""-2""\ color=""#666666""&gt;&lt;B&gt;-The Washington Post&lt;/B&gt;&lt;/FONT&gt;",Sci/Tech,4,1.2618576
3667,Large VGA screen; great graphics; included gaming bundle; Windows Media Player 10.0 Mobile; fast processor and ample memory; integrated Wi-Fi and Bluetooth; sleek design; user-replaceable battery.,Sci/Tech,4,1.3233731
3671,"Microsoft Corp. MSFT.O on Tuesday unveiled a new version of its Windows XP Media Center, adding features such as instant messaging and high-definition television to a personal computer designed for the living room.",Business,3,1.2371197
3676,"The 130 extrasolar planets discovered so far are in solar systems very different from our own, in which life-bearing planets like Earth are unlikely to exist. But an obscure characteristic of these planets and their stars has led astronomers to predict that our galaxy is brimming with solar systems like ours. The key to their prediction is something called metallicity.",Sci/Tech,4,1.2455935
3681,Microsoft has warned of seven newly found flaws in its software that could allow an attacker to steal data and take over a personal computer running the Windows operating system.,Sci/Tech,4,1.3151428
3690,"Software maker heads to LA to show off a host of gadgets that use one or another Microsoft technology to access movies, music and video.",Sci/Tech,4,1.2477232
3706,The Federal Trade Commission formally announced yesterday its first assault against spyware - bits of computer code that surreptitiously install themselves on the computers of Internet users ,Sci/Tech,4,1.3684068
3726,A company called MXS announced a new software emulator called Cherry OS that makes it possible to install Mac OS X onto x86 hardware (running Windows).,Sci/Tech,4,1.3658907
3731,"Hackers are trying to trick computer users into downloading damaging software by claiming to have sleazy photographs of football star David Beckham, experts warned today.",Sci/Tech,4,1.3141092
3739,"Expedition 10, the next crew to live on the International Space Station (ISS), is set to launch from Kazakhstan. US astronaut Leroy Chiao and Russian cosmonaut Salizhan Sharipov will leave the Baikonur Cosmodrome on a Soyuz rocket at 0306GMT on Thursday.",Sci/Tech,4,1.2594774
3757,"The iPod helped Apple's profit get up and dance. Apple Computer Inc. reported Wednesday that net income for its fourth fiscal quarter jumped 140 percent from the same period a year ago. &lt;BR&gt;&lt;FONT face=""verdana,MS Sans Serif,arial,helvetica"" size=""-2""\ color=""#666666""&gt;&lt;B&gt;-The Washington Post&lt;/B&gt;&lt;/FONT&gt;",Sci/Tech,4,1.3449254
3788,"USATODAY.com - Dell will set out Thursday to conquer markets dominated by Apple, Hewlett-Packard and others with products that include its first small digital music player, photo printer and plasma TV.",Sci/Tech,4,1.3258976
3793,"In search of the ultimate lie detector, researchers turn to thermal facial scans, brain wiring and eyeball tracking. But deception still, well, deceives. By Randy Dotinga.",Sci/Tech,4,1.285176
3802,"Users of the increasingly popular, open-source MySQL database may be at risk from remote attacks due to a bug in phpMyAdmin, a widely used Web-based MySQL administration tool.",Sci/Tech,4,1.2915603
3811,"It enables people to retrieve E-mail from Outlook and Outlook Express, documents from Microsoft Office, chat sessions from AOL IM, and Web pages viewed with Internet Explorer.",Sci/Tech,4,1.256245
3824,"October 14, 2004 - Microsoft is set to release its Windows Media Center Extender for Xbox mid-November. The device will allow you to view recorded and downloaded media content stored on your PC via your Xbox.",Sci/Tech,4,1.3101352
3827,"Amphibians such as leopard frogs and salamanders are threatened with extinction as their homes dry up and a new disease spreads, possibly as a result of global warming, according to a new study in Science magazine.",Sci/Tech,4,1.2954141
3853,"UC Berkeley -- On Jan. 14, 2005, the Huygens probe will plow into the orange atmosphere of Saturn's moon, Titan, becoming the first spacecraft to attempt to land on a moon in our solar system since the Soviet Union's Luna 24 touched down on Earth's moon in 1976...",Sci/Tech,4,1.3599203
3872,"OCTOBER 15, 2004 (IDG NEWS SERVICE) - Dell Inc. took the wraps off its holiday lineup on Thursday, showing new printers, plasma televisions and music players that will soon be available through its Web site.",Sci/Tech,4,1.3247825
3879,"(Article Central) Microsoft released its October batch of security advisories this week, with a number of  quot;critical quot; patches, including a significant fix for the Internet Explorer browser.",Sci/Tech,4,1.4414868
3891,IBM on Friday introduced high-end servers in its pSeries and iSeries lines that include virtualization features and raw power that some experts say put the products on par with offerings from rival Hewlett-Packard Co.,Sci/Tech,4,1.2753605
3922,"A RUSSIAN spacecraft has delivered three astronauts to the International Space Station, overcoming docking system problems which had delayed its launch.",Sci/Tech,4,1.2777824
3970,"SAN FRANCISCO -- At virtually every turn, Intel Corp. executives are heaping praise on an emerging long-range wireless technology known as WiMAX, which can blanket entire cities with high-speed Internet access.",Business,3,1.3216746
3989,Microsoft confirms that a pirated copy of Halo 2 for Xbox in the PAL video format and French language started circulating on the Internet this week over newsgroups and piracy sites.,Sci/Tech,4,1.3863065
3991,"Tough times often make for strange bedfellows, and the explosion of viruses, computer worms and spyware programs on the Internet is producing unique alliances among top technology firms. &lt;FONT face=""verdana,MS Sans Serif,arial,helvetica"" size=""-2"" color=""#666666""&gt;&lt;B&gt;-washingtonpost.com&lt;/B&gt;&lt;/FONT&gt;",Sci/Tech,4,1.5279325
4000,"Google has announced a new desktop search application that enables users to search their e-mail, files, web history, and chats. Perhaps learning from previous mistakes, Google says it has designed the product  quot;from the ground up to respect user privacy.",Business,3,1.2770656
4009,"The links between Apple and U2 grow stronger, with Apple #39;s announcement that it will hold a special music event next week on October 26.",Sci/Tech,4,1.2407038
4016,PC World has posted a news article claiming that the highly anticipated game Halo 2 for the Xbox has been released on the net.  quot;Microsoft confirms that a pirated copy of Halo 2 for Xbox in the PAL video format ,Sci/Tech,4,1.4140201
4070,"Linux distributor Red Hat Inc has appointed a vice president of desktop infrastructure technologies, a new position demonstrating its renewed commitment to Linux as a desktop operating system.",Sci/Tech,4,1.3187686
4073,"Trust Digital Inc., a McLean software company, is getting a new chief executive and \$3.1 million in new investments as it tries to expand its business making security software for wireless devices. &lt;FONT face=""verdana,MS Sans Serif,arial,helvetica"" size=""-2""\ color=""#666666""&gt;&lt;B&gt;-The Washington Post&lt;/B&gt;&lt;/FONT&gt;",Sci/Tech,4,1.4002607
4075,&lt;strong&gt;Review&lt;/strong&gt; From PC to hi-fi via Wi-Fi,Sci/Tech,4,1.275272
4084,"Advanced Micro Devices Inc. (AMD) is expected to unveil its most powerful desktop processors to date on Tuesday, a few days after rival Intel Corp. disclosed changes to its desktop processor road map.",Sci/Tech,4,1.3034917
4085,New Athlon 64 processors will compete with Intel's Pentium 4 Extreme Edition.,Sci/Tech,4,1.2825161
4105,"OCTOBER 19, 2004 (IDG NEWS SERVICE) - Customers that use the dual-core processors Intel Corp. and Advanced Micro Devices Inc. expect to ship next year won #39;t need to buy extra licenses for Microsoft Corp.",Sci/Tech,4,1.248478
4115,"roundup Plus: Good Technology supported by HP, Samsung...RIM touts BlackBerry with Wi-Fi...HP to sell Voltaire's InfiniBand switch.",Sci/Tech,4,1.3431166
4122," TOKYO (Reuters) - Japan's Toshiba Corp. &lt;A HREF=""http://www.reuters.co.uk/financeQuoteLookup.jhtml?ticker=6502.T qtype=sym infotype=info qcat=news""&gt;6502.T&lt;/A&gt; will  introduce laptop computers with HD DVD technology in December  2005, aiming to pressure rivals in the battle over formats for  next-generation DVDs, the Nihon Keizai daily said on Wednesday.",Sci/Tech,4,1.2949467
4152,"AMD is expected to unveil its most powerful desktop processors to date this week, a few days after rival Intel disclosed changes to its desktop processor road map.",Sci/Tech,4,1.3073504
4184,"Tabbed browsing, one of the more popular features built into alternative Web browsers, contains a security flaw that puts users at risk of spoofing attacks, research firm Secunia warned on Wednesday.",Sci/Tech,4,1.2866019
4195,"Customers who use the dual-core processors that Intel and Advanced Micro Devices are expected to begin shipping next year will not need to buy extra licenses for Microsoft software, the software maker will announce next week.",Sci/Tech,4,1.2645266
4244,"Texas Instruments Inc. today announced development of the wireless industry #39;s first digital TV on a single chip for cell phones, code-named  quot;Hollywood.",Sci/Tech,4,1.2439374
4248,"roundup Plus: SGI works on Linux performance software...Good Technology supported by HP, Samsung...RealNetworks loss widens on litigation.",Sci/Tech,4,1.3234768
4259,NewsFactor - Microsoft (Nasdaq: MSFT) has hooked up with Swatch to deliver the latest in a line of smart wristwatches using the software giant's MSN Direct wireless content-delivery technology.,Sci/Tech,4,1.3863966
4266," SAN FRANCISCO (Reuters) - Intel Corp. &lt;A HREF=""http://www.reuters.co.uk/financeQuoteLookup.jhtml?ticker=INTC.O qtype=sym infotype=info qcat=news""&gt;INTC.O&lt;/A&gt; on Thursday  said it has scrapped plan to enter the digital television chip  business, marking a major retreat from its push into consumer  electronics.",Sci/Tech,4,1.2403691
4306,"Microsoft and Swatch announced a new line of wireless data watches named Paparazzi. The watches offer news, sports, weather and stock quotes, among other snippets of content, via Microsoft #39;s MSN Direct wireless data service.",Sci/Tech,4,1.3233343
4316,"There is a strong trend for consumers to move away from using fixed-line phones in concert with mobiles to use mobile handsets for all or most of their voice calls, according to a study conducted for Finnish mobile handset maker Nokia by UK market ",Sci/Tech,4,1.2704053
4318,It bought Stata Labs and apparently plans to incorporate Stata technology in an e-mail client that could compete with Google #39;s Gmail.,Sci/Tech,4,1.3027908
4346,"The \$41 billion merger between Cingular Wireless LLC and AT T Wireless Services Inc. won approval from the Federal Communications Commission Friday, according to federal sources close to the agency. &lt;BR&gt;\&lt;FONT face=""verdana,MS Sans Serif,arial,helvetica"" size=""-2""\ color=""#666666""&gt;&lt;B&gt;-The Washington Post&lt;/B&gt;&lt;/FONT&gt;",Sci/Tech,4,1.3335485
4467,American astronaut Mike Fincke and Russian commander Gennady Padalka descended to Earth in remote Kazakstan late Saturday aboard a Soyuz space capsule.,Sci/Tech,4,1.3310062
4480,Stata Labs previously sold two products Bloomba and SAproxy Pro which have now been withdrawn from sale. Saproxy was an anti-spam product whilst Bloomba was an email management system which allows users to ,Sci/Tech,4,1.3222823
4483,Mobility will take center stage this week as San Francisco plays host to the Cellular Telecommunications   Internet Association's (CTIA) Wireless I.T.   Entertainment 2004 fall conference.,Sci/Tech,4,1.2415577
4489,"SAN FRANCISCO - After removing the 2006 ""Kodiak"" release of Exchange Server from its product road map earlier this year, Microsoft Corp.'s plans for the messaging software have gotten even cloudier.",Sci/Tech,4,1.2728983
4491,"The PalmOne Treo 650 Smartphone with high-resolution screen, Bluetooth, swappable battery and extended multimedia capabilities was officially announced today.",Sci/Tech,4,1.2695298
4493,"washingtonpost.com - Think your PC is safe? Think again. A new study indicates your home computer is likely bogged down with spyware, viruses and other scourges wrought by hackers and PC pranksters. Ignorance may be bliss for some people, but for computer users, not knowing can be costly and inefficient.",Sci/Tech,4,1.2387401
4494,"Sony Europe has launched two tiny 512MB and 1GB MP3 players, the NW-E95 and NW-E99 Network Walkman. Both play MP3 (Sony has officially bit the mp3 bullet) and ATRAC3plus compressed files and have a small blue backlit LCD screen.",Sci/Tech,4,1.3186848
4502,One of the first pieces of malicious code targeting Apple's Mac OS X operating system has been discovered.\,Sci/Tech,4,1.3251296
4508,"The Federal Trade Commission won an important victory last week in its fight to protect consumers from spyware, the software that tracks unsuspecting Web surfers, bombards them with advertisements and sometimes even steal login information and passwords.",Business,3,1.3633101
4515,"Adobe Systems Inc. ADBE.O and Yahoo Inc. YHOO.O on Monday said they have signed a deal to combine Adobe services, like its widely used document-sharing program, with Yahoo #39;s Web search functions.",Sci/Tech,4,1.388129
4546,"Since it arrived at Saturn in mid-2004, Cassini has already sent us back fascinating images of Titan, Saturn #39;s largest satellite.",Sci/Tech,4,1.2595714
4547,"Adobe Systems and Internet provider Yahoo! have announced a tie-up aimed at providing consumer services to Internet users. The two companies will introduce integrated products that feature Adobe services, increase the reach of Yahoo!",Sci/Tech,4,1.2748477
4557,"A little over a year after introducing the first version of Office Live Communications Server, Microsoft Corp. in December plans to release the next version of its enterprise instant messaging software, it said Monday.",Sci/Tech,4,1.251429
4571,"A little over a year after introducing the first version of Office Live Communications Server, Microsoft says it plans to release the next version of its enterprise instant messaging software, in December.",Business,3,1.3129404
4594,"NASA #39;s Cassini spacecraft streaked by Saturn #39;s smoggy moon Titan today, targeted to pass within just 750 miles of the planet-sized satellite to give scientists their first ",Sci/Tech,4,1.3163987
4597,AP - The U.S.-European spacecraft Cassini hurtled Tuesday toward its closest encounter yet with Saturn's giant moon Titan.,Sci/Tech,4,1.3144468
4600,U.S. District Judge Joseph A. DiClerico Jr. ordered Sanford Wallace and his companies to remove any software scripts from their Web sites that exploit security vulnerabilities in some versions of Internet Explorer.,Sci/Tech,4,1.4008505
4604,Microsoft released on Tuesday a preview version of new tools intended to make it easier for companies to create custom Web applications.,Sci/Tech,4,1.2533047
4609,"Linux desktop vendor Xandros Inc. on Tuesday announced the availability of its new Xandros Desktop Management Server (xDMS) application, which gives IT administrators the tools to roll out, configure and maintain mass deployments of Linux-equipped PCs.",Sci/Tech,4,1.3010492
4610,AP - Apple Computer Inc. on Tuesday introduced a new larger-capacity iPod with a color display as well as a first-of-its-kind digital compendium of the rock band U2's songs.,Sci/Tech,4,1.2722021
4617,"The company has just announced the release of two flash-memory-based devices, the Walkman NW-E99 and NW-E95, in Europe. The music players can play songs in MP3 and Sony #39;s own Atrac file format.",Sci/Tech,4,1.3506453
4643,"IOWA CITY, Iowa A NASA scientist has charged that the Bush administration is subverting science and misleading the public by trying to suppress or alter evidence on the dangers of global warming.",Sci/Tech,4,1.2603275
4665,PC World - IFire aims to displace LCD TVs with its lower-cost display technology.,Sci/Tech,4,1.268742
4674,"Dell (Quote, Chart) officials announced Wednesday an agreement with Linux distributor Novell (Quote, Chart) to distribute and support SUSE Enterprise Server 9 on its single- and dual-processor line of servers.",Sci/Tech,4,1.3913307
4678,"Much ado has been made about whether or not Linux is truly more secure than Windows. The results were not unexpected. Even by Microsoft #39;s subjective and flawed standards, fully 38 of the most recent patches address flaws that Microsoft ranks as Critical.",Sci/Tech,4,1.2529832
4694,"OCTOBER 27, 2004 (TECHWORLD.COM) - Linux distributor Suse has warned of one of the most serious security holes to date in version 2.6 of the Linux kernel, which could allow attackers to shut down a system running 2.6-based software.",Sci/Tech,4,1.399219
4698,AP - Georgia Tech wants to avoid being embarrassed by another ACC rookie.,Sports,2,1.2435392
4706,"Yahoo added a search feature for cell phones Wednesday, just a few weeks after rival Google launched one of its own. While Google SMS (Short Message Service) uses text-only messages to deliver its results, Yahoo #39;s ",Sci/Tech,4,1.2661804
4721,"Companies that provide federal agencies with network integration and payroll accounting technologies are benefiting from a government trying to bolster its defenses against terrorism, experts say. &lt;br&gt;&lt;FONT face=""verdana,MS Sans Serif,arial,helvetica"" size=""-2""\ color=""#666666""&gt;&lt;B&gt;-The Washington Post&lt;/B&gt;&lt;/FONT&gt;",Sci/Tech,4,1.392734
4740,"Novell has given its recently acquired Linux distro, SuSE, a push, by signing an agreement with Dell to offer SuSE Linux Enterprise Server (SLES) 9 on select PowerEdge servers worldwide.",Sci/Tech,4,1.4279064
4749,"Google and Microsft Getting Close\\Microsoft partnering with Google? Well sort of, an article released yesterday details the relationship between the two, and the use of Google Deskbar in Microsoft's Partner Pack for Windows, ""a collection of Microsoft and third-party products released last week that Microsoft describes on its Web site ...",Sci/Tech,4,1.3053187
4767,"Yahoo will offer its own version of wireless Internet searching, keeping pace with rival Google, which recently introduced a mobile search offering.",Sci/Tech,4,1.2450833
4775,com Staff. NASA once again postponed the launch of the Demonstration of Autonomous Rendezvous Technology (DART) spacecraft Thursday due to the discovery of contamination inside the fairing of its Pegasus launch vehicle.,Sci/Tech,4,1.3010079
4779,"Advanced Micro Devices is launching a low-cost Internet access device dubbed  quot;PIC, quot; or personal Internet communicator, targeted at first-time computer users in the developing world.",Sci/Tech,4,1.2851431
4783,The nation #39;s largest e-mail providers today filed a new round of lawsuits against Internet spammers allegedly responsible for shoveling millions of junk e-mail messages into computer users #39; in-boxes and their instant messaging screens.,Business,3,1.2794764
4791,"Games, graphic ring tones and other services dominate the showroom floor. Also: Yahoo battles Google for the cell phone.",Sci/Tech,4,1.2811307
4793,EMC has unveiled long-awaited storage virtualization technology that the company said will allow users to manage its arrays -- and high-end boxes from major competitors -- through a single interface.,Sci/Tech,4,1.2721727
4796,LOS ANGELES - The recording industry on Thursday filed another round of copyright infringement lawsuits against people it said were illegally distributing songs over the Internet.,Sci/Tech,4,1.2841123
4803,"Open source software proponents received a potential boost from the UK government Thursday with a release of a report citing the well-documented advantages on the server side, but also growing maturity on the desktop front.",Sci/Tech,4,1.3060462
4860,"Reuters - The surface of Saturn's moon Titan\may be covered by thick drifts of combustible organic ""snow""\floating on lakes of liquid methane or water and ammonia ice\flows, NASA scientists said on Friday.",Sci/Tech,4,1.3603841
4872,"WASHINGTON - The first radar images of Titan, the cloud-shrouded moon of Saturn, revealed a relatively young, active surface, NASA said Friday (Oct. 29).",Sci/Tech,4,1.3025348
4883,HOUSTON -- The NASA turbojet notoriously known as the  quot;vomit comet quot; for its use in training astronauts for weightlessness made its final flight Friday.,Sci/Tech,4,1.2452897
4885,"Photographs and radar surveys from the Cassini spacecraft #39;s Tuesday-night flyby of Saturn #39;s mysterious moon Titan are raising more questions than they #39;re answering, say NASA scientists.",Sci/Tech,4,1.4119549
4898,"Now that Steve Ballmer and company have given you all the facts you need to compare Windows and Linux, allow me to add just one little tidbit.",Sci/Tech,4,1.2489321
4936,"Earlier this year Microsoft released a major security update for Windows XP, which was designed to strengthen the operating systems defences against attack from viruses and hackers.",Sci/Tech,4,1.3133689
4942,Steve Ballmer #39;s letter to customers said nothing about the widespread reality of tens of thousands of Microsoft customers who are eager to deploy BOTH Windows and Linux.,Sci/Tech,4,1.3014215
4949,"SAN JOSE, Calif. - Apple Computer Inc. rolled out a new iPod Tuesday that allows users to view and share photos as it opened nine new iTunes music stores in Europe, spurring its rivalry with Microsoft Corp.",Sci/Tech,4,1.3031325
4965,"Today #39;s new word, for all you dictionary freaks, is  quot;spim quot;. Spam  IM (Instant Messaging) = Spim. IM Spam. And for many IM companies it is the bane of their existence requiring increasingly aggressive filtering and block list capabilities.",Sci/Tech,4,1.2996228
5036,"Nokia has launched its first product that supports Near Field Communication (NFC), an emerging radio frequency identification (RFID) technology that could have significant implications for mobile commerce.",Sci/Tech,4,1.3412467
5056,"NOVEMBER 03, 2004 (IDG NEWS SERVICE) - An anonymous group of malicious hackers reopened an online store that sells the stolen source code of prominent software products and is offering the code for Cisco Systems Inc.",Sci/Tech,4,1.3329585
5065,"The British National Health Service (NHS) has signed a massive software licensing deal with Microsoft. The deal will ultimately save the NHS \$625 million in licensing fees, as well as requiring that Microsoft ",Sci/Tech,4,1.2677662
5072,"AMSTERDAM: Nokia, the world #39;s biggest mobile phone maker, said on Wednesday it will create a single software platform for smart mobile phones that double as TVs, MP3 players, radios and e-mail devices.",Sci/Tech,4,1.3706113
5088,"Microsoft and Intel recently announced a new advertising campaign entitled  quot;Digital Joy quot; aimed at increasing awareness of living digital entertainment products, particularly Microsoft #39;s Media Center software.",Sci/Tech,4,1.2455409
5091,Movie studios and the Motion Picture Association of America said on Thursday they would sue individuals suspected of illegally distributing movies over the Internet.,Sci/Tech,4,1.2836196
5093,"Nov. 4, 2004 - A rare alignment of Jupiter #39;s three largest moons across the planet #39;s face was captured on film by the Hubble Space Telescope.",Sci/Tech,4,1.3864045
5100,"NASA #39;s Hubble Space Telescope (HST) captured an alignment of three of Jupiter #39;s largest moons: Io, Ganymede, and Callisto.",Sci/Tech,4,1.2892445
5123,"AP - NASA is aiming for a mid-May launch of the first shuttle flight since the Columbia tragedy almost two years ago. The launch date was the latest of several set by the space agency, and just as subject to change.",Sci/Tech,4,1.2640694
