,Original_Text,Class_String,Class_Number,Neuron_13
3543,AP - Starting running backs Quentin Griffin of the Broncos and Stephen Davis of the Panthers both were inactive for Sunday's game.,Sports,2,1.1955845
3544,"Jiri Novak of the Czech Republic settled his game after a rocky start and beat Taylor Dent 5-7, 6-1, 6-3 Sunday to win the Japan Open for the sixth title of his career.",Sports,2,1.0655978
3550, HOUSTON (Reuters) - Adam LaRoche crushed a game-tying  three-run homer and J.D. Drew slapped a ninth-inning RBI single  to give the Braves a 6-5 comeback victory over the Houston  Astros on Sunday.,Sports,2,1.1549543
3559,"The Ravens have pulled in front of the Redskins, 14-10, when B.J. Sams returns a punt 78 yards for a touchdown.",Sports,2,1.0941135
3560,"Virginia, Navy and Maryland face season-defining games, perhaps &lt;em&gt;program-defining &lt;/em&gt;games for the Cavaliers and Midshipmen as they play against Florida State and Notre Dame, respectively on Saturday.",Sports,2,1.2442795
3563,"NEW YORK - Ken Caminiti, the 1996 National League MVP who later admitted using steroids during his major league career, died Sunday. He was 41...",World,1,1.1000966
3618,This was not the way that American Lindsay Davenport wanted to claim her second career title at the Porsche Tennis Grand Prix. In a match between the top two ,Sports,2,1.0613694
3620,"The negotiations over the future of the British grand prix are expected to shift up a gear tomorrow when the sport #39;s governing body, the FIA, publishes a draft calendar for the 2005 formula one world championship.",Sports,2,1.1884906
3639,Nykesha Sales smiled when someone suggested the Connecticut Sun could add a WNBA title to this year's NCAA championships won by the UConn men's and women's teams.,Sports,2,1.1749369
3677,"Real Madrid played without four regulars and settled for a 0-0 draw with Villarreal yesterday, leaving them nine points behind Spanish league leaders FC Barcelona after 14 games.",Sports,2,1.1471049
3719,Marc Jackson scored 12 of his 21 points in the final 31/2 minutes and the Philadelphia 76ers capped their first training camp at Duke University with a 114-107 victory over the Washington Wizards on Tuesday night.,Sports,2,1.0626134
3746,Michael Owen heads England's winner in the World Cup qualifier against Azerbaijan.,World,1,1.1073066
3748,"Cincinnati, OH (Sports Network) - Cincinnati Bengals wide receiver Peter Warrick is doubtful for Sunday #39;s game against Cleveland because of a shin injury.",Sports,2,1.1288918
3768,"The senior quarterback rushed for 110 yards, threw for a touchdown and even punted a quick kick in the Mountaineers #39; 31-19 victory over Connecticut last night.",Sports,2,1.0584635
3771, NEW YORK (Reuters) - Jim Edmonds hit a three-run double to  key a six-run sixth inning as the St Louis Cardinals beat the  Houston Astros 10-7 in the opening game of the National League  Championship Series at Busch Stadium on Wednesday.,Sports,2,1.1025157
3809,Austrian goalkeeper Alex Manninger could miss the rest of the season after dislocating his shoulder in Wednesday #39;s World Cup qualifying draw with Northern Ireland.,Sports,2,1.0708358
3848,That #39;s the state of the Boston Red Sox pitching rotation after Schilling was scratched from his scheduled Game 5 start because of a sore ankle.,Sports,2,1.0880044
3871,"Unseeded Elena Bovina upset error-prone Venus Williams, 6-3, 6-2 Friday to advance to the Kremlin Cup semifinals. Bovina, 19, will be playing in her third semifinal this season.",Sports,2,1.14233
3896,Spain #39;s Miguel Angel imenez completed a 2 amp;1 victory over German Bernhard Langer in their delayed World Match Play Championship quarter-final at Wentworth on Saturday.,Sports,2,1.0719472
3901,"Miguel Angel Jimenez ended the strong challenge of his Ryder Cup captain, Bernhard Langer, on the 35th hole Saturday to earn a semifinal place in the World Match Play Championship.",Sports,2,1.1278565
3919,Brazilian midfielder Juninho scored his first goal for Celtic in a 3-0 drubbing of Hearts that gave the champions an eight-point lead at the top of the Scottish Premier League on Saturday.,Sports,2,1.1226846
3924,Defending champion Ernie Els beat Padraig Harrington 5 and 4 yesterday to move into the final of the World Match Play Championship.,Sports,2,1.2115227
3932,"WEST LAFAYETTE, Ind. -- Scott Starks returned a fumble by Purdue quarterback Kyle Orton 40 yards for a touchdown in the closing minutes to lift 10th-ranked Wisconsin to a 20-17 win over No. 5 Purdue yesterday.",Sports,2,1.0915524
3933,"AUBURN, Ala. -- Jason Campbell passed for a career-high 297 yards and three touchdowns to lead No. 4 Auburn to a 38-20 rout of Arkansas yesterday.",Sports,2,1.0903533
3941,"MOSCOW -- Nikolay Davydenko overcame leg cramps to beat Russian Davis Cup teammate Mikhail Youzhny in a tough Kremlin Cup semifinal, 7-5, 6-7, 7-5 on Saturday.",Sports,2,1.2599585
3955,"AP - For all the fuss over reported admissions of steroid use by Barry Bonds, Jason Giambi and Gary Sheffield, major league baseball probably won't discipline them.",Sports,2,1.1787865
3961,"Motorsport.com. Markko Martin dominated the this year #39;s edition of the legendary Tour de Corse rally, the 14th round of the 2004 World Rally Championship.",Sports,2,1.1419444
3966,"HOUSTON - Even in a season of 105 wins, there had to be losses. But not like this one. The Cardinals didn #39;t merely lose 6-5 to the Houston Astros in Game 4 of the National League Championship Series.",Sports,2,1.178584
3982,"FORT WORTH, Texas Helio Castroneves had a great restart today with two laps to go after a lengthy caution. He held off IndyCar Series champion Tony Kanaan to win the season finale at Texas Motor Speedway.",Sports,2,1.1076355
3996,Celtic manager Martin O #39;Neill believes striker Juninho is benefiting from the support of the Parkhead crowd as he settles into life in the Bank of Scotland Premier League.,Sports,2,1.0642337
3997,The Brazilian Grand Prix at Sao Paulo on 24 October will be the 18th and final round of the FIA Formula One World Championship 2004.,Sports,2,1.205239
4037,MADRID: Leggy models as ballgirls won #39;t be a distraction to family man Alex Corretja after the veteran moved into the second round of the Madrid Masters yesterday.,Sports,2,1.0745599
4042,AP - Jerry Rice could be headed north to reunite with Seattle Seahawks coach Mike Holmgren.,Sports,2,1.152347
4092,"MADRID, Dec. 5. - Samuel Etoo scored twice to help FC Barcelona beat Malaga 4-0 and extend its lead in the Spanish league to 10 points.",Sports,2,1.2020559
4125,"One night after they were pounded by 19 points in a preseason game in Cleveland, the Nets looked like a much different team against the expansion Charlotte Bobcats ",Sports,2,1.1727163
4126,Antonio McDyess and Derrick Coleman understood that coming to the defending NBA champion Detroit Pistons offered the best and worst scenarios for a veteran player.,Sports,2,1.0846775
4129,"EAST RUTHERFORD, NJ - In some ways, the New Jersey Nets are searching for an identity as much as the expansion Charlotte Bobcats. It #39;s the price of being dismantled in the offseason.",Sports,2,1.0761563
4141,"Donetsk, Ukraine, Oct. 20 -- Shakhtar Donetsks Romanian teenage forward Ciprian Marica believes his sides strong team spirit will see them beat Celtic twice in the UEFA Champions League.",Sports,2,1.1474657
4167," FOXBORO, Mass., (Sports Network) - The New England Patriots  placed rookie wide receiver P.K. Sam on injured reserve  Wednesday with a groin injury.",Sports,2,1.0608636
4180,Newcastle boss Graeme Souness was in defiant mood tonight as he attempted to push yesterdays training ground bust-up with striker Craig Bellamy into the background.,Sports,2,1.1527759
4192,"Valencia may have to ditch their new-found attacking style of football in favour of an  quot;ugly quot; defensive approach if they are to beat Inter Milan in the Champions League, according to club captain David Albelda.",Sports,2,1.1379788
4202,Former Philadelphia Phillies catcher John Russell will be the seventh person to interview for the team #39;s vacant managerial position.,Sports,2,1.1006659
4207,"DONETSK, Ukraine: Brazilian midfielder Matuzalem defied the chilly temperatures to score a double for Shakhtar Donetsk on Wednesday in a 3-0 win which virtually ended Celtic #39;s Champions League ambitions this season.",Sports,2,1.1224581
4213,Brazilian Juninho has apologised for his performance in Celtic #39;s demoralising 3-0 Champions League Group F defeat in the Ukraine last night.,Sports,2,1.1289592
4215,AP - The biggest comeback in postseason baseball history began when David Ortiz had one of the greatest days in baseball history.,Sports,2,1.089246
4281,"Top seed Tim Henman suffered a 6-4,4-6, 6-2 defeat to Croatian Ivan Ljubicic in the Madrid Masters on Thursday as Andre Agassi advanced to the quarter-finals with a 6-1,6-3 victory over Vincent Spadea.",Sports,2,1.108425
4283,"Carmelo Anthony, who missed Denver #39;s previous game after being cited for marijuana possession, scored 23 points for the Nuggets in a 100-88 preseason victory Thursday night over the Los Angeles Clippers.",Sports,2,1.1274569
4329,"MADRID, Spain -- England #39;s Paul Broadhurst, winless in nine years on the European Tour, shot a 6-under-par 65 Friday and took a one-stroke lead midway through the Madrid Open.",Sports,2,1.1534724
4368,AP - Milwaukee Bucks forward Zendon Hamilton will miss six weeks after undergoing arthroscopic surgery on his right knee.,Sports,2,1.1065989
4377,Sachin Tendulkar will play in the third Test against Australia beginning Tuesday. That the master batsman has been declared fit to play in the Test was announced by physio Andrew Leipus of the Indian cricket team.,Sports,2,1.0688092
4384,"MADRID: Marat Safin defeated Andre Agassi 6-3, 7-6 yesterday to book a place in the Madrid Masters final against Argentina #39;s David Nalbandian.",Sports,2,1.0668017
4432,"MINNEAPOLIS -- With Randy Moss relegated to two snaps of decoy duty, Daunte Culpepper and the Minnesota Vikings shifted gears and grinded one out against the Tennessee Titans.",Sports,2,1.1766485
4445,"The race for the Champ Car drivers #39; title is going to Mexico City in two weeks. Bruno Junqueira won yesterday #39;s Lexmark Indy 300 ahead of teammate Sebastien Bourdais, stalling Bourdais #39; run to the 2004 championship ",Sports,2,1.135045
4450,Ryan Palmer came from five shots behind with a magnificent 62 to earn his maiden PGA Tour tournament victory at the Funai Classic on Sunday.,Sports,2,1.2492468
4457,"Jimmie Johnson, center, winner of the NASCAR Subway 500 race, is escorted to a NEXTEL Cup trailer after the race at Martinsville Speedway in Martinsville, Va.",Sports,2,1.15051
4500,David Akers kicked a 50-yard field goal in overtime to help the Eagles to a 34-to-31 victory over the Cleveland Browns. Donovan McNabb matched a career high with four touchdown passes.,Sports,2,1.175264
4513,"Baltimore, MD (Sports Network) - Baltimore Ravens All-Pro offensive tackle Jonathan Ogden could miss this week #39;s game at Philadelphia against the undefeated Eagles because of a left hamstring injury.",Sports,2,1.1637421
4615,AP - Florida athletic director Jeremy Foley denied a report Tuesday that school officials have contacted former coach Steve Spurrier about replacing Ron Zook.,Sports,2,1.1713052
4631,The Washington Wizards #39; Brendan Haywood and Larry Hughes could face suspensions for their part in a fight during Monday night #39;s preseason game against the Bulls in Chicago.,Sports,2,1.108052
4649,"Hakim Hill, the ASU football teams oft-controversial running back, will be back on the field when the Sun Devils travel to face California, head coach Dirk Koetter announced Tuesday.",Sports,2,1.0761566
4702,"FRANKFURT, Germany -- Hosts Germany will play in the opening match of the 2006 World Cup, the organizing committee of the governing body FIFA announced on Wednesday.",Sports,2,1.1161712
4705,Bulgarian teenager Valeri Bojinov scored twice as Lecce came from two goals behind to draw 2-2 with Inter Milan in Italian first division league on Wednesday.,Sports,2,1.0867255
4725,Results of X-rays on Gary Payton #39;s right hand revealed a non-displaced fracture in the point guard #39;s right thumb. Payton did not play last night against the ,Sports,2,1.1076915
4728,"TIM HENMAN showed he was on top form despite being diagnosed as suffering from magnesium deficiency, with a straight-sets win over Antony Dupuis in the first round of the Davidoff Swiss Masters.",Sports,2,1.1035502
4729,NEW YORK - Brendan Haywood of the Washington Wizards was suspended for three games by the NBA yesterday for fighting during a pre-season game against the Chicago Bulls.,Sports,2,1.1441
4732,"For Derek Lowe, two roads diverged not in a yellow wood, as New England's poet laureate Robert Frost had it, but on the greenswards of Fenway Park, Yankee Stadium, and Busch Stadium.",Sports,2,1.0900068
4743,"No stranger to brash statements, jockey Corey Nakatani has a firm goal for Saturday #39;s Breeders #39; Cup program at Lone Star Park.",Sports,2,1.0982193
4747,DANIEL VETTORI spun New Zealand to the brink of a crushing victory over Bangladesh in the second and final Test at the MA Aziz Stadium in Chittagong today.,Sports,2,1.0797014
4770, CLEVELAND (Sports Network) - The Cleveland Cavaliers  Thursday picked up the team's 2005-06 contract option on  forward Drew Gooden.,Sports,2,1.2112905
4772,Sergio Garcia showed the consistency that has lifted his game this year with a four-under-par 67 in difficult conditions to share the Volvo Masters lead with Spanish compatriot Jose Manuel Lara.,Sports,2,1.0788623
4785,"Houston, TX (Sports Network) - Craig Biggio will be around for an 18th season with the Houston Astros. On Thursday, the team exercised its contract option on Biggio for the 2005 season.",Sports,2,1.1468141
4842,"Carin Koch of Sweden and South Korea #39;s Grace Park both shot a 6-under-par 66 on Friday, taking the lead after the first round of the LPGA #39;s CJ Nine Bridges Classic.",Sports,2,1.1484349
4884,"Although Giants wide receiver Amani Toomer took limited work yesterday after missing the previous two days of practice, coach Tom Coughlin won #39;t decide on his availability ",Sports,2,1.0592177
4892,Japan #39;s Makoto Tamada grabbed his third pole position of the season before Sunday #39;s Valencia MotoGP after clocking the fastest time in the second qualifying session on Saturday.,Sports,2,1.0700134
4896,"Unseeded Slovak Karol Beck reached the first final of his career at the St Petersburg Open, upsetting seventh-seeded Michael Llodra of France 6-4 2-6 6-1 on Saturday.",Sports,2,1.1481857
4903,World number one Vijay Singh shot a four-under-par 67 on Saturday and took the lead of the Chrysler Championship after three rounds.,Sports,2,1.0705473
4919,"For the second time this month, UNC football fans had something to celebrate. In a stunning upset, the Tar Heels beat Miami 31 to 28.",Sports,2,1.0788462
4930,Bolton Wanderers continued their impressive start to the season as they battled to beat in-form Newcastle United 2-1 on Sunday to stay in touch with the leading pack at the top of the Premier League.,Sports,2,1.0683917
4938,Valentino Rossi hailed an  quot;unbelievable quot; season after celebrating his fourth world championship with victory in Valencia.,Sports,2,1.05945
4973,"Missouri tailback Damien Nash was reinstated by coach Gary Pinkel, ending a one-game suspension for the teams #39; leading rusher.",Sports,2,1.1880746
5016,A brilliant late strike from Ronaldinho gave dominant Barcelona a 2-1 win over AC Milan in an epic Champions League contest at the Nou Camp on Tuesday.,Sports,2,1.1274915
5021,"Chelsea and Inter Milan have advanced to the next round of the Champions League, while AC Milan and Barcelona look certain to join them.",Sports,2,1.0822879
5061,Inter Milan striker Adriano has asked fans to forgive him after he was sent-off in the 0-0 draw against Valencia on Tuesday night.,Sports,2,1.121675
5095,SHAQUILLE O #39;Neal shot 7-for-9 and finished with 16 points in his Miami debut yesterday as the Heat took a 100-77 victory against the home side New Jersey Nets.,Sports,2,1.0869225
5099,"Sheldon Brown signed a six-year extension with Philadelphia on Thursday, keeping the second-year cornerback with the Eagles through the 2012 season.",Sports,2,1.3216279
5168,"Wally Backman is introduced as the new manager of the Arizona Diamondbacks during a news conference on Nov. 1, 2004, in Phoenix. Backman was fired Friday, Nov. 5, by the club.",Sports,2,1.1016397
5209,AP - Maria Sharapova withdrew from her semifinal at the Advanta Championships on Saturday with a strained right shoulder.,Sports,2,1.1017168
5210,"When Nextel Cup leader Kurt Busch was hit by engine failure at Atlanta Motor Speedway and finished 42nd last Sunday, the mishap tightened NASCAR #39;s new 10-race championship format.",Sports,2,1.1238046
5226,"Vijay Singh has a golf swing to envy, even when fooling around. A few days ago on the driving range at the Tour Championship, Singh grabbed Steve Flesch #39;s golf clubs.",Sports,2,1.1096046
5228,AP - Pittsburgh Steelers running back Duce Staley was downgraded Saturday from probable to questionable for Sunday's game against the Philadelphia Eagles.,Sports,2,1.2033775
5234,Barcelona coach Frank Rijkaard savoured his side #39;s battling qualities after the Catalan giants fought back to beat Deportivo La Coruna 2-1 at the Nou Camp and open up a nine-point lead in the Primera Liga.,Sports,2,1.0998986
5248, PARIS (Reuters) - Marat Safin won the Paris Masters for a  record-equaling third time when he beat Czech qualifier Radek  Stepanek 6-3 7-6 6-3 on Sunday.,Sports,2,1.165596
5253," NEW YORK (Reuters) - Top seed Amelie Mauresmo rallied to  beat Russia's sixth-seeded Vera Zvonareva 3-6, 6-2, 6-2 to  complete a successful defense of her Advanta championship title  in Philadelphia on Sunday.",Sports,2,1.2136637
5279,"Rashard Lewis scored 27 points and Ray Allen added 24, leading the SuperSonics to a 113-94 victory over the San Antonio Spurs last night in Seattle.",Sports,2,1.1008425
5290,Jake Plummer #39;s four touchdown passes and 137.8 quarterback rating Sunday only begins to describe the efficient air attack used by the Broncos to rout the Houston Texas 31-13.,Sports,2,1.0707843
5327,"No apologies, no justifications, no excuses necessary. Oklahoma isn #39;t slinking into the BCS championship game through the back door this year.",Sports,2,1.1196847
5348,"The body blows came in staccato fashion, from the arm of a rookie quarterback and the legs of an old pro. Ben Roethlisberger would give the ball to Jerome Bettis, and Bettis ",Sports,2,1.1386508
5478,"Major League Soccer plans to start a new league to develop young players, part of its 10-year sponsorship deal with Adidas.",Sports,2,1.0678526
5484,"Indiana Pacers center Scot Pollard and forward Jonathan Bender missed Wednesday night #39;s game against the Los Angeles Clippers, adding to the team #39;s injury woes.",Sports,2,1.1020606
5490,"INDIANAPOLIS, Nov. 10 (Ticker) -- The Indiana Pacers were looking for a first. The Los Angeles Clippers accomplished one. Elton Brand had 19 points and a season-high 16 rebounds as the Clippers pounded the Pacers, 102-68.",Sports,2,1.2454928
5491,"Traber was chosen in the first round and 16th overall of the 2001 draft by the New York Mets, and made his major league debut with Cleveland in 2003.",Sports,2,1.0738044
5496,"The Brazilian midfielder, 26, broke a bone during Tuesday #39;s League Cup victory over Everton - his comeback match after a calf injury.",Sports,2,1.1210648
5522," GOTEMBA, Japan (Reuters) - Britain's Darren Clarke shook  off the effects of jet-lag and a hectic schedule to fire a  six-under-par 66 for a share of the first-round lead at the  Taiheiyo Masters Thursday.",Sports,2,1.1141672
5547,Kurt Busch has learned a lot during his four years in NASCAR #39;s top series. He just hopes that knowledge is enough to carry him and his Roush Racing team to a Nextel Cup championship.,Sports,2,1.1629567
5557,"SEMMES, Ala. -- Grace Park, looking to clinch second place in the Player of the Year race, birdied the final hole Thursday to gain a share of the lead after the first round of the Tournament of Champions.",Sports,2,1.0882059
5563,"PALERMO, Nov 11 (SW) - After a 39-year wait for a Serie A Sicilian derby, the match between Palermo and Messina on Thursday managed only a 0-0 draw.",Sports,2,1.1419346
5569,"George Mason has five players score in double figures Thursday night as the Patriots defeat Indianapolis-Purdue Fort Wayne, 69-51, in the opening round of the Coaches vs. Cancer Classic.",Sports,2,1.191568
5576,Sixth-ranked Syracuse scores the first 24 points of the game and cruises to a 104-54 victory over Northern Colorado on Thursday night in the first round of the Coaches vs. Cancer Classic.,Sports,2,1.1856211
5583,Supernatural forces must be at work in the land of high school football. There's no other way to explain a schedule that features 12 games between first- and second-place teams of leagues this weekend.,Sports,2,1.059827
5585,AP - Two of the three ranked teams playing on the opening night of the college basketball season cruised to easy wins. Then there was Mississippi State.,Sports,2,1.0765921
5594,"Satchel Paige said don #39;t look back because something might be gaining on you. Satch was a baseball pitcher, not a football coach.",Sports,2,1.2979246
5636,The NFL cautioned Cleveland Browns defensive tackle Gerard Warren not to pick up a personal foul penalty against Pittsburgh Steelers quarterback Ben Roethlisberger during tomorrow #39;s game.,Sports,2,1.1696978
5654,"CLEVELAND - The NFL gave a warning to Browns defensive tackle Gerard Warren on Friday, a day after he said he would try to hit Pittsburgh quarterback Ben Roethlisberger in the head Sunday.",Sports,2,1.099052
5664,AP - Vince Young scored on an 18-yard touchdown run with 4:11 left and threw a 22-yard TD pass to Tony Jeffrey with 11 seconds remaining to rally No. 6 Texas past Kansas 27-23 Saturday.,Sports,2,1.063434
5665,"David Beckham, out for a month with broken ribs, was named by Sven-Goran Eriksson to England #39;s team for its friendly match on Wednesday against Spain at Real Madrid #39;s Santiago Bernabeu Stadium.",Sports,2,1.1112394
5675,"THE directors of Manchester United will this week demand an emergency meeting with Malcolm Glazer, head of the Florida family that is stalking the world-famous football club.",Sports,2,1.0957134
5735,"INDIANAPOLIS Peyton Manning completed 18 of 27 passes for 320 yards and threw five touchdowns as the Indianapolis Colts beat the Houston Texans, 49-to-14.",Sports,2,1.1778824
5781," NEW YORK (Reuters) - San Francisco Giants slugger Barry  Bonds captured a record seventh MVP award Monday, providing a  sparkling finish to a season tainted by doping allegations.",Sports,2,1.086552
5790,Mike Mularkey has a message to those clamoring for rookie quarterback JP Losman to replace Drew Bledsoe as Buffalo #39;s starter. Not yet.,Sports,2,1.1967279
5802,AP - Chris Paul scored 25 points and six assists to lift Wake Forest past George Washington 97-76 in the Preseason NIT in the Demon Deacons' debut as the nation's second-ranked team.,Sports,2,1.1580281
5803,"Barry Bonds continues to defy the odds, and at 40 years of age he is still easily the most dominant hitter in Major League Baseball.",Sports,2,1.094212
5820,"Roger Federer still appears unbeatable after he showed no signs of a torn thigh muscle to defeat Argentina #39;s Gaston Gaudio 6-1, 7-6 in the opening match of the ATP Masters Cup in Houston.",Sports,2,1.1558162
5821,"Just when their defense was playing at a high level and sparking a three-game winning streak, the Chicago Bears lost standout linebacker Brian Urlacher.",Sports,2,1.0629045
5887,"OGDEN, Utah -- Weber State football coach Jerry Graybeal resigned Tuesday after a 1-10 season, the worst in the program #39;s 43-year history.",Sports,2,1.0695437
5967,"Harrington scored a season-high 30 points in a superlative performance against his former team, but the Indiana Pacers still escaped Conseco Fieldhouse with a 93-83 victory over Atlanta.",Sports,2,1.0788456
5980,"Carmelo Anthony scored 30 points and Kenyon Martin added 24 points and 16 rebounds, helping the Denver Nuggets hold off the Toronto Raptors 112-106 Wednesday night.",Sports,2,1.2831815
5997," MIYAZAKI, Japan (Reuters) - Tiger Woods fired a superb  five-under-par 65 in torrential rain to take a three-stoke lead  after the first round of the Dunlop Phoenix tournament  Thursday.",Sports,2,1.1371375
6040,Casey Mears set a track qualifying record and won his third NASCAR Busch series pole of the season Thursday at Homestead-Miami Speedway.,Sports,2,1.2830029
6073,The annual summer barbecues that Ralph Friedgen and Frank Beamer co-host at their lake homes in Georgia may be a little less cordial after the way Beamer #39;s Virginia Tech Hokies waxed Friedgen #39;s Maryland Terrapins 55-6 last night.,Sports,2,1.1473837
6076,Top-seeded Roger Federer overcame a second-set lapse and remained unbeaten in the ATP Masters Cup Championships with a victory last night over Carlos Moya.,Sports,2,1.0832057
6077,The Philadelphia 76ers got a firsthand demonstration of why Tim Duncan might be the toughest player in the NBA to defend. Duncan scored a season-high 34 points and grabbed 13 rebounds to lead the Spurs to ,Sports,2,1.1403259
6102,Orange are set to square off in the title game of the Coaches vs. Cancer. Classic. The Orange posted an impressive 71-58 victory over 12th-ranked.,Sports,2,1.1826541
6135,"AP - Pittsburgh Steelers running back Duce Staley was downgraded to doubtful Friday with a sore hamstring, meaning he will almost certainly miss a third consecutive game Sunday.",Sports,2,1.0584494
