,Original_Text,Class_String,Class_Number,Neuron_7
3692,"Starbucks Corp. (SBUX.O: Quote, Profile, Research) on Tuesday said its chief executive, Orin Smith, will retire next year, surprising investors, who sent the coffee shop chain #39;s shares lower in after-hours trading.",Business,3,1.509811
3720,"McDonald #39;s third-quarter earnings rose a higher-than-expected 42 percent, the world #39;s largest restaurant chain says, citing strong sales in the United States and a lower tax rate.",Business,3,1.5206366
3729,"Global grocery retailer Ahold NV and its former chief executive have reached settlements with the US Securities and Exchange Commission over charges related to a \$1 billion overstatement of earnings, they said Wednesday.",Business,3,1.3781514
3763,"Reuters - A sharp slide in global metals\markets hammered industrial and mining stocks such as JFE\Holdings and BHP Billiton Thursday, while oil prices crawled\back toward record highs.",Business,3,1.5250463
3764,SAN FRANCISCO (CBS.MW) -- A rally in heating-oil futures to a fresh record and gains for natural gas for the first time in four sessions pulled crude prices more than \$1 a barrel higher Wednesday.,Business,3,1.4209933
3765,"Boeing soon may be eligible to buy US terrorism insurance at below-market rates, adding fuel to a debate with Europe over aircraft-maker subsidies.",Business,3,1.4494236
3770,"Temasek Holdings Pte, a \$53 billion Singapore government fund, may buy stakes in China #39;s first private bank and Indonesia #39;s biggest listed oil company as it steps up investments abroad.",Business,3,1.4136223
3778,"Shares of First Health Group Corp. (FHCC.O: Quote, Profile, Research) rose 21.5 percent in pre-market trading on Thursday after rival Coventry Health Care Inc.",Business,3,1.3395616
3789,US stock futures pointed to a flat market open Thursday as a rush of quarterly earnings reports painted a mixed picture for corporate profits amid lingering worries over the high price of oil.,Business,3,1.3591279
3854," NEW YORK (Reuters) - Pfizer Inc. &lt;A HREF=""http://www.investor.reuters.com/FullQuote.aspx?ticker=PFE.N target=/stocks/quickinfo/fullquote""&gt;PFE.N&lt;/A&gt; said on Friday it  is sending additional information to healthcare professionals  about its arthritis drug Bextra, a COX-2 product in the same  class as the withdrawn drug Vioxx.",Business,3,1.5628898
3861,Crude oil fell from yesterday #39;s record of \$54.88 a barrel in New York amid concern that sustained high prices may slow economies and reduce demand for energy.,Business,3,1.4306123
3862," NEW YORK (Reuters) - Delta Air Lines Inc. &lt;A HREF=""http://www.investor.reuters.com/FullQuote.aspx?ticker=DAL.N target=/stocks/quickinfo/fullquote""&gt;DAL.N&lt;/A&gt; on Friday  forecast a much wider third-quarter loss than Wall Street had  estimated, citing weak domestic fares and a spike in fuel  costs, sending its shares down nearly 6 percent.",Business,3,1.3755801
3934,"When Greenville County in South Carolina borrowed \$800 million two years ago to expand its public schools, insurance broker Marsh  amp; McLennan Cos.",Business,3,1.3844439
3976,"The Federal Government says they are considering more tax cuts for lower and middle-income Canadians. Fending off attacks over the 9.1 billion dollar budget surplus, Finance Minister Ralph Goodale said he ",Business,3,1.5008485
3988," NEW YORK (Reuters) - Pfizer Inc. said on Monday it plans to  sponsor a major clinical study to further assess the  cardiovascular safety of its arthritis drug Celebrex following  the withdrawal of Merck   Co.'s Vioxx, a drug in the same  class.",Business,3,1.399927
4006,Oil prices fell sharply on Monday in what traders described as a wave of profit-taking sparked by a steep decline in gasoline futures.,Business,3,1.5438164
4008,"MOSCOW: Foreign investors may take part in the sale of assets in Russian oil major Yukos main production unit, which could be offered at a 60 price discount to settle back taxes, Russian television reported on Monday.",Business,3,1.387033
4014," NEW YORK (Reuters) - Kmart Holding Corp. &lt;A HREF=""http://www.investor.reuters.com/FullQuote.aspx?ticker=KMRT.O target=/stocks/quickinfo/fullquote""&gt;KMRT.O&lt;/A&gt; on Monday  named a new president and chief executive in a move that could  signal the start of a campaign to revamp the discount  retailer's image.",Business,3,1.4586189
4024, NEW YORK (Reuters) - Oil prices retreated sharply after  setting record highs above \$55 a barrel on Monday as dealers  took profits on signs that energy costs are hurting economic  growth.,Business,3,1.5600233
4025," NEW YORK (Reuters) - U.S. stocks closed higher on Monday  after a drop in oil prices eased worries about corporate  profits, although disappointing earnings from diversified  manufacturer 3M Co. &lt;A HREF=""http://www.investor.reuters.com/FullQuote.aspx?ticker=MMM.N target=/stocks/quickinfo/fullquote""&gt;MMM.N&lt;/A&gt; limited gains on the blue-chip Dow.",Business,3,1.6146435
4026," CHICAGO (Reuters) - Kraft Foods Inc. &lt;A HREF=""http://www.investor.reuters.com/FullQuote.aspx?ticker=KFT.N target=/stocks/quickinfo/fullquote""&gt;KFT.N&lt;/A&gt; on Monday  posted a 3.8 percent drop in quarterly profit, weighed down by  higher marketing spending and increased costs for cheese,  coffee and other materials.",Business,3,1.3815733
4078,"Constellation Brands Inc., the world #39;s largest winemaker, offered \$1.3 billion in cash to acquire Robert Mondavi Corp., maker of lower-price Woodbridge wines.",Business,3,1.4429762
4097,"The record level of debt carried by American households and soaring home prices do not appear to represent serious threats to the US economy, Federal Reserve Chairman Alan Greenspan said Tuesday.",Sci/Tech,4,1.4495472
4098," NEW YORK (Reuters) - Wells Fargo   Co. &lt;A HREF=""http://www.investor.reuters.com/FullQuote.aspx?ticker=WFC.N target=/stocks/quickinfo/fullquote""&gt;WFC.N&lt;/A&gt;, the No. 4  U.S. bank, on Tuesday said third-quarter profit rose a  lower-than-expected 12 percent after a downturn in home  mortgage lending.",Business,3,1.6161188
4116,The plunge in US insurance stocks widened to include companies such as Aetna Inc. and Humana Inc. on concern New York Attorney General Eliot Spitzer #39;s probe of the industry will drag down profits.,Business,3,1.4303862
4128,NEW YORK - US stocks fell on Tuesday as health insurers #39; shares slid on worries that the New York attorney general #39;s probe will hit the entire industry.,Business,3,1.409496
4151,"Ford Motor Co. swung to a third-quarter profit, but losses at the automakers global automotive operations widened, underscoring the difficulty Ford still faces ",Business,3,1.3791542
4172,"Coca-Cola Bottling Co. Consolidated, the Coca-Cola Co. #39;s major bottler and distributor in the Southeast, said Wednesday that third-quarter profit fell as bad weather, high fuel prices and fewer promotions led to lower volume.",Business,3,1.4649746
4181," NEW YORK (Reuters) - Countrywide Financial Corp. on  Wednesday posted a 47 percent drop in quarterly earnings and  cut its outlook as mortgage refinancings fell and rates  climbed, sparking a broad sell-off in mortgage-company stocks.",Business,3,1.5698718
4189,French luxury goods company LVMH Moet Hennessy Louis said Wednesday it plans to buy whisky maker Glenmorangie PLC for about 300 million pounds (euro430.,Business,3,1.4519514
4191,The Securities and Exchange Commission said Wednesday that accounting firm KPMG LLP will pay \$10 million to Gemstar-TV Guide International shareholders to settle allegations it committed improper conduct in Gemstar #39;s audit.,Business,3,1.3578689
4205,"Australia #39;s Computershare Ltd. (CPU.AX: Quote, Profile, Research) has agreed to buy the second-largest US share registrar, EquiServe, for \$292 million, quadrupling ",Business,3,1.4065406
4235,Pharmaceutical giant Merck  amp; Co. said Thursday that third-quarter earnings dropped significantly year-over-year on charges related to the withdrawal of Vioxx from the market.,Business,3,1.4235858
4256," CHICAGO (Reuters) - Chocolate maker Hershey Foods Corp.  &lt;A HREF=""http://www.investor.reuters.com/FullQuote.aspx?ticker=HSY.N target=/stocks/quickinfo/fullquote""&gt;HSY.N&lt;/A&gt; on Thursday posted a higher-than-expected 16 percent  rise in quarterly profit and said it will get into the cookie  business.",Business,3,1.4556012
4308," NEW YORK (Reuters) - Citigroup Inc. &lt;A HREF=""http://www.investor.reuters.com/FullQuote.aspx?ticker=C.N target=/stocks/quickinfo/fullquote""&gt;C.N&lt;/A&gt; on Friday said  U.S. securities regulators may recommend enforcement  proceedings against the former head of Citigroup Global  Investment Management.",Business,3,1.3901563
4311,"Primaris Airlines Inc. has announced plans to buy 20 Boeing 7E7-8 Dreamliners and 20 737-800s, a deal worth \$3.8 billion at list prices, the new low-cost business carrier and the Boeing Co.",Business,3,1.3768258
4335,US Treasury prices rose on Friday as a potent combination of record high oil prices and slumping stocks kept market participants jittery about the potential for slower growth.,Business,3,1.4232887
4363,"Bankrupt US Airways is giving flight attendants, machinists and passenger service workers three weeks to reach consensual cost-cutting pacts before the airline asks ",Business,3,1.3587881
4400,"Pilots at US Airways narrowly approved \$300 million in wage and benefit cuts today, making the Air Line Pilots Association the first major union representing US Airways workers to agree to permanent concessions.",Business,3,1.5365021
4436, TOKYO (Reuters) - Tokyo's Nikkei average fell 2 percent at  the opening on Monday as investors shied away from exporters  including Toyota Motor Corp. after a fall in the dollar below  107 yen stoked concerns about their earnings.,Business,3,1.3985302
4472,"Harmony Gold Mining Co., the biggest miner of South African gold, made its fifth consecutive quarterly loss as the rand #39;s gains against the dollar eroded profit margins, compelling it to seek expansion to cut costs.",Business,3,1.3974539
4473," NEW YORK (Reuters) - U.S. stock futures pointed to a lower  market open on Monday, as oil prices hit another record,  fueling worries that soaring energy costs will bite into  corporate profits.",Business,3,1.4612337
4477,"The office of New York Attorney General Eliot Spitzer has uncovered evidence of improper business practices at Aon Corp., the world #39;s second-largest insurance broker, according to a published report.",Business,3,1.3847942
4478," NEW YORK (Reuters) - Ryder System Inc. &lt;A HREF=""http://www.investor.reuters.com/FullQuote.aspx?ticker=R.N target=/stocks/quickinfo/fullquote""&gt;R.N&lt;/A&gt; on Monday  reported an increase in quarterly net profit amid increased  demand for transport services, especially in its fleet  management division.",Business,3,1.4793068
4490,"Citigroup Inc. said Monday it will close its trust banking unit in Japan within a year, after Japanese authorities ordered the US financial services giant to suspend its private banking business there.",Business,3,1.3713335
4496,"Texas power company TXU Corp. (TXU.N: Quote, Profile, Research) on Monday raised its dividend by 350 percent, boosted its earnings forecast and increased its share buyback program ",Business,3,1.4052577
4510,Shares of Delta Air Lines soared after the troubled airline said Monday it entered into a commitment letter with American Express Travel Related Services Co.,Business,3,1.3868833
4554, NEW YORK (Reuters) - Treasuries prices crawled ahead on  Tuesday as a hesitant market awaited the latest reading on  consumer sentiment and an auction of new U.S. government debt.,Business,3,1.4507076
4556," BOSTON (Reuters) - Diversified manufacturer General  Electric Co. &lt;A HREF=""http://www.investor.reuters.com/FullQuote.aspx?ticker=GE.N target=/stocks/quickinfo/fullquote""&gt;GE.N&lt;/A&gt; said on Tuesday that it is on track to meet  its full-year earnings forecast and to achieve double-digit  gains in earnings per share in 2005.",Business,3,1.4591811
4562,"  NEW YORK (Reuters) - U.S. consumers turned more gloomy in  October, beset by soaring energy prices, relentless violence in  Iraq and the increasingly bitter end of the presidential  election campaign.",Business,3,1.3594494
4579,"A deeply divided SEC voted Tuesday to mandate new oversight for hedge funds -- largely unregulated investment pools, traditionally for the wealthy, that have become popular with small investors.",Business,3,1.4582881
4592,"The Reserve Bank of India announced the mid-term review of its monetary policy on Tuesday. Though the central Bank kept away from the much expected interest rate hike, the policy contained recommendations ",Business,3,1.431901
4599,TORONTO (CP) - A rally in the insurance sector helped take stock markets up sharply - and drove New York #39;s blue chip index to a triple-digit runup - despite higher oil prices and a further slowdown in US consumer confidence.,Business,3,1.4529624
4613,"Description: A divided Securities and Exchange Commission will likely approve new regulations governing the hedge fund industry. Under the rules, all but the smallest hedge funds would be required to register with federal regulators.",Business,3,1.4306241
4618,"Reuters - Marsh   McLennan Cos. , the\world's largest insurance broker, said on Tuesday it would\reform its business practices and stop accepting fees at the\center of an investigation by New York Attorney General Eliot\Spitzer into bid rigging.",Business,3,1.411617
4645,"The Spanish bank which is buying Abbey made a 2.2bn profit (3.1bn euros)in the first nine months of 2004. Banco Santander Central Hispano, which is acquiring the UK lender in a 8.",Business,3,1.4867222
4650,"AFP - Anglo-Australian mining giant BHP Billiton and Alcoa, the world's largest aluminium producer, have agreed to sell their metal services joint venture Integris Metals for 660 million dollars (359 million pounds) including debt, a joint statement said.",World,1,1.3912266
4670,"Comcast Corp. (CMCSA.O: Quote, Profile, Research) , the largest US cable operator, on Wednesday posted a quarterly profit that fell short of Wall Street forecasts but reported better-than ",Business,3,1.4677798
4673," NEW YORK (Reuters) - U.S. stocks jumped on Wednesday as oil  prices, which have held investor enthusiasm for stocks in check  for months, fell sharply after a higher-than-expected crude  build last week.",Business,3,1.4512844
4685, JAKARTA (Reuters) - OPEC has taken the unprecedented step  of urging the United States to tap its emergency crude reserves  to bring down world oil prices.,Business,3,1.4140309
4688,"The US economy continued to expand in September and early October in spite of rising energy costs, the Federal Reserve said Wednesday in its Beige Book, a survey of business activity around the country.",Business,3,1.3709008
4703,MELBOURNE (Dow Jones)--Australia #39;s National Foods Ltd. (NFD.AU) on Thursday told shareholders to take no action on New Zealand dairy group Fonterra Co-operative Group Ltd.,Business,3,1.4692191
4717,"Blaming excess capacity, extremely high fuel prices, which and descending fares, ATA Holdings Corp., parent of discount airline carrier ATA Airlines, said it has filed for bankruptcy.",Business,3,1.5720127
4750,"ATA Holdings Corp. (ATAH), parent of struggling low-cost carrier ATA Airlines, on Tuesday filed for Chapter 11 bankruptcy protection as falling fares and soaring fuel prices drained it of cash.",Business,3,1.4513172
4751,"DETROIT - Dow Chemical Co. #39;s third-quarter earnings soared 86 percent to beat Wall Street forecasts, thanks largely to improved margins.",Business,3,1.3828446
4758,"Viacom Inc. (VIAb.N: Quote, Profile, Research) (VIA.N: Quote, Profile, Research) on Thursday posted a quarterly loss on charges related to the spinoff of video rental chain Blockbuster ",Business,3,1.4504985
4798,"Alliance Capital Management Holdings LP (AC.N: Quote, Profile, Research) , one of the biggest US money managers, on Thursday said its profit rose in the third quarter ",Business,3,1.4356707
4836," CHICAGO (Reuters) - Avon Products Inc. &lt;A HREF=""http://www.investor.reuters.com/FullQuote.aspx?ticker=AVP.N target=/stocks/quickinfo/fullquote""&gt;AVP.N&lt;/A&gt; on Friday  posted higher quarterly earnings as business in Latin America  and Europe helped offset weakness in the United States for the  direct seller of cosmetics.",Business,3,1.369842
4856,"Credit Suisse First Boston, the securities arm of Switzerland #39;s second-biggest bank, plans to cut costs by combining some units and eliminating jobs, people familiar with the matter said.",Business,3,1.3547534
4865,The Standard  amp; Poor #39;s 500 Index rose for a fourth day as investors looked past a disappointing third- quarter economic growth report to better-than-expected readings on Chicago-area business and consumer confidence.,Business,3,1.4098961
4941,"SINGAPORE : Singapore #39;s unemployment rate has fallen to its lowest level in five years on the back of strong economic growth in the first half of the year, the government said Monday.",Business,3,1.3410025
4952,"SINGAPORE : The government is extending third-party war risk insurance cover to the Civil Aviation Authority of Singapore and SATS Security Services, a unit of the Singapore Airlines group.",Business,3,1.4418151
4962,Merck  amp; Co. shares fell as much as 7 percent to their lowest level in more than eight years after the Wall Street Journal said the drugmaker tried for years to stop safety concerns from hurting sales of its Vioxx painkiller.,Business,3,1.423816
4972,MOSCOW : Russian authorities hit the bruised Yukos oil giant with a battery of fresh tax claims which could see the firm #39;s total debt soar to an astronomical 17 billion dollars.,Business,3,1.3484733
4981,"WHITEHOUSE STATION, NJ - Shares of Merck  amp; Co. plunged nearly 10 percent Monday after a media report said documents show the pharmaceutical giant hid or denied evidence for years that its blockbuster arthritis drug Vioxx causes heart problems.",Business,3,1.4434344
4987,"Singapore shares ended higher Tuesday boosted by modest overnight gains on Wall Street and easing oil prices, traders said. The United States is a major trading partner and the local stock market traditionally ",Business,3,1.4087827
4994,"Britain #39;s biggest airport operator BAA posted a 16 percent jump in first-half earnings on Tuesday, meeting expectations as cheap airfares and stronger economies drove up passenger numbers.",Business,3,1.3919708
5000,"Toyota Motor Corporation, the world #39;s second-largest carmaker, had an unexpected drop in quarterly profit as investment earnings declined at a truckmaking unit and a stronger yen cut the value of overseas sales.",Business,3,1.3500417
5059,"US stocks rallied Wednesday, boosted by shares of health and defence companies that are seen benefiting from the re-election of President George W. Bush, but higher oil prices checked advances.",Business,3,1.337785
5076,Consumers shrugged off higher gasoline prices and weaker economic conditions to lift new car and truck sales up 2.2 percent in October.,Business,3,1.4517467
5077,Yukos warned yesterday it could declare bankruptcy within months following fresh tax claims that could leave Russia #39;s biggest oil company facing an astronomical bill of \$17 billion (R104 billion).,Business,3,1.3619293
5083,Crude futures eased slightly Thursday after a US government report showed another boost in supplies ahead of the Northern Hemisphere winter.,Business,3,1.3939251
5084,"CVS Corp. (CVS.N: Quote, Profile, Research) , the No. 2 US drugstore chain, on Thursday reported a lower quarterly profit as it grappled with expenses tied to its recent purchase of Eckerd drug stores from JC Penney Co.",Business,3,1.446393
5117," NEW YORK/OTTAWA (Reuters) - Pfizer Inc. &lt;A HREF=""http://www.investor.reuters.com/FullQuote.aspx?ticker=PFE.N target=/stocks/quickinfo/fullquote""&gt;PFE.N&lt;/A&gt; said on  Thursday its arthritis drug Celebrex was safe after a report in  a Canadian newspaper linked it to 14 deaths,",Business,3,1.4932889
5133,"The UK #39;s Financial Services Authority approved Santander Central Hispano SA #39;s 9.4 billion-pound (\$17.4 billion) takeover of Abbey National Plc, paving the way for Europe #39;s biggest cross-border bank merger.",Business,3,1.5577364
5153,"Vornado Realty Trust said on Friday it has acquired a 4.3 percent stake in the retailer Sears, Roebuck  amp; Co.. Sears #39; stock rose as high as \$45.",Business,3,1.5926708
5162," NEW YORK (Reuters) - Sears, Roebuck   Co. &lt;A HREF=""http://www.investor.reuters.com/FullQuote.aspx?ticker=S.N target=/stocks/quickinfo/fullquote""&gt;S.N&lt;/A&gt; shares  jumped as much as 25 percent on Friday after real estate  company Vornado Realty Trust &lt;A HREF=""http://www.investor.reuters.com/FullQuote.aspx?ticker=VNO.N target=/stocks/quickinfo/fullquote""&gt;VNO.N&lt;/A&gt; said it raised its stake  in the retailer, a step that could lead Sears to convert some  of its real estate assets into cash.",Business,3,1.469697
5175,"Sears, Roebuck and Co. #39;s stock shot up 23 percent Friday after a real estate investment trust disclosed it had purchased a 4.3 percent interest in the department-store chain.",Business,3,1.4327252
5197,"Cazenove said it had agreed to hive off its investment banking business into a joint venture with JP Morgan Chase and Co, in effect ending the independence of the 181-year-old British bank.",Business,3,1.3412614
5199,"Vornado Realty Trust gave Sears, Roebuck  amp; Co. #39;s stock a big boost Friday when it said it bought a 4.3 percent stake in the famous but struggling chain.",Business,3,1.5215454
5225," NEW YORK (Reuters) - The bonanza many believe President  Bush has handed the mutual fund industry with his plans to  reform Social Security may be a mirage, industry leaders said  on Friday.",Business,3,1.3382969
5259,"As YUKOS contemplates a staggering \$17.5 billion tax bill, the spectre of bankruptcy has never seemed closer for Russia #39;s biggest oil company.",Business,3,1.5044782
5282,"Westpac Bank has reported a record after-tax profit of \$2.54 billion, a 16 per cent increase on the previous year #39;s results. The bank has also announced a final dividend of 44 cents, taking the full-year dividend to 86 cents fully franked.",Business,3,1.3788577
5292,"LONDON, November 8 (newratings.com) - British Airways #39; (BAI1.FSE) second-quarter pretax profits more than doubled this fiscal year, boosted by the company #39;s effective cost reduction measures and a robust upturn in the long-haul passenger traffic trends.",Business,3,1.3692247
5300,"US stocks opened slightly lower on Monday as investors pause after a three-day rally last week, with interest rates and a weakening dollar gaining focus now that the presidential election is over.",Business,3,1.3761038
5309," SEATTLE/NEW YORK (Reuters) - Microsoft Corp. &lt;A HREF=""http://www.investor.reuters.com/FullQuote.aspx?ticker=MSFT.O target=/stocks/quickinfo/fullquote""&gt;MSFT.O&lt;/A&gt; said  on Monday it had agreed to settle antitrust lawsuits with  Novell Inc. &lt;A HREF=""http://www.investor.reuters.com/FullQuote.aspx?ticker=NOVL.O target=/stocks/quickinfo/fullquote""&gt;NOVL.O&lt;/A&gt; and an industry trade group, marking the  end of a decade-long antitrust battle.",Business,3,1.4271132
5333," SEATTLE/NEW YORK (Reuters) - Microsoft Corp. &lt;A HREF=""http://www.investor.reuters.com/FullQuote.aspx?ticker=MSFT.O target=/stocks/quickinfo/fullquote""&gt;MSFT.O&lt;/A&gt; said  on Monday said it will pay \$536 million to its smaller rival  Novell Inc. &lt;A HREF=""http://www.investor.reuters.com/FullQuote.aspx?ticker=NOVL.O target=/stocks/quickinfo/fullquote""&gt;NOVL.O&lt;/A&gt; to settle an antitrust suit and resolved a  10-year dispute with a computer trade group.",Business,3,1.396925
5365," LONDON (Reuters) - The dollar held almost a cent above its  record low against the euro on Tuesday, winning a respite after  heavy selling as European officials warned about a strong euro  and investors grew wary ahead of U.S. trade data.",Business,3,1.3715693
5370," NEW YORK (Reuters) - Drugstore chain CVS Corp. &lt;A HREF=""http://www.investor.reuters.com/FullQuote.aspx?ticker=CVS.N target=/stocks/quickinfo/fullquote""&gt;CVS.N&lt;/A&gt; on  Tuesday said October sales at stores open at least a year rose  5.4 percent on higher demand for prescriptions and other  merchandise at its CVS stores.",Business,3,1.3949943
5399,"MARSH  amp; MCLENNAN, the insurance broker, is to axe 3,000 jobs to help to prop up its flagging profits, which have been hurt by a \$232 million (125 million) charge to cover a potential settlement with Eliot Spitzer, the New York attorney-general.",Business,3,1.3462162
5403," LOS ANGELES/PHILADELPHIA (Reuters) - California's insurance  commissioner on Tuesday ended his opposition to Anthem Inc.'s  &lt;A HREF=""http://www.investor.reuters.com/FullQuote.aspx?ticker=ATH.N target=/stocks/quickinfo/fullquote""&gt;ATH.N&lt;/A&gt; proposed \$16.5 billion acquisition of WellPoint Health  Networks Inc. &lt;A HREF=""http://www.investor.reuters.com/FullQuote.aspx?ticker=WLP.N target=/stocks/quickinfo/fullquote""&gt;WLP.N&lt;/A&gt; after Anthem agreed to hike its funding  of state health projects.",Business,3,1.3941833
5404,"Crude oil futures closed below 48 dollars a barrel Tuesday, the lowest level in seven weeks amid rising expectations about US oil supply for this winter.",Business,3,1.4480305
5447,"Share prices in Hong Kong rose Wednesday, led by airline stocks, on falling oil prices. The key Hang Seng Index jumped 155.70 points, or 1.2 percent, to end at 13,672.",Business,3,1.4394745
