,Original_Text,Class_String,Class_Number,Neuron_38
3801,But researchers say data based on analogue phone usage may not yield same results as digital phone usage.,Sci/Tech,4,1.4647403
3802,"Users of the increasingly popular, open-source MySQL database may be at risk from remote attacks due to a bug in phpMyAdmin, a widely used Web-based MySQL administration tool.",Sci/Tech,4,1.3906518
3811,"It enables people to retrieve E-mail from Outlook and Outlook Express, documents from Microsoft Office, chat sessions from AOL IM, and Web pages viewed with Internet Explorer.",Sci/Tech,4,1.6681976
3815,The companies target mainstream audiences with a low-cost combination digital video recorder and DVD burner box.,Sci/Tech,4,1.4222716
3816,"Intel Corp. has confirmed its near-term plans for its desktop processors before it reaches the multicore era. The company will not release a 4GHz version of its flagship Pentium 4 product, having decided instead to realign its engineers around the company's new design priorities, an Intel spokesman said Thursday.",Sci/Tech,4,1.4409406
3824,"October 14, 2004 - Microsoft is set to release its Windows Media Center Extender for Xbox mid-November. The device will allow you to view recorded and downloaded media content stored on your PC via your Xbox.",Sci/Tech,4,1.6656332
3826, SAN FRANCISCO (Reuters) - Network computer maker Sun  Microsystems Inc. on Thursday posted a narrower quarterly loss  as revenue rose for the second consecutive quarter on higher  sales of servers after three years of declines.,Business,3,1.5807323
3827,"Amphibians such as leopard frogs and salamanders are threatened with extinction as their homes dry up and a new disease spreads, possibly as a result of global warming, according to a new study in Science magazine.",Sci/Tech,4,1.4422079
3829,"LOS GATOS, Calf. Shares of mail-order DVD rental company Netflix plunged today amid buzz that Amazon-dot-com is getting into the movie rental business.",Business,3,1.4622105
3830,The Intel Corporation said on Thursday that it was canceling its plans to market a faster version of its Pentium 4 chip for personal computers to focus on products with  quot;more bang for the buck.,Sci/Tech,4,1.4904537
3835,"The Intel Corporation said that it was canceling plans to market a faster version of its Pentium 4 chip to focus on products with ""more bang for the buck.""",Sci/Tech,4,1.4539756
3846,"There's no such thing as a free lunch. And soon, there may be no such thing as an ad-free RSS feed, either, as publishers add advertisements to their feeds in hopes of making money through the popular content-aggregating technology. By Cyrus Farivar.",Sci/Tech,4,1.3833774
3872,"OCTOBER 15, 2004 (IDG NEWS SERVICE) - Dell Inc. took the wraps off its holiday lineup on Thursday, showing new printers, plasma televisions and music players that will soon be available through its Web site.",Sci/Tech,4,1.408792
3883,"Halo 2, one of the most anticipated video games of the year, got an early release date, but not the way fans or its publisher, Microsoft, had hoped.",Sci/Tech,4,1.4242567
3887,Reuters - Video chain Blockbuster Inc on\Friday said it would lower the price of its online DVD rentals\to undercut a similar move by Netflix Inc. that sparked a stock\a sell-off of both companies' shares.,Sci/Tech,4,1.6690503
3891,IBM on Friday introduced high-end servers in its pSeries and iSeries lines that include virtualization features and raw power that some experts say put the products on par with offerings from rival Hewlett-Packard Co.,Sci/Tech,4,1.4166161
3922,"A RUSSIAN spacecraft has delivered three astronauts to the International Space Station, overcoming docking system problems which had delayed its launch.",Sci/Tech,4,1.4417014
3945,"OCTOBER 14, 2004 (REUTERS) - SAN FRANCISCO -- Sun Microsystems Inc. today posted a narrower quarterly loss as revenue rose year over year for the second consecutive quarter after three years of declines, sending shares slightly higher.",Sci/Tech,4,1.5321647
3950,RESEARCH TRIANGLE PARK - IBM is rolling out a new line of Power5-processor based servers that it says outperform rivals from Sun and HP.,Sci/Tech,4,1.4288096
3954," NEW YORK (Reuters) - Price declines for U.S. consumer  electronics accelerated in August, fueled by discounted price  cuts for the popular iPod digital music player and traditional  DVD players, according to an industry study prepared for  Reuters.",Sci/Tech,4,1.541646
3968,"The findings come in a report from the newly formed Consumer Spyware Initiative, a joint effort by Dell and the non-profit Internet Education Foundation that aims to increase awareness of spyware.",Business,3,1.5244254
3970,"SAN FRANCISCO -- At virtually every turn, Intel Corp. executives are heaping praise on an emerging long-range wireless technology known as WiMAX, which can blanket entire cities with high-speed Internet access.",Business,3,1.4833407
3983,"Already the search tool so popular its name has become a verb, Google has been quietly adding important features in the background since it became a public company.",Sci/Tech,4,1.4760263
3989,Microsoft confirms that a pirated copy of Halo 2 for Xbox in the PAL video format and French language started circulating on the Internet this week over newsgroups and piracy sites.,Sci/Tech,4,1.5002812
3991,"Tough times often make for strange bedfellows, and the explosion of viruses, computer worms and spyware programs on the Internet is producing unique alliances among top technology firms. &lt;FONT face=""verdana,MS Sans Serif,arial,helvetica"" size=""-2"" color=""#666666""&gt;&lt;B&gt;-washingtonpost.com&lt;/B&gt;&lt;/FONT&gt;",Sci/Tech,4,1.5384138
4000,"Google has announced a new desktop search application that enables users to search their e-mail, files, web history, and chats. Perhaps learning from previous mistakes, Google says it has designed the product  quot;from the ground up to respect user privacy.",Business,3,1.414738
4005,"OCTOBER 18, 2004 (COMPUTERWORLD) - IBM and Borland Software Corp. last week separately brought out upgrades to their development tool lines that executives said add support for heterogeneous environments and ",Sci/Tech,4,1.4913074
4016,PC World has posted a news article claiming that the highly anticipated game Halo 2 for the Xbox has been released on the net.  quot;Microsoft confirms that a pirated copy of Halo 2 for Xbox in the PAL video format ,Sci/Tech,4,1.5589664
4020,"Texas Instruments Inc. (TXN.N: Quote, Profile, Research) , the largest maker of chips for cellular phones, on Monday said quarterly profit rose about 26 percent on demand from handset ",Business,3,1.6045103
4021,"IBM recently unveiled the TotalStorage DS6000, a roughly VCR-size system aimed at mid-size businesses. The new DS8000 series system features IBM Power5 microprocessors and IBM #39;s Virtualization ",Sci/Tech,4,1.5121158
4023,"OCTOBER 18, 2004 (COMPUTERWORLD) - Microsoft Corp. #39;s move to a monthly patch-release cycle one year ago this month has made it easier to install security updates for Windows and other products, IT managers said last weekeven as they were greeted with a ",Sci/Tech,4,1.4393076
4030,"NEW YORK - IBM Corp. posted quarterly results on Monday showing 9 percent revenue growth from last year and slight earnings growth, despite a \$320 million charge it took during the quarter to settle some claims in a lawsuit over its pension plan.",Sci/Tech,4,1.4205403
4047,"AP - People who use public or workplace computers for e-mail, instant messaging and Web searching have a new privacy risk to worry about: Google's free new tool that indexes a PC's contents for quickly locating data.",Sci/Tech,4,1.5182958
4049,"Telecommunications firm MCI Inc. on Monday said it will take a hefty \$3.5 billion charge in the third quarter to impair property, equipment and intangible assets related to its consumer phone business.",Business,3,1.5869421
4052,"Boeing Co. received at least \$49 million in excessive profits on a \$1.2 billion contract to supply explosives-detection systems to hundreds of the nation #39;s airports, the Department of Homeland ",Business,3,1.4097477
4069,Microsoft and Cisco Systems will collaborate to make their emerging products for network security compatible. The vendors had been working independently in the area of PC access to networks but say customers ,Sci/Tech,4,1.6021109
4070,"Linux distributor Red Hat Inc has appointed a vice president of desktop infrastructure technologies, a new position demonstrating its renewed commitment to Linux as a desktop operating system.",Sci/Tech,4,1.5272228
4072,"Technology India: New York, Oct 19 : The world #39;s leading computer chipmaker Intel has jumped off the chip speed roller coaster by yanking its four giga hertz (4 GHz) Pentium 4 processor off the drawing board.",Sci/Tech,4,1.4878047
4073,"Trust Digital Inc., a McLean software company, is getting a new chief executive and \$3.1 million in new investments as it tries to expand its business making security software for wireless devices. &lt;FONT face=""verdana,MS Sans Serif,arial,helvetica"" size=""-2""\ color=""#666666""&gt;&lt;B&gt;-The Washington Post&lt;/B&gt;&lt;/FONT&gt;",Sci/Tech,4,1.6458197
4082,Users and developers anxious to get their hands on Microsoft SQL Server 2005 will have wait a little longer. Since early this year Microsoft said to expect the finished version of the product in the first half of 2005.,Sci/Tech,4,1.4384288
4083,"Customers that use the dual-core processors that Intel Corp. and Advanced Micro Devices Inc. (AMD) are expected to begin shipping next year will not need to buy extra licenses for Microsoft Corp. software, the software maker will announce Tuesday.",Sci/Tech,4,1.5934978
4084,"Advanced Micro Devices Inc. (AMD) is expected to unveil its most powerful desktop processors to date on Tuesday, a few days after rival Intel Corp. disclosed changes to its desktop processor road map.",Sci/Tech,4,1.4661384
4090,Symbol Technologies Tuesday launched a line of enterprise-class handheld devices aimed at mobile professionals such as retail managers and supply chain management professionals.,Sci/Tech,4,1.5621331
4093,"Sprint Corp. (FON.N: Quote, Profile, Research) on Tuesday reported a larger third-quarter loss due to a \$3.5 billion write-down in the value of its long-distance assets.",Business,3,1.413607
4105,"OCTOBER 19, 2004 (IDG NEWS SERVICE) - Customers that use the dual-core processors Intel Corp. and Advanced Micro Devices Inc. expect to ship next year won #39;t need to buy extra licenses for Microsoft Corp.",Sci/Tech,4,1.6112645
4111,"Microsoft (Quote, Chart) said it has clarified its software licensing policies to address a new trend in microprocessors and to keep the pressure on its rivals.",Sci/Tech,4,1.4043245
4116,The plunge in US insurance stocks widened to include companies such as Aetna Inc. and Humana Inc. on concern New York Attorney General Eliot Spitzer #39;s probe of the industry will drag down profits.,Business,3,1.4100505
4119," LOS ANGELES (Reuters) - No. 1 video game maker Electronic  Arts Inc on Tuesday reported higher quarterly profits on strong  demand for titles like Madden NFL 2005, but its stock price  fell after a holiday forecast fell short of Wall Street  expectations.",Business,3,1.563554
4123,"OT quot; gt; Motorola, the world #39;s second-largest maker of cellphones, said yesterday that its profit more than quadrupled in the third quarter and revenue jumped 26 percent compared with the quarter ",Business,3,1.383234
4136,"Lucent Technologies' population of retired workers has grown so large over the years, there are four retirees for every active employee on its payroll. With health insurance costs soaring, Lucent now is saying that it's time for retirees to help pay for the benefit.",Business,3,1.3943866
4138,A Colorado man who placed a  quot;transplant wanted quot; ad on a Massachusetts-based Internet site is expected today to receive a kidney donated by a total stranger who simply wanted to do  quot;something big. quot; The transaction marks the first time an organ transplant has been brokered by a commercial web company.,Business,3,1.5761993
4148,"Motorola Inc., the world's No. 2 maker of cell phones, on Tuesday said its quarterly profit\more than tripled, as sales rose 26 percent, driven in part by a host of new handset models and cost controls.",Sci/Tech,4,1.593406
4152,"AMD is expected to unveil its most powerful desktop processors to date this week, a few days after rival Intel disclosed changes to its desktop processor road map.",Sci/Tech,4,1.3935829
4161,"In effort to expand market share, firm says it will invest \$100M in Disney #39;s money-losing business. NEW YORK (Reuters) - Children #39;s Place Retail Stores Inc.",Business,3,1.4326675
4177,"The Istanbul technology is meant to replace MSN chat and Windows Messenger. Microsoft has not released much information on the technology, which may not reach market until next year or even later.",Sci/Tech,4,1.5065683
4194,Apple Computer (NASDAQ: AAPL) recently launched its Apple iTunes Store in Canada. But is a website really a store when all the company appears to be doing is charging different rates in each country?,Sci/Tech,4,1.5189781
4195,"Customers who use the dual-core processors that Intel and Advanced Micro Devices are expected to begin shipping next year will not need to buy extra licenses for Microsoft software, the software maker will announce next week.",Sci/Tech,4,1.5686592
4201,"Ten years after it unveiled its first dream house, Microsoft has a new demonstration home showcasing technology that Microsoft is betting will become commonplace within a few years.",Sci/Tech,4,1.5766927
4210,The steady decline in distillate fuel inventories comes as traders remain jittery about the world's strong demand and limited crude oil supply cushion.,Business,3,1.4880219
4214,"Three top Citigroup Inc. executives, including Vice Chairman Deryck Maughan, are leaving the financial services giant in the wake of a scandal at its Japanese private banking unit.",Business,3,1.4536488
4216,"By Bloomberg News. Cingular Wireless, which is buying AT amp;T Wireless, said yesterday that third-quarter sales rose 4.9 percent, to \$4.",Business,3,1.5624151
4219,"Lucent Technologies yesterday posted higher fiscal fourth- quarter earnings, helping lift the telecommunications equipment maker to its first profitable year since 2000.",Business,3,1.4279898
4222,"They #39;re bold, brash and break most rules of business -- so why are the Google guys multi-billionaires? GOOGLE Inc had plenty to celebrate at its recent annual summer picnic -- its debut as a public company ",Sci/Tech,4,1.5468601
4223,California #39;s top insurance regulator said Wednesday he will file a civil suit shortly in the widening scandal over insurance industry sales practices.,Business,3,1.4212965
4230,"USATODAY.com - Organized crime rings and petty thieves are flocking to the Internet like start-ups in the go-go '90s, establishing a multibillion-dollar underground economy in just a few years. The Internet's growth as an economic engine, particularly for financial transactions, is feeding the felonious frenzy.",Sci/Tech,4,1.4465176
4242,"AT amp;T Corp. swung to a third-quarter loss of \$7.12 billion after recording huge charges related to the company #39;s retreat from traditional telephone services, which has included at least 7,500 more job cuts ",Business,3,1.4067024
4244,"Texas Instruments Inc. today announced development of the wireless industry #39;s first digital TV on a single chip for cell phones, code-named  quot;Hollywood.",Sci/Tech,4,1.546078
4248,"roundup Plus: SGI works on Linux performance software...Good Technology supported by HP, Samsung...RealNetworks loss widens on litigation.",Sci/Tech,4,1.40293
4249,"Athletic shoe and apparel maker Reebok International Ltd. (RBK) on Thursday posted better-than-expected quarterly earnings, helped by improved sales due to acquisitions and the weak dollar.",Business,3,1.5014571
4254,Don #146;t let less-than-perfect credit prevent you from driving the car you want. Fill out a free loan application at Auto Net Financial and we #146;ll pre-arrange financing at a dealer near you.,Business,3,1.3955141
4263," SEATTLE (Reuters) - Microsoft Corp. &lt;A HREF=""http://www.investor.reuters.com/FullQuote.aspx?ticker=MSFT.O target=/stocks/quickinfo/fullquote""&gt;MSFT.O&lt;/A&gt;, the world's  largest software maker, on Thursday said its first quarter  profit climbed as personal computer sales and business demand  fueled higher sales.",Business,3,1.6613318
4264,"The Motley Fool - The lure of bundling services has been hanging over the communications industry for the past six years or so, although many companies have been unable to perfect a winning strategy. Bundling brings together services such as wired (local and long distance) and wireless phone service, Internet access, and satellite or cable television services.",Sci/Tech,4,1.6813984
4266," SAN FRANCISCO (Reuters) - Intel Corp. &lt;A HREF=""http://www.reuters.co.uk/financeQuoteLookup.jhtml?ticker=INTC.O qtype=sym infotype=info qcat=news""&gt;INTC.O&lt;/A&gt; on Thursday  said it has scrapped plan to enter the digital television chip  business, marking a major retreat from its push into consumer  electronics.",Sci/Tech,4,1.3973625
4269,"Disney and Viacom agreed to a fine of \$1.5 million from the Federal Communications Commission over claims their children #39;s cable television networks violated advertising restrictions, the FCC said Thursday.",Business,3,1.4278097
4278,"At Gartner Symposium ITXPO, Microsoft Chief Executive, Steve Ballmer touched on quite a few topics that are targeted towards Microsoft #39;s end consumers.",Sci/Tech,4,1.5795146
4284,"REDMOND, Washington, Oct 21 (AFP) - The world #39;s biggest software company, Microsoft Corp, said Thursday that its first quarter profits swelled to 2.9 billion dollars as consumers and businesses pumped up demand for new computers.",Business,3,1.679483
4292,WASHINGTON (CBS.MW) -- Qwest Communications on Thursday said it #39;s agreed to pay \$250 million to end a federal probe of allegedly fraudulent accounting practices used by former executives.,Business,3,1.5346502
4297,Thursday #39;s agreement between Qwest Communications and federal regulator settles allegations of  quot;massive financial fraud quot; at a price of \$250 million.,Business,3,1.4308487
4306,"Microsoft and Swatch announced a new line of wireless data watches named Paparazzi. The watches offer news, sports, weather and stock quotes, among other snippets of content, via Microsoft #39;s MSN Direct wireless data service.",Sci/Tech,4,1.5063721
4308," NEW YORK (Reuters) - Citigroup Inc. &lt;A HREF=""http://www.investor.reuters.com/FullQuote.aspx?ticker=C.N target=/stocks/quickinfo/fullquote""&gt;C.N&lt;/A&gt; on Friday said  U.S. securities regulators may recommend enforcement  proceedings against the former head of Citigroup Global  Investment Management.",Business,3,1.4082354
4311,"Primaris Airlines Inc. has announced plans to buy 20 Boeing 7E7-8 Dreamliners and 20 737-800s, a deal worth \$3.8 billion at list prices, the new low-cost business carrier and the Boeing Co.",Business,3,1.4476498
4316,"There is a strong trend for consumers to move away from using fixed-line phones in concert with mobiles to use mobile handsets for all or most of their voice calls, according to a study conducted for Finnish mobile handset maker Nokia by UK market ",Sci/Tech,4,1.5915933
4323,"OCTOBER 22, 2004 (IDG NEWS SERVICE) - Amazon.com Inc. fell a penny short of analysts #39; per-share earnings expectations, while reporting net sales of \$1.",Sci/Tech,4,1.4618292
4327," NEW YORK/SAN FRANCISCO (Reuters) - Shares of Google Inc.  rose as much as 20 percent on Friday, to trade at more than  twice the level of its cut-price IPO, after the Web search  leader posted strong quarterly results in its first reported  quarter as a public company.",Business,3,1.6406764
4346,"The \$41 billion merger between Cingular Wireless LLC and AT T Wireless Services Inc. won approval from the Federal Communications Commission Friday, according to federal sources close to the agency. &lt;BR&gt;\&lt;FONT face=""verdana,MS Sans Serif,arial,helvetica"" size=""-2""\ color=""#666666""&gt;&lt;B&gt;-The Washington Post&lt;/B&gt;&lt;/FONT&gt;",Sci/Tech,4,1.6349659
4349,Stock prices were pummeled by a toxic combination of still-rising oil prices and anxiety surrounding Eliot Spitzer #39;s probe of the insurance industry.,Business,3,1.5271641
4356,"Delta Air Lines Inc. could file for Chapter 11 bankruptcy protection as soon as next week, a source familiar with the matter said yesterday.",Business,3,1.4309775
4359,"NEW YORK Oct. 18, 2004 - People who use public or workplace computers for e-mail, instant messaging and Web searching have a new privacy risk to worry about: Google #39;s free new tool that indexes a PC #39;s contents for quickly locating data.",Business,3,1.5302835
4381,MAJOR Japanese computer maker Toshiba aimes to sell laptop computers that are loaded with its next generation DVD drive by next year.,Sci/Tech,4,1.5167227
4388,"Shareholders in Kidde, the fire protection group, have indicated they would be prepared to sell out if United Technologies Corporation (UTC), the US industrial conglomerate ",Business,3,1.3913705
4392," In finance, a process that requires a company to estimate the expected future value of a company #39;s pension assets and the expected cost of fulfilling pension and health care obligations to current and retired employees.",Business,3,1.4426992
4437,"MG Rover, the ailing British carmaker, has signed a binding agreement to hand over technology and know-how to the Shanghai Automotive Industry Corporation (SAIC).",Business,3,1.4094589
4442,I.B.M. plans to begin releasing a monthly report of threats to computer networks in an effort to establish an indicator similar to the federal governments Homeland Security Advisory System.,Sci/Tech,4,1.5009952
4451,"The \$41 billion merger between Cingular Wireless LLC and AT amp;T Wireless Services Inc. won approval from the Federal Communications Commission yesterday, according to federal sources close to ",Sci/Tech,4,1.6031492
4481,AP - South Korea's Hynix Semiconductor Inc. said Monday its third-quarter net profit more than tripled from same period last year thanks to steady global prices for memory chips.,World,1,1.4293556
4482,Cisco and Microsoft have gotten the word: IT managers are tired of constantly plugging security holes in their networks.,Sci/Tech,4,1.4381503
4486,A privately-owned Dutch steelmaker headed by billionaire Lakshmi Mittal is buying US-based International Steel Group Inc. for about \$4.,Business,3,1.3980925
4488,"WASHINGTON - Internet users at home are not nearly as safe online as they believe, according to a nationwide inspection by researchers.",Sci/Tech,4,1.4492995
4493,"washingtonpost.com - Think your PC is safe? Think again. A new study indicates your home computer is likely bogged down with spyware, viruses and other scourges wrought by hackers and PC pranksters. Ignorance may be bliss for some people, but for computer users, not knowing can be costly and inefficient.",Sci/Tech,4,1.491512
4496,"Texas power company TXU Corp. (TXU.N: Quote, Profile, Research) on Monday raised its dividend by 350 percent, boosted its earnings forecast and increased its share buyback program ",Business,3,1.4315652
4498,"\\Found this  via BoingBoing this morning:\\""The new Treo 650 is out today -- and as a long-time fan of the Treo, I've been\looking forward to it. I've asked in the past for ""one with everything"" -- a\phone with all the features I could want in one device, without\compromises. It looks like PalmOne delivered, with a 320x320 screen, removable\battery, upgraded OS, a better camera, and Bluetooth.""\\""Oops -- not quite! TreoCentral is reporting that the Sprint version of the\Treo 650 doesn't allow you to use Bluetooth for dial-up networking through\your computer. Apparently other carriers will, but not Sprint.""\\""You see, Sprint sells connection cards, which are PCCards that allow you to\dial up y ...\\",Sci/Tech,4,1.4484032
4501,"United Online Inc., a California-based provider of low-cost Internet subscription services, has agreed to buy Internet networking company Classmates Online Inc.",Business,3,1.723771
4502,One of the first pieces of malicious code targeting Apple's Mac OS X operating system has been discovered.\,Sci/Tech,4,1.4583694
4503,IBM on Monday plans to begin releasing a monthly report of threats to computer networks in an effort to establish an indicator similar to the US government #39;s Homeland Security Advisory System.,Sci/Tech,4,1.4842118
4506,Most users think their computer is safe from adware and spyware--but they #39;re wrong. A survey conducted by Internet service provider America Online found that 20 percent of home computers were infected by a ,Sci/Tech,4,1.5602623
4507,"Yahoo may glow in the halo effect of the popular Adobe Acrobat Reader, installed on more than 500 million computers. At 274 million users, Yahoo will leverage the partnership to try to oust ",Sci/Tech,4,1.5055478
4508,"The Federal Trade Commission won an important victory last week in its fight to protect consumers from spyware, the software that tracks unsuspecting Web surfers, bombards them with advertisements and sometimes even steal login information and passwords.",Business,3,1.4099712
4514,Cisco Systems announces an upgrade to its CallManager software to improve security on its IP telephony gear.,Sci/Tech,4,1.4174923
4515,"Adobe Systems Inc. ADBE.O and Yahoo Inc. YHOO.O on Monday said they have signed a deal to combine Adobe services, like its widely used document-sharing program, with Yahoo #39;s Web search functions.",Sci/Tech,4,1.4968559
