,Original_Text,Class_String,Class_Number,Neuron_22
1967,NewsFactor - Questions regarding potential patent issues and skepticism from the \open source community relating to Microsoft's (Nasdaq: MSFT) SenderID have prompted global Internet service provider AOL (NYSE: AOL) to drop the anti-spam technology.,Sci/Tech,4,0.64869666
1968,"ATI Technologies announced a technology that reduces the need for dedicated graphics memory, which could lead to lower PC system costs.",Sci/Tech,4,0.6308409
1978,"Graphics chipmaker ATI (Quote, Chart) unveiled a new technology it said lets its visual chips share system memory for graphics processing.",Sci/Tech,4,0.6753233
1984," #147;The single most effective way to avoid viruses and spyware is to simply chuck Windows altogether and buy an Apple Macintosh, #148; writes Walt Mossberg in the Wall Street Journal.  #147;There has never been a successful virus written for Mac OS X, and there is almost no spyware that targets the Mac. Plus, the Mac is invulnerable to viruses and spyware written for Windows. Not only is it more secure, but the Mac operating system is more capable, more modern and more attractive than Windows XP, and just as stable. #148; Sep 17",Sci/Tech,4,0.65946704
1986,"Record labels and Microsoft are in discussions about ways that the next generation of the Windows operating system, code-named Longhorn, can support copy-protected CD technology.",Sci/Tech,4,0.63501173
2082,Microsoft Corp. will allow governments around the world that use its software to have controlled access to the source code for its pervasive Microsoft Office 2003 desktop offerings for the first time.,Sci/Tech,4,0.6394981
2093,"Apple #39;s splashy digital music player has emboldened Microsoft and other technology titans to move quickly to the next frontier in portable entertainment: the video iPod, so to speak.",Sci/Tech,4,0.64934945
2104,"Sun Microsystems will hold its quarterly product launch this week, unleashing a raft of new hardware offerings spanning servers to storage.",Sci/Tech,4,0.6577408
2106,"&lt;p&gt;\&lt;/p&gt;&lt;p&gt; SAN FRANCISCO (Reuters) - The number of new viruses and\worms aimed at Microsoft Corp.'s &lt;MSFT.O&gt; ubiquitous Windows\operating system rose 400 percent between January and June from\the same year-earlier period, leading computer security company\Symantec said on Sunday.&lt;/p&gt;",Sci/Tech,4,0.6326216
2107,"Yahoo Launching Music Download Service This Year\\After its \$160 million aquisition of MusicMatch, Yahoo is expected to be releasing its own music download service at the end of the year. According to ZDNet, Yahoo has been in the development phase of its music download service since last year, working with ...",Sci/Tech,4,0.6440061
2113,"Cisco, IBM, Microsoft and SAP have the most loyal customers in IT, according to a report released today. The fact that they are some of the biggest, most successful IT vendors in ",Sci/Tech,4,0.6296016
2133,"AP - After years of battling Microsoft Corp., Sun Microsystems Inc. has set its sights on Linux vendors, seeking to jump into a low-end but high-volume market it's been accused of ignoring.",Sci/Tech,4,0.6651839
2151,"The European Space Agency says data collected by its probe, Mars Express, has provided new evidence in the search for life on Mars.",Sci/Tech,4,0.63037527
2165,"Apple Computer #39;s rack-mounted storage system received a vote of confidence Monday, with database giant Oracle endorsing the Xserve RAID as part of an initiative to cut storage costs.",Sci/Tech,4,0.65128475
2169,"SAN FRANCISCO -- Hoping to emerge from the shadow of its more popular rivals, Ask Jeeves Inc. is adding new tools for visitors to save and organize links to Web pages they find through the company's online search engine.",Business,3,0.6322956
2170,AP - Sony Corp. on Tuesday showed a smaller book-size PlayStation 2 going on sale worldwide next month that will help the Japanese electronics and entertainment giant cut costs as video-game consoles continue to drop in price.,Sci/Tech,4,0.62610424
2199,"Repairs to the oxygen generator onboard the International Space Station seemed to work, but then failed the following day. Astronauts are again limited to backup oxygen supplies. By Amit Asaravala.",Sci/Tech,4,0.6398816
2202,"From the 1950 #39;s until the present, one of the dominant companies in the world #39;s computer industry. Offers a variety of data processing hardware systems, system and application software, and information technology services.",Sci/Tech,4,0.7072612
2208,"Google results with links to books at Amazon.com, the Internet Movie Database, Google Images, and GuruNet.com, plus site information, including similar links that others have followed.",Sci/Tech,4,0.626908
2223,Apple will be getting some stiff competition in the coming year. A slew of manufacturers will soon offer players utilizing small 1 quot; hard drives that help propel the iPod and allow them to compete more favorably in the market.,Sci/Tech,4,0.63392484
2252,"SiliconValley.com - There's been a lot of innovation in online publishing lately, but regular Internet users might be scratching their heads at some of the lingo. Social software, blogs and RSS technology? What does it all mean?",Sci/Tech,4,0.6440605
2269,Cape Clear Software and Neon Systems Inc. on Wednesday announced they are working together to integrate their respective technologies and allow users to quickly integrate mainframe applications and data through the use of Web services.,Sci/Tech,4,0.68031615
2270,"In an effort to stop scams that cause unwitting Internet users to be charged premium rates for calls placed by software surreptitiously installed on their PCs, Ireland is going to block outgoing calls to 13 countries.",Sci/Tech,4,0.6709303
2272,"NetManage (Quote, Chart) agreed to acquire privately held Librados for an undisclosed sum. The deal would give NetManage application adapters to help its Host Services Platform server applications via service ",Sci/Tech,4,0.65471935
2289,"A new GAO report indicates that offshore outsourcing could hurt IT employment growth over the next decade, but the study released today is sprinkled with caveats and qualifiers and shows more study is needed.",Sci/Tech,4,0.635204
2294,"AP - For six years, iMacs have set the standard for the PC industry with eye-popping designs, clever utilization of space and leaps forward in usability. Lately, though, Apple Computer Inc. seems to be making more waves with iPod music players than its venerable consumer PCs.",Sci/Tech,4,0.65819114
2316,Land of the rising routers. Cisco Systems (nasdaq: CSCO - news - people ) and Fujitsu (otc: FJTSY - news - people ) will join forces to develop high-end routers for Internet networks in Japan.,Sci/Tech,4,0.62948793
2348,"This paper discusses the use of NetFlow, a traffic profile monitoring technology available on many routers, for use in the early detection of worms, spammers, and other abnormal network activity in large enterprise networks and service providers. Part 2 of 2.",Sci/Tech,4,0.6834169
2374,"Ireland #39;s telecom regulator said this week that is taking  quot;extraordinary quot; measures to protect internet users from rogue autodialer programs that hijack their modems and run up long-distance phone charges by suspending direct dialing to 13 countries, most ",Sci/Tech,4,0.65450966
2441,Microsoft Watch: Redmond had told developers privately earlier this year of plans to port some SP2 fixes to older versions of Windows.,Sci/Tech,4,0.6512505
2520,"After coming up with Gmail and Google News, rumours are rife that search engine Google is now working on a web browser, reports BBC.",Sci/Tech,4,0.6429641
2534,"AFP - Riding on the global success of PlayStation 2 (PS2), Sony has launched its first hand-held game console to challenge rival Nintendo, whose Game Boy Advance monopolizes the worldwide portable game market.",Sci/Tech,4,0.6277127
2555,"David Mott, a Dartmouth-educated Wall Street investment banker, is increasingly leveraging his reputation in the local and national biotech communities.&lt;br&gt;&lt;FONT face=""verdana,MS Sans Serif,arial,helvetica"" size=""-2"" color=""#666666""&gt;&lt;B&gt;-The Washington Post&lt;/b&gt;&lt;/font&gt;",Sci/Tech,4,0.6236704
2574,"Adobe has updated Photoshop #39;s support for digital cameras #39; RAW image formats. The new plug-in adds to the number of camera models supported and includes a utility for converting images into the DNG, digital negative format.",Business,3,0.6409322
2586,"McData plans to introduce a new SAN router this week designed to connect the growing number of isolated SAN networks in corporations.&lt;p&gt;ADVERTISEMENT&lt;/p&gt;&lt;p&gt;&lt;img src=""http://ad.doubleclick.net/ad/idg.us.ifw.general/sbcspotrssfeed;sz=1x1;ord=200301151450?"" width=""1"" height=""1"" border=""0""/&gt;&lt;a href=""http://ad.doubleclick.net/clk;9228975;9651165;a?http://www.infoworld.com/spotlights/sbc/main.html?lpid0103035400730000idlp""&gt;SBC Case Study: Crate   Barrel&lt;/a&gt;&lt;br/&gt;What sold them on improving their network? A system that could cut management costs from the get-go. Find out more.&lt;/p&gt;",Sci/Tech,4,0.64549357
2605,"SEPTEMBER 27, 2004 (COMPUTERWORLD) - CHICAGO -- Microsoft #39;s announcement of a disk-to-disk backup application designed to consolidate data backups on Windows servers positions the company to compete against storage management stalwarts such as Veritas ",Sci/Tech,4,0.6484676
2610,"ROUND ROCK, Texas -- Dell Inc. and America Online Inc. announced a partnership Monday to provide 5,000 low-income students with free refurbished personal computers and a year #39;s worth of Internet access.",Business,3,0.63619584
2611,"Cisco Systems is accelerating its push into the SMB market with the launch this week of entry-level switching modules, an aggregation switch and a Web-based management tool that helps smaller customers gain easier access to high-level features.",Sci/Tech,4,0.6584863
2618,"To boost performance for high-end users, Dell Inc. is upgrading its high-performance computing clusters by adding support for larger Topspin InfiniBand switches and PCIe host channel adapters.",Sci/Tech,4,0.65168
2635,"washingtonpost.com - Microsoft Corp. officials said yesterday that the company has spent millions of dollars preparing a version of its Windows operating system without a program for playing digital music and videos, in the event it loses its bid to postpone antitrust sanctions ordered by European authorities.",Sci/Tech,4,0.6421159
2669,"AOL has kicked off an initiative designed to make it easier for developers to engineer, test and distribute licensed AOL Instant Messenger (AIM) clients for mobile devices.",Sci/Tech,4,0.65708435
2673,"Microsoft and Amazon.com Monday filed one joint and several separate lawsuits against companies and individuals accusing them variously of trying to defraud consumers by imitating Amazon and Microsoft, the companies said Tuesday.",Sci/Tech,4,0.6244286
2707,"Mary Bellis Waller, now 64, posted on two Internet dating sites during her search for a companion. Waller was a pioneer of online dating among people her age, and thousands of others age 60 and older are also turning to the Internet to find romance.",Sci/Tech,4,0.6813407
2718,SEATTLE -- Amazon.com has filed three lawsuits in King County Superior Court against unidentified defendants who allegedly forged e-mails and Web sites to fool consumers into thinking they are doing business with the Internet retailer.,Business,3,0.62517965
2727,"An I.B.M. machine has reclaimed the title of fastest supercomputer, overtaking a Japanese computer that had caused shock waves at United States government agencies when it set a computing speed record in 2002.",Sci/Tech,4,0.6293463
2732,"NEW YORK - In a harbinger of security threats to come, hackers have exploited a newly announced flaw in Microsoft Corp. programs and begun circulating malicious code hidden in images that use the popular JPEG format.",Sci/Tech,4,0.63946104
2764,"MacCentral - Apple has improved the services offered to subscribers of .Mac. Previously, the amount of storage for a basic .Mac account was 100MB, with a maximum of 15MB for e-mail. The service's base online storage has been increased to 250MB, e-mail service has been enhanced, and the cost of upgrading has been reduced. .Mac's basic subscription price remains the same -- US #36;99.95 per year.",Sci/Tech,4,0.6410243
2776,Want a full-fledged Windows XP computer that's about the size of a Pocket PC? Tiny machine debuts after two years of delay.,Sci/Tech,4,0.6482057
2797,"Researchers are developing tiny atomic clocks that could be made using standard semiconductor processes and slipped into cellphones, hand-held computers and global positioning system receivers.",Sci/Tech,4,0.6290177
2799,InfoWorld - Security experts have spotted the first attempts to create an Internet worm that propagates using instant messages and exploits a recently disclosed flaw in Microsoft software.,Sci/Tech,4,0.65916073
2804,"In a move to add more open-source arrows to its quiver, Linux seller Red Hat has acquired the Netscape server software products of AOL Time Warner, the companies plan to announce Thursday.",Sci/Tech,4,0.62306035
2811,"Microsoft and Amazon.com have joined forces to take legal action against US and Canadian-based companies for allergy sending fraudulent e-mails to Amazon and Hotmail users, claiming to represent these companies.",Sci/Tech,4,0.6341832
2842,"A flurry of space tourism milestones and announcements in recent days signals that human spaceflight is shifting from governments to the private sector, space experts say.",Sci/Tech,4,0.6471535
2844,"PalmSource #39;s latest iteration of the Palm OS operating system, code named Cobalt, is expected to be available in consumer mobile phone devices in the first half of 2005.",Sci/Tech,4,0.6426516
2862,"NewsFactor - Red Hat (Nasdaq: RHAT) has acquired Netscape \server-software products of AOL Time Warner (NYSE: AOL), as part of the Linux vendor's ""open-source architecture"" strategy.",Sci/Tech,4,0.65911573
2882,"More PCs run the alternative OS, but many will end up with a pirated version of Windows, report says. Linux may be shipping on a growing number of PCs sold in the emerging markets of Asia, Latin America, and Eastern Europe.",Sci/Tech,4,0.6415804
2886,"Microsoft just swears that it hasn #39;t given up on Internet Explorer and that it #39;s really, really important to the future of Microsoft, to the next version of Windows, etc.",Sci/Tech,4,0.6527886
2910,"The two companies say they will jointly develop a set-top box to download movies over the internet. Netflix will arrange the movie licensing from Hollywood studios, and TiVo will take care of the product technology.",Sci/Tech,4,0.6385961
3004,"WASHINGTON: The US space agency NASA has put off resumption of space shuttle flights from March until at least May, the agency has said.",Sci/Tech,4,0.64195657
3034,"Comprehensive security programs that include firewall software, spyware defenses and diagnostic and repair tools are necessay to keep a PC in good health these days. &lt;FONT face=""verdana,MS Sans Serif,arial,helvetica"" size=""-2"" color=""#666666""&gt;&lt;B&gt;-The Washington Post&lt;/B&gt;&lt;/FONT&gt;",Sci/Tech,4,0.72754425
3056,"AP - There's no space in the space station. With no garbage pickup by shuttles for nearly two years, the international space station is looking more and more like a cluttered attic.",Sci/Tech,4,0.6223219
3073,"PalmOne #39;s Tungsten T5 comes with 256MB of flash memory, so you never risk losing your data. If you #39;re a pack-rat type who likes to keep a lot of data you can #39;t afford to lose on your personal digital assistant, PalmOne has a handheld for you.",Sci/Tech,4,0.63156086
3128,"OWEGO, United States : A group of technology and telecommunications heavyweights led by Lockheed Martin Corp has won a potential three billion dollar contract from the US Postal Service to revamp its vast data communication networks, Lockheed Martin said.",Business,3,0.65706074
3197,"PalmOne Inc., the leading maker of handheld computers, said Tuesday it licensed Microsoft Corp. software that enables secure delivery of corporate e-mail to portable devices.",Sci/Tech,4,0.67419183
3199,"palmOne has licensed Microsoft #39;s Exchange Server ActiveSync protocol for use on future Treo devices, allowing for wireless server synchronization.",Sci/Tech,4,0.6653001
3220,Semiconductor stocks were mixed Tuesday after Advanced Micro Devices Inc. warned quarterly revenue would be lower than expected due to sluggish sales of flash memory chips used in mobile phones and other devices.,Business,3,0.659096
3222,The Amazon Web Services (AWS) division of online retail giant Amazon.com yesterday released Amazon E-Commerce Service 4.0 and the beta version of Alexa Web Information Service.,Sci/Tech,4,0.6851494
3278,"MOJAVE, Calif. - The private manned rocket SpaceShipOne (search) streaked toward space early Monday in a bid to top an altitude of 62 miles for the second time in six days and claim the \$10 million Ansari X Prize (search).",Sci/Tech,4,0.6260943
3287,"roundup Plus: Microsoft ships Virtual PC 7...SGI warns of lower revenue, deeper loss...SAP taps search technology.",Sci/Tech,4,0.6584914
3290,"IBM Corp. and four partners on Wednesday announced what they call a ""major breakthrough"" in identity management designed to help business and government agencies protect assets, including IT systems and physical facilities, from unauthorized users.",Sci/Tech,4,0.65840214
3292,"The Department of Homeland Security has filled the nation's top cyber-security post after the previous chief abruptly resigned last week, choosing the former director's deputy to take over the position. &lt;FONT face=""verdana,MS Sans Serif,arial,helvetica"" size=""-2"" color=""#666666""&gt;&lt;B&gt;-washingtonpost.com&lt;/B&gt;&lt;/FONT&gt;",Sci/Tech,4,0.63585496
3306,"AP - Howard Schmidt, a highly regarded technology executive who was former special adviser to President Bush for cybersecurity, is returning to work with the Homeland Security Department on efforts to protect the nation's computer networks.",World,1,0.6312531
3334,"Honeywell has issued lawsuits against 34 companies, including Dell, Apple, Sony and Toshiba alleging LCD panels used in their products infringe a 1992 patent the company holds.",Business,3,0.62308407
3371,"Nokia Corp. has no immediate plans to use Intel Corp.'s processors in its handsets, the Finnish phone maker said Thursday, tempering an announcement earlier this week that Intel is building a reference design for a Symbian OS (operating system) mobile phone based on Nokia's Series 60 user interface.",Sci/Tech,4,0.6872929
3375,"New Trojan Targets Adware\\Antivirus maker Symantec has reported the arrival of a spooky Trojan Horse online, which does something unique. Codenamed Downloader.Lunii, it attacks and even removes advertisement enabled softwares, which are generally considered harmful for the system. On execution of the code, it tries to kill the processes associated ...",Sci/Tech,4,0.62360567
3429,Sprint and Fuji Photo Film USA recently introduced a new service that lets Sprint #39;s Picture Mail customers send digital camera phone pictures from their online Picture Mail ,Sci/Tech,4,0.6269325
3435,InfoWorld - Microsoft and Sun Microsystems on Thursday are publishing a specification to leverage Web services for managing a broad range of IT systems including PCs and devices on a network.,Sci/Tech,4,0.6875779
3456,Yesterday we covered the news that Google is expanding their search to the mobile arena with their new Google SMS service which lets you search by sending text messages from your cellphone.,Sci/Tech,4,0.6398877
3459,"The Cassini spacecraft in orbit around Saturn caught a glimpse of Tethys, a cratered, icy moon. Notable for Tethys are its split fissure and enormous crater, both of which leave the impression that its fragile surface is remaking itself slowly...",Sci/Tech,4,0.65352345
3470,"October 8, 2004 - Dell Inc. is recalling about 2.9 million AC adapters nationwide_ 4.4 million worldwide_ used with notebook personal computers because they can overheat and cause a fire and electrical shock ",Sci/Tech,4,0.6242126
3472,"LOS ANGELES - NASA #39;s Mars rover, Opportunity, has found more signs that rocks on the Red Planet were once submerged in water. Data sent by Opportunity suggest a crater was drenched a second time after drying out, scientists said.",Sci/Tech,4,0.6695734
3478,SAN FRANCISCO - Representatives for the music and movie industries have filed a petition asking the U.S. Supreme Court to overturn an appeals court decision in which companies that enable peer-to-peer (P-to-P) file trading networks were absolved of liability for copyright violations by users of those networks.,Sci/Tech,4,0.6997611
3502,"While some handheld computers have GPS capabilities, not nearly as many people carry a PDA as the legions who've adopted cell phones as a daily appendage. That's why the notion of adding GPS navigation to a cell phone, as Nextel has with a service called TeleNav, seems appealing.",Sci/Tech,4,0.63615316
3535,"Microsoft has suspended the beta testing of the next version of its MSN Messenger client because of a potential security problem, a company spokesperson says.",Sci/Tech,4,0.63009024
3588,"Putting some truth to the rampant rumours that Google was getting into the instant messaging business, the company has announced the beta test release of Google SMS, the mobile phone equivalent of IM.",Sci/Tech,4,0.6347247
3602,"Computer users could stop most viruses and cyber attacks by fixing a small number of common flaws, according to new research. Viruses, spam and distributed denial of service attacks could ",Sci/Tech,4,0.6999314
3605,"Only 4 percent of Americans have ever used the Internet to buy prescription drugs - and even fewer do so through foreign pharmacies - despite Web sites maintained by a handful of states to help citizens import medicines more cheaply from Canada, a new study finds.",Sci/Tech,4,0.6231781
3617,"PARIS The open-source computer system known as Linux won a tough battle over Microsoft earlier this year when the city of Munich decided to change the operating software of 14,000 government computers, despite the personal intervention of Steve Ballmer ",Business,3,0.6742388
3623,Ziff Davis - Silicon Graphics Inc. will ship a new ultra high performance Intel Itanium-based Linux workstation designed for scientific and medical applications.,Sci/Tech,4,0.6661508
3655,"Court documents show federal prosecutors have told lawyers for former WorldCom Inc. chief executive Bernard J. Ebbers that they plan to argue he lied about the telecommunications giant's financial condition in order to get personal loans. &lt;FONT face=""verdana,MS Sans Serif,arial,helvetica"" size=""-2""\ color=""#666666""&gt;&lt;B&gt;-The Washington Post&lt;/B&gt;&lt;/FONT&gt;",Sci/Tech,4,0.6834951
3667,Large VGA screen; great graphics; included gaming bundle; Windows Media Player 10.0 Mobile; fast processor and ample memory; integrated Wi-Fi and Bluetooth; sleek design; user-replaceable battery.,Sci/Tech,4,0.67384833
3671,"Microsoft Corp. MSFT.O on Tuesday unveiled a new version of its Windows XP Media Center, adding features such as instant messaging and high-definition television to a personal computer designed for the living room.",Business,3,0.6374374
3681,Microsoft has warned of seven newly found flaws in its software that could allow an attacker to steal data and take over a personal computer running the Windows operating system.,Sci/Tech,4,0.6551668
3690,"Software maker heads to LA to show off a host of gadgets that use one or another Microsoft technology to access movies, music and video.",Sci/Tech,4,0.6665554
3703,"Homeland Security Secretary Tom Ridge said yesterday that the role of overseeing computer security and the Internet should have a higher profile at the agency, in the face of increasing concern from technology executives and experts that cyber-security is getting inadequate attention.",Sci/Tech,4,0.63940537
3706,The Federal Trade Commission formally announced yesterday its first assault against spyware - bits of computer code that surreptitiously install themselves on the computers of Internet users ,Sci/Tech,4,0.64204824
3726,A company called MXS announced a new software emulator called Cherry OS that makes it possible to install Mac OS X onto x86 hardware (running Windows).,Sci/Tech,4,0.66113114
3757,"The iPod helped Apple's profit get up and dance. Apple Computer Inc. reported Wednesday that net income for its fourth fiscal quarter jumped 140 percent from the same period a year ago. &lt;BR&gt;&lt;FONT face=""verdana,MS Sans Serif,arial,helvetica"" size=""-2""\ color=""#666666""&gt;&lt;B&gt;-The Washington Post&lt;/B&gt;&lt;/FONT&gt;",Sci/Tech,4,0.7183488
3787,"Bill Gates predicts a\future for the entertainment industry in which traditional\broadcast television is rendered irrelevant. It's a positive\vision, however, because new and better business models made\possible by technology are emerging.",Sci/Tech,4,0.6266
3811,"It enables people to retrieve E-mail from Outlook and Outlook Express, documents from Microsoft Office, chat sessions from AOL IM, and Web pages viewed with Internet Explorer.",Sci/Tech,4,0.65367204
3816,"Intel Corp. has confirmed its near-term plans for its desktop processors before it reaches the multicore era. The company will not release a 4GHz version of its flagship Pentium 4 product, having decided instead to realign its engineers around the company's new design priorities, an Intel spokesman said Thursday.",Sci/Tech,4,0.6830269
3824,"October 14, 2004 - Microsoft is set to release its Windows Media Center Extender for Xbox mid-November. The device will allow you to view recorded and downloaded media content stored on your PC via your Xbox.",Sci/Tech,4,0.66784024
