,Original_Text,Class_String,Class_Number,Neuron_7
5460," NEW YORK (Reuters) - Federated Department Stores Inc.  &lt;A HREF=""http://www.investor.reuters.com/FullQuote.aspx?ticker=FD.N target=/stocks/quickinfo/fullquote""&gt;FD.N&lt;/A&gt;, parent of Macy's and Bloomingdale's, posted  higher-than-expected quarterly earnings on Wednesday, as the  company rebounded from the Florida hurricanes.",Business,3,1.3748112
5481,THE Bank of England yesterday cut its forecast for UK economic growth next year to 2.5 per cent and said inflation could be below expectations.,Business,3,1.4555763
5483," TOKYO (Reuters) - The Nikkei average was up 0.37 percent in  mid-morning trade on Thursday as a recovery in the dollar  helped auto makers among other exporters, but trade was slow as  investors waited for important Japanese economic data.",Business,3,1.4541944
5493,"Intel Corp., the world #39;s biggest computer-chip maker, doubled its quarterly dividend and boosted its stock buyback program by \$11.",Business,3,1.4018703
5506,"South African mining giant Gold Fields lost a high court bid to halt a hostile takeover by rival Harmony Gold, which is seeking to create the world #39;s biggest gold producer, a court official said.",Business,3,1.3479663
5518,"Jones Apparel Group said Thursday it struck a deal to acquire Barneys New York Inc., agreeing to pay \$400 million for the upscale clothing retailer #39;s outstanding stock and debt.",Business,3,1.3891414
5530,"Target Corp. , the No. 2 US discount retailer, on Thursday posted a higher quarterly profit on stronger sales and gains from selling its Mervyn #39;s department store chain, and forecast 2004 would end well.",Business,3,1.3604503
5540," CHICAGO (Reuters) - Pilots at Delta Air Lines Inc. &lt;A HREF=""http://www.investor.reuters.com/FullQuote.aspx?ticker=DAL.N target=/stocks/quickinfo/fullquote""&gt;DAL.N&lt;/A&gt;  on Thursday ratified a concession package that will save the  carrier \$1 billion a year, in a move the company hopes will buy  it time to restructure outside of bankruptcy.",Business,3,1.4355574
5580,"SAN FRANCISCO (CBS.MW) -- Pilots at Delta Air Lines approved a management-backed pay cut that will save the airline \$5 billion over the next five years, the pilots union said Thursday.",Business,3,1.4424316
5592,"AFP - The French economy hit a rough patch in the third quarter, throwing the government's full-year growth target into question amid signs of an economic slowdown in the 12-nation eurozone.",Business,3,1.3456432
5618,"New York Attorney General Eliot Spitzer on Friday filed suit against Universal Life Resources (ULR), charging the life and disability insurance broker with taking fraudulent kick-backs for steering business to certain insurers ",Business,3,1.35268
5621," NEW YORK (Reuters) - SunTrust Banks Inc. &lt;A HREF=""http://www.investor.reuters.com/FullQuote.aspx?ticker=STI.N target=/stocks/quickinfo/fullquote""&gt;STI.N&lt;/A&gt;, which  fired three executives over its accounting for bad loans, on  Friday restated first-half profit higher by \$25.1 million, more  than it had forecast, to fix the mistakes.",Business,3,1.3520569
5638, Federal Reserve officials agreed at a meeting in September that they probably would keep raising their benchmark interest rate in coming quarters because of the likelihood of continued solid economic growth.,Business,3,1.3702486
5666,NEW DELHI : Indian Prime Minister Manmohan Singh pledged to try to shield the poor by keeping down prices of essential goods amid rising inflation.,Business,3,1.3587863
5739," CHICAGO (Reuters) - Wm. Wrigley Jr. Co. &lt;A HREF=""http://www.investor.reuters.com/FullQuote.aspx?ticker=WWY.N target=/stocks/quickinfo/fullquote""&gt;WWY.N&lt;/A&gt; is buying  the Life Savers and Altoids candy and mint businesses from  Kraft Foods Inc. &lt;A HREF=""http://www.investor.reuters.com/FullQuote.aspx?ticker=KFT.N target=/stocks/quickinfo/fullquote""&gt;KFT.N&lt;/A&gt; for \$1.48 billion in cash, the  companies said on Monday.",Business,3,1.4997379
5755,"LONDON (CBS.MW) -- European markets saw a moderate advance in early trade Monday, carrying over some of the late-session rally on Wall Street and helped by steel group Arcelor #39;s view of Chinese demand.",Business,3,1.3381096
5775,"  WASHINGTON (Reuters) - U.S. regulators filed fraud charges  on Monday against former Hollinger International Inc. &lt;A HREF=""http://www.investor.reuters.com/FullQuote.aspx?ticker=HLR.N target=/stocks/quickinfo/fullquote""&gt;HLR.N&lt;/A&gt;  Chairman Conrad Black and his deputy, David Radler, moving to  bar the two from serving as officers of a public company.",Business,3,1.3722111
5776,"Home improvement retailer Lowe #39;s Cos. (LOW.N: Quote, Profile, Research) on Monday reported a 15 percent rise in third-quarter profit, aided by its expansion to New York ",Business,3,1.3720022
5807,"CHICAGO (CBS.MW) -- Wm. Wrigley Jr. Co. said Monday that it #39;s getting into the candy business via a \$1.48 billion acquisition of the Life Savers and Altoids brands, among others, from Kraft Foods Inc.",Business,3,1.3666098
5842, NEW YORK (Reuters) - U.S. stocks opened lower on Tuesday  after a government report showing a much larger-than-expected  rise in U.S. producer prices in October raised inflation  concerns.,Business,3,1.457767
5843,"Crude oil fell to the lowest price in almost two months after Iran, OPEC #39;s second-biggest oil producer, said it would stop enriching uranium to ward off US calls for sanctions.",Business,3,1.3486311
5865, NEW YORK (Reuters) - Two senior insurance underwriters at  Zurich American Insurance Co. pleaded guilty  on Tuesday to  misdemeanors related to bid-rigging in the insurance market.,Business,3,1.3482996
5883,Crude oil futures fell Tuesday after moving above \$47 US a barrel in intraday trading. December delivery crude on the New York Mercantile Exchange dropped 76 cents to \$46.11 per barrel.,Business,3,1.4445852
5916,"AFP - US oil major ConocoPhillips has boosted its stake in Russia's second-largest oil producer LUKoil to 10 percent, giving Conoco at least one representative on LUkoil's board.",World,1,1.3634896
5919,"The US Treasury Secretary pledges commitment to a strong dollar, as the currency hits another record low against euro.",Business,3,1.4578689
5932," WASHINGTON (Reuters) - U.S. housing starts jumped a  larger-than-expected 6.4 percent in October to the busiest pace  since December as buyers took advantage of low mortgage rates,  a government report showed on Wednesday.",Business,3,1.4234054
5942,"Shares of local companies Martha Stewart Living Omnimedia and Vornado Realty Trust were boosted by news that Sears and Kmart will merge in an \$11 billion deal, creating a new company called Sears Holdings with about \$55 billion in yearly revenue and ",Business,3,1.4148868
5952," NEW YORK (Reuters) - U.S. stocks ended higher on Wednesday  after Kmart's plan to buy Sears in an \$11.5 billion deal was  announced and computer maker Hewlett-Packard Co. &lt;A HREF=""http://www.investor.reuters.com/FullQuote.aspx?ticker=HPQ.N target=/stocks/quickinfo/fullquote""&gt;HPQ.N&lt;/A&gt; posted  solid earnings.",Business,3,1.5616547
5969,"Reuters - The dollar was in striking distance of\record lows against the euro and 7-    month lows versus the\yen on Thursday, as traders concluded that nations at an\upcoming G20 meeting would tolerate a weaker dollar.",Business,3,1.3994722
5978,"Stocks closed higher on Wall Street as investors welcomed the merger of Kmart Holding Corp. and Sears. However, climbing oil prices restricted gains.",Business,3,1.6384302
5981,"AFP - Despite India's economic boom in software and outsourcing services, economists have warned the government needs more reforms to create jobs in manufacturing to cut poverty.",World,1,1.3471915
5986,"WASHINGTON -- The two founders of the Pilgrim Baxter mutual fund family have agreed to pay \$80 million each to settle regulators' charges of improper trading to benefit themselves and friends at the expense of longer-term shareholders, the authorities said yesterday.",Business,3,1.4263419
5987,"A month after federal regulators adopted sweeping new rules for mutual fund oversight, fund trustees remain concerned about their ability to serve as watchdogs over fund managers and others who handle investor money, a new survey shows.",Business,3,1.3786739
5994,Stocks bounded higher Wednesday as investors shrugged off a fresh indicator of rising inflation and welcomed postitive economic reports and the merger of Kmart Holding Corp.,Business,3,1.5709337
5996,"PENNY-PINCHING American Airlines is to remove the pillows from half its planes to save \$300,000 (163,000) a year. While the cost savings are small beer compared with the \$4bn a year American has slashed ",Business,3,1.424683
5998,"Houston, Nov 17 : US authorities are probing if Linda, wife of ex-Enron Chairman Ken Lay, acted improperly when she had their family foundation sell 1.3 million Enron stocks just days before the energy giant #39;s bankruptcy.",Business,3,1.4180666
6015," CHICAGO (Reuters) - Shares of Medtronic Inc. &lt;A HREF=""http://www.investor.reuters.com/FullQuote.aspx?ticker=MDT.N target=/stocks/quickinfo/fullquote""&gt;MDT.N&lt;/A&gt; on  Thursday sank 7 percent to their lowest level in more than  three months after the medical device maker posted  weaker-than-expected growth in one of its key business units,  sparking at least three broker downgrades.",Business,3,1.3996589
6066,"Kmart Holding Corp and Sears, Roebuck and Co said Wednesday that they are merging to form a new retail company called Sears Holdings Corp that will be the US #39; third-largest retailer with about US\$55 billion in annual revenues.",Business,3,1.4083707
6074,German Finance Minister Eichel called for the euro #39;s  quot;brutal quot; rise versus the dollar to be put on the agenda of the summit of G20 countries in Berlin this weekend amid concerns the greenback #39;s slide could hit EU growth.,Business,3,1.3430498
6104,AFP - US Federal Reserve chairman Alan Greenspan said the United States' huge current account deficit cannot be indefinitely financed by foreign countries and investors.,Business,3,1.361054
6131,"Russia pressed ahead yesterday with controversial plans to break up the country #39;s biggest oil company Yukos, setting a date of December 19 for an auction of its main production unit at a bargain basement starting price of \$8.65bn (4.88bn).",Business,3,1.4450551
6173, WASHINGTON (Reuters) - The U.S. Congress asked the  Securities and Exchange Commission on Saturday to send  lawmakers a report justifying a new rule forcing mutual fund  boards to have independent chairmen.,Business,3,1.4212362
6224,SYDNEY (Dow Jones)--Australian building products manufacturer James Hardie Industries NV (JHX) surprised investors Monday by reporting a 9.5 drop in net profit for ,Business,3,1.3487937
6230,"Wal-Mart Stores Inc. said a surge in after-Christmas shopping spurred December same-store sales gains of about 3 percent, at the high end of its forecast. Kmart Holding Corp. said profit rose 10 percent during the holiday season after it limited deep discounts.",Business,3,1.419065
6243,"Swiss mining group Xstrata PLC Monday launched a hostile 7.4 billion Australian dollar (US\$5.8 billion; euro4.4 billion) bid for uranium and copper miner WMC Resources LTD, increasing pressure on the independent Australian miner.",Business,3,1.4851005
6256,"Campbell Soup Co. (CPB.N: Quote, Profile, Research) on Monday posted a better-than-expected 9 percent rise in profit, sending shares to a near three-year high, as heavy promotions and product improvements spurred soup sales.",Business,3,1.3569435
6258,"Reuters - Stelco Inc.\(STEa.TO) has lost a contract to supply steel to General Motors\Inc. , its biggest customer, because the insolvent\Canadian steelmaker failed to strike a deal with its workers,\the union at Stelco said on Monday.",Business,3,1.3347055
6265,"Reuters - Stelco Inc. (STEa.TO) has lost a\contract to supply steel to its biggest customer General Motors\Corp. , the company said on Monday, after the insolvent\Canadian steelmaker failed to strike a deal with its workers.",Business,3,1.3415592
6272," NEW YORK (Reuters) - U.S. stocks rose on Monday as a higher  price target for shares of Apple Computer Inc. &lt;A HREF=""http://www.investor.reuters.com/FullQuote.aspx?ticker=AAPL.O target=/stocks/quickinfo/fullquote""&gt;AAPL.O&lt;/A&gt;  prompted enthusiasm for technology stocks and a rally in crude  oil stalled.",Business,3,1.4035696
6290,Donald Trump #39;s flagship casino business yesterday filed for bankruptcy as part of a financial restructuring aimed at easing \$1.8bn (1m) debt.,Business,3,1.5162412
6296,"Mining giant BHP Billiton has completed a bigger-than-expected A\$2.27 billion (950 million pound) share buyback, driving up its stock price as investors reinvest profits from the tax-efficient deal.",Business,3,1.491135
6300,The war of words between Mylan Laboratories Inc. and the company #39;s largest shareholder over Mylan #39;s \$4 billion deal to acquire King Pharmaceuticals Inc.,Business,3,1.4252709
6435,"Shareholders in Yukos are considering liquidation or filing for bankruptcy, after deciding against a rescue plan for the embattled Russian oil firm.",Business,3,1.3615441
6464,"By Bloomberg News. WR Grace  amp; Company, a producer of chemicals and building material that filed for bankruptcy protection in 2001 amid thousands of asbestos-related claims, said yesterday ",Business,3,1.3494508
6475,"Angry over unfair subsidies paid to US companies from tariffs collected on goods imported here, the WTO has widened the gap with Congress by imposing sanctions of their own.",Business,3,1.3684313
6508,"BRUSSELS (AFP) - Eurozone figures due out this week will confirm that confidence is slumping due to high oil prices and the rise of the euro, and that inflation is easing, economists said.",Business,3,1.4209114
6554,"Wal-Mart, the world #39;s largest retailer, has lowered its November growth forecast amid concerns that fuel costs may slow down Christmas retail sales.",Business,3,1.4169886
6561, NEW YORK (Reuters) - Oil prices slid 3 percent on Monday on  expectations that more mild U.S. weather at the start of the  New Year will limit heating oil demand.,Business,3,1.3393209
6591,"President Bush on Monday chose Carlos Gutierrez, the Cuban-born CEO of Kellogg Co (KN: Quote, Profile, Research) , as his nominee to be commerce secretary, his second selection of a Hispanic for a second-term Cabinet.",Business,3,1.3636435
6612,Gold Fields Ltd. won an appeal on Friday in its battle to stave off a hostile \$7.1 billion takeover by Harmony Gold Mining Co. that would create the world #39;s largest gold mining company.,Business,3,1.3782411
6629,"The newly-created oil unit of Russian gas monopoly OAO Gazprom, Gazpromneft, will take part in the auction of the embattled Yukos oil company #39;s largest unit, Yuganskneftegaz, Dow Jones NewsWires reported Tuesday, citing the news agency Prime-Tass.",Business,3,1.4990165
6646,"US meat processor Smithfield Foods has reported higher second-quarter earnings, as higher hog prices offset lower pork margins and a loss in its beef operations.",Business,3,1.4342774
6680,At least 100 Delta Air Lines (nyse: DAL - news - people ) pilots are expected to retire effective Wednesday. That #39;s the starting date for the 32.5 pay cut agreed upon under Chief Executive Gerald Grinstein #39;s master plan.,Business,3,1.3748815
6693," CHICAGO (Reuters) - U.S. regulators warned Cyberonics Inc.  &lt;A HREF=""http://www.investor.reuters.com/FullQuote.aspx?ticker=CYBX.O target=/stocks/quickinfo/fullquote""&gt;CYBX.O&lt;/A&gt; of manufacturing deficiencies at the Houston plant  that makes its sole product, an implantable device to treat  epilepsy, the company said on Monday.",Business,3,1.4221865
6724," DETROIT (Reuters) - Ford Motor Co. &lt;A HREF=""http://www.investor.reuters.com/FullQuote.aspx?ticker=F.N target=/stocks/quickinfo/fullquote""&gt;F.N&lt;/A&gt; on Wednesday  reported its sixth straight month of weaker vehicle sales,  prompting the second-largest U.S. automaker to further cut  production of cars and trucks, while Chrysler posted another  sales gain.",Business,3,1.5056008
6725," NEW YORK (Reuters) - U.S. stocks rose on Wednesday as crude  oil futures fell more than \$2 a barrel on a big jump in U.S.  petroleum supply, easing worries about the impact of energy  costs on corporate profits and economic growth.",Business,3,1.6199679
6784,"The European Central Bank surprised financial markets on Thursday by revealing it had considered raising interest rates even as the euro zone economy slows, saying it is worried about inflationary risks.",Business,3,1.3517966
6789,A US government advisory panel is to recommend a revision to the minimum level of crude inventories required to ensure adequate supplies of crude oil to the nation #39;s refiners to produce gasoline ,Business,3,1.381343
6790," SAN FRANCISCO (Reuters) - Oracle Corp. &lt;A HREF=""http://www.investor.reuters.com/FullQuote.aspx?ticker=ORCL.O target=/stocks/quickinfo/fullquote""&gt;ORCL.O&lt;/A&gt; is in  merger talks with other technology companies as it awaits the  outcome of its \$9.2 billion hostile takeover bid for rival  software maker PeopleSoft Inc. &lt;A HREF=""http://www.investor.reuters.com/FullQuote.aspx?ticker=PSFT.O target=/stocks/quickinfo/fullquote""&gt;PSFT.O&lt;/A&gt;.",Business,3,1.4625041
6791," NEW YORK (Reuters) - Albertsons Inc. &lt;A HREF=""http://www.investor.reuters.com/FullQuote.aspx?ticker=ABS.N target=/stocks/quickinfo/fullquote""&gt;ABS.N&lt;/A&gt;, the No. 2  U.S. grocer, on Thursday posted higher quarterly profit, but  warned that full-year earnings could hit the low end of its  estimates due to competition and skittish consumers, sending  shares down 6 percent.",Business,3,1.4116193
6810,"NTL, the UKs largest cable company, has agreed to sell its radio and television broadcasting business for 1.27bn to a fund managed by Australias Macquarie Bank.",Business,3,1.4910245
6814,"Britain #39;s biggest cable company, NTL, agreed yesterday to sell its radio and television broadcasting business for 1.27bn to a consortium led by a fund managed by Australia #39;s Macquarie Bank.",Business,3,1.45458
6819,"The Securities and Exchange Commission yesterday filed civil fraud charges against three former Kmart Corp. executives and five employees of companies that supplied the Troy, Mich., retail chain, accusing them of scheming to inflate Kmart's profit by \$24 million in 2001.",Business,3,1.3397692
6862,"The U.S. dollar fell to another new low against the euro Friday, pushing the European currency higher than \$1.34 after U.S. employment data came in weaker than expected.",Business,3,1.4068589
6878,"Halifax yesterday became the the first major lender to predict widespread falls in house prices across Britain next year. Reporting that house prices fell again last month, Britain #39;s biggest mortgage lender ",Business,3,1.562965
6900,Stocks edged higher Friday as another drop in oil prices helped Wall Street withstand the effects of a disappointing jobs creation report.,Business,3,1.3826311
6961, LONDON (Reuters) - Oil prices sank to a four-month low  below \$41 for U.S. crude on Wednesday after leading OPEC  producer Saudi Arabia questioned the need for the cartel to  curb supplies.,Business,3,1.3755102
6969,Canadian mining firm Farallon Resources Ltd. on Wednesday said it agreed to privately sell about \$20 million Canadian (\$16.3 million) worth of stock to accredited investors and company insiders.,Business,3,1.3550321
6974," NEW YORK (Reuters) - Newspaper publisher Gannett Co Inc.  &lt;A HREF=""http://www.investor.reuters.com/FullQuote.aspx?ticker=GCI.N target=/stocks/quickinfo/fullquote""&gt;GCI.N&lt;/A&gt; will need to see advertising demand pick up for its  fourth-quarter earnings to meet the consensus target of Wall  Street analysts, its chief financial officer said on Wednesday.",Business,3,1.3478135
6986," NEW YORK (Reuters) - Alamosa Holdings Inc. &lt;A HREF=""http://www.investor.reuters.com/FullQuote.aspx?ticker=APCS.O target=/stocks/quickinfo/fullquote""&gt;APCS.O&lt;/A&gt; will  acquire AirGate PCS Inc. &lt;A HREF=""http://www.investor.reuters.com/FullQuote.aspx?ticker=PCSA.O target=/stocks/quickinfo/fullquote""&gt;PCSA.O&lt;/A&gt; for \$392 million in stock  creating the largest Sprint Corp. &lt;A HREF=""http://www.investor.reuters.com/FullQuote.aspx?ticker=FON.N target=/stocks/quickinfo/fullquote""&gt;FON.N&lt;/A&gt; wireless affiliate,  the companies said on Wednesday.",Business,3,1.4743528
6989,"THE stock market opened higher today as industrials stocks mitigated the effects of a weaker resources sector.  quot;Commodity prices are generally weaker on renewed speculation of weaker demand in China, quot; Wilson HTM senior client adviser Angus Bligh said.",Business,3,1.3384647
7042, NEW YORK (Reuters) - U.S. Treasury prices extended early  losses on Thursday after private and foreign investors showed  little interest in a sale of reopened debt.,Business,3,1.4067891
7045,"America West Holdings Corp., parent of America West Airlines Inc., on Thursday said it does not plan to submit a bid to acquire bankrupt ATA Holdings Corp.",Business,3,1.4076809
7050," CHICAGO (Reuters) - America West Holdings Corp. &lt;A HREF=""http://www.investor.reuters.com/FullQuote.aspx?ticker=AWA.N target=/stocks/quickinfo/fullquote""&gt;AWA.N&lt;/A&gt; on  Thursday said it would not bid for assets of bankrupt carrier  ATA Airlines, saying the value does not justify the cost.",Business,3,1.4248382
7057,"America West Airlines backed away Thursday from a potential bidding war for bankrupt ATA Airlines, paving the way for AirTran to take over ATA operations.",Business,3,1.5090362
7075,"In another report, import prices excluding petroleum posted the largest increase in 10 months, a possible early warning on inflation from the weaker dollar.",Business,3,1.4785703
7130,"Southwest Airlines said on Friday it will bid at least USD\$100 million for assets of bankrupt ATA Airlines, including taking over six of ATA #39;s 14 gates at Chicago #39;s Midway Airport and selling tickets on some of each other #39;s flights.",Business,3,1.3556093
7233,"LONDON (CBS.MW) - Failed efforts to merge stock exchanges have littered the trading landscape in recent years, but the German stock exchange isn #39;t giving up on creating a pan-European and British market for trading stocks and derivatives.",Business,3,1.4515221
7328,"Merck  amp; Co. plans to cut its workforce by 5,100 jobs by the end of the year--about 700 more than originally planned. Whitehouse Station, NJ-based Merck said in materials filed with the Securities and Exchange ",Business,3,1.4350903
7349,"The decline of the US dollar is a signal that policy makers need to do more to ensure the currency #39;s depreciation won #39;t hurt global growth, International Monetary Fund chief economist Raghuram Rajan said.",Business,3,1.3723323
7376,Embattled Russian oil giant Yukos has filed for bankruptcy protection in a US court in an attempt to prevent the forced sale of its main production arm.,Business,3,1.4600534
7425,"HONG KONG (Dow Jones)--Shares of Air China Ltd. (0753.HK), the country #39;s largest airline, opened 6 higher at their debut Wednesday on the Hong Kong Stock Exchange #39;s main board.",Business,3,1.4741542
7438, A Fort Worth brokerage that sold high-fee mutual funds to military families agreed yesterday to pay \$12 million to settle allegations that it used misleading marketing literature and scripts.,Business,3,1.3466483
7441,MOSCOW - Embattled Russian oil giant Yukos filed for bankruptcy protection in a US court in a last-ditch bid to avert auction of its core production unit.,Business,3,1.4468129
7501,"Johnson  amp; Johnson, the pharmaceutical and health care giant, has announced an agreement to buy Guidant, one of the largest US makers of devices to treat heart and circulatory illnesses, for \$25.4 billion.",Business,3,1.3501153
7507,"Crude oil futures are headed for their biggest weekly gain in 21 months on speculation cold weather may boost demand in the US Northeast, where 80 percent of the country #39;s heating oil is used.",Business,3,1.3643111
7508,"Parmalat, the bankrupt Italian dairy and food company, sued 45 banks on Thursday seeking to recover money it paid to them in the year before the company #39;s collapse.",Business,3,1.3377999
7535," LONDON (Reuters) - A U.S. bankruptcy court is likely to  revoke its temporary ban on the sale of Russian oil group  YUKOS's main production unit, lawyers said on Friday.",Business,3,1.3735292
7547," NEW YORK (Reuters) - The Dow Jones industrial average fell  on Friday after Pfizer Inc. &lt;A HREF=""http://www.investor.reuters.com/FullQuote.aspx?ticker=PFE.N target=/stocks/quickinfo/fullquote""&gt;PFE.N&lt;/A&gt; shares opened nearly 19  percent down on trial data for its popular arthritis drug  Celebrex that showed increased risk of heart attack.",Business,3,1.5028744
7556,"US stocks fell as setbacks for drugmakers, including a study showing Pfizer Inc. #39;s Celebrex painkiller increased the risk of heart attacks, sent health-care shares tumbling.",Business,3,1.3979956
