,Original_Text,Class_String,Class_Number,Neuron_20
1,"SPACE.com - TORONTO, Canada -- A second\team of rocketeers competing for the  #36;10 million Ansari X Prize, a contest for\privately funded suborbital space flight, has officially announced the first\launch date for its manned rocket.",Sci/Tech,4,1.3325942
11, LOS ANGELES (Reuters) - Apple Computer Inc.&lt;AAPL.O&gt; on  Tuesday began shipping a new program designed to let users  create real-time motion graphics and unveiled a discount  video-editing software bundle featuring its flagship Final Cut  Pro software.,Sci/Tech,4,1.3379667
17,"European Space Agency -- ESAs Mars Express has relayed pictures from one of NASA's Mars rovers for the first time, as part of a set of interplanetary networking demonstrations.     The demonstrations pave the way for future Mars missions to draw on joint interplanetary networking capabilities...",Sci/Tech,4,1.3469726
43,"FT.com - Shares in Sohu.com, a leading US-listed Chinese internet portal, fell more than 10 per cent on Friday after China's biggest mobile phone network operator imposed a one-year suspension on its multimedia messaging services because of customers being sent spam.",Sci/Tech,4,1.3315095
63,"NewsFactor - Oracle (Nasdaq: ORCL) has revamped its sales-side CRM applications in version 11i.10 of its sales, marketing, partner relationship management and e-commerce application.",Sci/Tech,4,1.2707491
70,"Red Flag Software Co., the company behind China's leading Linux client distribution, plans to focus more on its server operating system and enterprise customers, the company's acting president said.",Sci/Tech,4,1.2710677
71,"AOL Properties Sign Girafa For Thumbnail Search Images\\Girafa.com Inc. announced today that the CompuServe, Netscape, AIM and ICQ properties of America Online, Inc., have signed an agreement with Girafa to use Girafa's thumbnail search images as an integrated part of their search results.\\Using Girafa's thumbnail search service, search users can ...",Sci/Tech,4,1.2622985
72,"AP - NASA's Cassini spacecraft has spied two new little moons around satellite-rich Saturn, the space agency said Monday.",Sci/Tech,4,1.310926
89,"A proposal backed by a coalition of telephone carriers would cut billions of dollars in fees owed by long-distance companies to regional phone giants but would allow the regional companies to make up some of the difference by raising monthly phone bills for millions of consumers. &lt;FONT face=""verdana,MS Sans Serif,arial,helvetica"" size=""-2""\ color=""#666666""&gt;&lt;B&gt;-The Washington Post&lt;/B&gt;&lt;/FONT&gt;",Sci/Tech,4,1.3357422
114,"Reuters - Two new moons were spotted around\Saturn by the Cassini space probe, raising the total to 33\moons for the ringed planet, NASA said on Monday.",Sci/Tech,4,1.3651731
124,"NewsFactor - IBM (NYSE: IBM) has -- again -- sought to have the pending legal claims by The SCO Group dismissed. According to a motion it filed in a U.S. district court, IBM argues that SCO has no evidence to support its claims that it appropriated confidential source code from Unix System V and placed it in Linux.",Sci/Tech,4,1.3791225
173,"BOSTON The jury is still out on whether a computer can ever truly be intelligent, but there is no question that it can have multiple personalities. It #39;s just a matter of software. We usually think of the processor chip as the brains of a computer. The ...",Sci/Tech,4,1.2881342
190,"CHICAGO - Hewlett-Packard(HP) has moved its Active Counter Measures network security software into beta tests with a select group of European and North American customers in hopes of readying the product for a 2005 release, an HP executive said at the HP World conference here in Chicago Wednesday.",Sci/Tech,4,1.2753937
233,"TechWeb - Customers are decoupling storage from server purchases, which explains why EMC and NetApp earnings were up and why Sun and HP were flat or down, Warmenhoven says.",Sci/Tech,4,1.2614911
246,"While the total number of home internet users has reached a plateau in the US, those who do use the internet are adopting broadband at a rapid pace, according to Marc Ryan, senior director of analysis at the audience measurement company. ",Sci/Tech,4,1.3047091
283,"In a dramatic ending that marks a beginning in scientific research, NASA's Genesis spacecraft is set to swing by Earth and jettison a sample return capsule filled with particles of the Sun that may ultimately tell us more about the genesis of our solar system.",Sci/Tech,4,1.3532363
306,"Understanding Google AdWords\\Unlike many search engines Google, to its credit, clearly denotes search listings that are paid placement. In fact, Google AdWords appear in a separate section down the left side of the screen.\\Google AdWords provide an inexpensive advertising venue for businesses to advertise products or services to a targeted ...",Sci/Tech,4,1.302595
423,"New antispam technology standards are on the way that promise to hit spammers where it hurts the most--their wallets. At issue is the ability to authenticate the original source of e-mail messages, a major ",Sci/Tech,4,1.2587984
454,"Wi-Fi is going sky-high thanks to a deal forged between enterprise Internet service provider iPass and Connexion by Boeing. Under the deal, iPass #39;s 528,000-plus Wi-Fi enterprise customers will ",Sci/Tech,4,1.3227983
457,NewsFactor - Siebel Systems (Nasdaq: SEBL) has named EDS as the charter partner in Siebels' new business process outsourcing (BPO) global strategic-alliance program. The agreement expands the relationship between EDS and Siebel to provide a set of high-value managed products and service offerings targeted at the BPO and customer relationship management (CRM) marketplaces.,Sci/Tech,4,1.2832279
462,"MOSCOW (AFP) -- A new Russian-US team for the International Space Station (ISS) will take off from the Baikonur space station in the former Soviet republic of Kazakhstan in October, Russian space officials said.       The three-person team, due to be approved on Thursday, will leave for the ISS on board a Russian Soyuz TMA-5 spacecraft, Russia's Federal Space Agency, Roskosmos said on its website...",Sci/Tech,4,1.3147395
491,"A molecular switch known to regulate fat metabolism appears to prevent obesity and turns laboratory mice into marathon runners, a Salk Institute study has found.",Sci/Tech,4,1.3366365
499,One thing that #39;s always irritated those who don #39;t choose to use Internet Explorer is finding a website that requires IE. Such complaints seem to have grown all the more passionate now security concerns are driving more users to consider IE alternatives.,Sci/Tech,4,1.3481388
510,"PC World - Linksys will provide broadband-to-phone adapters and, eventually, Wi-Fi equipment.",Sci/Tech,4,1.240098
531,"SAN JOSE, Calif.Cisco Systems Inc. said it has agreed to acquire P-Cube for \$200 million in stock and cash to enable service providers to further control and manage such advanced Internet Protocol services ",Sci/Tech,4,1.255732
536,WLAN kit makers Linksys and Netgear have rolled out consumer and small-business oriented wireless access points with integrated Voice over IP (VoIP) support.,Sci/Tech,4,1.3574147
537,"A tiny telescope has spotted a giant planet circling a faraway star, using a technique that could open a new phase of planetary discovery, scientists say.",Sci/Tech,4,1.3220173
539,"Reuters - Playboy magazine on Tuesday\posted to its Web site an unpublished portion from its\interview with Google's founders, which raised regulatory\eyebrows not for what it revealed, but for its timing -- just\before the Internet search engine's much-anticipated initial\public offering.",Sci/Tech,4,1.3032368
567,"In an attempt to stem the growing tide of online scams, identity theft and the proliferation of junk e-mail, the Justice Department and state law enforcement officials have initiated what seems to be the largest dragnet yet against spammers, so-called ""phishers"" and other Internet con artists. &lt;FONT face=""verdana,MS Sans Serif,arial,helvetica"" size=""-2"" color=""#666666""&gt;&lt;B&gt;-washingtonpost.com&lt;/B&gt;&lt;/FONT&gt;",Sci/Tech,4,1.5375156
572,"WASHINGTON - A tiny telescope has spotted a giant planet circling a faraway star, using a technique that could open a new phase of planetary discovery.",Sci/Tech,4,1.2704848
581,"Best Softwarelaunched this week an overhaul of its Act contact management software, adding to the product line a second version with more scalability and advanced functionality.",Sci/Tech,4,1.3048333
582,"Microsoft on Wednesday announced the release to manufacturing of Microsoft Operations Manager (MOM) 2005 and MOM 2005 Workgroup Edition, a new edition that the company previously called MOM 2005 Express.",Business,3,1.2527702
586,"Server shipments and revenue increased in the second quarter, with low-cost servers based on Linux or the Windows operating system growing faster than their Unix counterparts, according to research firm Gartner Inc.",Sci/Tech,4,1.2624264
594,"Customers will be able to download film clips, audio and video, interactive multiplayer games, multimedia music tracks,  quot;push-to-watch quot; services, as well as access large e-mail attachments.",Sci/Tech,4,1.3144437
596,Company is upgrading current support and service program to draw more mainframe customers.,Sci/Tech,4,1.2381171
597,"The FBI seized computers, software and equipment as part of an investigation into illegal sharing of copyrighted movies, music and games over an Internet ""peer-to-peer"" network, Attorney General John Ashcroft announced Wednesday.",Sci/Tech,4,1.2376045
632,"Understanding Search Engine Models\\To understand search engines and search engine marketing, one must first understand the search engine model. There are two fundamentally different types of search engine back ends: site directories and spidering search engines. Site directory databases are built by a person manually inputting data about websites. Most ...",Sci/Tech,4,1.2555816
645,Reuters - Intel Corp. (INTC.O) on Thursday\said it has upgraded the wireless networking capabilities of\its Centrino line of notebook computer chips to allow broader\network access with improved security.,Sci/Tech,4,1.2880405
661,"NewsFactor - IBM (NYSE: IBM) has said it will purchase Venetica, a privately held firm that provides content-integration software to unstructured data sources.",Sci/Tech,4,1.2720885
715,"By SARA LEITCH     BRUNSWICK, Maine (AP) -- Astronauts spend years training before they can lift off into space. They learn to operate shuttles, perform experiments in zero-gravity, and eat bugs if they must...",Sci/Tech,4,1.2517627
763,"Microsoft says it plans to broadly release the long-awaited update to its flagship Windows operating system, dubbed  #39;Longhorn #39;, in 2006.",Sci/Tech,4,1.2486143
778,"For the past few years, viruses have attacked Microsoft #39;s operating system, Web browser or e-mail programs seemingly on a weekly basis.",Sci/Tech,4,1.2412287
791,"If my car died tomorrow, I'd have a lot less angst picking its successor than I would if my TV conked out. &lt;FONT face=""verdana,MS Sans Serif,arial,helvetica"" size=""-2""\ color=""#666666""&gt;&lt;B&gt;-Rob Pegoraro&lt;/B&gt;&lt;/FONT&gt;",Sci/Tech,4,1.4270302
910,"pinkUZI writes  quot;Intel will announce that it has crammed 500 million transistors on to a single memory chip, shrinking them in size by 30.",Sci/Tech,4,1.2414964
921,"Juniper Networks (Quote, Chart) has launched a new initiative designed to improve interoperability of popular third-party antivirus and firewall measures with its own Secure Socket Layer (define) Virtual Private Network (define) appliances.",Sci/Tech,4,1.283776
957,Novell is reorganising its business to focus on two key areas - Linux and identity management. The networking software firm #39;s Nterprise and Linux operations will be folded into a Platform and Application Services group CRN reports.,Sci/Tech,4,1.2478621
960,"AFP - Apple Computers launched the newest version of its iMac model, which at two inches thick, is the world's thinnest desktop computer, the company said.",Sci/Tech,4,1.3519545
968," PARIS (Reuters) - Apple Computer unveiled, after a  two-month delay, its new iMac desktop computer on Tuesday which  integrates disk drives and processors into a flat display less  than two inches thick.",Sci/Tech,4,1.3591828
969,"PARIS Apple Computer engineered another design coup on Tuesday, unveiling a new iMac here that incorporates all of the personal computer #39;s innards into a flat-panel screen that balances on an aluminum stand.",Sci/Tech,4,1.2416797
971,"MANHASSET, NY - Philips Electronics and Samsung Electronics have entered into a deal that will enable Samsung to deploy cellular devices using Philips #39; near-field communications chip and technology.",Sci/Tech,4,1.3336823
977,"Microsoft said Friday that it is delaying the release of a new data-storage technology, named WinFS, from the next version of Windows, code-named Longhorn, in order to deliver the operating system by 2006.",Sci/Tech,4,1.3065908
982,Upgraded version of this encryption app adds plenty of tools for networked users.,Sci/Tech,4,1.2893736
985,"Skype for Windows, Skype for Pocket PC and Skype for Linux -- Skype for Mac OS X is free. Skype users can control their online presence and ",Sci/Tech,4,1.3658799
988,Microsoft will ship its next Windows client code-named Longhorn in 2006 as originally promised -- but without the next-generation file system known as WinFS.,Sci/Tech,4,1.3538302
998,"AMD has demonstrated the company #39;s first dual-core microprocessors. Dual-core processors offer improved performance over single-core chips, especially in multithreaded applications.",Sci/Tech,4,1.313354
1002,TechWeb - Availability of Entellium's code could speed development of industry-specific CRM products.,Sci/Tech,4,1.2523586
1009,"SiliconValley.com - Attempting to capitalize on iPod mania, Apple Computer Tuesday unveiled a fast new version of the iMac that it all but touted as a smart accessory for the sexy music players.",Sci/Tech,4,1.3162905
1014,An alert posted on the company #39;s Web site outlined the patches that should be posted to fix numerous security holes in a number of applications.,Sci/Tech,4,1.239482
1015,There #39;s a remarkable graph on Google #39;s Zeitgeist site showing the meteoric rise of Microsoft Internet Explorer 6 use and equally catastrophic decline of all other competing browsers.,Sci/Tech,4,1.2840211
1035,"By PAUL GEITNER    BRUSSELS, Belgium (AP) -- Europeans eat less of the most dangerous, cholesterol-raising fats than Americans do and the amount is decreasing, according to a report released Wednesday by the European Food Safety Authority.    Scientists at the European Food Safety authority declined to say whether the EU should follow the United States' lead and require special labels on margarine, chips, cookies, fries and other potential sources of trans fatty acids...",Sci/Tech,4,1.2471061
1059,"This service leverages new Windows Media 10 technologies to enable Napster subscribers to download music to portable devices, a technology called Janus.",Sci/Tech,4,1.2672572
1071,"Cue the music: Microsoft has officially thrown its headphones into the ring in the contest to bring legal music downloads to the masses. &lt;FONT face=""verdana,MS Sans Serif,arial,helvetica"" size=""-2""\ color=""#666666""&gt;&lt;B&gt;-washingtonpost.com&lt;/B&gt;&lt;/FONT&gt;",Sci/Tech,4,1.5448097
1072,"""Multiple reports of provocateurs setting trash fires in midtown,"" read one text message sent to 400-plus mobile phones this week through a service called Ruckus RNC 2004 Text Alerts.",Sci/Tech,4,1.2505227
1078,"SiliconValley.com - Microsoft makes its long-anticipated entry into the online music market today, marking the first serious challenge to Apple Computer's popular iTunes service.",Sci/Tech,4,1.335037
1085,SOFTWARE FIRM Microsoft seems to have agreed to bend to the will of the open source community on its anti-spam technology sender ID.,Sci/Tech,4,1.3784271
1107,"With today's expected announcement, hardware vendors will get access to the BladeCenter specifications by signing a seven-page licensing agreement, which grants users the right to license the specifications for certain types of products.",Sci/Tech,4,1.257265
1118,"The adapters can overheat and cause damage to the circuit board, according to a safety agency. WASHINGTON: IBM will recall about 225,000 AC power adapters for several models of its laptop computer because ",Sci/Tech,4,1.2765106
1119,"EMC has hired a former IBM veteran to be its chief technology officer, in what appears to be the latest step in EMC #39;s evolution from a data storage hardware specialist to a more comprehensive computing company.",Sci/Tech,4,1.2714977
1167,"com. The Apache Software Foundation, developers of the popular open-source Apache web server, said on Thursday that it wouldn #39;t support the proposed anti-spam standard Sender ID, because the licensing terms set by Microsoft Corp.",Sci/Tech,4,1.3540144
1187,"The digital music space is changing, with more songs and a growing number of places to download music legally. Realizing that the time was ripe to see how we were doing, I took some song recommendations and sat down to see what I could download.",Sci/Tech,4,1.2566268
1230,"\\""It's been a lot of fun writing XMLhack since 1999, but it's time for us to take\a rest.""\\""XMLhack has always been run by volunteers writing in their spare time, and now\most of us have so little of that precious commodity it's infeasible to keep the\site going at anything like the rate we want it to be.""\\""As editor, I'd like to extend my grateful thanks to all the contributors over\time, a list of whom you can see on the contributors page. My special thanks go\to Simon St.Laurent, my co-conspirator from the start.""\\So long guys!\\I've been a subscriber to XMLHack for probably &gt; 3 years now.  They were one of\the earlier blog-like sites to have RSS in what I'd call a 'modern' and rich\f ...\\",Sci/Tech,4,1.2542666
1257,A space capsule set to plunge into Earth #39;s atmosphere with a piece of the Sun this Wednesday has spawned additional projects ranging from spacecraft design to the detection of dangerous asteroids.,Sci/Tech,4,1.2678472
1294,"New research from NOP, shows that more of the UK Internet population are progressing to broadband - with usage at 41 per cent up from 27 per cent just six months ago, and an increase in females using the internet.",Sci/Tech,4,1.3221059
1315,"roundup Plus:  Samsung to put hard drives in phones...IDC says external disk storage up...Lawmakers to vote on spyware, piracy bills.",Sci/Tech,4,1.2696036
1346,"A space capsule holding atoms collected from solar wind was en route to a tricky rendezvous with Earth, offering scientists the first material NASA has brought back from space in nearly three decades.",Sci/Tech,4,1.2864913
1354,A San Francisco startup plans to boldly go where no game developer has gone before with an online game based on the cult TV series  quot;Star Trek.,Sci/Tech,4,1.2417012
1363,"The Genesis space capsule, which had orbited the sun for more than three years in an attempt to find clues to the origin of the solar system, crashed to Earth on Wednesday after its parachute failed to deploy.",Sci/Tech,4,1.289128
1368,"SAN FRANCISCO -- Intel Corp.'s decision to begin shipping versions of x86 processors that are capable of 64-bit computing has slowed down the adoption of the company's high-end Itanium processors, a senior executive acknowledged Tuesday during a question and answer session at the Intel Developer Forum (IDF) in San Francisco.",Sci/Tech,4,1.2383888
1370,"In a bid to expand the customer base for its database software, Sybase Inc. released on Tuesday a free, limited version of its software for deployment on Linux systems.",Sci/Tech,4,1.394579
1392,"Microsoft announced on Wednesday five new mice and keyboards: Wireless Optical Desktop, which comes with a wireless mouse and keyboard; Wireless Notebook Optical Mouse; Digital Media Pro Keyboard; and Standard Wireless Optical Mouse.",Sci/Tech,4,1.3100231
1401,"The machine has a 400GB hard disk drive, is capable of zapping video elsewhere in a home, and is designed to let consumers program recording remotely over the Internet--including via cell phones.",Sci/Tech,4,1.2928337
1425,Big Blue will use AMD's chip in a high-performance server but isn't yet planning a general-purpose Opteron system.,Sci/Tech,4,1.2682095
1426,"Prosecutors in Verden, Germany, indicted an 18-year-old student on Wednesday for allegedly creating the Sasser worm that crashed hundreds of thousands of computers worldwide after spreading at lighting speed over the Internet.",Sci/Tech,4,1.295978
1428,"Google Toolbar Using Keywords Function\\Looks like Google is trying to assure placement within the browser one step at a time. The latest update of the Google toolbar includes ""browse by keyword,"" meaing if I type in ""how do I kill this hangover"" into my IE URL field, I will get ...",Sci/Tech,4,1.2691612
1433,"RealNetworks Inc. has sold about 3 million songs online during a three- week, half-price sale designed to promote an alternative to Apple Computer Inc.",Sci/Tech,4,1.395397
1444,BOSTON - Computer viruses and worms will have to share the stage with a new challenger for the attention of attendees at a conference of antivirus researchers: spam e-mail.,Sci/Tech,4,1.4191629
1446,"IBM (Quote, Chart) is looking to get a leg up on the competition with the October 15 launch of eServer 326, a rack-mounted server that supports AMD #39;s (Quote, Chart) upcoming dual-core 64-bit processor.",Sci/Tech,4,1.3124709
1471,Software allows users of personal digital assistants to make free calls using Wi-Fi networks.,Sci/Tech,4,1.3187586
1498,"By Ed Edelson, HealthDay Reporter    HealthDayNews -- Could electric light pose a cancer threat?    It might seem like the wildest of paranoid beliefs, but a growing number of scientists suspect it might be true. The reason: Turning on the lights after dark may affect a small number of ""clock genes"" that play a major role in controlling how cells live, die and function, these researchers suggest...",Sci/Tech,4,1.2584753
1507,"Some material has been found still intact inside the crashed Genesis space capsule, say Nasa scientists.",Sci/Tech,4,1.4511313
1516,"SAN FRANCISCOSun Microsystems Inc. next week will roll out two new servers featuring its UltraSPARC IV processors, a Sun executive said Friday.",Sci/Tech,4,1.2741084
1542,"Hitachi Global Storage Technologies and Intel are pushing the development of an interface technology that they hope will smooth the adoption of compact hard drives into mobile phones, PDAs, and digital music players, the companies say.",Sci/Tech,4,1.3239518
1610,Ziff Davis - Commtouch's anti-spam software update halts spam by tracking e-mail server sending patterns.,Sci/Tech,4,1.3927298
1618,"IBM will push its Power5 line of servers down into the low end of the market, taking Linux with it, when it unwraps an aggressively priced series of Linux-only systems on Monday that will go up against the offerings of Sun Microsystems and Hewlett-Packard ",Sci/Tech,4,1.3492652
1640,"If you #39;ve been using the new Windows Media Player 10 for Windows XP, you may have noticed that Microsoft shifted from some of the more formal language that it used in Windows Media Player 9 --  quot;Copy from CD quot; and  quot;Copy to CD quot; -- to the more casual terms ",Sci/Tech,4,1.2592218
1641,"SEPTEMBER 13, 2004 (COMPUTERWORLD) - Cisco Systems Inc. tomorrow plans to announce an all-new line of branch-office routers that integrate basic routing capabilities with IP voice support, security tools and other functionality.",Sci/Tech,4,1.3902156
1642,"AP - Seeking to be more competitive with Microsoft Corp., Linux backers have agreed on a standard version of the operating system so that programs written for one Linux distribution will work with others.",Sci/Tech,4,1.2680501
1666,"ORLANDO, Fla.Microsoft Corp. announced another edition of its upcoming development tools family, releasing information on Visual Studio 2005 Standard Edition at the VSLive!",Sci/Tech,4,1.241028
1667,Virus writers have created a piece of malware that  #39;talks #39; to victims. The Amus email worm uses Windows Speech Engine (which is built-in to Windows XP) to deliver a curious message to infected users.,Sci/Tech,4,1.3466998
1669,"Though the release is technically a preview, the 1.0 version is a significant milestone for the open-source browser software, which has already won an enthusiastic following as an alternative to Microsoft #39;s Internet Explorer.",Sci/Tech,4,1.4011142
1676,Internet hardware giant Cisco Systems is said to be preparing to launch a new family of routers that can manage both voice and data applications.,Sci/Tech,4,1.2724009
1683,The eServer OpenPower 720 is aimed at the entry-level market for 64-bit Linux-based servers and runs various configurations of what IBM calls the Power5 at 1.5 and 1.65GHz.,Sci/Tech,4,1.2835188
1717,"Sony Japan has released a new Clie for the Japanese market only. The Clie PEG-VZ90 is a Palm OS multimedia Clie handheld, that features a large OLED screen, slider hidden buttons, plentiful memory and WiFi.",Sci/Tech,4,1.3797593
1724,Microsoft Corp. has made fingerprint biometric technology an integral part of its keyboard and mouse peripherals with new products that mark the company #39;s first foray into biometric devices.,Sci/Tech,4,1.2643481
1728,"To expand the capabilities of SD memory cards in mobile devices, the SD Card Association has recently formed a Mobile Phone Task Force.",Sci/Tech,4,1.3044174
1762,"Reuters - The launch of a Russian rocket scheduled\to blast off to the International Space Station next month has\been postponed because of problems with the docking system,\Russia's space agency said on Wednesday.",Sci/Tech,4,1.3065279
