,Original_Text,Class_String,Class_Number,Neuron_43
2056,"KHARTOUM, Sudan Sept. 19, 2004 - A US-backed United Nations resolution threatening oil sanctions for the violence in Sudan #39;s Darfur region will only make it harder for the government to calm the insurrection there, a Sudanese official said Sunday.",World,1,0.8236677
2073,Sudan said Sunday that the UN Security Council #39;s resolution threatening oil sanctions if it failed to end violence in the country #39;s western region of Darfur was unfair ,World,1,0.82020205
2074,Sinn Fein President Gerry Adams   recommends his party  accept proposals to revive power-sharing.,World,1,0.82147187
2087," JAKARTA (Reuters) - Early returns in Indonesia's  presidential elections Monday gave a lead to ex-general Susilo  Bambang Yudhoyono, who has vowed firmer leadership to fight  terror and boost the economy, over incumbent Megawati  Sukarnoputri.",World,1,0.851286
2108,"AP - A car bomb exploded in the northern Iraq city of Mosul on Monday, killing three people, hospital police said.",World,1,0.89789
2125,"Tropical Storm Jeanne killed at least 250 people and injured at least 380 in northern Haiti, the United Nations said. UN spokeswoman Denise Cook said the bodies of 250 people were in ",World,1,0.85022414
2140,"US troops fought a gunbattle with insurgents along a busy street in Baghdad today, sending passers-by scurrying for cover, witnesses said, Five US troops were reported killed in separate clashes in a volatile western province as ",World,1,0.8499836
2161,"Prime Minister Manmohan Singh arrived on Tuesday for the first major diplomatic foray that includes talks with US President George W Bush, Pakistan President Pervez Musharraf and address to the UN General Assembly.",World,1,0.84760225
2203,"AP - A Senate panel on Tuesday approved the nomination of Rep. Porter Goss, R-Fla., to head the CIA, overcoming Democrats' objections that Goss was too political for the job.",World,1,0.8248542
2249,"Los Angeles Times - BAGHDAD  #8212; Militants said Tuesday that they had beheaded a second American hostage in as many days and threatened to kill a British captive, increasing pressure on President Bush and British Prime Minister Tony Blair to confront a recent wave of kidnappings of foreigners in the Iraqi capital.",World,1,0.87520415
2276, UNITED NATIONS (Reuters) - Israel urged the United Nations  on Wednesday to move toward sanctions against Iran because  Tehran is never going to abandon its alleged quest for nuclear  weapons.,World,1,0.85533017
2325,"GAZA -- Palestinian security forces know who was behind the killing of three Americans in Gaza nearly a year ago but cannot act against the factions while fighting with Israel continues, a top Palestinian security official said.",World,1,0.851388
2339,"UN peacekeepers hand control of security in the Sierra Leone capital, Freetown, to local forces after the end of a brutal war.",World,1,0.86668533
2340,"Offering a simple, ""Thank you America,"" Iraqi interim Prime Minister Ayad Allawi declared Thursday that his country is succeeding in its effort to move past the war that ousted Saddam Hussein.",World,1,0.88511467
2360,"AFP - The Nigerian army killed 24 Islamic militants who had taken refuge in the mountainous northeastern region bordering Cameroon, the spokesman for the northeastern state of Borno said.",World,1,0.83165175
2366," UNITED NATIONS (Reuters) - Russia on Thursday proposed a  U.N. crackdown on the abuse of political asylum for terrorist  purposes, raising pressure on Western states to hand over  wanted Chechen activists.",World,1,0.8256737
2369,A high-ranking Palestinian Liberation Organization delegation led by Chairman Mahmoud Abbas held landmark talks with the Syrian leaders in Damascus Monday.,World,1,0.9440155
2370,"BAGHDAD US warplanes fired on targets in the east Baghdad slum of Sadr City on Thursday, the second day of fighting in the Shiite militia stronghold.",World,1,0.930108
2426,The United Nations High Commissioner for Refugees says granting more autonomy to southern Sudan could help end the bloody conflict there.,World,1,0.8406314
2463,"Sudan says it has foiled a coup plot by backers of detained Islamist leader, Hassan al-Turabi.",World,1,0.9378437
2476,The leaders of India and Pakistan promised Friday to work together to  quot;restore normalcy and cooperation quot; between their countries and seek peace in the disputed Himalayan territory of Kashmir.,World,1,0.92184603
2482,"GAZA CITY, Gaza Strip - A day after a mortar round killed an Israeli-American woman in a nearby settlement, the Israeli army charged into a Palestinian refugee camp Saturday, killing one person and tearing down 35 homes, witnesses and a U.N. aid official said...",World,1,0.86722004
2486,"The top United Nation refugee official is in Chad, where Saturday, he toured a camp for Sudanese refugees who have fled violence in the western Darfur region.",World,1,0.933437
2507,"UN Secretary-General Kofi An nan meets with visiting Iraqi Prime Minister Iyad Allawi at UN headquarters in New York, Sep 24. (Xinhua Photo).",World,1,0.8263446
2512,Efforts to secure the release of Iraq hostage Ken Bigley are being stepped up as a delegation from the Muslim Council of Britain #39; heads to Baghdad for talks.,World,1,0.90371656
2514,"AFP - A French national shot dead in the Saudi Red Sea city of Jeddah overnight was the target of a  quot;terrorist attack quot; according to initial investigations, an interior ministry spokesman told AFP.",World,1,0.86312866
2528,"Widening its pursuit of Hamas beyond the occupied territories, Israel reached into Damascus Sunday, dealing a blow to both Hamas and Syria.",World,1,0.8725278
2564,"JERUSALEM -- A Hamas official was killed Sunday when his sport utility vehicle exploded in a neighborhood of Damascus, Syria, seconds after he started the engine, according to witnesses and the Palestinian militant group #39;s leaders, who accused Israel of ",World,1,0.83813214
2637,THE HAGUE: President General Pervez Musharraf Monday described the killing of Amjad Farooqi as big achievement by security forces and said  quot;important terrorist has been eliminated.,World,1,0.885248
2695,"Under international pressure to disarm and disband Arab militias in troubled Darfur, Sudan #39;s government is instead reportedly moving hundreds, possibly thousands, of the fighters from Darfur to remote areas of southern Sudan.",World,1,0.92316943
2720,"(CBS/AP) As US forces continued to bombard the restive city of Fallujah and clashed with militants in the streets of Baghdad, there was unrest in the normally quiet British-patrolled city of Basra.",World,1,0.82234037
2725,Palestinian gunmen yesterday released a CNN journalist abducted in Gaza City apparently to pressure members of an Arab minority group not to serve in the Israeli army.,World,1,0.909774
2730,"AP - A Syrian crackdown on terror groups would be the best way to halt violence in Syria and promote peace in the Middle East, the State Department said Monday after the assassination in Damascus of a leader of Hamas' bombing unit.",World,1,0.8390141
2761," RAMALLAH, West Bank (Reuters) - Lawmakers angered by the  Palestinian leadership's failure to make reforms plan to force  a parliamentary no-confidence vote that could bring down the  government appointed by Yasser Arafat, legislators said.",World,1,0.8908151
2769,AP - The State Department said Monday it is taking seriously allegations that Laotian military forces may have massacred children of the country's Hmong ethnic minority.,World,1,0.8623114
2802,"AFP - Britain has extended full citizenship rights to Gurkha soldiers from Nepal who serve in the British armed forces, Prime Minister Tony Blair has said.",World,1,0.91291845
2824, GAZA (Reuters) - A column of Israeli tanks surged into the  heart of the Jabalya refugee camp in the northern Gaza Strip on  Thursday as the army broadened its sweep for militants behind a  deadly rocket attack on an Israeli town.,World,1,0.8932444
2834,"_ At least three bombs exploded near a US convoy in western Baghdad on Thursday, killing 37 people and wounding more than 50, officials said.",World,1,0.88460183
2838,"Pakistan President General Pervez Musharraf met Pope John Paul II, who urged him to adopt a  quot;spirit of dialogue and tolerance quot; in his region.",World,1,0.83212173
2840,"BAGHDAD, Iraq - The Arab news network Al-Jazeera showed video Thursday of 10 new hostages seized in Iraq by militants.    Al-Jazeera said the 10 - six Iraqis, two Lebanese and two Indonesian women - were taken by The Islamic Army in Iraq...",World,1,0.9651794
2853," JABALYA, Gaza (Reuters) - Twenty-three Palestinians and  three Israelis were killed Thursday, Gaza's bloodiest day for  more than two years, as Israel's army struck back after a  rocket attack killed two Israeli children in a border town.",World,1,0.85815746
2855,"WASHINGTON, Sept. 30, 2004 -- A series of car bombings in Baghdad today killed one American soldier and wounded 13 others. The bombings also killed at least two Iraqi policemen and reportedly injured scores of other Iraqis.",World,1,0.91785985
2881,"Three bombs exploded at a neighborhood celebration today in western Baghdad, killing 35 children and seven adults, officials said.",World,1,0.83113945
2901,"SAMARRA, Iraq - U.S. and Iraqi forces launched a major assault Friday to regain control of the insurgent stronghold of Samarra, and hospital officials said at least 80 people were killed and 100 wounded...",World,1,0.93137234
2964,The United States welcomed on Friday Sudanese official #39;s announcement to accept a larger AfricanUnion (AU) mission in the western region of Darfur and urged the speedy deployment of AU troops.,World,1,0.8790872
2977," GAZA (Reuters) - The Israeli army killed two militants  Saturday in an air strike in the northern Gaza Strip, bringing  the number of Palestinians Israel has killed in one of its  deadliest Gaza raids to 39.",World,1,0.96002185
2990,"AFP - A powerful home-made bomb has exploded in a compound housing offices of an autonomous Muslim regional government in the southern Philippine city of Cotabato, wounding one person, police said.",World,1,0.8298274
2997,Pakistan beefed up security Saturday as minority Shi #39;ite Muslims prepared to bury victims of a suicide bomb attack on a mosque in the eastern town of Sialkot that killed at least 30 people a day earlier.,World,1,0.8584779
3006,"GUWAHATI: A string of powerful bomb blasts rocked Nagaland and Assam on the birth anniversary of Mahatma Gandhi Saturday, killing at least 19 people and injuring more than 50.",World,1,0.8952052
3041,"French security forces have arrested 20 people suspected of being members of the outlawed Basque separatist group, Eta. Most were Spaniards living in the Basque region of south-western France.",World,1,0.8807862
3054,"PORT-AU-PRINCE, Haiti Oct. 3, 2004 - Gunfire erupted in a slum teeming with loyalists of ousted President Jean-Bertrand Aristide on Sunday, sending people scattering through trash-strewn streets following ",World,1,0.8893773
3122, BAGHDAD (Reuters) - Islamic militants distributed a video  in Iraq on Monday showing the killings of two men who  identified themselves as an Italian of Iraqi origin and a Turk.,World,1,0.85674304
3132,"Reuters - Israeli soldiers shot and killed a\Palestinian gunman on Monday as he approached a military\outpost near a Jewish settlement in the southern Gaza Strip, a\military source said.",World,1,0.8315801
3143,The UN Security Council called an emergency meeting Monday at the request of Arab nations to consider a resolution demanding an immediate halt to a major Israeli offensive in the northern Gaza Strip.,World,1,0.96875703
3151,"France has criticized unofficial negotiators for complicating release efforts for two French hostages held in Iraq, the BBC reported Saturday.",World,1,0.8321767
3167,"Four soldiers are charged with the murder of an Iraqi general who died in custody in Iraq, the US army says.",World,1,0.8890842
3169,"Insurgents exploded two car bombs at the gates of the main US-Iraqi headquarters in Baghdad and near major hotels Monday, killing at least 21 people and wounding 96.",World,1,0.8271845
3210,Reuters - The Israeli army said it had attacked\the car of the Palestinian Islamic Jihad militant commander who\was killed in a Gaza City airstrike on Tuesday.,World,1,0.9637037
3226,The United States on Tuesday vetoed an Arab-backed resolution demanding an immediate end to military operations in Gaza and a pullout of Israeli forces.,World,1,0.969424
3228,"WARSAW - Poland should decide soon when to pull its troops out of Iraq and end a political debate that encourages Al-Qaeda, Prime Minister Marek Belka says.",World,1,0.905536
3253,"Children collect usable metal parts from the site of a car bomb explosion in Baghdad, Iraq, October 4. AP. BAGHDAD (AFP) - Britain #39;s Foreign Secretary Jack Straw paid a surprise visit to Iraq on Tuesday amid ",World,1,0.8979216
3300,Sudan agreed to a five-point peace plan for the war-torn region of Darfur yesterday after Tony Blair set a three-month deadline for an end to the long-running conflict.,World,1,0.8235179
3301,Mutinous soldiers demanding pay for peacekeeping duty abroad killed the commander of Guinea-Bissau #39;s armed forces on Wednesday and seized key buildings in the capital of the former Portuguese colony.,World,1,0.83430064
3311," MULTAN, Pakistan (Reuters) - At least 37 people were killed  and 52 wounded when a car bomb exploded at a rally to  commemorate an assassinated religious leader in the central  Pakistani city of Multan early on Thursday, police said.",World,1,0.8615554
3344,"AP - Two American soldiers were killed and two others were wounded in separate bombings that occurred within hours, the U.S. military said Thursday.",World,1,0.83495486
3353, HANOI (Reuters) - An Asia-Europe forum accepted Myanmar and  12 other new members on Thursday ahead of a summit strained by  Yangon's human rights record and detention of democracy icon  Aung San Suu Kyi.,World,1,0.8804118
3358,"could help the interim government #39;s efforts to calm rebel-held strongholds before elections due in January. colleague, Sheikh Mahmoud Sudani, after he got out of jail on Thursday.",World,1,0.8202888
3400,"Reuters - Among those tipped to win the 2004 Nobel\Peace Prize on Friday are the U.N. nuclear watchdog and its\leader Mohamed ElBaradei, a Kenyan environmentalist and a\Russian anti-nuclear activist.",World,1,0.83631533
3485, GAZA (Reuters) - Israeli troops killed four armed  Palestinians in the Gaza Strip on Saturday as it pressed a  massive 10-day-old offensive that has cost 85 Palestinian lives  in an attempt to stop militants firing rockets.,World,1,0.8393242
3503,"India News  gt; Pattan/Srinagar, Oct.9 : A suicide bomber rammed a car packed with explosives into an army convoy in Kashmir today, killing four soldiers and a civilian and wounding 30 more, police said.",World,1,0.88780373
3511,"Troops of Pakistani para-military force check Afghan refugee voters before they enter in polling station to vote in Afghanistan #39;s presidential election at Jallozai camp near Peshawar, Pakistan on Saturday, Oct. 9, 2004.",World,1,0.85076153
3513,"AFP - Islamist rebels have attacked a major police patrol and taken a number of hostages in a remote area of northeastern Nigeria near the Cameroon border, the missing officers' commander told AFP.",World,1,0.9514645
3516,Israeli troops killed five armed Palestinians in the Gaza Strip today as it pressed on with a massive offensive aimed at stopping militants firing rockets into Israel.,World,1,0.9639787
3526,A rocket attack and suicide car bombing killed at least four people in Baghdad Sunday as Defense Secretary Donald Rumsfeld began an unannounced visit to Iraq to gauge efforts to calm violence before January elections.,World,1,0.8928745
3528,"BAGHDAD, Iraq - Two car bombs shook the capital in quick succession Sunday, killing at least 10 Iraqis and wounding 16, police and hospital officials said. One American soldier was hurt...",World,1,0.8195348
3545,"PHNOM PENH, Oct. 10. - King Norodom Sihanouk declared on Sunday that his son, Crown Prince Norodom Sihamoni is ready to accept kingship.",World,1,0.9149582
3549,"ISLAMABAD - Tribal elders in Pakistan #39;s South Waziristan tribal area and local administration officials are negotiating with the kidnappers of two Chinese engineers to secure their release, a government spokesman said Sunday.",World,1,0.8228595
3552,"Bombs in Baghdad killed 18 people as the US Defence Secretary, Donald Rumsfeld, declared that America was winning the war against insurgency during a visit to Iraq.",World,1,0.9412023
3558,Leaders of Iraq's Sunni minority say they have failed to generate any enthusiasm for nationwide elections scheduled for January.,World,1,0.8194417
3579," GAZA (Reuters) - Several explosions rocked the house of an  Islamic Jihad militant leader in a Palestinian refugee camp in  the southern Gaza Strip on Monday, witnesses said.",World,1,1.0200785
3594,"Israel #39;s Ariel Sharon has rejected his army #39;s request to scale back its Gaza offensive, seeking to avoid any show of weakness after deadly bombings in Egyptian resorts crowded with Israelis, security sources said.",World,1,0.82558775
3609,"Reuters - Prime Minister Ariel Sharon survived\two no-confidence votes in Israel's parliament on Monday,\clinging to power as he seeks to push through a disputed plan\for withdrawal from some occupied territory.",World,1,0.8417066
3611,"BAGHDAD: Members of radical cleric Moqtada al-Sadr #39;s militia began handing back their weapons yesterday under a deal with the interim Iraq Government, while two US soldiers were killed in a Baghdad rocket attack.",World,1,0.8305214
3669,A PAKISTANI militant leader linked to al-Qaeda said today he refused to meet a council of tribal elders trying to secure the release of two Chinese hostages held by his group.,World,1,0.8285278
3705,"US forces stepped up operations yesterday across a wide swath of the Sunni insurgent strongholds northwest of the capital, pounding targets in three urban centers from the air and supporting Iraqi troops in raids on mosques suspected of harboring ",World,1,0.9208085
3727,At least nine Iraqis and four US soldiers are reported to have been killed in renewed violence in Iraq.,World,1,0.8980829
3737,"Roadside bombings killed four American soldiers in Baghdad, the US command said Wednesday, as US and Iraqi troops stepped up pressure on Sunni insurgents before this week #39;s start of the Islamic holy month of Ramadan.",World,1,0.8408773
3749,"Reuters - Israel dealt a double blow to the\Palestinian Islamic group Hamas on Wednesday, arresting a West\Bank leader held responsible for a twin suicide bus bombing\that killed 16 and killing two militants in Gaza air strikes.",World,1,0.96757233
3782,"In southeast Pakistan one of two Chinese hostages injured during a rescue operation died of his injuries, military sources said Thursday.",World,1,0.85074216
3783,Chinese President Hu Jintao sent a message to Norodom Sihamoni on Thursday to congratulate him on his election as the king of Cambodia.,World,1,0.8236969
3810,"Israel says it will not restrict access to the al-Aqsa mosque compound in Jerusalem during the Muslim holy month of Ramadan, that begins on Friday.",World,1,0.8389516
3821,"The United Nations secretary-general, Kofi Annan, has appealed to the European Union to play a bigger role in UN peacekeeping operations.",World,1,0.8487389
3844,"KABUL, Afghanistan -- Vote counting started yesterday in Afghanistan's landmark election, widely expected to install US-backed interim leader Hamid Karzai as the war-ravaged country's first popularly chosen president.",World,1,0.9682603
3878,Pakistani President General Pervez Musharraf has arrived in Britain for a visit which will include talks with Prime Minister Tony Blair.,World,1,0.8502471
3886,THE federal government has welcomed the bringing of formal terrorism charges against Indonesian militant cleric Abu Bakar Bashir. A spokesman for Foreign Minister Alexander Downer said the charges reflected ,World,1,0.8906606
3893,"PORT-AU-PRINCE, Haiti - Heavy gunfire erupted yesterday when police streamed into a slum stronghold of ousted President Jean-Bertrand Aristide.",World,1,0.91108376
3897,"Palestinians retrieved belongings from the rubble of dozens of homes and work crews patched up roads and water pipes today - the aftermath of Israels 17-day military offensive, the deadliest in the Gaza Strip in four years of fighting.",World,1,0.82238084
3918," JABALYA REFUGEE CAMP, Gaza Strip (Reuters) - Palestinians  sifted through the rubble of dozens of homes in a sprawling  refugee camp on Saturday after Israel ended its most powerful  assault in the Gaza Strip in four years of bloodshed.",World,1,0.8426738
3928,"Secretary of State Colin Powell will visit Tokyo for two days next weekend to discuss security and trade as well as stalled talks aimed at ending North Korea #39;s nuclear ambitions, Japanese officials said on Sunday.",World,1,0.8413816
3931,Critics of the Iraq war have slammed the prime minister following a decision to allow British troops to move into dangerous territory around Baghdad under US military command.,World,1,0.88498014
3958,"LONDON, Oct. 17 -- The US-led war in Iraq has not made the world any safer, UN Secretary General Kofi Annan said in a British television interview aired on Sunday.",World,1,0.8898313
3960,AFP - Australia has turned down a diplomatic plea for a contribution to a military force to protect United Nations (UN) personnel in Iraq.,World,1,0.9691137
3979,"An Australian journalist was seized by militants in Iraq for nearly 24 hours, but then released unharmed.",World,1,0.8292582
4076,"AFP - Myanmar's Prime Minister General Khin Nyunt -- among the most reformist of the military regime's leaders -- has been sacked and placed under house arrest for alleged corruption, a Thai government spokesman said.",World,1,0.86172855
4077,"Care International charity says its chief of operations in Iraq has been kidnapped in Baghdad. A spokeswoman told Reuters on Tuesday that Margaret Hassan, who has been working ",World,1,0.83430207
4087,Israel's opposition leader warns that the prime minister risks being assassinated over his Gaza disengagement plan.,World,1,0.8276308
4095,"A mortar attack on an Iraqi National Guard headquarters north of Baghdad killed at least four National Guards and injured 80 others, officials said Tuesday.",World,1,0.8654184
4104,"Supporters of Afghan President Hamid Karzai say he is on course to win the presidential elections, with about one-quarter of the votes counted.",World,1,0.87582016
4108,BAGHDAD - Iraqi militants threatened to kill an Australian journalist and interrogated him for more than 20 hours after kidnapping him outside a Baghdad hotel.,World,1,0.9386908
4127,"A radical Muslim cleric who is wanted on terrorism charges in the United States was accused by British prosecutors Tuesday of encouraging others to murder non-believers, including Jews, and inciting racial hatred.",World,1,0.8364777
4183, JERUSALEM (Reuters) - Israel's parliament took  extraordinary security steps Wednesday for a vote next week on  a Gaza pullout plan expected to spark Jewish settler protests  and heighten death threats against Prime Minister Ariel Sharon.,World,1,0.92953175
4209,"Canadian Press - BEIJING (AP) - A gas explosion in a coal mine in central China killed 56 people and left scores trapped and missing, the government said Thursday.",World,1,0.8834061
4229,At least one Palestinian is shot dead by Israeli troops as he attacked a checkpoint near Gaza City.,World,1,0.94149196
4251,Sudan #39;s government and Darfur rebels are likely to restart talks Thursday as the African Union said it would increase its forces in the restive region.,World,1,0.88127196
4261,"Britain agreed Thursday to meet a U.S. request for British troops to be moved into volatile central Iraq, a proposal that has met strong opposition within the governing Labour Party.",World,1,0.8350834
4282,"GAZA CITY: One of the leaders of Hamas #39; military wing was killed in an Israeli airstrike in Gaza City early today, a Hamas spokesman said.",World,1,1.0050907
4307,AP - A military judge ordered a U.S. Army reservist on Friday to stand trial Jan. 7 in Baghdad for allegedly abusing Iraq inmates at the Abu Ghraib prison outside Baghdad.,World,1,0.9743736
4315,"Religious and political leaders gather at the Umm al-Qura Sunni Muslim mosque outside Baghdad, where clerics called for their followers to boycott Iraq #39;s January elections.",World,1,0.95961833
4344,"In line with his pledge made during the election campaign, Indonesian new President Susilo Bambang Yudhoyono stressed the importance of fighting corruption and terror while ",World,1,0.872402
4353,"AP - A roadside bomb exploded near an American military patrol in Baghdad Saturday, injuring six soldiers, the U.S. command said.",World,1,0.9085766
4358,"Reuters - U.S. planes bombed targets in\Iraq's rebel-held city of Falluja, killing two people, and the\U.S. military said it had captured a lieutenant of its\deadliest Islamist enemy in Iraq in a raid early on Saturday.",World,1,0.9001978
4374,"Insurgents launched strikes on Saturday at United States and Iraqi outposts across Iraq, killing at least a dozen Iraqi police officers and national guardsmen ",World,1,0.917988
4376,"Suspected Algerian Islamic militants killed 16 people in the first attack on civilians since the start of the holy month of Ramadan, officials said on Saturday.",World,1,0.85039425
4378,"KABUL - A man with six grenades strapped to his body killed himself and a 12-year-old girl on a busy street in Kabul Saturday, police said.",World,1,0.8594289
