,Original_Text,Class_String,Class_Number,Neuron_43
57,"BAGHDAD, Iraq - Delegates at Iraq's National Conference called on radical Shiite cleric Muqtada al-Sadr to abandon his uprising against U.S. and Iraqi troops and pull his fighters out of a holy shrine in Najaf...",World,1,0.9199894
90," KABUL (Reuters) - The United States has brokered a  cease-fire between a renegade Afghan militia leader and the  embattled governor of the western province of Herat,  Washington's envoy to Kabul said Tuesday.",World,1,0.8869796
98,"AGHDAD, Iraq, Aug. 17  A delegation of Iraqis was delayed for security reasons today but still intended to visit Najaf to try to convince a rebellious Shiite cleric and his militia to evacuate a shrine in the holy city and end ...",World,1,0.83575207
108,"AFP - Sudan will take the lead in restoring order to its rebellious Darfur region but needs the support of African peacekeepers and humanitarian aid, Foreign Minister Mustafa Osman Ismail said.",World,1,0.93140197
131,"AFP - Georgian and South Ossetian forces overnight accused each other of trying to storm the other side's positions in Georgia's breakaway region of South Ossetia, as four Georgian soldiers were reported to be wounded.",World,1,0.83160865
159, GAZA (Reuters) - A senior Hamas leader survived an Israeli  assassination attempt in the Gaza Strip Wednesday but at least  five other Palestinians were killed in the explosion that tore  through his home.,World,1,0.84122205
163," PRESENTACION, Philippines (Reuters) - Philippine communist  rebels freed Wednesday two soldiers they had held as ""prisoners  of war"" for more than five months, saying they wanted to  rebuild confidence in peace talks with the government.",World,1,0.8235997
187,"Police in Burundi #39;s capital, Bujumbura, used tear gas to break up a demonstration Wednesday held to protest the massacre of Congolese Tutsi refugees. ",World,1,0.8203758
192,"AFP - Democratic White House hopeful Senator John Kerry warned that President George W. Bush's plan to withdraw 70,000 troops from Europe and Asia would hinder the war on terrorism and embolden North Korea.",World,1,0.89704275
193,Shia cleric Moqtada Sadr reportedly agrees to end an uprising in the holy Iraqi city of Najaf.,World,1,0.8616589
203," BAGHDAD (Reuters) - U.S. forces killed more than 50 Shi'ite  militiamen on Wednesday in a significant advance into a Baghdad  suburb that is a powerbase for radical cleric Moqtada al-Sadr,  the military said.",World,1,0.9496801
221,"YASSER Arafat, the Palestinian president, made a rare acknowledgement of mistakes under his rule yesterday and urged reforms to end corruption. ",World,1,0.85118407
238,"Italian Premier Silvio Berlusconi (left) goes for a walk with British Prime Minister Tony Blair and his wife Cherie Blair at Berlusconi #39;s villa, Monday. AP ...",World,1,0.862427
249,The kidnappers of an American-French journalist in Iraq have threatened to execute him within 48 hours unless US forces withdraw from the holy city of Najaf. ,World,1,0.8277607
296,"Reuters - Some 30,000 Sudanese, victims of fresh\attacks by Arab militia inside Darfur, have threatened to cross\into Chad, the U.N. refugee agency warned on Friday.",World,1,0.9309262
321," NAJAF, Iraq (Reuters) - Rebel Shi'ite fighters appeared  still to be in control of the Imam Ali mosque in the Iraqi city  Najaf early on Saturday, but the whereabouts of their leader,  the fiery cleric Moqtada al-Sadr, were unknown.",World,1,0.8820312
332,"Israeli soldiers shot and killed a Palestinian as he approached a security fence between Israel and the Gaza Strip, Israeli military sources said on Saturday.",World,1,0.9705892
342,"PAKISTANI troops backed by artillery and aircraft attacked two suspected terrorist hideouts near the rugged Afghan border yesterday, killing and wounding a number of militants, Pakistan army and security officials said.",World,1,0.95380616
351,"Fatah, the mainstream Palestinian movement, hopes that its former West Bank leader Marwan Barghouti would take back his candidacy for the Jan. 9 presidential election.",World,1,0.8469014
361,"AFP - A Jewish social centre in central Paris was destroyed by fire overnight in an anti-Semitic arson attack, city authorities said.",World,1,0.82017
364," KABUL (Reuters) - A man and two women were shot dead by  Afghan and U.S.-led troops after their vehicle ran through a  checkpoint on Saturday, a U.S. military statement said.",World,1,0.8676498
368,"AP - Russian President Vladimir Putin made an unannounced visit to Chechnya on Sunday, laying flowers at the grave of the war-ravaged region's assassinated president a week before elections for a new leader.",World,1,0.84418935
388,"A man and two women were shot dead by Afghan and US-led troops after their vehicle ran through a checkpoint on Saturday, a US military statement said.",World,1,0.8666413
389,Afghan President Hamid Karzai is to visit Pakistan to discuss fighting terror and boosting trade.,World,1,0.8545657
393," NAJAF, Iraq (Reuters) - A U.S. AC-130 gunship attacked  Shi'ite militia positions in the holy Iraqi city of Najaf early  on Monday after tanks reinforced the siege of a shrine at the  center of a nearly three-week insurgency.",World,1,0.87788045
402,": A military plane crashed into a mountain in Central Venezuela, killing 25 people, including five children, the Air Force rescue team said in a statement.",World,1,0.82062036
403,AFP - The African Union will bring Sudan's warring government and rebel armies into talks with regional power-brokers aimed at heading off a mounting humanitarian crisis in the province of Darfur.,World,1,0.9209534
472,"A former Palestinian security minister who could be key to keeping order among rival factions in Gaza after an Israeli pullout held a fence-mending meeting Monday with President Yasser Arafat, officials said.",World,1,0.9448434
505," SEOUL (Reuters) - North Korea hurled invective at President  Bush for a second day on Tuesday, calling him a political idiot  and human trash, and said six-party talks on Pyongyang's  nuclear ambitions appeared doomed.",World,1,0.8594413
513,British Foreign Minister Jack Straw said his country does not plan to deploy forces to Darfur in western Sudan but will provide technical assistance.,World,1,0.8223489
566,"ABUJA, Aug 25, 2004 (dpa) -- Rebel groups agreed Wednesday to participate in peace talks with the Sudanese government being held in the Nigerian capital of Abuja after coming under pressure to disarm and accept confinement to camps in the country #39;s ",World,1,0.82251203
579,"AFP - Afghanistan has a chance for real political legitimacy when voters go to the polls in the country's first post-Taliban presidential election, the UN's envoy to the nation said.",World,1,0.8253897
625," NAJAF, Iraq (Reuters) - A mortar attack on a packed mosque  in the town of Kufa on Thursday killed at least 25 people as  Iraq's most influential Shi'ite cleric headed to the nearby  holy city of Najaf to try to end a bloody three-week uprising.",World,1,0.847779
639,"Reuters - Iraqi kidnappers of seven employees of a Kuwaiti company said in a video statement on Thursday they would release the captives once their employer halted operations in Iraq, Al Arabiya television reported.",World,1,0.82290685
652,Australian Foreign Minister Alexander Downer says a US investigation has rejected allegations that Australian terror suspect David Hicks was abused while in US custody in Afghanistan and Cuba.,World,1,0.83059776
672,"GAZA CITY: The Israeli army demolished 13 Palestinian houses during an incursion in the southern Gaza Strip town of Rafah on Thursday, Palestinian security sources and witnesses said.",World,1,1.0045925
695," NAJAF, Iraq (Reuters) - Rebel Iraqi cleric Moqtada al-Sadr  on Friday ordered his men inside Najaf's Imam Ali mosque to lay  down their weapons and join thousands of Shi'ite pilgrims  outside the shrine.",World,1,0.9044577
720,"One of two Russian airliners that crashed nearly simultaneously was brought down by a terrorist act, officials said Friday, after finding traces of explosives in the plane's wreckage. A Web site connected to Islamic militants claimed the action was connected to Russia's fight against Chechen separatists.",World,1,0.8358388
725,Nepalese Prime Minister has rejected the UN offer of mediating in talks with Maoist rebels. But Sher Bahadur Deuba has not ruled out an expanded role for India to resolve the conflict in the Himalayan kingdom.,World,1,0.83649105
775,"KHARTOUM, Sudan -- Armed with knives, Eritrean deportees hijacked a plane that left Libya carrying about 80 fellow Eritreans and forced it to land yesterday in the Sudanese capital before surrendering to security forces, officials said.",World,1,0.84427214
780,A Yemeni court jailed five al Qaeda supporters for 10 years Saturday for the bombing of the French supertanker Limburg and sentenced to death another militant who plotted to kill the US ambassador to the Arab state.,World,1,0.8859201
792,AFP - Sudanese rebels walked away from African Union peace talks to hold a 24-hour boycott in protest at alleged government attacks on civilians in the war-torn western province of Darfur.,World,1,0.998716
795,"Falluja and Ramadi, and much of Anbar Province, are now controlled by militias, with U.S. troops confined to outside bases.",World,1,0.8672476
797,US forces and radical Shiite cleric Muqtada al-Sadr #39;s militia battled Saturday in Baghdad even as the truce that ended the bloody fighting between US-Iraqi troops and the militia forces in Najaf held for a second day.,World,1,0.81991196
799,"AFP - The United States suspended flights of CH-53D military helicopters in Japan, bowing to protests over a crash in an Okinawa university campus.",World,1,0.82345915
818,Tuesday: A Shiite insurgency appeared to be weakening as Iraqi forces moved to within 200 yards of the Imam Ali Shrine. Wednesday: Iraq #39;s top Shiite cleric returned home with a peace initiative demanding an end to the fighting in Najaf.,World,1,0.8480884
831, PARIS (Reuters) - France's government and leaders of its  Muslim minority urged Iraqi militants Sunday to free two French  journalists they were holding hostage in a bid to force Paris  to revoke its ban on Muslim headscarves in schools.,World,1,0.84265363
832," BASRA, Iraq (Reuters) - Oil and gas spilled during recent  sabotage attacks on Iraq's southern oil pipelines ignited  Sunday and firefighters battled to douse the flames.",World,1,0.8688766
846,Peace talks between Darfur rebels and the Sudanese Government have resumed after a 24-hour boycott by rebels who accused Khartoum of violating a ceasefire by killing 75 civilians in six villages.,World,1,0.9100959
860,At least seven people have been killed in a bomb blast in central Kabul - the second deadly explosion in Afghanistan over the weekend.,World,1,0.94309783
868,The American military met for five hours on Sunday with representatives of the rebellious cleric Moktada al-Sadr in the volatile Baghdad Shiite neighborhood of Sadr ,World,1,0.969066
869,"Iraq's interim prime minister said that he had held private meetings with representatives of insurgent groups from Fallujah, Ramadi and Samarra to  persuade them to accept a government amnesty offer.",World,1,0.91571
879,"Islamabad, :A new Cabinet in Pakistan is likely to be sworn in on Monday, two days after Finance Minister Shaukat Aziz was made the country #39;s 23rd Prime Minister.",World,1,0.84143007
915,"BAGHDAD, Iraq - Rebel Shiite cleric Muqtada al-Sadr called for his followers across Iraq to end fighting against U.S. and Iraqi forces and is planning to join the political process in the coming days, an al-Sadr aide said Monday...",World,1,0.8274399
919,"KABUL (Masnet  amp; News Agencies) - At least eleven people, including two US citizens, were killed when a truck bomb exploded in downtown Kabul in the second deadly blast to strike Afghanistan over the weekend.",World,1,0.84194845
962,"Canadian Press - CANBERRA, Australia (AP) - Diplomats investigated Tuesday a report that an Australian oil engineer had been abducted in Yemen by armed tribesmen, but a conflicting report from Yemen said there was no kidnapping.",World,1,0.8255738
978,"rebels struggle to make headway in talks aiming to ease the conflict in the Darfur region. sanctions on Sudan, by saying Moscow opposed sanctions.",World,1,0.8546246
986,"Protesters in Kathmandu have expressed disbelief and frustration after learning of the deaths of 12 Nepalese hostages in Iraq. Nepal #39;s ambassador to Qatar, Somananda Suman, confirmed ",World,1,0.87970215
993,"Gunmen opened fire Wednesday on a convoy carrying former Iraqi Governing Council member Ahmad Chalabi in an apparent assassination attempt that wounded two of his bodyguards, Chalabi #39;s spokesman said.",World,1,0.84169716
999,"BAGHDAD - Gunmen ambushed the convoy of former Iraqi governing council president Ahmed Chalabi on Wednesday, wounding two of his bodyguards, aides said.",World,1,0.953265
1047, THE HAGUE (Reuters) - Judges at The Hague tribunal on  Thursday imposed a defense counsel on former Yugoslav President  Slobodan Milosevic to avoid further delays in his war crimes  trial.,World,1,0.90226984
1049,The UN tribunal in The Hague says it will impose a defence lawyer on former Yugoslav leader Slobodan Milosevic.,World,1,0.85720116
1058,"Israeli forces destroyed two five-story apartment buildings in a Gaza refugee camp early Thursday after evacuating thousands of Palestinians from a neighborhood, said residents and the military.",World,1,0.9620812
1090,AP - A group of congressional Democrats is asking President Bush to dismiss a senior military intelligence officer who made church speeches that included inflammatory religious remarks while discussing the war on terrorism.,World,1,0.9004014
1105,"A shoot-on-sight curfew imposed to prevent riots and violent protests over the killing of 12 Nepalese workers in Iraq entered its third day Friday, while officials said they were trying to recover the bodies of the slain hostages.",World,1,0.84951586
1109,"One Saudi policeman was killed and three others were wounded in clashes with militants in a town northeast of Riyadh. A number of suspects were arrested in the battles, officials said.",World,1,0.8641844
1146,"Israeli military helicopters yesterday evening bombarded by missiles a building in one of the refugee camps in the downtown of Gaza, while two Palestinians were killed and other three injured in the sector by the Israeli bullets.",World,1,0.87025994
1180," LORETO, Italy (Reuters) - Pope John Paul prayed for the  victims of the ""inhumane violence"" of Russia's Beslan school  tragedy as he said Mass on Sunday before 200,000 people in  central Italy.",World,1,0.8498102
1185,Reuters - France remained hopeful on Sunday that\two French hostages in Iraq would be freed and a religious\fatwa issued in Iraq demanded their release.,World,1,0.8985876
1186,"Iraq #39;s toppled leader Saddam Hussein and his top aides will go on trial within weeks, Iraqi Minister of State Kasim Daoud said on Sunday.",World,1,0.8804606
1199,"South Africa has canceled a meeting with prosecutors from Equatorial Guinea who had hoped to interview Mark Thatcher on his suspected links to a coup plot in the oil-rich country, officials said on Sunday.",World,1,0.86256915
1224,"AFP - The foreign ministers of India and Pakistan held a closing round of talks amid reports of progress on peripheral issues, but the nuclear rivals remained deadlocked on Kashmir.",World,1,0.8926947
1227," BESLAN, Russia (Reuters) - Russia on Monday mourned the  deaths of hundreds of children and adults in its worst hostage  drama as criticism mounted over the way President Vladimir  Putin and his security forces handled the crisis.",World,1,0.83998364
1239,"BAGHDAD, Iraq -- A US military official in Iraq said seven American marines have been killed Monday in a car-bomb explosion. Several other Marines have been wounded in the attack.",World,1,0.91871613
1263,"A massive car bomb exploded on the outskirts of the Iraqi city of Fallujah, killing seven United States Marines and wounding several others, a US military official said.",World,1,0.91113365
1269,"The Philippines Saturday expressed quot;deepest sympathy quot; to the families of the dead in the Russian school siege on Friday, in which 322 people were killed when Russian troops stormed ",Sci/Tech,4,0.82322323
1298," BAGHDAD (Reuters) - Iraqi fighters battled U.S. troops in a  Baghdad slum district Tuesday, raising the death toll to 22  Iraqis and one U.S. soldier and threatening to wreck a  cease-fire called by rebel Shi'ite cleric Moqtada al-Sadr.",World,1,0.91440266
1316,"US troops battled Shiite militiamen loyal to rebel cleric Muqtada al-Sadr in the Baghdad slum of Sadr City on Tuesday in fierce fighting that killed 36 people, including ",World,1,0.9260364
1329,"AP - Afghanistan's historic election campaign got under way Tuesday, pitting 17 hopefuls against interim leader Hamid Karzai in the race to become the impoverished country's first popularly elected president.",World,1,0.87822926
1352,"Baghdad, Sept. 8 (NNN): Bloody clashes on Tuesday between US forces and Shia militiamen left more than 46 persons, including six US soldiers, dead across Iraq during the past 24 hours, officials said here on Wednesday.",World,1,0.84355175
1386,Reuters - Israeli forces thrust into the outskirts\of the Jabalya refugee camp in the northern Gaza Strip on\Thursday in what the military said was an effort to stop\Palestinians firing rockets into Israel.,World,1,0.9040814
1394,"AFP - Two Britons were shot dead by unknown gunmen near the famous Bridge over the River Kwai in western Thailand, police said.",World,1,0.81995016
1399,"Egypt took a step back from plans to help the Palestinians prepare for an Israeli withdrawal from Gaza on Wednesday, saying it could not play its role in full as long as Israeli attacks on Palestinians continue.",World,1,0.8309157
1445,"JAKARTA, Indonesia - Suspected Muslim militants detonated a car bomb Thursday outside the Australian Embassy in Jakarta, killing nine people and wounding 173 in a bloody strike at a key U.S. ally in the war in Iraq...",World,1,0.92213935
1490,Rebel leaders from Sudan #39;s Darfur region called on Thursday on Nigeria to intervene and kickstart African Union-sponsored talks on the crisis in the west of Sudan ,World,1,0.91555107
1504, HARARE (Reuters) - A Zimbabwe court jailed British former  special services officer Simon Mann for seven years on Friday  in a case prosecutors had linked to a foiled coup plot in  oil-rich Equatorial Guinea.,World,1,0.8763998
1517,AP - U.S. troops handed over medical supplies to Iraqi relief workers Friday amid a siege of a northeastern ethnic Turkish city where Iraqi and American forces are trying to root out hundreds of militants.,World,1,0.90732735
1519,"AP - Accused U.S. Army deserter Charles Jenkins left his Tokyo hospital for an American military base to surrender to military authorities Saturday, nearly 40 years after he allegedly defected to North Korea.",World,1,0.84440786
1521,"TOKYO - Accused U.S. Army deserter Charles Jenkins left his Tokyo hospital for an American military base to surrender to military authorities Saturday, nearly 40 years after he allegedly defected to North Korea...",World,1,0.8595308
1529,The British leader of a group of 67 alleged mercenaries accused of plotting a coup in Equatorial Guinea has been sentenced to seven years in jail.,World,1,0.8736904
1544,A US military intelligence soldier in Iraq has been sentenced to 8 months in prison for taking part in torturing detainees in Abu Ghraib prison.,World,1,0.9230635
1545,At least two protesters were killed when supporters of a sacked Afghan governor clashed with US and Afghan security forces in the western city of Herat.,World,1,0.93851364
1549,AFP - Sealing ratification of an EU constitution and the question of terrorism will top the agenda when Spanish Prime Minister Jose Luis Rodriguez Zapatero welcomes French President Jacques Chirac and German Chancellor Gerhard Schroeder to a summit meeting Monday.,World,1,0.82223356
1593," BAGHDAD (Reuters) - At least 110 people were killed across  Iraq on Sunday in a sharp escalation of violence that saw gun  battles, car bombs and bombardments rock the capital.",World,1,0.8865664
1598,"BAGHDAD, Sept 12: At least 45 people died in a wave of bombings and battles between US troops and militants on Sunday, as Iraq #39;s US-installed prime minister said over 3,000 had perished in the  #39;terrorism #39; washing over the country.",World,1,0.86443496
1636,"KABUL, Afghanistan -- Afghan President Hamid Karzai #39;s government Saturday replaced two governors, including a strongman in the west, in a bold step to establish control ahead of landmark presidential elections.",World,1,0.8573594
1649,VIENNA (MNA) - A United States official confirmed to AFP news agency on Friday that Washington fails to take Irans nuclear issue to the United Nations Security Council for possible sanctions against Tehran.,World,1,0.89367986
1739,"Pakistani forces have been battling al Qaeda fighters in an ongoing operation to rout terrorists in a tribal area near the border with Afghanistan, Pakistani intelligence sources said.",World,1,0.90077496
1760,"At least 69 people have been killed and scores wounded during a day of carnage in Iraq. In Baghdad, 47 Iraqis died and over 120 were injured in a massive explosion near a police station.",World,1,0.8545805
1808,"Three suspected Muslim militants gunned down a Briton in the Saudi capital Riyadh on Wednesday, security sources and diplomats said.",World,1,0.9286386
1828,"For the first time in 41 years, Saudi Arabia is allowing local elections. The ruling family's goal, political analysts and diplomats say, is to determine whether a more open government might help defuse a rising armed threat by Muslim  militants in the kingdom.",World,1,0.8875458
1846,"AFP - Two Americans and a Briton were abducted from their home in a plush Baghdad district at dawn, in the latest blow in Iraq's five-month-old foreign hostage crisis, the interior ministry said.",World,1,0.82758826
1848,"The army is in a very advanced stage of preparations for a withdrawal from the Gaza Strip and four small West Bank settlements in 2005, Israel Defense Forces Chief of Staff, Lieutenant ",World,1,0.8367098
1850,: An Indonesian court sentenced a Muslim militant to 12 years in jail on Thursday after finding him guilty of involvement in last year #39;s JW Marriott hotel bombing in Jakarta.,World,1,0.8489714
1877,"Prime Minister Ariel Sharon acknowledged that Israel was not following the moribund Mideast peace plan, and said an Israeli pullout from the Gaza Strip was unlikely to revive it, according ",World,1,0.8482563
1925,The Bush administration reached a tentative deal yesterday with three European nations at the UN nuclear watchdog agency on the next step in confronting Iran over its suspected nuclear weapons program.,World,1,0.8520561
1933,"BAGHDAD -- Kidnappers seized two Americans and a Briton from their central Baghdad villa at dawn yesterday, in a bold raid that could further limit the mobility of foreigners in the Iraqi capital.",World,1,0.83815455
1939,"A Chechen rebel commander has claimed responsibility for the school hostage siege in southern Russia earlier this month, during which more than 320 hostages were killed, half of them children.",World,1,0.8729516
1965,"Iraqi health officials said American airstrikes that demolished homes late today in a village south of the volatile city of Falluja killed at least 44 people and wounded 27, including women and children.",World,1,0.8555947
1966,"AP - An American jet fired a missile at a house where about 10 members of an al-Qaida-linked group were believed to be meeting in the Sunni insurgent stronghold of Fallujah on Friday, police and the U.S. military said. At least three people were killed.",World,1,0.8583729
1980,BAGHDAD : At least six people were killed in two suicide car bombings in Baghdad while another 47 people died in a series of US air strikes around the Iraqi insurgent bastion of Fallujah.,World,1,0.9773523
1994,"Violence raged on in Iraq on Friday, with five Iraqis killed in a suicide car bombing in Baghdad and three more Turkish drivers reportedly kidnapped.",World,1,0.98394936
2016,The International Atomic Energy's 35-nation board of governors passed a resolution calling for the country to suspend all uranium enrichment activities that could contribute to producing fuel for a nuclear bomb.,World,1,0.84003824
2020,"AFP - Pakistani troops have hemmed in Al-Qaeda-linked foreign fighters and their local allies hiding in tribal border regions with a series of military assaults, a top Pakistani general said.",World,1,0.8750475
2021, UNITED NATIONS (Reuters) - The United States and China held  last-minute talks on Saturday before the U.N. Security Council  was to vote on a resolution that would consider oil sanctions  against Sudan if it did not stop atrocities in the Darfur  region.,World,1,0.8518497
2024,Prime Minister Tony Blair has his government is doing all in its power to help a kidnapped Briton -- but he has avoided a public response to insurgents threatening to kill the man.,World,1,0.84906805
2027," KHARTOUM (Reuters) - Sudan said Saturday that U.N.  sanctions, threatened over atrocities in the Darfur region,  would lead ""this society to a complete destruction.""",World,1,0.85859376
2042,"AFP - Japan's army has worked out a secret plan to deal with possible large-scale terror attacks by North Korea, a press report said.",World,1,0.85106766
2055,"A suicide attacker detonated a car bomb Sunday near a joint US-Iraqi checkpoint, killing three people and wounding seven, including four US soldiers in the northern city of Samarra, the military said.",World,1,0.9164002
