,Original_Text,Class_String,Class_Number,Neuron_20
1795,"Microsoft, which recommended immediate updates, said the newly discovered vulnerability could allow remote code execution of code thanks to a buffer-overrun vulnerability in the processing of JPEG image formats.",Sci/Tech,4,1.3738945
1814,"BTG, a London-based firm that focuses on intellectual property and technology commercialization, filed suit against Amazon.com, Barnesandnoble.com and two other Internet companies for infringing on patents related to the tracking of users online.",Sci/Tech,4,1.3703054
1831,"Shareholders approved Aether Systems Inc.'s sale of one of its two remaining operating divisions Wednesday, a deal that will take the Owings Mills company out of the wireless business and nearly complete its transformation into a mortgage investment fund.&lt;BR&gt;\&lt;FONT face=""verdana,MS Sans Serif,arial,helvetica"" size=""-2""\ color=""#666666""&gt;&lt;B&gt;-The Washington Post&lt;/B&gt;&lt;/FONT&gt;",Sci/Tech,4,1.2739673
1833,New PCs will ship with a chip designed to thwart hackers--a hardware approach that's said to be safer than software.,Sci/Tech,4,1.2706054
1854,Iomega Corp. is soon expected to ship its first network-attached storage (NAS) device based on wireless networking technology.,Sci/Tech,4,1.3515084
1898,"Add America Online Inc. to the growing list of companies and organizations shunning a spam-fighting proposal from Microsoft Corp. AOL cited  quot;tepid support quot; for Microsoft #39;s so-called Sender ID technology, which ",Sci/Tech,4,1.2440821
1923,"The FTC gave limited endorsement to the notion of cash rewards for people who help track down e-mail spammers, but suggested that the measure might work in fewer circumstances than had been pushed by some anti-spam activists. &lt;br&gt;&lt;FONT face=""verdana,MS Sans Serif,arial,helvetica"" size=""-2"" color=""#666666""&gt;&lt;B&gt;-The Washington Post&lt;/B&gt;&lt;/FONT&gt;",Sci/Tech,4,1.4441854
1954,The Web console -- to be made available specifically to corporate and enterprise licensees of Norton AntiVirus software -- will allow administrators to distribute virus definitions and product updates on demand.,Sci/Tech,4,1.3041022
1955,"IBM is using a microcontroller from National Semiconductor that stores passwords, digital certificates and encryption keys.",Sci/Tech,4,1.2495135
1964,The Beaverton-based Open Source Development Labs announced this week it is combining some efforts with another open source group to further the adoption of Linux.,Sci/Tech,4,1.3400581
1967,NewsFactor - Questions regarding potential patent issues and skepticism from the \open source community relating to Microsoft's (Nasdaq: MSFT) SenderID have prompted global Internet service provider AOL (NYSE: AOL) to drop the anti-spam technology.,Sci/Tech,4,1.3204265
1978,"Graphics chipmaker ATI (Quote, Chart) unveiled a new technology it said lets its visual chips share system memory for graphics processing.",Sci/Tech,4,1.2723532
1984," #147;The single most effective way to avoid viruses and spyware is to simply chuck Windows altogether and buy an Apple Macintosh, #148; writes Walt Mossberg in the Wall Street Journal.  #147;There has never been a successful virus written for Mac OS X, and there is almost no spyware that targets the Mac. Plus, the Mac is invulnerable to viruses and spyware written for Windows. Not only is it more secure, but the Mac operating system is more capable, more modern and more attractive than Windows XP, and just as stable. #148; Sep 17",Sci/Tech,4,1.2663721
1986,"Record labels and Microsoft are in discussions about ways that the next generation of the Windows operating system, code-named Longhorn, can support copy-protected CD technology.",Sci/Tech,4,1.3692647
1996,"A new generation of smaller, sleeker and cheaper MP3 players from the likes of Sony, Rio, Creative and Rave MP are hitting the market this fall, and they all have Apple Computer #39;s white-hot digital music player in their sights.",Sci/Tech,4,1.3094896
2007,"Industry observers say Linux's similarity to Unix, its lower cost and ability to run on Intel hardware make the Unix market ripe for open-source conquest.",Sci/Tech,4,1.2428797
2034,"AP - A 20-year-old man has been arrested in England in the theft of the proprietary software blueprints used by Cisco Systems Inc.'s networking equipment, police and the company confirmed.",Sci/Tech,4,1.2684613
2070,"washingtonpost.com - RFID tags, the dime-sized devices that can track inventory from the factory to the store, are being embraced as one of the hottest of new technologies. But Patrick J. Sweeney II likens most available applications of RFID, or radio frequency identification, to the user-unfriendly personal computers of the 1980s: a blank screen and a command prompt.",Sci/Tech,4,1.2560331
2093,"Apple #39;s splashy digital music player has emboldened Microsoft and other technology titans to move quickly to the next frontier in portable entertainment: the video iPod, so to speak.",Sci/Tech,4,1.2612852
2103,"Verity this week will unwrap a software add-on to its search system, designed to make unstructured content more usable in corporate applications. The announcement follows activity from ClearForest, which last month introduced Version 6.0 of its Text Analytics platform for systematically structuring unstructured data so it can be processed with enterprise data in business intelligence systems.",Sci/Tech,4,1.3246732
2104,"Sun Microsystems will hold its quarterly product launch this week, unleashing a raft of new hardware offerings spanning servers to storage.",Sci/Tech,4,1.2800909
2106,"&lt;p&gt;\&lt;/p&gt;&lt;p&gt; SAN FRANCISCO (Reuters) - The number of new viruses and\worms aimed at Microsoft Corp.'s &lt;MSFT.O&gt; ubiquitous Windows\operating system rose 400 percent between January and June from\the same year-earlier period, leading computer security company\Symantec said on Sunday.&lt;/p&gt;",Sci/Tech,4,1.247553
2107,"Yahoo Launching Music Download Service This Year\\After its \$160 million aquisition of MusicMatch, Yahoo is expected to be releasing its own music download service at the end of the year. According to ZDNet, Yahoo has been in the development phase of its music download service since last year, working with ...",Sci/Tech,4,1.2667738
2139,The chipmaker announces a chip that combines VoIP (voice over Internet Protocol) and Wi-Fi into a single chip.,Sci/Tech,4,1.3174621
2143,"JBoss, the self-proclaimed Professional Open Source company, released JBoss Application Server 4.0 today. The announcement follows closely behind the announcements of JBossCache 1.1 and the company #39;s new partnership with Sleepycat Software.",Sci/Tech,4,1.2958913
2149,"Water vapour and methane gas have been found in the same places on Mars, strengthening speculation that the Red Planet could be a haven for microbial life, space scientists say.",Sci/Tech,4,1.3114825
2151,"The European Space Agency says data collected by its probe, Mars Express, has provided new evidence in the search for life on Mars.",Sci/Tech,4,1.2682576
2196,"Ask Jeeves Search Engine Gets Slim and Personal\\Ask Jeeves has introduced new changes which have totally made over the search engine which hopes to give Yahoo, MSN and Google a run for their money. The new changes at Ask.com include MyJeeves personal search, a revamped local search, and an update ...",Sci/Tech,4,1.2874093
2199,"Repairs to the oxygen generator onboard the International Space Station seemed to work, but then failed the following day. Astronauts are again limited to backup oxygen supplies. By Amit Asaravala.",Sci/Tech,4,1.3156242
2202,"From the 1950 #39;s until the present, one of the dominant companies in the world #39;s computer industry. Offers a variety of data processing hardware systems, system and application software, and information technology services.",Sci/Tech,4,1.2862426
2217,"National Science Foundation grants \$12.6 million to university scientists to study worms, viruses and the Net's ecology.",Sci/Tech,4,1.3229028
2269,Cape Clear Software and Neon Systems Inc. on Wednesday announced they are working together to integrate their respective technologies and allow users to quickly integrate mainframe applications and data through the use of Web services.,Sci/Tech,4,1.3859383
2272,"NetManage (Quote, Chart) agreed to acquire privately held Librados for an undisclosed sum. The deal would give NetManage application adapters to help its Host Services Platform server applications via service ",Sci/Tech,4,1.2451057
2294,"AP - For six years, iMacs have set the standard for the PC industry with eye-popping designs, clever utilization of space and leaps forward in usability. Lately, though, Apple Computer Inc. seems to be making more waves with iPod music players than its venerable consumer PCs.",Sci/Tech,4,1.3206588
2348,"This paper discusses the use of NetFlow, a traffic profile monitoring technology available on many routers, for use in the early detection of worms, spammers, and other abnormal network activity in large enterprise networks and service providers. Part 2 of 2.",Sci/Tech,4,1.2708299
2353," NEW YORK (Reuters) - Take-Two Interactive Software Inc.  &lt;A HREF=""http://www.reuters.co.uk/financeQuoteLookup.jhtml?ticker=TTWO.O qtype=sym infotype=info qcat=news""&gt;TTWO.O&lt;/A&gt; on Monday said that prices for its sports video games  will likely return to higher levels once new game consoles  arrive in late 2005 or 2006.",Sci/Tech,4,1.2552077
2358," WASHINGTON (Reuters) - VeriSign Inc. &lt;A HREF=""http://www.reuters.co.uk/financeQuoteLookup.jhtml?ticker=VRSN.O qtype=sym infotype=info qcat=news""&gt;VRSN.O&lt;/A&gt; and a  children's safety group unveiled a new technology on Thursday  that they said would make it easier for children to avoid child  predators online.",Sci/Tech,4,1.2463206
2414,AP - The first solar-wind samples recovered from the crashed Genesis space capsule have been sent to researchers in California.,Sci/Tech,4,1.3145941
2441,Microsoft Watch: Redmond had told developers privately earlier this year of plans to port some SP2 fixes to older versions of Windows.,Sci/Tech,4,1.3138282
2447,"Due to lack of demand, the chipmaker postpones plans to build Wi-Fi access points into desktop PCs this year.",Sci/Tech,4,1.2635273
2483,"Mozilla released a Preview Release of version 1.0 of its new, lightweight browser, named Firefox, even as Web traffic metrics indicate that Microsofts Internet Explorer may be losing market share for the first time in many years.",Sci/Tech,4,1.2480512
2510,"The Bison win their second straight game with a 53-7 domination of nonconference Savannah State before 5,205 at Greene Stadium.",Sports,2,1.241664
2520,"After coming up with Gmail and Google News, rumours are rife that search engine Google is now working on a web browser, reports BBC.",Sci/Tech,4,1.2563255
2522,"Every time a new IE security flaw is announced, or whenever someone gets fed up with hackers manipulating their Web browser, Firefox and other Mozilla-based browsers get a bump in the marketplace.",Sci/Tech,4,1.2742466
2534,"AFP - Riding on the global success of PlayStation 2 (PS2), Sony has launched its first hand-held game console to challenge rival Nintendo, whose Game Boy Advance monopolizes the worldwide portable game market.",Sci/Tech,4,1.3501624
2574,"Adobe has updated Photoshop #39;s support for digital cameras #39; RAW image formats. The new plug-in adds to the number of camera models supported and includes a utility for converting images into the DNG, digital negative format.",Business,3,1.2679341
2601,"SEPTEMBER 27, 2004 (COMPUTERWORLD) - Betrusted Holdings Inc. in New York and TruSecure Corp. in Herndon, Va., last week said they #39;re merging to form a single IT security services vendor.",Sci/Tech,4,1.260993
2608,"IronPort Systems has launched the latest version of its IronPort C-Series E-mail Security Appliance, adding Virus Outbreak Filters that the company said could respond to new virus outbreaks within minutes.",Sci/Tech,4,1.2473817
2611,"Cisco Systems is accelerating its push into the SMB market with the launch this week of entry-level switching modules, an aggregation switch and a Web-based management tool that helps smaller customers gain easier access to high-level features.",Sci/Tech,4,1.2685922
2618,"To boost performance for high-end users, Dell Inc. is upgrading its high-performance computing clusters by adding support for larger Topspin InfiniBand switches and PCIe host channel adapters.",Sci/Tech,4,1.2944871
2655,"It #39;s like doing cold-case detective work on elephants, but University of Washington scientist Samuel Wasser has devised an innovative method for pinpointing the DNA fingerprints of poached elephant tusks.",Sci/Tech,4,1.2554244
2693,"Freescale Semiconductor Inc. took some of the wraps off of its dual-core microprocessor design, which the company said would be tailored to embedded applications.",Sci/Tech,4,1.3267976
2707,"Mary Bellis Waller, now 64, posted on two Internet dating sites during her search for a companion. Waller was a pioneer of online dating among people her age, and thousands of others age 60 and older are also turning to the Internet to find romance.",Sci/Tech,4,1.2725697
2708,"NEW YORK (AP) -- In a harbinger of security threats to come, hackers have exploited a newly announced flaw in Microsoft Corp. (MSFT) programs and begun circulating malicious code hidden in images that use the popular JPEG format...",Sci/Tech,4,1.3984588
2732,"NEW YORK - In a harbinger of security threats to come, hackers have exploited a newly announced flaw in Microsoft Corp. programs and begun circulating malicious code hidden in images that use the popular JPEG format.",Sci/Tech,4,1.3951278
2748,In the beginning there was Darwin. And then there was intelligent design. How the next generation of 'creation science' is invading America's classrooms. By Evan Ratliff from Wired magazine.,Sci/Tech,4,1.251561
2753,"Aimed at making cheaper PCs, Microsoft on Wednesday unveiled low-cost Windows XP Starter Edition operating systems in India in Hindi targetting the first-time home users.",Sci/Tech,4,1.3195506
2756,"The Redmond, Wash.-based software giant today announced a year-long pilot program to start shipping the Windows XP Starter Edition to India in early 2005.",Sci/Tech,4,1.2511092
2797,"Researchers are developing tiny atomic clocks that could be made using standard semiconductor processes and slipped into cellphones, hand-held computers and global positioning system receivers.",Sci/Tech,4,1.272818
2799,InfoWorld - Security experts have spotted the first attempts to create an Internet worm that propagates using instant messages and exploits a recently disclosed flaw in Microsoft software.,Sci/Tech,4,1.4632753
2801,AP - The inventor of the World Wide Web told a technology conference on Wednesday that making the Web more useful hinges on a familiar challenge: Getting the players behind the technology to agree on standards governing how computers communicate with one another.,Sci/Tech,4,1.247852
2804,"In a move to add more open-source arrows to its quiver, Linux seller Red Hat has acquired the Netscape server software products of AOL Time Warner, the companies plan to announce Thursday.",Sci/Tech,4,1.2579824
2807,MOJAVE -- Burt Rutan #39;s space ship one made its first trip into sub-orbital outer space in pursuit of the \$10 million Ansari X Prize.,Sci/Tech,4,1.3121037
2842,"A flurry of space tourism milestones and announcements in recent days signals that human spaceflight is shifting from governments to the private sector, space experts say.",Sci/Tech,4,1.2908746
2849,Linux seller plans to release Netscape Enterprise Suite as open-source software in a bid to expand beyond its core product.,Sci/Tech,4,1.2556273
2862,"NewsFactor - Red Hat (Nasdaq: RHAT) has acquired Netscape \server-software products of AOL Time Warner (NYSE: AOL), as part of the Linux vendor's ""open-source architecture"" strategy.",Sci/Tech,4,1.3275077
2886,"Microsoft just swears that it hasn #39;t given up on Internet Explorer and that it #39;s really, really important to the future of Microsoft, to the next version of Windows, etc.",Sci/Tech,4,1.2822864
2915,"US scientists have charted the genetic map of a microscopic algae that absorbs huge amounts of greenhouse gases.  quot;These organisms are incredibly important in the global carbon cycle, quot; said Virginia Armbrust ",Sci/Tech,4,1.2702286
2918,"Some of the net's biggest players such as AOL, Hotmail and Yahoo are stepping up efforts to combat spam.",Sci/Tech,4,1.3467937
2929,"Designer Burt Rutan #39;s SpaceShipOne cracked through Earth #39;s atmosphere and into outer space Sept. 29. Pilot Mike Mevill guided the aircraft to an altitude of 102,870 meters.",Sci/Tech,4,1.2812978
2931,"SPACE.com - The second attempt by the rocketplane SpaceShipOne to soar into space and snag \  the  #36;10 million Ansari X Prize is planned for Monday, officials announced last \  night.",Sci/Tech,4,1.2537545
2936,"OCTOBER 01, 2004 (COMPUTERWORLD) - Sun Microsystems Inc. this week released Java 2 Platform Standard Edition (J2SE) 5.0, an upgrade of its programming language with more than 100 new features designed to bolster ",Sci/Tech,4,1.2888641
2941,"Despite a seemingly calamitous crash to Earth last month by the Genesis spacecraft, large portions of the solar wind samples it had gathered in space appear to be salvageable, NASA scientists announced on Sept.",Sci/Tech,4,1.3842002
2965,"Amit Yoran, the government's cybersecurity chief, abruptly resigned yesterday after a year at the Department of Homeland Security, a move that raised questions about the Bush administration's ability to quickly improve cybersecurity.",Sci/Tech,4,1.2473798
3034,"Comprehensive security programs that include firewall software, spyware defenses and diagnostic and repair tools are necessay to keep a PC in good health these days. &lt;FONT face=""verdana,MS Sans Serif,arial,helvetica"" size=""-2"" color=""#666666""&gt;&lt;B&gt;-The Washington Post&lt;/B&gt;&lt;/FONT&gt;",Sci/Tech,4,1.4651903
3038,"An Australian open-source industry group on Friday took exception to a Gartner report that pre-loading PCs with Linux is often a precursor to adding a pirated copy of Windows, calling the research  quot;farcical.",Sci/Tech,4,1.3135866
3063,New England win a record-tying 18th straight game - plus an NFL round-up.,World,1,1.3517579
3073,"PalmOne #39;s Tungsten T5 comes with 256MB of flash memory, so you never risk losing your data. If you #39;re a pack-rat type who likes to keep a lot of data you can #39;t afford to lose on your personal digital assistant, PalmOne has a handheld for you.",Sci/Tech,4,1.2644289
3087,Red Hat chairman and chief executive Matthew Szulik said in a statement:  quot;Directory Server and Certificate Management System have already been widely deployed in the enterprise and are mature ,Sci/Tech,4,1.3022257
3100,"InfoWorld - Hoping to put in place the last missing piece of the Java stack, Gluecode Software and the Apache Software Foundation this week unwrapped Project Agila, which the companies claim is the first embeddable open source BPM engine.",Sci/Tech,4,1.2507802
3136,"MacCentral - Apple on Monday released Security Update 2004-09-30, which fixes two AFP Server and CUPS issues as well as problems with NetInfoManager, postfix and the ServerAdmin component in Mac OS X Server v10.2.8 and v10.3.5. In addition, a QuickTime heap buffer overflow problem that could allow someone to execute code hidden in a BMP has been repaired. The CUPS and QuickTime fixes apply to Mac OS X v10.3.5 and v10.2.8 as well as the Server versions of each while the others apply only to the user and Server editions of v10.3.5.",Sci/Tech,4,1.318145
3140,"IBM on Monday introduced a biometric notebook computer with an integrated fingerprint reader,which it says can recognize the user of the computer.",Sci/Tech,4,1.3030072
3159,"update PalmOne on Monday introduced a handheld computer that holds on to data even when the battery runs down, as part of a revamping of its mobile-device lineup.",Sci/Tech,4,1.2787436
3197,"PalmOne Inc., the leading maker of handheld computers, said Tuesday it licensed Microsoft Corp. software that enables secure delivery of corporate e-mail to portable devices.",Sci/Tech,4,1.241533
3199,"palmOne has licensed Microsoft #39;s Exchange Server ActiveSync protocol for use on future Treo devices, allowing for wireless server synchronization.",Sci/Tech,4,1.3595203
3204,"Intertrust, Philips and Sony have added more top consumer electronics, content and technology heavyweights to their attempt to create an open interoperable Digital Rights Management environment.",Sci/Tech,4,1.3136
3222,The Amazon Web Services (AWS) division of online retail giant Amazon.com yesterday released Amazon E-Commerce Service 4.0 and the beta version of Alexa Web Information Service.,Sci/Tech,4,1.3302542
3229,"Yahoo launched a new service designed to let users of its search engine save and manage their query results for accessing later and sharing with others, the company said Tuesday.",Sci/Tech,4,1.2696377
3257,"Fujitsu Computer Systems Corp. on Wednesday plans to unveil upgrades to the company's Primergy tower and rack-mounted servers that will use the 64-bit capable version of the Xeon processor, code-named Nocona.",Sci/Tech,4,1.3342757
3263,Upcoming Opteron chips will occupy the same space as single-core models.,Sci/Tech,4,1.2888037
3278,"MOJAVE, Calif. - The private manned rocket SpaceShipOne (search) streaked toward space early Monday in a bid to top an altitude of 62 miles for the second time in six days and claim the \$10 million Ansari X Prize (search).",Sci/Tech,4,1.2882335
3287,"roundup Plus: Microsoft ships Virtual PC 7...SGI warns of lower revenue, deeper loss...SAP taps search technology.",Sci/Tech,4,1.3082027
3292,"The Department of Homeland Security has filled the nation's top cyber-security post after the previous chief abruptly resigned last week, choosing the former director's deputy to take over the position. &lt;FONT face=""verdana,MS Sans Serif,arial,helvetica"" size=""-2"" color=""#666666""&gt;&lt;B&gt;-washingtonpost.com&lt;/B&gt;&lt;/FONT&gt;",Sci/Tech,4,1.4447954
3306,"AP - Howard Schmidt, a highly regarded technology executive who was former special adviser to President Bush for cybersecurity, is returning to work with the Homeland Security Department on efforts to protect the nation's computer networks.",World,1,1.2629726
3313,Customers using Windows XP Embedded will be able to use a downloadable preview to test the new software for conflicts with existing drivers.,Sci/Tech,4,1.270064
3342,"Monday was a big day in Mojave. Tens of thousands of spectators showed up to see Burt Rutans SpaceShipOne make its second flight from below sea level to the edge of space, and in doing so ",Sci/Tech,4,1.2438176
3364,"TOKYO (AFX) - Firms that are supporting one of the next-generation optical DVD formats, the Blu-ray Disc, plan to release camcorders that record on smaller versions of the discs as early as 2005, the Nihon Keizai Shimbun reported, without citing sources.",Sci/Tech,4,1.2539821
3371,"Nokia Corp. has no immediate plans to use Intel Corp.'s processors in its handsets, the Finnish phone maker said Thursday, tempering an announcement earlier this week that Intel is building a reference design for a Symbian OS (operating system) mobile phone based on Nokia's Series 60 user interface.",Sci/Tech,4,1.3363146
3375,"New Trojan Targets Adware\\Antivirus maker Symantec has reported the arrival of a spooky Trojan Horse online, which does something unique. Codenamed Downloader.Lunii, it attacks and even removes advertisement enabled softwares, which are generally considered harmful for the system. On execution of the code, it tries to kill the processes associated ...",Sci/Tech,4,1.2521813
3383,"The number of homes using Net telephony should reach 12 million by 2009, but existing VoIP players could face hurdles.",Sci/Tech,4,1.2371167
3404,"SAN FRANCISCO - As expected, Advanced Micro Devices Inc.'s (AMD's) third-quarter revenue came in a little under the company's earlier predictions, but strong increases in sales of its 64-bit desktop and server processors led to the company's fourth straight profitable quarter.",Sci/Tech,4,1.2719653
3421,PROGRESS: Many students eagerly await the final version of Mozilla #39;s Firefox Internet browser that will be released later this month.,Sci/Tech,4,1.2847335
3435,InfoWorld - Microsoft and Sun Microsystems on Thursday are publishing a specification to leverage Web services for managing a broad range of IT systems including PCs and devices on a network.,Sci/Tech,4,1.2385632
3438,"Curious polygon shapes on the surface of Mars are among the latest evidence clearly suggesting the presence of water, and some of it may have appeared there even after the surface was bombarded by objects from distant space.",Sci/Tech,4,1.3174103
3455,Sun Microsystems says it will pay Kodak \$92 million to settle a high-profile patent suit involving Sun #39;s Java programming technology.,Business,3,1.260817
3456,Yesterday we covered the news that Google is expanding their search to the mobile arena with their new Google SMS service which lets you search by sending text messages from your cellphone.,Sci/Tech,4,1.3147781
3472,"LOS ANGELES - NASA #39;s Mars rover, Opportunity, has found more signs that rocks on the Red Planet were once submerged in water. Data sent by Opportunity suggest a crater was drenched a second time after drying out, scientists said.",Sci/Tech,4,1.2905991
3478,SAN FRANCISCO - Representatives for the music and movie industries have filed a petition asking the U.S. Supreme Court to overturn an appeals court decision in which companies that enable peer-to-peer (P-to-P) file trading networks were absolved of liability for copyright violations by users of those networks.,Sci/Tech,4,1.2593114
