,Original_Text,Class_String,Class_Number,Neuron_22
3827,"Amphibians such as leopard frogs and salamanders are threatened with extinction as their homes dry up and a new disease spreads, possibly as a result of global warming, according to a new study in Science magazine.",Sci/Tech,4,0.6473143
3872,"OCTOBER 15, 2004 (IDG NEWS SERVICE) - Dell Inc. took the wraps off its holiday lineup on Thursday, showing new printers, plasma televisions and music players that will soon be available through its Web site.",Sci/Tech,4,0.6349383
3891,IBM on Friday introduced high-end servers in its pSeries and iSeries lines that include virtualization features and raw power that some experts say put the products on par with offerings from rival Hewlett-Packard Co.,Sci/Tech,4,0.62323016
3922,"A RUSSIAN spacecraft has delivered three astronauts to the International Space Station, overcoming docking system problems which had delayed its launch.",Sci/Tech,4,0.6264516
3954," NEW YORK (Reuters) - Price declines for U.S. consumer  electronics accelerated in August, fueled by discounted price  cuts for the popular iPod digital music player and traditional  DVD players, according to an industry study prepared for  Reuters.",Sci/Tech,4,0.6633786
3968,"The findings come in a report from the newly formed Consumer Spyware Initiative, a joint effort by Dell and the non-profit Internet Education Foundation that aims to increase awareness of spyware.",Business,3,0.6376469
3970,"SAN FRANCISCO -- At virtually every turn, Intel Corp. executives are heaping praise on an emerging long-range wireless technology known as WiMAX, which can blanket entire cities with high-speed Internet access.",Business,3,0.6451085
3989,Microsoft confirms that a pirated copy of Halo 2 for Xbox in the PAL video format and French language started circulating on the Internet this week over newsgroups and piracy sites.,Sci/Tech,4,0.68553483
3991,"Tough times often make for strange bedfellows, and the explosion of viruses, computer worms and spyware programs on the Internet is producing unique alliances among top technology firms. &lt;FONT face=""verdana,MS Sans Serif,arial,helvetica"" size=""-2"" color=""#666666""&gt;&lt;B&gt;-washingtonpost.com&lt;/B&gt;&lt;/FONT&gt;",Sci/Tech,4,0.75532156
4000,"Google has announced a new desktop search application that enables users to search their e-mail, files, web history, and chats. Perhaps learning from previous mistakes, Google says it has designed the product  quot;from the ground up to respect user privacy.",Business,3,0.6495873
4005,"OCTOBER 18, 2004 (COMPUTERWORLD) - IBM and Borland Software Corp. last week separately brought out upgrades to their development tool lines that executives said add support for heterogeneous environments and ",Sci/Tech,4,0.6788651
4016,PC World has posted a news article claiming that the highly anticipated game Halo 2 for the Xbox has been released on the net.  quot;Microsoft confirms that a pirated copy of Halo 2 for Xbox in the PAL video format ,Sci/Tech,4,0.6769412
4023,"OCTOBER 18, 2004 (COMPUTERWORLD) - Microsoft Corp. #39;s move to a monthly patch-release cycle one year ago this month has made it easier to install security updates for Windows and other products, IT managers said last weekeven as they were greeted with a ",Sci/Tech,4,0.63490075
4047,"AP - People who use public or workplace computers for e-mail, instant messaging and Web searching have a new privacy risk to worry about: Google's free new tool that indexes a PC's contents for quickly locating data.",Sci/Tech,4,0.6331181
4069,Microsoft and Cisco Systems will collaborate to make their emerging products for network security compatible. The vendors had been working independently in the area of PC access to networks but say customers ,Sci/Tech,4,0.67966616
4070,"Linux distributor Red Hat Inc has appointed a vice president of desktop infrastructure technologies, a new position demonstrating its renewed commitment to Linux as a desktop operating system.",Sci/Tech,4,0.6724722
4073,"Trust Digital Inc., a McLean software company, is getting a new chief executive and \$3.1 million in new investments as it tries to expand its business making security software for wireless devices. &lt;FONT face=""verdana,MS Sans Serif,arial,helvetica"" size=""-2""\ color=""#666666""&gt;&lt;B&gt;-The Washington Post&lt;/B&gt;&lt;/FONT&gt;",Sci/Tech,4,0.7411394
4083,"Customers that use the dual-core processors that Intel Corp. and Advanced Micro Devices Inc. (AMD) are expected to begin shipping next year will not need to buy extra licenses for Microsoft Corp. software, the software maker will announce Tuesday.",Sci/Tech,4,0.62299705
4084,"Advanced Micro Devices Inc. (AMD) is expected to unveil its most powerful desktop processors to date on Tuesday, a few days after rival Intel Corp. disclosed changes to its desktop processor road map.",Sci/Tech,4,0.6427021
4105,"OCTOBER 19, 2004 (IDG NEWS SERVICE) - Customers that use the dual-core processors Intel Corp. and Advanced Micro Devices Inc. expect to ship next year won #39;t need to buy extra licenses for Microsoft Corp.",Sci/Tech,4,0.658778
4177,"The Istanbul technology is meant to replace MSN chat and Windows Messenger. Microsoft has not released much information on the technology, which may not reach market until next year or even later.",Sci/Tech,4,0.6450568
4195,"Customers who use the dual-core processors that Intel and Advanced Micro Devices are expected to begin shipping next year will not need to buy extra licenses for Microsoft software, the software maker will announce next week.",Sci/Tech,4,0.6454419
4244,"Texas Instruments Inc. today announced development of the wireless industry #39;s first digital TV on a single chip for cell phones, code-named  quot;Hollywood.",Sci/Tech,4,0.6286795
4264,"The Motley Fool - The lure of bundling services has been hanging over the communications industry for the past six years or so, although many companies have been unable to perfect a winning strategy. Bundling brings together services such as wired (local and long distance) and wireless phone service, Internet access, and satellite or cable television services.",Sci/Tech,4,0.6457329
4306,"Microsoft and Swatch announced a new line of wireless data watches named Paparazzi. The watches offer news, sports, weather and stock quotes, among other snippets of content, via Microsoft #39;s MSN Direct wireless data service.",Sci/Tech,4,0.6265418
4316,"There is a strong trend for consumers to move away from using fixed-line phones in concert with mobiles to use mobile handsets for all or most of their voice calls, according to a study conducted for Finnish mobile handset maker Nokia by UK market ",Sci/Tech,4,0.7027527
4346,"The \$41 billion merger between Cingular Wireless LLC and AT T Wireless Services Inc. won approval from the Federal Communications Commission Friday, according to federal sources close to the agency. &lt;BR&gt;\&lt;FONT face=""verdana,MS Sans Serif,arial,helvetica"" size=""-2""\ color=""#666666""&gt;&lt;B&gt;-The Washington Post&lt;/B&gt;&lt;/FONT&gt;",Sci/Tech,4,0.71901035
4381,MAJOR Japanese computer maker Toshiba aimes to sell laptop computers that are loaded with its next generation DVD drive by next year.,Sci/Tech,4,0.63522935
4442,I.B.M. plans to begin releasing a monthly report of threats to computer networks in an effort to establish an indicator similar to the federal governments Homeland Security Advisory System.,Sci/Tech,4,0.6513157
4488,"WASHINGTON - Internet users at home are not nearly as safe online as they believe, according to a nationwide inspection by researchers.",Sci/Tech,4,0.6376054
4493,"washingtonpost.com - Think your PC is safe? Think again. A new study indicates your home computer is likely bogged down with spyware, viruses and other scourges wrought by hackers and PC pranksters. Ignorance may be bliss for some people, but for computer users, not knowing can be costly and inefficient.",Sci/Tech,4,0.6557366
4498,"\\Found this  via BoingBoing this morning:\\""The new Treo 650 is out today -- and as a long-time fan of the Treo, I've been\looking forward to it. I've asked in the past for ""one with everything"" -- a\phone with all the features I could want in one device, without\compromises. It looks like PalmOne delivered, with a 320x320 screen, removable\battery, upgraded OS, a better camera, and Bluetooth.""\\""Oops -- not quite! TreoCentral is reporting that the Sprint version of the\Treo 650 doesn't allow you to use Bluetooth for dial-up networking through\your computer. Apparently other carriers will, but not Sprint.""\\""You see, Sprint sells connection cards, which are PCCards that allow you to\dial up y ...\\",Sci/Tech,4,0.6474466
4501,"United Online Inc., a California-based provider of low-cost Internet subscription services, has agreed to buy Internet networking company Classmates Online Inc.",Business,3,0.6238003
4502,One of the first pieces of malicious code targeting Apple's Mac OS X operating system has been discovered.\,Sci/Tech,4,0.6263408
4503,IBM on Monday plans to begin releasing a monthly report of threats to computer networks in an effort to establish an indicator similar to the US government #39;s Homeland Security Advisory System.,Sci/Tech,4,0.6271051
4506,Most users think their computer is safe from adware and spyware--but they #39;re wrong. A survey conducted by Internet service provider America Online found that 20 percent of home computers were infected by a ,Sci/Tech,4,0.6815422
4507,"Yahoo may glow in the halo effect of the popular Adobe Acrobat Reader, installed on more than 500 million computers. At 274 million users, Yahoo will leverage the partnership to try to oust ",Sci/Tech,4,0.6510705
4508,"The Federal Trade Commission won an important victory last week in its fight to protect consumers from spyware, the software that tracks unsuspecting Web surfers, bombards them with advertisements and sometimes even steal login information and passwords.",Business,3,0.6807151
4515,"Adobe Systems Inc. ADBE.O and Yahoo Inc. YHOO.O on Monday said they have signed a deal to combine Adobe services, like its widely used document-sharing program, with Yahoo #39;s Web search functions.",Sci/Tech,4,0.64934796
4525,"com October 25, 2004, 6:49 PM PT. This priority retains its ranking at number five as more and more companies deploy Web Services to share business logic, data and processes with each other and with clients.",Sci/Tech,4,0.6667793
4547,"Adobe Systems and Internet provider Yahoo! have announced a tie-up aimed at providing consumer services to Internet users. The two companies will introduce integrated products that feature Adobe services, increase the reach of Yahoo!",Sci/Tech,4,0.6705401
4557,"A little over a year after introducing the first version of Office Live Communications Server, Microsoft Corp. in December plans to release the next version of its enterprise instant messaging software, it said Monday.",Sci/Tech,4,0.6786009
4559,"SAN FRANCISCO - Intel Corp. is working on a device management technology that could allow IT departments to take advantage of existing management software and bring a host of disparate wireless devices under the IT department umbrella, an Intel executive said Monday at the Cellular Telecommunications and Internet Association's Wireless Entertainment and IT conference here.",Sci/Tech,4,0.6522944
4571,"A little over a year after introducing the first version of Office Live Communications Server, Microsoft says it plans to release the next version of its enterprise instant messaging software, in December.",Business,3,0.6850525
4600,U.S. District Judge Joseph A. DiClerico Jr. ordered Sanford Wallace and his companies to remove any software scripts from their Web sites that exploit security vulnerabilities in some versions of Internet Explorer.,Sci/Tech,4,0.6729307
4604,Microsoft released on Tuesday a preview version of new tools intended to make it easier for companies to create custom Web applications.,Sci/Tech,4,0.6318675
4609,"Linux desktop vendor Xandros Inc. on Tuesday announced the availability of its new Xandros Desktop Management Server (xDMS) application, which gives IT administrators the tools to roll out, configure and maintain mass deployments of Linux-equipped PCs.",Sci/Tech,4,0.6800431
4610,AP - Apple Computer Inc. on Tuesday introduced a new larger-capacity iPod with a color display as well as a first-of-its-kind digital compendium of the rock band U2's songs.,Sci/Tech,4,0.64079994
4641,AP - United Microelectronics Corp.  #151; the world's No. 2 producer of made-to-order chips  #151; on Wednesday reported that its third-quarter net profit more than doubled on year as shipments of chips for mobile phones and other gadgets increased.,Sci/Tech,4,0.6303664
4674,"Dell (Quote, Chart) officials announced Wednesday an agreement with Linux distributor Novell (Quote, Chart) to distribute and support SUSE Enterprise Server 9 on its single- and dual-processor line of servers.",Sci/Tech,4,0.68553245
4678,"Much ado has been made about whether or not Linux is truly more secure than Windows. The results were not unexpected. Even by Microsoft #39;s subjective and flawed standards, fully 38 of the most recent patches address flaws that Microsoft ranks as Critical.",Sci/Tech,4,0.6497748
4681,"The worldwide market for handheld devices saw its third successive quarter of year-over-year decline in the third quarter of 2004, according to a new report released by IDC.",Business,3,0.6236058
4689,"SAN FRANCISCO -- Yahoo (Quote, Chart) expanded its search empire to the mobile arena with the launch of some additional services. The company was one of the original content providers for mobile devices running ",Business,3,0.6491863
4701,"If a handheld device doesn't have voice capabilities, a growing number of users around the world aren't interested, according to IDC. For the third straight quarter, shipments of handheld devices such as personal digital assistants (PDAs) fell as some prominent vendors decided to pull back from the market, IDC said Wednesday.",Sci/Tech,4,0.68299925
4706,"Yahoo added a search feature for cell phones Wednesday, just a few weeks after rival Google launched one of its own. While Google SMS (Short Message Service) uses text-only messages to deliver its results, Yahoo #39;s ",Sci/Tech,4,0.6558814
4721,"Companies that provide federal agencies with network integration and payroll accounting technologies are benefiting from a government trying to bolster its defenses against terrorism, experts say. &lt;br&gt;&lt;FONT face=""verdana,MS Sans Serif,arial,helvetica"" size=""-2""\ color=""#666666""&gt;&lt;B&gt;-The Washington Post&lt;/B&gt;&lt;/FONT&gt;",Sci/Tech,4,0.7330719
4740,"Novell has given its recently acquired Linux distro, SuSE, a push, by signing an agreement with Dell to offer SuSE Linux Enterprise Server (SLES) 9 on select PowerEdge servers worldwide.",Sci/Tech,4,0.6715753
4742,"SONY is going head-to-head with Nintendo in the battle for the handheld games console market. The company will price its long-awaited PlayStation Portable (PSP) at about 100 for its launch in Japan, when ",Sci/Tech,4,0.6459632
4749,"Google and Microsft Getting Close\\Microsoft partnering with Google? Well sort of, an article released yesterday details the relationship between the two, and the use of Google Deskbar in Microsoft's Partner Pack for Windows, ""a collection of Microsoft and third-party products released last week that Microsoft describes on its Web site ...",Sci/Tech,4,0.6833905
4754,"US chip maker Advanced Micro Devices AMD.N has unveiled a low-cost Internet access device that could cost just a few hundred dollars, aimed at first-time technology users in the developing world.",Sci/Tech,4,0.6221786
4767,"Yahoo will offer its own version of wireless Internet searching, keeping pace with rival Google, which recently introduced a mobile search offering.",Sci/Tech,4,0.65017265
4773,America Online Inc. said Thursday it had filed a federal lawsuit accusing numerous unnamed defendants of violating federal and state laws by sending bulk messages known as  quot;spim quot; to instant message accounts and Internet chat rooms.,Business,3,0.6854812
4779,"Advanced Micro Devices is launching a low-cost Internet access device dubbed  quot;PIC, quot; or personal Internet communicator, targeted at first-time computer users in the developing world.",Sci/Tech,4,0.6345721
4783,The nation #39;s largest e-mail providers today filed a new round of lawsuits against Internet spammers allegedly responsible for shoveling millions of junk e-mail messages into computer users #39; in-boxes and their instant messaging screens.,Business,3,0.6950958
4793,EMC has unveiled long-awaited storage virtualization technology that the company said will allow users to manage its arrays -- and high-end boxes from major competitors -- through a single interface.,Sci/Tech,4,0.6578488
4850,"Reuters - Stock of Google Inc.  powered\to new highs on Friday, buoyed by the web search leader's new\products and growth prospects, which complement its recent\strong financial results, analysts said.",Sci/Tech,4,0.6397294
4857,NewsFactor - America Online is adding a layer of security to its popular Internet\service with the bundling of virus protection software from McAfee at no\charge to customers. AOL (NYSE: AOL) claims it is the first ISP to offer premium\antivirus coverage in the basic membership package.,Sci/Tech,4,0.6255636
4860,"Reuters - The surface of Saturn's moon Titan\may be covered by thick drifts of combustible organic ""snow""\floating on lakes of liquid methane or water and ammonia ice\flows, NASA scientists said on Friday.",Sci/Tech,4,0.6597311
4915,The American space agency Nasa says the first space shuttle mission since the Columbia disaster of 2003 is to be launched next May or early June.,Sci/Tech,4,0.6228279
4936,"Earlier this year Microsoft released a major security update for Windows XP, which was designed to strengthen the operating systems defences against attack from viruses and hackers.",Sci/Tech,4,0.6329448
4942,Steve Ballmer #39;s letter to customers said nothing about the widespread reality of tens of thousands of Microsoft customers who are eager to deploy BOTH Windows and Linux.,Sci/Tech,4,0.67040944
4947,"The Chinese government confirmed this weekend that it has closed 1,600 internet cafes and fined operators a total of 100m yuan since March, when it began its crackdown on violent or pornographic content, and other material it considers harmful to public ",Sci/Tech,4,0.62768734
4949,"SAN JOSE, Calif. - Apple Computer Inc. rolled out a new iPod Tuesday that allows users to view and share photos as it opened nine new iTunes music stores in Europe, spurring its rivalry with Microsoft Corp.",Sci/Tech,4,0.6681953
4960,"Mobile-phone makers scored a surprising hit four years ago when they introduced handsets equipped with tiny digital cameras. Today, nearly one-third of the cell phones sold worldwide do double duty as cameras ",Sci/Tech,4,0.6308633
4965,"Today #39;s new word, for all you dictionary freaks, is  quot;spim quot;. Spam  IM (Instant Messaging) = Spim. IM Spam. And for many IM companies it is the bane of their existence requiring increasingly aggressive filtering and block list capabilities.",Sci/Tech,4,0.64099544
5023,"Microwave brightness of Titan reveals surface properties such as temperature composition and roughness. Image Credit: NASA/JPL. Looking at radar reflections of Titan, scientists are puzzled by what they see ",Sci/Tech,4,0.6275386
5038,"Citing technical challenges due to hurricanes, NASA officials said that the initial space shuttle mission for Return to Flight will slip from March to May 2005.",Sci/Tech,4,0.6427604
5048,Microsoft Corp. has launched a new entry in its ongoing effort to bring more innovative PC form factors to marketin the somewhat quirky form of a high-end system specialized for project managers.,Sci/Tech,4,0.6487861
5053,New handsets from the mobile phones global leader will have hard disk to store more songs and pictures in a move to tap the rapidly growing smartphone market.,Sci/Tech,4,0.633526
5056,"NOVEMBER 03, 2004 (IDG NEWS SERVICE) - An anonymous group of malicious hackers reopened an online store that sells the stolen source code of prominent software products and is offering the code for Cisco Systems Inc.",Sci/Tech,4,0.67667717
5065,"The British National Health Service (NHS) has signed a massive software licensing deal with Microsoft. The deal will ultimately save the NHS \$625 million in licensing fees, as well as requiring that Microsoft ",Sci/Tech,4,0.6333586
5072,"AMSTERDAM: Nokia, the world #39;s biggest mobile phone maker, said on Wednesday it will create a single software platform for smart mobile phones that double as TVs, MP3 players, radios and e-mail devices.",Sci/Tech,4,0.7090619
5088,"Microsoft and Intel recently announced a new advertising campaign entitled  quot;Digital Joy quot; aimed at increasing awareness of living digital entertainment products, particularly Microsoft #39;s Media Center software.",Sci/Tech,4,0.6291285
5101,"Nokia has forecast that smartphone shipments worldwide are expected to increase to 238 million units by 2008, up from 23 million this year, according to Anssi Vanjoki, executive vice president and general manager of multimedia at Nokia.",Sci/Tech,4,0.6536397
5140,Microsoft said today that it plans to give customers three days' advance notice about its monthly security updates to help them prepare to install related software patches.,Sci/Tech,4,0.6465095
5148,InfoWorld - Hosted CRM service provider Salesforce.com took another step forward last week in its strategy to build an online ecosystem of vendors that offer software as a service.,Sci/Tech,4,0.64027977
5177,"Tiger Telematics acquired Integra SP, a UK company that produces software allowing real-time streaming of data and applications to handheld devices.",Sci/Tech,4,0.63104475
5264,"Solution providers last week said they do not expect the sudden departure of Novell vice chairman Chris Stone, who engineered the company #39;s aggressive Linux push, to slow its Linux initiative.",Sci/Tech,4,0.63223326
5306,"Fresh from setting a record for performance among supercomputers just a few days ago, IBM on Monday announced it is making a commercial version of its Blue Gene system available to be aimed at businesses and scientific researchers.",Sci/Tech,4,0.6721449
5307,"""Halo 2"" appears to be one of the most hotly hyped and heavily anticipated video games ever, and Microsoft is planning a Tuesday release that may rival the best of Hollywood's movie glitz. &lt;FONT face=""verdana,MS Sans Serif,arial,helvetica"" size=""-2""\ color=""#666666""&gt;&lt;B&gt;-washingtonpost.com&lt;/B&gt;&lt;/FONT&gt;",Sci/Tech,4,0.7652158
5331,IBM #39;s Linux Scholar Challenge is one of a few programs to drum up enthusiasm among students worldwide in Linux and open-source software.,Sci/Tech,4,0.68495643
5341,"Novell, one of the popular names in the open-source community, has launched Linux Desktop 9 OS for enterprise computer systems today for lower deployment and management prices.",Sci/Tech,4,0.6621506
5372,"Perhaps Microsoft was hoping for all eyes to be on the much-ballyhooed launch Tuesday of its ""Halo 2"" video game, but the company's efforts to clean up its lawsuit headaches can't be overshadowed by virtual gunslinging.  &lt;FONT face=""verdana,MS Sans Serif,arial,helvetica"" size=""-2""\ color=""#666666""&gt;&lt;B&gt;-washingtonpost.com&lt;/B&gt;&lt;/FONT&gt;",Sci/Tech,4,0.777369
5385,"Novell #39;s Linux Desktop 9 includes an end-user operating system, office applications and productivity tools. It boasts the same levels of security and reliability as the SuSE Linux Enterprise ",Sci/Tech,4,0.6901893
5390,"NewsFactor - With Bluetooth short-range wireless technology finding its way into an array of hardware products, ranging from mobile phones to in-vehicle telematics systems, a working group promoting the specification has outlined a strategy to make it even more attractive and useful.",Sci/Tech,4,0.6652478
5391,"Advanced Micro Devices Inc. will use Chartered Semiconductor Manufacturing Ltd.'s manufacturing services to produce AMD's Opteron and Athlon 64 processors starting in 2006, adding production capacity as the company starts building chips at its second Dresden, Germany, plant, the companies said Monday.",Sci/Tech,4,0.6453051
5414,Microsoft is having big problems in the Search Engine Market. Their online search engine stands nowhere on popularity charts and now Google and Yahoo!,Sci/Tech,4,0.6462965
5417,"With  48 editions in 19 different languages available in over 60 countries, Reader #146;s Digest is a publishing phenomenon: the world #146;s top-selling magazine. And wherever you buy your copy, at least one thing will remain constant  #151; the quality and color balance of the images. See how  a Mac-based workflow ensures this color consistency.\ Nov 09",Sci/Tech,4,0.6222177
5436,"After years of licensing search technology from Yahoo and seeing its Web search market share slowly but steadily decline, Microsoft has finally developed its own search engine and is expected to unveil it later this week.",Sci/Tech,4,0.6574319
5468,Business Objects executives this week touted dashboard technology features and rallied support for standardization on their new business intelligence software -- two hot-button issues for users here at the company's International Users Conference.,Sci/Tech,4,0.6440724
5469,"IBM's new Lotus Web Conferencing Service, expected to be offered next month, requires that users simply register an account and have an Internet connection, a Web browser and a phone.",Sci/Tech,4,0.6824135
