,Original_Text,Class_String,Class_Number,Neuron_5
1703,AFP - US computer networking giant Cisco's Indian subsidiary announced the launch of a leasing arm to grab a slice of the growing domestic IT market.,Sci/Tech,4,1.7622628
1705,Fourth quarter hiring in the Buffalo Niagara Falls market is expected to be on the rise according to the latest Manpower Employment Outlook Survey.,Business,3,1.834441
1709,"Novell Inc. has completed its conversion to Linux by launching an attack on Microsoft Corp., claiming that the company has stifled software innovation and that the market will abandon Microsoft Windows at some point in the future.",Sci/Tech,4,1.9446963
1711,"In case you have not heard, Microsoft just upped the ante in the digital music war when it launched its Windows Media Player 10 and its beta online music store this month.",Sci/Tech,4,1.8789201
1713,International Business Machines Corp. and LG Electronics Inc. will end an eight-year alliance that helped expand the US computer maker #39;s presence in the booming South Korean PC market.,Business,3,1.9875301
1719,Retail sales slid in August as people steered away from buying cars and shoppers kept a close eye on their spending after splurging in July.,Business,3,1.797109
1720, SAN FRANCISCO (Reuters) - Oracle Corp. on Tuesday reported  a higher quarterly profit as the world's second largest  software company benefited from steady demand for its flagship  database software.,Business,3,2.1101387
1724,Microsoft Corp. has made fingerprint biometric technology an integral part of its keyboard and mouse peripherals with new products that mark the company #39;s first foray into biometric devices.,Sci/Tech,4,1.785989
1725,AP - Business software giant Oracle Corp. said Tuesday that first-quarter earnings rose 16 percent driven by new database license sales that rose 19 percent.,Sci/Tech,4,2.026046
1726,AUSTIN - The stock of Allied Waste Industries Inc. fell Tuesday after the waste hauler cut its 2004 profit outlook for the second time in as many months.,Business,3,1.8428231
1730,"Oracle Corp. (ORCL.O: Quote, Profile, Research) on Tuesday reported a 16 percent rise in quarterly net income as the world #39;s second largest software company benefited ",Business,3,2.0076745
1746,"Reuters - Delta Air Lines Inc.'s pilots union on\Tuesday directed its negotiators to work out an agreement to\address the early retirement of a large number of pilots, which\threatens to push the No. 3 U.S. airline into a Chapter 11\bankruptcy filing.",Business,3,1.9148377
1748,"CHICAGO (CBS.MW) -- Higher operating costs are canceling out expense reductions and cutting into Chiquita Brands #39; profit expectations for the third quarter, the company said Tuesday.",Business,3,1.8327949
1750,"&lt;a href=""http://news.com.com/NokiajoinsSecureDigitalindustrygroup/2100-1039_3-5365922.html""&gt;Nokia joins Secure Digital industry group&lt;/a&gt; &lt;font size=-1 color=#6f6f6f&gt;&lt;nobr&gt;CNET News.com&lt;/nobr&gt;",Sci/Tech,4,1.7628976
1770,"The US information tech sector lost 403,300 jobs between March 2001 and this past April, and the market for tech workers remains bleak, according to a new report.",Business,3,1.8208139
1773,"Apple Computer Corp. is charging its British iTunes customers 17 percent more per download than its European customers, a consumer watchdog group said on Wednesday.",Sci/Tech,4,1.8010725
1788,"Brazilian aircraft manufacturer Embraer (EMBR4.SA: Quote, Profile, Research) (ERJ.N: Quote, Profile, Research) on Wednesday said it had suspended aircraft deliveries to US Airways (UAIR.",Business,3,1.871611
1792,"Oracle Corp. handed the software industry some positive earnings news after the bell on Tuesday, but investors pulled cash from the sector on concerns that information technology spending has become anemic.",Business,3,1.9602572
1814,"BTG, a London-based firm that focuses on intellectual property and technology commercialization, filed suit against Amazon.com, Barnesandnoble.com and two other Internet companies for infringing on patents related to the tracking of users online.",Sci/Tech,4,1.8570834
1819,"Global financial markets are stronger and more resilient than at any time since the stock market bubble burst in the late 1990s, the International Monetary Fund said Wednesday.",Business,3,1.7955775
1820,HONG KONG - There #39;s a new service for men seeking true love. A software company has created an artificial girlfriend that lonely men can download to a mobile phone.,Sci/Tech,4,1.8097316
1825,"Technology shares edged up in Asia on Tuesday, as crude oil prices hovered near \$44 a barrel and the dollar languished ahead of key US economic data.",Business,3,1.8689153
1831,"Shareholders approved Aether Systems Inc.'s sale of one of its two remaining operating divisions Wednesday, a deal that will take the Owings Mills company out of the wireless business and nearly complete its transformation into a mortgage investment fund.&lt;BR&gt;\&lt;FONT face=""verdana,MS Sans Serif,arial,helvetica"" size=""-2""\ color=""#666666""&gt;&lt;B&gt;-The Washington Post&lt;/B&gt;&lt;/FONT&gt;",Sci/Tech,4,2.0201364
1833,New PCs will ship with a chip designed to thwart hackers--a hardware approach that's said to be safer than software.,Sci/Tech,4,1.830915
1851,"Reuters - Netopia Inc.  a maker of\networking gear, on Thursday said its auditor KPMG LLP\resigned, and said it will restate two years of results and\revise the results in its most recent fiscal quarter.",Sci/Tech,4,1.9443581
1855,Close watchers of the online music business no doubt noted yesterday #39;s announcement of Yahoo! #39;s (Nasdaq: YHOO) purchase of Musicmatch with interest.,Sci/Tech,4,1.8431352
1862,"Hurricane Ivan, which slammed into the US Gulf coast today, may cost insurers \$4 billion to \$10 billion, rivaling hurricanes Charley and Frances, Risk Management Solutions Inc.",Business,3,1.8544221
1868,"(CP) - SONY has introduced it #39;s Clie PEG-VZ90, an entertainment multimedia handheld using Palm OS 5.2.1. The unit boasts the world #39;s largest 480x320 pixels organic electroluminescent (EL) display, which many regard as a next-generation technology capable ",Sci/Tech,4,1.8219118
1890,"com September 16, 2004, 1:15 PM PT. This fourth priority #39;s main focus has been improving or obtaining CRM and ERP software for the past year and a half.",Sci/Tech,4,1.8594737
1893,"Reuters - Texas Instruments Inc., the\largest maker of chips for cellular phones, on Thursday said it\plans to buy back  #36;1 billion in stock and boost its quarterly\dividend by more than 17 percent, becoming the latest\technology company to return extra cash to investors.",Sci/Tech,4,2.017483
1895,AP - Eastman Kodak Co. and International Business Machines Corp. Thursday said they have agreed to develop and make image sensors for digital still cameras and camera phones.,Sci/Tech,4,1.8029288
1897,"Aircraft maker Airbus insisted on Thursday it had no intention of taking sides in a Microsoft antitrust case, even though it filed a brief in an EU court on the software giant #39;s side.",Business,3,1.9370753
1898,"Add America Online Inc. to the growing list of companies and organizations shunning a spam-fighting proposal from Microsoft Corp. AOL cited  quot;tepid support quot; for Microsoft #39;s so-called Sender ID technology, which ",Sci/Tech,4,1.937375
1900,"Shares of Texas Instruments Inc. (TXN.N: Quote, Profile, Research) rose after the market close on Thursday, after the chip maker said it plans to buy back \$1 billion in stock ",Business,3,2.0557978
1905,"Sun Microsystems (Quote, Chart) may have saved itself from years of costly litigation when it settled with Microsoft over their long-running Java dispute, but a clause in the landmark deal has open source supporters parsing its potential impact.",Sci/Tech,4,1.7997241
1916,"BEIJING, Sept. 17 (Xinhaunet) -- European plane maker Airbus has reported progress in plans to allow passengers to use mobile phones while in flight with a target date of 2006.",Sci/Tech,4,1.8029047
1920,"AP - Consumer prices barely budged in August, suggesting that inflation isn't currently a problem for the economy and Federal Reserve policy-makers can stick with a gradual approach to raising interest rates.",Business,3,1.7889844
1921,Goldman Sachs Group Inc. may be in talks with the founding family of top Japanese consumer finance firm Takefuji Corp. for a stake of over \$2.,Business,3,1.9602224
1929,"WASHINGTON - Consumer prices barely budged last month, suggesting that inflation isn #39;t currently a problem for the economy and Federal Reserve policymakers can stick with a gradual approach to raising interest rates.",Business,3,1.7884612
1949,Qualcomm Inc. on Friday raised its quarterly profit forecast due to strong demand for its mobile phone technology. The San Diego company said it expects earnings per ,Business,3,1.9683065
1954,The Web console -- to be made available specifically to corporate and enterprise licensees of Norton AntiVirus software -- will allow administrators to distribute virus definitions and product updates on demand.,Sci/Tech,4,1.8151768
1958," NEW YORK (Reuters) - U.S. blue chips advanced on Friday  after Ford Motor Co. &lt;A HREF=""http://www.investor.reuters.com/FullQuote.aspx?ticker=F.N target=/stocks/quickinfo/fullquote""&gt;F.N&lt;/A&gt; raised its earnings forecasts, while  wireless technology provider Qualcomm Inc. &lt;A HREF=""http://www.investor.reuters.com/FullQuote.aspx?ticker=QCOM.O target=/stocks/quickinfo/fullquote""&gt;QCOM.O&lt;/A&gt; limited  gains on the Nasdaq after saying an accounting review may  reduce pretax income.",Business,3,2.0032525
1967,NewsFactor - Questions regarding potential patent issues and skepticism from the \open source community relating to Microsoft's (Nasdaq: MSFT) SenderID have prompted global Internet service provider AOL (NYSE: AOL) to drop the anti-spam technology.,Sci/Tech,4,1.87752
1968,"ATI Technologies announced a technology that reduces the need for dedicated graphics memory, which could lead to lower PC system costs.",Sci/Tech,4,1.8432822
1978,"Graphics chipmaker ATI (Quote, Chart) unveiled a new technology it said lets its visual chips share system memory for graphics processing.",Sci/Tech,4,1.8877026
1997,Business software maker PeopleSoft Friday said it was boosting compensation packages for all employees except its chief executive in a move that would raise the ,Business,3,1.851377
2006,"Apple's latest Form 10-K filing with the Securities and Exchange Commission offers a look at how the company did this past year, how it thinks it's doing and what's to come.",Sci/Tech,4,1.8881917
2010,"Coca-Cola Co. (KO.N: Quote, Profile, Research) , which warned earlier this week of lower-than-expected profits this year, said on Friday it will pay Chairman and Chief Executive Neville Isdell \$1.",Business,3,1.8169369
2035,"The triumph last week of the Bic pen over expensive, state-of-the-art steel locks has panicked the bicycling community, and churned Internet rumor mills about how much the lock manufacturer knew and when the company knew it.",Business,3,1.8656281
2061,"Cisco Systems and Microsoft are headed for a collision over network security, with customers caught in the middle. The two companies have each proposed competing  quot;end to end quot; security architectures, marking ",Sci/Tech,4,1.7989317
2082,Microsoft Corp. will allow governments around the world that use its software to have controlled access to the source code for its pervasive Microsoft Office 2003 desktop offerings for the first time.,Sci/Tech,4,1.9350462
2093,"Apple #39;s splashy digital music player has emboldened Microsoft and other technology titans to move quickly to the next frontier in portable entertainment: the video iPod, so to speak.",Sci/Tech,4,1.8635021
2095," WASHINGTON (Reuters) - A pornography bill-processing  company has agreed to forego \$17 million that it billed  computer users in order to settle deceptive-business charges,  the U.S. Federal Trade Commission said on Monday.",Sci/Tech,4,1.8669025
2104,"Sun Microsystems will hold its quarterly product launch this week, unleashing a raft of new hardware offerings spanning servers to storage.",Sci/Tech,4,1.8653165
2113,"Cisco, IBM, Microsoft and SAP have the most loyal customers in IT, according to a report released today. The fact that they are some of the biggest, most successful IT vendors in ",Sci/Tech,4,1.7875892
2116," NEW YORK (Reuters) - New York Times Co. on Monday forecast  third-quarter and full-year earnings below Wall Street's  average targets on weak revenue so far in September, sending  its shares to two-year lows.",Business,3,1.863608
2120,"Its official. Microcell Telecommunications Fido wireless service will be the new dog in Rogers Wireless Communications Canadian kennel, and that puppy wasnt cheap.",Business,3,1.8591759
2124,"Looking for new ways to boost its revenue, America Online is launching an online shopping service that won #39;t require an AOL account to access.",Business,3,1.9974526
2127,"BOSTON (CBS.MW) - Pharmaceutical powerhouse Pfizer is buying a 5 percent stake in biotechnology researcher Medarex under their newly signed collaboration deal, according to Medarex Chief Executive Donald Drakeman.",Business,3,1.8216292
2133,"AP - After years of battling Microsoft Corp., Sun Microsystems Inc. has set its sights on Linux vendors, seeking to jump into a low-end but high-volume market it's been accused of ignoring.",Sci/Tech,4,1.8561506
2145,"com September 20, 2004, 6:13 PM PT. This fourth priority #39;s main focus has been improving or obtaining CRM and ERP software for the past year and a half.",Sci/Tech,4,1.8594737
2151,"The European Space Agency says data collected by its probe, Mars Express, has provided new evidence in the search for life on Mars.",Sci/Tech,4,1.8023548
2157,"Nike Inc. (NKE.N: Quote, Profile, Research) on Monday reported a 25 percent rise in quarterly profit, topping Wall Street estimates, on strong sales of Converse sneakers ",Business,3,1.8762695
2169,"SAN FRANCISCO -- Hoping to emerge from the shadow of its more popular rivals, Ask Jeeves Inc. is adding new tools for visitors to save and organize links to Web pages they find through the company's online search engine.",Business,3,1.8615617
2170,AP - Sony Corp. on Tuesday showed a smaller book-size PlayStation 2 going on sale worldwide next month that will help the Japanese electronics and entertainment giant cut costs as video-game consoles continue to drop in price.,Sci/Tech,4,1.8918697
2176,"Ask Jeeves Inc. has made three significant enhancements to its search engine, as the Emeryville, California company continues to take aim at its much larger competitors ",Sci/Tech,4,1.8408333
2177,"Internet advertising revenues jumped 40 percent in the first half of this year, driven largely by the growing popularity of keyword ads tied to search results.",Sci/Tech,4,1.7614084
2178,"By Ed Edelson, HealthDay Reporter    HealthDayNews -- Children who are abused or neglected grow up to be adults with a significantly greater risk of heart disease, a new study says.    It's the first study to show a direct link between a wide range of childhood problems and ischemic heart disease -- blockage of the arteries that leads to heart attacks and other major problems, said Maxia Dong, a medical epidemiologist at the U.S...",Sci/Tech,4,1.7795603
2180,"Bill Gates and Steve Ballmer each received total compensation of \$901,667 in Microsoft Corp.'s 2004 fiscal year, up 4.4 percent from \$863,447 one year ago.",Sci/Tech,4,1.851538
2182," NEW YORK (Reuters) - U.S. stocks edged up on Tuesday as  investors expected the Federal Reserve to stay on a course of  ""measured"" interest-rate increases, while major Wall Street  investment banks rose on higher profits.",Business,3,1.8771088
2186,"Online holiday shoppers this year are making cash registers jingle and meeting analysts #39; expectations as they spent \$8.8 billion in November, researchers said Monday.",Business,3,1.8404152
2202,"From the 1950 #39;s until the present, one of the dominant companies in the world #39;s computer industry. Offers a variety of data processing hardware systems, system and application software, and information technology services.",Sci/Tech,4,2.036244
2204," SAN FRANCISCO (Reuters) - Contract electronics manufacturer  Jabil Circuit Inc. &lt;A HREF=""http://www.investor.reuters.com/FullQuote.aspx?ticker=JBL.N target=/stocks/quickinfo/fullquote""&gt;JBL.N&lt;/A&gt; on Tuesday posted a higher quarterly  profit on stronger demand for computers, cellphones and other  electronic products.",Business,3,1.9698957
2207,"SEPTEMBER 21, 2004 (IDG NEWS SERVICE) - With 15,000 attendees at PeopleSoft Inc. #39;s Connect 2004 user show waiting to hear how the company would handle Oracle Corp.",Business,3,1.9357785
2222,"WASHINGTON - Representatives of wireless telephone carriers planning a telephone directory service told a U.S. Senate committee Tuesday that legislation to protect their customers' privacy isn't needed, because their plan already does.",Sci/Tech,4,1.8100826
2223,Apple will be getting some stiff competition in the coming year. A slew of manufacturers will soon offer players utilizing small 1 quot; hard drives that help propel the iPod and allow them to compete more favorably in the market.,Sci/Tech,4,1.794073
2225,Cisco Systems unveiled two SAN products that it says will help companies evade or recover quickly from disasters affecting corporate data.,Sci/Tech,4,1.807784
2227,"NEW YORK - US internet ad revenue jumped to a record US\$2.37 billion (\$3.5 billion) in the second quarter, surpassing the highest levels of the dotcom era.",Business,3,1.9009966
2245,"Sony on Tuesday showed a smaller, book-sized PlayStation 2 that will go on sale worldwide next month and help the Japanese electronics giant cut costs as video-game consoles continue to drop in price.",Sci/Tech,4,1.8830795
2252,"SiliconValley.com - There's been a lot of innovation in online publishing lately, but regular Internet users might be scratching their heads at some of the lingo. Social software, blogs and RSS technology? What does it all mean?",Sci/Tech,4,1.862801
2253,Vodafone has unveiled plans for 10 new third-generation handsets for Christmas to help shore up its struggling Japanese unit. Vodafone VOD.,Business,3,1.7880713
2256,"PeopleSoft Inc. is deepening its ties with IBM Corp., announcing on Tuesday a sales and development partnership it called the most significant enterprise applications alliance in the companies' history.",Sci/Tech,4,1.9925971
2258,"As the threat of a hostile takeover by Oracle rumbles on, PeopleSoft has announced a \$1bn partnership with IBM. Speaking at PeopleSoft #39;s user conference in San Francisco yesterday, the company #39;s chief executive ",Business,3,2.0180483
2260,"WASHINGTON -- Verizon Wireless, the nation #39;s largest wireless carrier, clashed with other cellular carriers on Tuesday, telling a US Senate committee that a proposal for a national wireless telephone directory is a  quot;terrible idea quot; and that the proposal ",Business,3,1.9216826
2263,"Stocks fell on Wednesday after investment bank Morgan Stanley (MWD.N: Quote, Profile, Research) said quarterly profit fell, casting doubt on corporate profit growth, while a brokerage downgrade on Cisco Systems Inc.",Business,3,2.0122805
2269,Cape Clear Software and Neon Systems Inc. on Wednesday announced they are working together to integrate their respective technologies and allow users to quickly integrate mainframe applications and data through the use of Web services.,Sci/Tech,4,1.8045974
2270,"In an effort to stop scams that cause unwitting Internet users to be charged premium rates for calls placed by software surreptitiously installed on their PCs, Ireland is going to block outgoing calls to 13 countries.",Sci/Tech,4,1.7702985
2272,"NetManage (Quote, Chart) agreed to acquire privately held Librados for an undisclosed sum. The deal would give NetManage application adapters to help its Host Services Platform server applications via service ",Sci/Tech,4,1.8086988
2287,"com September 22, 2004, 12:36 PM PT. This fourth priority #39;s main focus has been improving or obtaining CRM and ERP software for the past year and a half.",Sci/Tech,4,1.8594737
2294,"AP - For six years, iMacs have set the standard for the PC industry with eye-popping designs, clever utilization of space and leaps forward in usability. Lately, though, Apple Computer Inc. seems to be making more waves with iPod music players than its venerable consumer PCs.",Sci/Tech,4,1.8467675
2308," WASHINGTON (Reuters) - Fannie Mae used improper accounting  to manipulate its quarterly earnings reports, regulators said,  touching off the mortgage finance industry's second such  controversy in less than 18 months.",Business,3,1.9439625
2312,Fannie Mae chief executive Franklin D. Raines invited reporters to his Wisconsin Avenue headquarters a year ago to complain good-naturedly that recent disclosures of accounting manipulations at smaller rival Freddie Mac had unjustly hurt his company.,Business,3,1.9345766
2321,Beleaguered British Energy has applied to delist its shares as it tries to stop shareholders from blocking a restructuring plan to keep the company in business.,Business,3,1.8938445
2338," NEW YORK (Reuters) - U.S. Treasury yields held near  six-month lows on Thursday, though the market was struggling to  extend recent hefty gains in the face of profit-taking.",Business,3,1.8273009
2343,"The business software maker inks a deal with IBM, but it isn't likely to dissuade Oracle.",Business,3,1.906811
2344,"A proposed bailout of Donald J. Trump #39;s casino company has been shelved, and Trump now says he may take the company private. The company #39;s shares fell 10 percent.",Business,3,1.8592725
2348,"This paper discusses the use of NetFlow, a traffic profile monitoring technology available on many routers, for use in the early detection of worms, spammers, and other abnormal network activity in large enterprise networks and service providers. Part 2 of 2.",Sci/Tech,4,1.84781
2350,"Commerce One Inc., an Internet software maker valued at \$20 billion at the peak of dot-com mania, is poised to go out of business as a pauper.",Sci/Tech,4,1.8929082
2352," NEW YORK (Reuters) - U.S. stocks slipped on Thursday after  Exxon Mobil Corp. &lt;A HREF=""http://www.investor.reuters.com/FullQuote.aspx?ticker=XOM.N target=/stocks/quickinfo/fullquote""&gt;XOM.N&lt;/A&gt; was downgraded by a brokerage and oil  prices rose, raising investor concerns about the health of  corporate profits and economic growth.",Business,3,1.9037212
2354,"Sanjay Kumar, the former chief executive of Computer Associates of Islandia, NY, pleaded innocent Thursday to charges he helped inflate financial results.",Business,3,1.8862618
2356,Beacon Roofing Supply Inc. saw its shares jump nearly 22 percent in its first day of trading Thursday after the company priced its initial public offering at the midpoint of its expected \$12 to \$14 price range.,Business,3,1.8798426
2364,"Microsoft has filed nine lawsuits against individuals and companies allegedly involved sending out spam, including one suit against a Web hosting company that claimed it was ""bulletproof"" and couldn't be shut down.",Sci/Tech,4,1.810068
2367,"American Airlines holding company AMR Corp. (AMR: Research, Estimates) on Wednesday said the airline #39;s August revenue was weaker than expected after hurricanes and high fuel prices ",Business,3,1.8677176
2377,"Ottawa has set a price per share of C\$64.50 (\$50.42) in the sale of its 19 percent stake in Petro-Canada (PCA.TO: Quote, Profile, Research) , as analysts ",Business,3,1.8122004
2385,"ID Biomedical Corp. (IDB.TO: Quote, Profile, Research) (IDBE.O: Quote, Profile, Research) signed a 10-year US distribution deal for its Fluviral drug that could reap ",Business,3,1.8593841
2387,Astronomers poring over the deepest image ever taken of the universe are coming to different conclusions about what made space transparent to light billions of years ago.,Sci/Tech,4,1.8217427
2391," NEW YORK, Sept. 23 -- Investment banking firm Lehman Brothers Holdings Inc. is nearing an agreement to pay approximately \$200 million to settle a shareholder lawsuit over its work for bankrupt energy trader Enron Corp., sources familiar with the case said.",Business,3,1.8607225
2395," LONDON (Reuters) - U.S. Treasury prices rose on Friday,  with a rally in Japanese government bond (JGB) prices helping  the market recover some ground from the previous day's  sell-off.",Business,3,1.8155897
2396,"General Electric Co. yesterday agreed to a settlement with the Securities and Exchange Commission, which accused the company of failing to provide shareholders ",Business,3,1.8220683
2424,Reuters - Boeing Co. Chief Executive Harry\Stonecipher said on Friday the U.S. aircraft maker's archrival\Airbus was exaggerating the speed of recovery in the commercial\airplane market.,Business,3,1.8831679
2425," LONDON (Reuters) - Britain's financial regulator will step  up scrutiny of investment banks' management of conflicts of  interest and risk in the wake of a number of high profile cases  such as WorldCom, Enron and Parmalat.",Business,3,2.072478
2430,A consortium led by Sony Corp. of America that includes Comcast Corp. has entered into a definitive agreement to acquire Metro-Goldwyn Mayer Inc.,Business,3,1.873117
2440," NEW YORK (Reuters) - U.S. securities regulators may file  suit against Morningstar Inc., a provider of mutual fund and  stock research, over incorrect data it published about a mutual  fund, the company said on Friday.",Business,3,1.9106857
2445,"US stocks got a mild boost on Friday as government data showed better-than-expected demand in August for durable goods other than transportation equipment, but climbing oil prices limited gains.",Business,3,1.7854159
