,Original_Text,Class_String,Class_Number,Neuron_35
5042,An Iraqi security official said gunmen abducted a Lebanese-American contractor who worked with the US Army in Iraq. Officials said gunmen snatched him when he answered the door at his Baghdad home overnight.,World,1,1.1364739
5082,"Palestinian leader Yasser Arafat has been in a coma for several hours and now in critical condition, Arafat #39;s senior aides said on Thursday.",World,1,1.1402321
5121,A letter left on the body of murdered film-maker Theo van Gogh reportedly threatens the life of a liberal politician.,World,1,1.1411885
5125," CAIRO (Reuters) - Israel released six Egyptian students  from prison on Sunday as part of a deal which includes freedom  for Israeli businessman and convicted spy Azzam Azzam, Egyptian  security sources said.",World,1,1.1233599
5207,Pakistani President General Pervez Musharraf on his visit after the landmark presidential polls in Afghanistan congratulated his Afghan counterpart Hamid Karzai for his victory Saturday afternoon.,World,1,1.2620056
5230,Militants threatening to kill three UN hostages said yesterday that talks with Afghan and UN officials had been postponed for another day.,World,1,1.1876084
5235," KABUL (Reuters) - Afghan militants holding three U.N.  workers hostage began talks with the government and the United  Nations on Sunday and the kidnappers have dropped some of their  demands, a militant spokesman said.",World,1,1.2075582
5243,The Iraqi government declared a state of emergency for 60 days as U.S. and Iraqi forces prepared for an expected assault on rebels in Fallujah.,World,1,1.2977825
5245, BAGHDAD (Reuters) - Iraq's interim government declared a  state of emergency for 60 days on Sunday to quell violence  gripping the country ahead of January elections.,World,1,1.2058827
5247,"JERUSALEM -- Former US envoys say that the passing of Yasser Arafat would open up new opportunities for Mideast peace, especially if new, pragmatic Palestinian leaders emerge.",World,1,1.1606916
5249," PARIS (Reuters) - Yasser Arafat, critically ill in a Paris  hospital, has suffered liver failure, a Palestinian official  said on Sunday as Arafat's subordinates decided in his absence  to enforce a law and order plan in Palestinian areas.",World,1,1.1445518
5251,"KABUL (AFP) - Militants claiming to hold three foreign UN workers met Afghan officials on Sunday and gave them a list of 26 prisoners whom they want to swap for their hostages, a spokesman for the group said.",World,1,1.0914686
5255,Militants holding three foreign United Nations workers in Afghanistan said that they had held negotiations with officials from the Afghan government and the United ,World,1,1.1345371
5263,"AFP - A little known radical Islamic group has threatened to kill Indian cricketers when they tour Bangladesh from Tuesday, the Indian High Commission told AFP.",World,1,1.0987275
5287, ABIDJAN (Reuters) - Ivory Coast President Laurent Gbagbo  appealed for an end to the anti-French violence which erupted  after France destroyed most of the country's air force in  retaliation for the killing of nine French peacekeepers.,World,1,1.1500502
5291,A video purportedly showing a suicide attack against British troops last week was posted on an Islamic website. Soldiers from Britain #39;s Black Watch regiment were manning a vehicle checkpoint south of Baghdad ,World,1,1.0881213
5358,"U.S. Army and Marine units thrust into the heart of the insurgent stronghold of Fallujah on Tuesday, fighting fierce street battles and conducting house-to-house searches on the second day of a major assault to retake the city from Islamic militants.",World,1,1.1874342
5360," KATHMANDU (Reuters) - A bomb tore through a government  building under construction in the Nepali capital on Tuesday,  wounding at least 38 people in an attack police suspect was  carried out by Maoist rebels.",World,1,1.10293
5429,"AFP - An Italian aid worker walked free from the southern Philippines jungle, a day after he was abducted by local gunmen.",World,1,1.0837251
5441,"Iran will pull out of the nuclear Non-Proliferation Treaty (NPT) and develop its atomic programme in secret if Western nations threaten or put pressure on Tehran, a senior Iran diplomat was quoted as saying on Wednesday.",World,1,1.1276677
5445,"France and the United Nations began evacuating thousands of French and other expatriates Wednesday trapped at U.N. offices and a French military base amid days of anti-foreigner rampages in Ivory Coast's largest city, French and U.N. officials said.",World,1,1.1434379
5471,"BEIRUT, Lebanon - Yasser Arafat promised Palestinians he would return them to the homes they lost when Israel was founded in 1948.",World,1,1.2011888
5487,"AP - U.S. troops, on the verge of gaining control of the city, fought pockets of resistance in this former militant stronghold Wednesday and uncovered what the Iraqi commander said were ""hostage slaughterhouses"" in which foreign captives had been killed.",World,1,1.1365057
5510,The fragile relations between Tokyo and Beijing were further weakened yesterday when a suspected Chinese nuclear submarine was chased out of Japanese territorial waters.,World,1,1.1238604
5513,"AP - Tears and gunshots, praise and condemnation marked the death of Yasser Arafat, whose fight for the Palestinian cause made him a towering and controversial figure on the world stage.",World,1,1.093751
5516,"A car bomb exploded near a police patrol in busy central Baghdad on Thursday, killing 17 people and wounding 20, police said. A police source said the blast missed a convoy ",World,1,1.1155372
5520,"Yasser Arafat, who triumphantly forced his peoples plight into the world spotlight but failed to achieve his lifelong quest for Palestinian statehood, died today, aged 75, Palestinian Cabinet minister Saeb Erekat confirmed.",World,1,1.1397648
5527,Description: Dutch police arrest three suspects after a counterterror operation in The Hague. The murder of filmmaker Theo van Gogh by a suspected Islamic extremist has heightened concern about terrorism in the Netherlands.,World,1,1.1130102
5550,AP - Dutch lawmakers accused the government Thursday of underestimating the threat from Islamic terrorists and failing to protect a filmmaker slain by a suspected Muslim radical.,World,1,1.187094
5564,The death of Palestinian leader Yasser Arafat is deeply dividing an already torn Middle Eastern country. As Palestinians mourn the loss of their leader ,World,1,1.2401974
5566," JAKARTA (Reuters) - An earthquake measuring 6.0 on the  Richter scale shook an island in eastern Indonesia on Friday,  killing six people and injuring at least six more, a government  official said.",World,1,1.1500692
5568,"The Israeli prime minister, Ariel Sharon, yesterday said the death of his long-time rival, Yasser Arafat, could prove to be  quot;a historic turning point in the Middle East quot;.",World,1,1.1052052
5630,"Tens of thousands of civilians are confined to their houses in Fallujah and may be in need of humanitarian aid as US and Iraqi forces battle insurgents for control of the city, according to Iraq #39;s Islamic Party.",World,1,1.1860346
5641,Palestinians pay their last respects to Yasser Arafat after chaotic scenes at his burial in Ramallah.,World,1,1.188215
5655," NANO, Pakistan (Reuters) - Pakistani forces are driving al  Qaeda-linked militants out of mountains near the Afghan border  but attacks such as a bomb that wounded soldiers on Saturday  could not be ruled out, a commander said.",World,1,1.1444147
5682,"After days of speculation and a chase by Japanese destroyers and a surveillance plane, it has finally been determined that the nuclear submarine that intruded into Japanese territorial water between Okinawa and Taiwan was Chinese.",World,1,1.1024728
5710,"AP - Iran has agreed to fully suspend uranium enrichment and linked activities that Washington asserts are part of a nuclear weapons program, diplomats said Sunday.",World,1,1.2078475
5716,"AP - Mahmoud Abbas, the temporary successor to Yasser Arafat, escaped unharmed Sunday when militants firing assault rifles burst into a mourning tent for the deceased Palestinian leader, killing two security guards and wounding six other people.",World,1,1.1820264
5743,"WASHINGTON -- Iran pledged yesterday to temporarily suspend its uranium enrichment program in an attempt to ease suspicions that it is trying to develop nuclear weapons. The move could defuse a longstanding showdown with the United States over Iran's nuclear activities, diplomats said.",World,1,1.1211821
5778,Fierce battles between insurgents and US and Iraqi forces killed at least 27 people today in Baqouba and south of Baghdad as US forces move against the last remaining pockets of resistance in Fallujah.,World,1,1.1637938
5799,"Islamabad, Nov. 16 (NNN): Pakistans leading newspaper, Dawn, finds the timing of the Indian announcement on reduction of troops in Kashmir as significance.",World,1,1.0908269
5805,A rebel counteroffensive swept through central and northern Iraq on Monday as American troops struggled to flush the remaining insurgents from the rubble-strewn streets of Falluja.,World,1,1.237626
5827,"On the eve of a high-profile UN Security Council visit to Nairobi, members are split over a draft resolution on atrocities in Sudan #39;s western Darfur region.",World,1,1.24385
5878,"ARIEL SHARON, the Israeli Prime Minister, made his first conciliatory gesture towards Palestinians after the death of Yassir Arafat when he said that he would consider co-ordinating the dismantling of Jewish settlements in the Gaza Strip with a new ",World,1,1.1572806
5913,"MOSUL, Iraq -- US and Iraqi troops stormed insurgent-held police stations and neighborhoods in this northern city Tuesday, retaking a number of sites seized last week by gunmen who rose up in support of militants in Fallujah.",World,1,1.1280442
5938,"AP - Homemade bombs exploded in two Buenos Aires banks Wednesday, killing a security guard, police said.",World,1,1.1342912
5951,"UN Security Council members have arrived in Nairobi for a two-day meeting devoted to the conflicts engulfing Sudan, including the western Darfur region.",World,1,1.0849422
5961,THE Palestinian Authority is to set up an official commission of inquiry into Yasser Arafats death amid increasing rumours among the Palestinian public that he was poisoned by Israel.,World,1,1.1139802
5984,"An Israeli tank has opened fire and killed three Egyptian troops on the sensitive border between the two countries, mistaking them for Palestinian militants on the way to carry out an attack, Israeli media says.",World,1,1.0936869
5989,"JERUSALEM A preliminary Israeli army investigation has found that Israeli troops apparently killed three Egyptian soldiers by mistake, thinking they were Palestinian militants along the Gaza-Egypt border.",World,1,1.2610759
5991,"An Israeli tank has opened fire and killed three Egyptian troops in a border zone near the Gaza Strip after mistaking them for Palestinian arms smugglers, Israeli security sources say.",World,1,1.2784792
5992,"AFP - Three Egyptian policemen were killed overnight by Israeli tank fire on the tense border between Egypt and the Gaza Strip when they were mistaken for Palestinian arms smugglers, officials said.",World,1,1.2751039
6002,"President Thabo Mbeki has urged all countries, including Ivory Coast #39;s neighbours, to immediately enforce a United Nations arms embargo on government and rebel forces in Ivory Coast.",World,1,1.1549445
6032,"The Israeli prime minister, Ariel Sharon, apologized to Egypt today after an Israeli army tank crew fired on an Egyptian patrol near the border with Gaza, killing three Egyptian police officers.",World,1,1.2369868
6048,Sponsors of an internationally backed Mideast peace plan will send their foreign ministers to the region next week in hopes of restarting Israeli-Palestinian talks in the wake of Yasser Arafat #39;s death.,World,1,1.116024
6075,"JERUSALEM -- Israeli troops mistook three Egyptian police officers for Palestinian militants and shot them dead yesterday along the Gaza Strip's border with Egypt, increasing tensions between the neighbors.",World,1,1.1383742
6107,"AFP - Pakistani security forces have arrested a key Al-Qaeda operative wanted in connection with attacks on Christian targets and a failed bid to kill President Pervez Musharraf, an official said.",World,1,1.2375572
6166,"BAGHDAD, IRAQ - Insurgents continued to strike against coalition targets in Iraq Saturday, resulting in the deaths of one US soldier and four government employees in Baghdad.",World,1,1.1331805
6211,"PARIS - Nasser al-Kidwa, nephew of the deceased Palestinian leader Yasser Arafat, arrived in Paris from Cairo Sunday to pick up a copy of Arafat #39;s medical records.",World,1,1.0886061
6213,US Secretary of State Colin Powell has launched a new Middle East peace drive by saying he will press both Israeli and Palestinian leaders for steps to help Palestinians elect a successor to Yasser Arafat.,World,1,1.3002784
6254,"CBN.com - (CBN News) -ERUSALEM  -h the death of Yasser Arafat behind them, the Palestinians and Israelis are now facing an historic opportunity to move forward in peace.",World,1,1.1265209
6255,International Atomic Energy Agency (IAEA) Director-General Mohamed ElBaradei angrily rejected allegations that he had collaborated with Iran ahead of releasing investigation reports about Tehrans nuclear program.,World,1,1.0786555
6263,An Israeli military court has charged an army officer with illegally using his weapon when he allegedly shot a Palestinian girl who was already dead.,World,1,1.1108489
6305," GAZA (Reuters) - Israeli soldiers shot dead five  Palestinians in north Gaza on Tuesday after mortar fire from  Palestinian militants wounded two people in a nearby Jewish  settlement, medics on both sides said.",World,1,1.2063683
6334," SEOUL (Reuters) - North Korea gave a visiting U.N. official  a ""very positive message"" about resuming stalled six-way talks  on its nuclear programs, the South Korean Unification Ministry  said Wednesday.",World,1,1.1038673
6343,"AP - Iran sought on Wednesday to partially roll back its commitment to freeze all uranium enrichment programs, demanding the right to run some equipment that can be used to produce nuclear arms.",World,1,1.1554669
6377,"QUETTA, Pakistan - A bomb fixed to a bicycle killed one man and injured 15 people in southwestern Pakistans restive desert province of Baluchistan on Thursday, police said.",World,1,1.1614733
6383,"MOSCOW, November 25 (Itar-Tass) - A special task force unit freed both women who were held hostage by two armed army deserters in the Moscow region.",World,1,1.0905052
6384,UK Foreign Secretary Jack Straw lays a wreath at the grave of former Palestinian Leader Yasser Arafat.,World,1,1.2178266
6413,"DAMASCUS, Syria - Syrian President Bashar Assad is ready to resume peace talks with Israel  quot;without conditions, quot; a top UN envoy said yesterday.",World,1,1.1225944
6434,"A lieutenant of Iraq's most feared insurgent leader, Abu Musab Zarqawi, was captured this week, the country's national security minister said Thursday.",World,1,1.1963454
6468,"National Guard troops arrested two brothers Friday in connection with a state prosecutor's killing, just days after two suspects in the car bombing case were shot dead by police, authorities said.",World,1,1.0940337
6473,"AP - A key U.N. atomic agency meeting adjourned for the weekend, giving Iran time to consider a total freeze of a program that could make weapons grade uranium and for delegates to decide on further steps in policing Tehran's nuclear activities.",World,1,1.0905117
6556,"The Palestinians will not accept an interim settlement with Israel, Palestine Liberation Organization chief Mahmoud Abbas told the Arab League during a visit to Egypt yesterday.",World,1,1.199262
6579, JERUSALEM (Reuters) - Prime Minister Ariel Sharon on Monday  narrowly survived three parliamentary no-confidence votes  sponsored by opposition parties over deepening poverty in  Israel.,World,1,1.2393363
6615,"AP - A Pentagon spokesman said Monday that Red Cross officials have ""made their view known"" that the indefinite detention of terror suspects at Guantanamo Bay, Cuba, amounts to torture.",World,1,1.0991411
6632,"Reuters - A car bomb exploded near a U.S.\military patrol in the town of Baiji, north of Baghdad, on\Tuesday, killing at least seven Iraqis and wounding 20 people,\including two U.S. soldiers, doctors and the military said.",World,1,1.2325629
6743," PORT-AU-PRINCE, Haiti (Reuters) - Shooting erupted on  Wednesday outside Haiti's presidential palace while Secretary  of State Colin Powell was inside talking with the interim  leaders of the violence-plagued country.",World,1,1.0821983
6833,"AP - There is no reason to hold a meeting of Iraq's neighbors planned for this week in Amman, an Iranian envoy said Monday in a further sign of strained relations following accusations by Jordan's King Abdullah that Tehran wanted to influence the Iraqi elections.",World,1,1.0994022
6902, JERUSALEM (Reuters) - Israel termed as premature on Tuesday  an Egyptian report that it had agreed in principle with the  Palestinians on proposals to end their conflict but said it  would respond positively if militants ceased attacks.,World,1,1.0944756
6948," SAMARRA, Iraq (Reuters) - Three Iraqis were killed on  Wednesday when a suicide car bomber attacked a U.S. convoy in  the northern city of Samarra, a local police official said.",World,1,1.1453683
7029,"MOSUL, Iraq, Dec 9 (AFP) - Six Iraqi national guardsmen and 10 civilians were wounded in two bomb attacks in the northern city of Mosul on Thursday, police said.",World,1,1.2028774
7053,"KEY talks between the government of Sudan and rebels in the troubled Darfur region tomorrow could fail because of a new surge of violence, the UN #39;s envoy to the country said.",World,1,1.0798872
7086," JERUSALEM (Reuters) - Israeli Prime Minister Ariel Sharon  on Friday invited the opposition Labour Party to begin talks to  form a unity government, a move that would avoid early  elections and pave the way for a withdrawal from Gaza.",World,1,1.0991627
7101,Darfur #39;s rebel leaders held preliminary talks with African Union mediators in Abuja on Friday ahead of the latest round of peace negotiations on the crisis in the western Sudanese region.,World,1,1.1184782
7118,"LAST MONTH the United States and its allies signaled a change in Sudan policy. Rather than pressuring Sudan #39;s government to halt its genocidal attacks against civilians in the western province of Darfur, they ",World,1,1.1402911
7167,"The health records of Yasser Arafat, who died at Percy Military hospital near Paris last month, have been submitted to Palestinian authorities.",World,1,1.1652728
7170,Israel #39;s opposition Labour party began talks with Prime Minister Ariel Sharon #39;s Likud party yesterday about joining its coalition - a partnership aimed at promoting a military withdrawal from Gaza.,World,1,1.1346211
7179," SEOUL (Reuters) - North Korea will not dismantle its  nuclear programs or improve ties with South Korea until  questions about the South's nuclear experiments are clearly  answered, Pyongyang said on Sunday.",World,1,1.0907767
7197,"RAFAH, Gaza Strip (AFP) - Four Israeli soldiers were killed when Palestinian militants blew up a tunnel under an army post in Gaza, as jailed intifada leader Marwan Barghuti pulled out of the Palestinian elections.",World,1,1.279248
7228,JAKARTA (Antara): President Susilo Yudhoyono asked Indonesian diplomats on Monday to help the government improve Indonesia #39;s bad image.,Business,3,1.0966997
7237," KHARTOUM (Reuters) - Two employees of a British charity  were killed in Sudan's troubled Darfur region on Sunday when  their convoy came under fire, the aid agency said on Monday.",World,1,1.1372583
7245,"AP - Spain's prime minister, heckled Monday by opposition lawmakers, angrily denied his Socialist party instigated anti-government rallies on the eve of a general election to reap political benefit from the Madrid train bombings.",World,1,1.122346
7253,"Army reinforcements sent to bolster the Democratic Republic of Congo #39;s fragile border region with Rwanda have clashed with former rebel units within the army, a local military commander said on Sunday.",World,1,1.0821525
7264,Officials in Iraq say at least 10 Iraqis have been killed and several others wounded in separate insurgent attacks across the country.,World,1,1.1943288
7267,"SEOUL North Korea is seriously reconsidering its role in talks on its nuclear programs because of what it sees as a concerted campaign to topple the government in Pyongyang, the North Korean Foreign Ministry said Monday.",World,1,1.0743937
7312,The DUP was last night reconsidering its boycott of talks with the Irish government after Taoiseach Bertie Ahern apologised to party leader Ian Paisley.,World,1,1.0849974
7320,"Iraq may begin war crimes trials for senior members of Saddam Hussein #39;s former regime as soon as next week, Iraqi Prime Minister Ayad Allawi said.",World,1,1.1885693
7356,"KANDAHAR, Afghanistan, Dec 14 -- Afghan forces have captured two top figures of the deposed Taliban government, including the personal security chief of leader Mohammad Omar, provincial officials said Tuesday.",World,1,1.1350332
7375,"The kidnapped Turkish engineer was found dead in Kunar province in east Afghanistan on Wednesday, one day after he was abducted by unknown gunmen, the Afghan Interior Ministry said.",World,1,1.2314538
7382,North Korea has warned Japan that it will treat economic sanctions as a  quot;declaration of war quot; and threatens to try to exclude Tokyo from six-party talks on Pyongyang #39;s nuclear arms programs.,World,1,1.1026175
7390,"Hijackers who took as many as 26 people hostage on a commuter bus on the outskirts of Athens released five of the captives. Police are in negotiations to free the remaining hostages, a spokeswoman said.",World,1,1.1288289
7396,"ANKARA, Dec 15 (AFP) - The Turkish ambassador in Afghanistan has confirmed the death of a Turkish engineer kidnapped Tuesday in Afghanistan #39;s eastern Kunar province, the Anatolia news agency reported Wednesday.",World,1,1.1362936
7419,"AFP - An Italian national working for a British non-governmental organisation has been taken hostage in Iraq, the Italian news agency ANSA reported, quoting Italian intelligence sources.",World,1,1.1948957
7512,"Israel withdraws from Khan Younis refugee camp in the Gaza Strip, after a four-day operation that left 11 dead.",World,1,1.1823376
7533,"Israel will not attend a Middle East conference in London early next year but backs its stated aim of fostering Palestinian reform in pursuit of peace after Yasser Arafat #39;s death, a senior official says.",World,1,1.0812783
7534,BAGHDAD (AFP) - The United States failed win a promise from the United Nations to increase its staff in Iraq ahead of elections as Washington stepped up its charges that Damascus was sheltering insurgent leaders.,World,1,1.1162444
7560," JERUSALEM (Reuters) - Israel's opposition Labour party has  clinched a deal with Prime Minister Ariel Sharon's Likud party  to join his coalition, a move that could push forward his Gaza  pullout plan, Israeli media reported on Friday.",World,1,1.1230843
7578,"CAIRO, Dec 17 (AFP) -- One of the two main rebel groups in Sudan #39;s war-torn Darfur region said that the government had launched an offensive on rebel-held towns in southern Darfur, denouncing it as a truce violation.",World,1,1.1178545
