,Original_Text,Class_String,Class_Number,Neuron_5
10," LOS ANGELES (Reuters) - A group of technology companies  including Texas Instruments Inc. &lt;TXN.N&gt;, STMicroelectronics  &lt;STM.PA&gt; and Broadcom Corp. &lt;BRCM.O&gt;, on Thursday said they  will propose a new wireless networking standard up to 10 times  the speed of the current generation.",Sci/Tech,4,1.8242218
11, LOS ANGELES (Reuters) - Apple Computer Inc.&lt;AAPL.O&gt; on  Tuesday began shipping a new program designed to let users  create real-time motion graphics and unveiled a discount  video-editing software bundle featuring its flagship Final Cut  Pro software.,Sci/Tech,4,1.9187504
12," AMSTERDAM (Reuters) - Free Record Shop, a Dutch music  retail chain, beat Apple Computer Inc. to market on Tuesday  with the launch of a new download service in Europe's latest  battleground for digital song services.",Sci/Tech,4,2.0035055
16,"Jet Propulsion Lab -- Scientists have discovered irregular lumps beneath the icy surface of Jupiter's largest moon, Ganymede. These irregular masses may be rock formations, supported by Ganymede's icy shell for billions of years...",Sci/Tech,4,1.9240507
23,"Google has billed its IPO as a way for everyday people to get in on the process, denying Wall Street the usual stranglehold it's had on IPOs. Public bidding, a minimum of just five shares, an open process with 28 underwriters - all this pointed to a new level of public participation. But this isn't the case.",Sci/Tech,4,1.8271924
43,"FT.com - Shares in Sohu.com, a leading US-listed Chinese internet portal, fell more than 10 per cent on Friday after China's biggest mobile phone network operator imposed a one-year suspension on its multimedia messaging services because of customers being sent spam.",Sci/Tech,4,1.8338118
47," HONG KONG (Reuters) - Dell Inc. &lt;DELL.O&gt;, the world's  largest PC maker, said on Monday it has left the low-end  consumer PC market in China and cut its overall growth target  for the country this year due to stiff competition in the  segment.",Sci/Tech,4,1.9658922
58," NEW YORK (Reuters) - U.S. Treasury debt prices slipped on  Monday, though traders characterized the move as profit-taking  rather than any fundamental change in sentiment.",Business,3,1.7904485
63,"NewsFactor - Oracle (Nasdaq: ORCL) has revamped its sales-side CRM applications in version 11i.10 of its sales, marketing, partner relationship management and e-commerce application.",Sci/Tech,4,1.7652273
70,"Red Flag Software Co., the company behind China's leading Linux client distribution, plans to focus more on its server operating system and enterprise customers, the company's acting president said.",Sci/Tech,4,1.8340638
71,"AOL Properties Sign Girafa For Thumbnail Search Images\\Girafa.com Inc. announced today that the CompuServe, Netscape, AIM and ICQ properties of America Online, Inc., have signed an agreement with Girafa to use Girafa's thumbnail search images as an integrated part of their search results.\\Using Girafa's thumbnail search service, search users can ...",Sci/Tech,4,1.9022611
83,"SAN FRANCISCO -- In the latest of a series of product delays, Intel Corp. has postponed the launch of a video display chip it had previously planned to introduce by year end, putting off a showdown with Texas Instruments Inc. in the fast-growing market for high-definition television displays.",Business,3,1.786177
86,AP - Shares of Kmart Holding Corp. surged 17 percent Monday after the discount retailer reported a profit for the second quarter and said chairman and majority owner Edward Lampert is now free to invest the company's  #36;2.6 billion in surplus cash.,Business,3,1.7645665
89,"A proposal backed by a coalition of telephone carriers would cut billions of dollars in fees owed by long-distance companies to regional phone giants but would allow the regional companies to make up some of the difference by raising monthly phone bills for millions of consumers. &lt;FONT face=""verdana,MS Sans Serif,arial,helvetica"" size=""-2""\ color=""#666666""&gt;&lt;B&gt;-The Washington Post&lt;/B&gt;&lt;/FONT&gt;",Sci/Tech,4,1.9602509
93,"NEW YORK (CNN/Money) - Money managers are growing more pessimistic about the economy, corporate profits and US stock market returns, according to a monthly survey by Merrill Lynch released Tuesday. ",Business,3,1.7607617
97," NEW YORK (Reuters) - Staples Inc. &lt;A HREF=""http://www.investor.reuters.com/FullQuote.aspx?ticker=SPLS.O target=/stocks/quickinfo/fullquote""&gt;SPLS.O&lt;/A&gt;, the top U.S.  office products retailer, on Tuesday reported a 39 percent jump  in quarterly profit, raised its full-year forecast and said it  plans to enter the fast-growing Chinese market, sending its  shares higher.",Business,3,1.8349061
110,Web giant Yahoo! is gambling that price cuts on its domain name registration and Web hosting products will make it more competitive with discounters in the space -- which means that small businesses looking to move online get a sweeter deal through ...,Business,3,1.9260075
111,"IBM said Tuesday it has acquired a pair of Danish IT services firms as part of its effort to broaden its presence in Scandinavia. As a result of the moves, IBM will add about 3,700 IT staffers to its global head count. Financial terms of ...",Sci/Tech,4,1.7806122
112,"Motorola plans to sell mobile phone network equipment that uses Linux-based code, a step forward in network gear makers #39; efforts to rally around a standard. ",Sci/Tech,4,1.7736684
118,"Mills Corp. agreed to purchase a 50 percent interest in nine malls owned by General Motors Asset Management Corp. for just over \$1 billion, creating a new joint venture between the groups. The deal will extend ...",Business,3,1.7958109
154,"SAN JOSE, Calif. - In a sign that Google Inc.'s initial public offering isn't as popular as expected, the company lowered its estimated price range to between \$85 and \$95 per share, down from the earlier prediction of \$108 and \$135 per share...",World,1,1.9138753
161,USATODAY.com - The Securities and Exchange Commission is expected to vote Wednesday to prohibit mutual fund companies from funneling stock trades to brokerage firms that agree to promote their funds to investors.,Business,3,1.9315104
162,"RealNetworks has kicked off what it claims is the biggest online music sale in history. For a limited time, every song in the firm #39;s RealPlayer Music Store can be downloaded for 49 cents, with most albums available for \$4.99. ",Sci/Tech,4,1.8749245
167,Cox Communications Inc. #39;s board of directors has formed a special committee of independent directors to consider Cox Enterprises Inc. #39;s proposal to take the company private in a \$8 billion stock buyout. ,Business,3,1.8688745
172,AP - Discount retailer Ross Stores Inc. Wednesday said its profit fell about 40 percent in the latest quarter due to problems with a new computer system that limited the company's ability to respond to changes in customer demand.,Business,3,2.0015354
173,"BOSTON The jury is still out on whether a computer can ever truly be intelligent, but there is no question that it can have multiple personalities. It #39;s just a matter of software. We usually think of the processor chip as the brains of a computer. The ...",Sci/Tech,4,1.7903926
180," NEW YORK (Reuters) - Kroger Co., the top U.S. grocer, on  Tuesday posted a 29 percent rise in quarterly profit due to  cost controls, but price cuts to lure shoppers caused earnings  to miss Wall Street estimates and shares fell.",Business,3,1.8749146
207,"Reuters - Intuit Inc. (INTU.O), maker of\the No. 1 U.S. tax presentation software TurboTax, on Wednesday\posted a wider quarterly loss after taking a goodwill\impairment charge during its seasonally weaker fourth quarter.",Sci/Tech,4,2.0397763
216,"Health care and consumer products maker Johnson  amp; Johnson (JNJ.N: Quote, Profile, Research) is in negotiations to acquire medical-device maker Guidant Corp.",Business,3,2.0111804
224,Credit Suisse Group announced plans to merge its Credit Suisse First Boston Securities unit with the rest of the company #39;s operations and cut as many as 300 jobs.,Business,3,1.8335645
232,Bank of America Corp. yesterday laid off hundreds of workers at Fleet bank branches across the Northeast as the North Carolina bank began to implement its brand of ...,Business,3,1.7717153
239," NEW YORK (Reuters) - Shares of Google Inc. will make their  Nasdaq stock market debut on Thursday after the year's most  anticipated initial public offering priced far below initial  estimates, raising \$1.67 billion.",Business,3,1.9804115
240,Former president Bill Clinton on Monday helped launch a new Internet search company backed by the Chinese government which says its technology uses artificial intelligence to produce better results than Google Inc.,Sci/Tech,4,2.0191689
243,"MacCentral - Market research company Ipsos-Insight on Tuesday announced the results of TEMPO, a quarterly survey of digital music behaviors. According to the report, consumers aged 12 and older in the United States were as likely to be aware of Apple Computer Inc.'s iTunes Music Store and Napster 2.0 when it came to recognizing digital music download brands -- each music service registered 20 percent of what TEMPO refers to as ""top-of-mind"" awareness.",Sci/Tech,4,1.8147061
257, NEW YORK (Reuters) - Pharmacy chain CVS Corp. on Thursday  said it would offer the world's first disposable digital camera  with a bright color viewing screen that allows consumers to  instantly preview pictures.,Sci/Tech,4,1.8897582
267,"The makers of two leading file-sharing programs are not legally liable for the songs, movies and other copyright works swapped online by their users, a federal appeals court ruled Thursday in a stinging blow to the entertainment industry. ",Sci/Tech,4,1.9657854
272,"AP - Ohio authorities sued Best Buy Co. Inc. on Thursday, alleging the electronics retailer engaged in unfair and deceptive business practices.",Business,3,1.83253
280,"Attorney General Jim Petro is suing Best Buy, alleging the electronics retailer has engaged in unfair and deceptive business practices. ",Business,3,1.8727134
292,"In a major setback for the music and movie industries, a federal appeals court upholds a lower court's decision in the infamous Grokster case, ruling peer-to-peer services Morpheus and Grokster are not liable for the copyright infringement of their users. By Katie Dean.",Sci/Tech,4,1.7904427
293,"The producer of ads featuring PC users who switched to Macs is applying the same tactic to political commercials. This time, he'll focus on former backers of President Bush, recruited online, who've changed their political allegiance. By Louise Witt.",Sci/Tech,4,1.7856705
297,USATODAY.com - Even a big first-day jump in shares of Google (GOOG) couldn't quiet debate over whether the Internet search engine's contentious auction was a hit or a flop.,Sci/Tech,4,1.9097198
299,"Montana jury orders oil firm to pay up over gas pipeline leak from 1955; company plans to appeal. NEW YORK (Reuters) - A Montana jury ordered ChevronTexaco Corp., the number two US oil company, to pay \$40.3 million for environmental damage from a gasoline ...",Business,3,1.7677186
301," &lt;A HREF=""http://www.investor.reuters.com/FullQuote.aspx?ticker=RSE.N target=/stocks/quickinfo/fullquote""&gt;RSE.N&lt;/A&gt; jumped before the bell after General Growth  Properties Inc. &lt;A HREF=""http://www.investor.reuters.com/FullQuote.aspx?ticker=GGP.N target=/stocks/quickinfo/fullquote""&gt;GGP.N&lt;/A&gt;, the No. 2 U.S. shopping mall owner, on  Friday said it would buy Rouse for \$7.2 billion.",Business,3,1.8166674
317,NewsFactor - Amazon.com (Nasdaq: AMZN) has said it will buy Joyo.com Limited -- a British Virgin Islands company that operates the largest Internet retail Web site in China -- for US #36;75 million.,Business,3,1.8319767
325,"In a report, the research firm painted a bright future for the open source operating system, claiming that shipments of servers running Linux -- and revenues from those shipments -- will rise significantly over the next five years.",Sci/Tech,4,1.7674041
329,"Samsung Electronics, the world #39;s second largest computer chip manufacturer, yesterday said that it would invest Won25,000bn (\$24bn) in its semiconductor business by 2010 to generate ",Business,3,2.0110686
345,"Internet retailer Amazon.com Inc. said on Thursday that it will buy Joyo.com Ltd., which runs some of China #39;s biggest retail Web sites, for about \$75 million to gain entry into China #39;s fast-growing market.",Sci/Tech,4,1.8883971
346,"Software developer Salesforce.com Inc. posted a sharp rise in second-quarter profit on better-than-expected revenue during its first quarter as a public company, but investors shunned the stock in late trading ",Sci/Tech,4,2.1001124
357,China will spend about \$3.4 billion over two to three years laying thousands of miles of oil pipelines to help secure its energy supply in the face of soaring prices and demand.,Business,3,1.8349149
399,"Aug. 23, 2004 (TheDeal.com) Problem-plagued Nortel Networks Corp. announced plans Thursday, Aug. 19, to eliminate an additional 3,500 jobs and fire seven more senior executives as the company labors to reinvent ",Business,3,1.9224794
417,Australian budget airline Virgin Blue announced Monday it will increase the fuel surcharge it adds to ticket prices from Aug. 26 because of soaring oil prices.,Business,3,1.8189389
422, LONDON (Reuters) - The dollar bounced off recent four-week  lows against the euro and yen on Monday in thin August trade  with investors focusing on U.S. data and a speech by the  Federal Reserve chief later in the week.,Business,3,1.7872236
426," NEW YORK (Reuters) - Retailer Kmart Holdings Corp. &lt;A HREF=""http://www.investor.reuters.com/FullQuote.aspx?ticker=KMRT.O target=/stocks/quickinfo/fullquote""&gt;KMRT.O&lt;/A&gt;  on Monday said it finalized a deal to sell 18 of its stores to  Home Depot Inc. &lt;A HREF=""http://www.investor.reuters.com/FullQuote.aspx?ticker=HD.N target=/stocks/quickinfo/fullquote""&gt;HD.N&lt;/A&gt; for \$271 million.",Business,3,1.9139276
428,"USATODAY.com - Apple's trendy iPod digital music player, which has revitalized the company, is giving laptop sales a boost during back-to-school season.",Sci/Tech,4,1.8407649
433,"Reuters - Southwest Airlines Inc. (LUV.N), the\largest U.S. discount carrier, on Monday said it will eliminate\88 scheduled flights in order to boost revenue by freeing up\planes for more lucrative markets.",Business,3,1.8146048
438,Microsoft Corp. #39;s decision to release a major upgrade for its flagship operating system in the same month that hundreds of thousands of students are reporting to college campuses across the ,Sci/Tech,4,1.8026704
446,"Online retail sales continue to show significant growth, according to the latest figures released by the US Department of Commerce.",Sci/Tech,4,1.8780258
447,Terra Lycos SA introduced two search tools on its Lycos U.S. Internet site on Monday as part of a recently announced strategy to focus on services that allow users to connect with others.,Sci/Tech,4,1.9097424
452," NEW YORK (Reuters) - U.S. blue chips were near the  unchanged mark on Monday as a disappointing sales forecast from  retailer Wal-Mart Stores Inc. &lt;A HREF=""http://www.investor.reuters.com/FullQuote.aspx?ticker=WMT.N target=/stocks/quickinfo/fullquote""&gt;WMT.N&lt;/A&gt; dampened sentiment,  offsetting the benefit of easing oil prices.",Business,3,1.9797646
454,"Wi-Fi is going sky-high thanks to a deal forged between enterprise Internet service provider iPass and Connexion by Boeing. Under the deal, iPass #39;s 528,000-plus Wi-Fi enterprise customers will ",Sci/Tech,4,1.8539687
466," NEW YORK (Reuters) - Americans paid their credit card bills  on time at a record high level in June, sending credit card  delinquencies to their lowest level in four years, Moody's  Investors Service said on Monday.",Business,3,1.7624105
467,OTTAWA -- A local firm that says it can help shrink backup times at large data centres is growing its business thanks to an alliance with Sun Microsystems Inc.,Business,3,1.918677
471,"Network equipment giant Cisco Systems (Quote, Chart) is buying IP platform specialist P-Cube for \$200 million in cash and stock. P-Cube #39;s technology helps telecom carriers, cable operators and ISPs manage ",Sci/Tech,4,1.8444203
477,"SAN FRANCISCO - Intel Corp. has cut prices on its computer chips by as much as 35 percent, though analysts on Monday said the cuts were probably unrelated to swelling inventories of the world #39;s largest chip maker.",Sci/Tech,4,2.012432
484,"blackhawk writes  quot;SAS Braathens, the Norwegian unit of Scandinavian airline SAS, will cut Oslo routes to Geneva and London Gatwick in the first step of a plan to eliminate 10 routes.",Business,3,1.8066206
512,"Intel has slashed prices across the board as it prepares to get behind new processor lines due this autumn. The Itanium server line has seen cuts of over 30 per cent, while prices for Intel #39;s fastest business ",Sci/Tech,4,2.0294852
526,"NEW YORK - Cisco Systems is aggressively trying to build its presence in key growth markets, and it #39;s using both new products and new acquisitions to do it.",Sci/Tech,4,1.7794678
531,"SAN JOSE, Calif.Cisco Systems Inc. said it has agreed to acquire P-Cube for \$200 million in stock and cash to enable service providers to further control and manage such advanced Internet Protocol services ",Sci/Tech,4,1.859354
549,Can you hear him now: Virgin Group Chairman Richard Branson said in Hong Kong that his company has earmarked \$300 million for a cell phone joint venture in China.,Business,3,1.7832934
554," Internosis Inc., an information technology company in Arlington, plans to move its headquarters to Greenbelt in October. The relocation will bring 170 jobs to Prince George's County.",Sci/Tech,4,1.7883233
558,"The PC industry is doing a better job this year of satisfying its U.S. customers, and better technical support and easier-to-use hardware seem to have made a difference, according to the American Customer Satisfaction Index.",Sci/Tech,4,1.7913908
559,"The United Nations, through its International Open Source Network (IOSN) will organize the first annual Software Freedom Day on Saturday in an effort to educate Asian users about the benefits of Free and Open Source Software (FOSS) and encourage its wider use in the region.",Sci/Tech,4,1.7756009
560,"By PAUL GEITNER    BRUSSELS, Belgium (AP) -- Software giant Microsoft Corp. (MSFT) and the media and entertainment powerhouse Time Warner Inc...",Sci/Tech,4,1.8266926
565,"Shares  in Indian software services giant Tata Consultancy close 16 higher on their market debut, raising \$1.2bn for the company.",World,1,2.0139883
567,"In an attempt to stem the growing tide of online scams, identity theft and the proliferation of junk e-mail, the Justice Department and state law enforcement officials have initiated what seems to be the largest dragnet yet against spammers, so-called ""phishers"" and other Internet con artists. &lt;FONT face=""verdana,MS Sans Serif,arial,helvetica"" size=""-2"" color=""#666666""&gt;&lt;B&gt;-washingtonpost.com&lt;/B&gt;&lt;/FONT&gt;",Sci/Tech,4,1.7765324
575,"Despite a weak third-quarter earnings report that sent its shares plunging 24 percent Tuesday, poultry producer Sanderson Farms Inc.",Business,3,1.8575772
578,VoIP (define) upstart Vonage has quickly amassed another \$105 million from venture capitalists and is looking to Latin America and Asia to accelerate an already torrid growth rate.,Sci/Tech,4,1.8661759
582,"Microsoft on Wednesday announced the release to manufacturing of Microsoft Operations Manager (MOM) 2005 and MOM 2005 Workgroup Edition, a new edition that the company previously called MOM 2005 Express.",Business,3,1.7812712
586,"Server shipments and revenue increased in the second quarter, with low-cost servers based on Linux or the Windows operating system growing faster than their Unix counterparts, according to research firm Gartner Inc.",Sci/Tech,4,1.9940038
589,"Quiznos Sub, the third-largest US sandwich chain, said on Wednesday it signed a deal to serve PepsiCo Inc. (PEP.N: Quote, Profile, Research) drinks in its US outlets, ending a 23-year relationship with Coca-Cola Co.",Business,3,1.9127836
594,"Customers will be able to download film clips, audio and video, interactive multiplayer games, multimedia music tracks,  quot;push-to-watch quot; services, as well as access large e-mail attachments.",Sci/Tech,4,1.8091327
597,"The FBI seized computers, software and equipment as part of an investigation into illegal sharing of copyrighted movies, music and games over an Internet ""peer-to-peer"" network, Attorney General John Ashcroft announced Wednesday.",Sci/Tech,4,1.8157349
602,"Sales of server systems rose 7.7 percent globally in the second quarter to \$11.55 billion as demand for Information Technology remained strong after a three year downturn, market research firm Gartner said in a statement.",Sci/Tech,4,1.9817194
615,"Singapore Airlines Ltd., Asia #39;s most profitable carrier, is betting new planes will help it lure passengers from Emirates and Cathay Pacific Airways Ltd.",Business,3,1.8665829
619,"Snoopy has left the building. Well, almost. MetLife Inc. , the insurance giant that employs Charlie Brown's dog in ads, is close to completing a deal to sell its State Street Research and Management investment arm to BlackRock Inc. for about \$400 million. Everyone involved will be better off for it.",Business,3,1.8380734
621,"Factory orders in July for costly manufactured goods recorded the biggest gain in four months. New home sales, meanwhile, slid, according to a pair of reports ",Business,3,1.833956
624,"Come September, Japanese electronics giant Casio Computer will launch the world #39;s smallest digital camera with a zoom lens. Casio #39;s palm-sized Exilim camera is much smaller than others as, for the first time, it uses a ceramic lens.",Sci/Tech,4,1.8213378
627,Enterprises seeking higher security for their growing number of mobile devices may be interested in new encryption technology that Nokia Corp. is deploying in its smart phone products.,Sci/Tech,4,1.8451363
628," NEW YORK (Reuters) - BlackRock Inc. &lt;A HREF=""http://www.investor.reuters.com/FullQuote.aspx?ticker=BLK.N target=/stocks/quickinfo/fullquote""&gt;BLK.N&lt;/A&gt;, one of the  largest U.S. fixed income managers, on Thursday said it will  buy its far smaller competitor State Street Research    Management Co., marking the biggest takeover in the asset  management business this year.",Business,3,1.8364353
632,"Understanding Search Engine Models\\To understand search engines and search engine marketing, one must first understand the search engine model. There are two fundamentally different types of search engine back ends: site directories and spidering search engines. Site directory databases are built by a person manually inputting data about websites. Most ...",Sci/Tech,4,1.833773
636,"Intel #39;s share of the booming flash market jumped 40.8 percent in the second quarter, according to market-research firm iSuppli Corp.",Sci/Tech,4,1.8684099
640,"NEW YORK, August 26 (New Ratings) - BlackRock Inc (BLK.NYS), a leading US-based fixed-income asset management company, has reportedly agreed to buy State Street Research  amp; Management Company, a unit of MetLife Inc, for \$375 million in a cash and stock ",Business,3,2.0143812
651,"CHICAGO (CBS.MW) - Discount retailer Dollar General reported a 19 percent rise in fiscal second-quarter earnings, helped by higher sales and lower charges.",Business,3,1.8710308
664,SAN FRANCISCO (CBS.MW) - TiVo said its second-quarter loss widened from a year earlier on higher customer acquisition costs. Free!,Sci/Tech,4,1.7758838
685,Oracle Corp. President Charles Phillips on Monday said PeopleSoft Inc. customers have become more comfortable with the prospect of a merger between the two software firms even as the proposed transaction awaits a critical ruling from a Delaware court.,Business,3,1.8668159
706,"The da Vinci Project, a Toronto group planning to launch a homemade, manned spacecraft in October, is having trouble getting its paperwork off the ground. Canadian regulators are leery of approving the launch. And then there's the matter of finding insurance. By Dan Brekke.",Sci/Tech,4,1.8468598
708,"Personal computer giant Hewlett-Packard Co. is stepping deeper than ever into the consumer electronics arena with its fall product lineup - so don't be surprised if you hear about ""HP TV"" along with ""HDTV"" when shopping for your next television.",Sci/Tech,4,1.8155804
709,Customers of Sprint Corp. and SBC Communications Inc. will be able to use both companies' wireless Internet connections with less hassle under a reciprocal deal announced Friday.,Sci/Tech,4,1.9753243
733,"EU Trade Commissioner Peter Mandelson and his US counterpart, Robert Zoellick, aim for a truce in the latest transatlantic row over government aid for aviation rivals Boeing and Airbus.",Business,3,1.8833767
744,"The computer-hardware giant, best known for products such as PCs and printers, on Friday laid out its plan to become a brand-name in consumer electronics products such as flat-screen TVs, music players and the devices that move content between them.",Business,3,1.767468
748,"The US space agency, NASA, continues work on improving the safety of the space shuttle, before the fleet of orbiters resumes its visits to the international space station next year.",Sci/Tech,4,1.8608825
762,"Siemens, the world #39;s fourth-largest maker of mobile phones, said Friday that a software flaw that can create a piercing ring in its newest phone models might hurt earnings in its handset division.",Business,3,2.0024087
