,Original_Text,Class_String,Class_Number,Neuron_35
57,"BAGHDAD, Iraq - Delegates at Iraq's National Conference called on radical Shiite cleric Muqtada al-Sadr to abandon his uprising against U.S. and Iraqi troops and pull his fighters out of a holy shrine in Najaf...",World,1,1.1799393
90," KABUL (Reuters) - The United States has brokered a  cease-fire between a renegade Afghan militia leader and the  embattled governor of the western province of Herat,  Washington's envoy to Kabul said Tuesday.",World,1,1.1114365
108,"AFP - Sudan will take the lead in restoring order to its rebellious Darfur region but needs the support of African peacekeepers and humanitarian aid, Foreign Minister Mustafa Osman Ismail said.",World,1,1.2101192
159, GAZA (Reuters) - A senior Hamas leader survived an Israeli  assassination attempt in the Gaza Strip Wednesday but at least  five other Palestinians were killed in the explosion that tore  through his home.,World,1,1.1102874
192,"AFP - Democratic White House hopeful Senator John Kerry warned that President George W. Bush's plan to withdraw 70,000 troops from Europe and Asia would hinder the war on terrorism and embolden North Korea.",World,1,1.1588844
193,Shia cleric Moqtada Sadr reportedly agrees to end an uprising in the holy Iraqi city of Najaf.,World,1,1.1400261
203," BAGHDAD (Reuters) - U.S. forces killed more than 50 Shi'ite  militiamen on Wednesday in a significant advance into a Baghdad  suburb that is a powerbase for radical cleric Moqtada al-Sadr,  the military said.",World,1,1.2162888
238,"Italian Premier Silvio Berlusconi (left) goes for a walk with British Prime Minister Tony Blair and his wife Cherie Blair at Berlusconi #39;s villa, Monday. AP ...",World,1,1.1197836
296,"Reuters - Some 30,000 Sudanese, victims of fresh\attacks by Arab militia inside Darfur, have threatened to cross\into Chad, the U.N. refugee agency warned on Friday.",World,1,1.2205579
321," NAJAF, Iraq (Reuters) - Rebel Shi'ite fighters appeared  still to be in control of the Imam Ali mosque in the Iraqi city  Najaf early on Saturday, but the whereabouts of their leader,  the fiery cleric Moqtada al-Sadr, were unknown.",World,1,1.1623175
332,"Israeli soldiers shot and killed a Palestinian as he approached a security fence between Israel and the Gaza Strip, Israeli military sources said on Saturday.",World,1,1.3231498
342,"PAKISTANI troops backed by artillery and aircraft attacked two suspected terrorist hideouts near the rugged Afghan border yesterday, killing and wounding a number of militants, Pakistan army and security officials said.",World,1,1.2836125
351,"Fatah, the mainstream Palestinian movement, hopes that its former West Bank leader Marwan Barghouti would take back his candidacy for the Jan. 9 presidential election.",World,1,1.0800341
364," KABUL (Reuters) - A man and two women were shot dead by  Afghan and U.S.-led troops after their vehicle ran through a  checkpoint on Saturday, a U.S. military statement said.",World,1,1.1436429
388,"A man and two women were shot dead by Afghan and US-led troops after their vehicle ran through a checkpoint on Saturday, a US military statement said.",World,1,1.1365625
393," NAJAF, Iraq (Reuters) - A U.S. AC-130 gunship attacked  Shi'ite militia positions in the holy Iraqi city of Najaf early  on Monday after tanks reinforced the siege of a shrine at the  center of a nearly three-week insurgency.",World,1,1.110405
402,": A military plane crashed into a mountain in Central Venezuela, killing 25 people, including five children, the Air Force rescue team said in a statement.",World,1,1.0791188
403,AFP - The African Union will bring Sudan's warring government and rebel armies into talks with regional power-brokers aimed at heading off a mounting humanitarian crisis in the province of Darfur.,World,1,1.1168257
472,"A former Palestinian security minister who could be key to keeping order among rival factions in Gaza after an Israeli pullout held a fence-mending meeting Monday with President Yasser Arafat, officials said.",World,1,1.2328327
505," SEOUL (Reuters) - North Korea hurled invective at President  Bush for a second day on Tuesday, calling him a political idiot  and human trash, and said six-party talks on Pyongyang's  nuclear ambitions appeared doomed.",World,1,1.0972385
566,"ABUJA, Aug 25, 2004 (dpa) -- Rebel groups agreed Wednesday to participate in peace talks with the Sudanese government being held in the Nigerian capital of Abuja after coming under pressure to disarm and accept confinement to camps in the country #39;s ",World,1,1.0846283
579,"AFP - Afghanistan has a chance for real political legitimacy when voters go to the polls in the country's first post-Taliban presidential election, the UN's envoy to the nation said.",World,1,1.0989939
614,AFP - Pakistan defeated arch-rivals India 3-0 here to ensure they stand among the top six in the Olympic men's field hockey competition.,World,1,1.102829
672,"GAZA CITY: The Israeli army demolished 13 Palestinian houses during an incursion in the southern Gaza Strip town of Rafah on Thursday, Palestinian security sources and witnesses said.",World,1,1.3314646
695," NAJAF, Iraq (Reuters) - Rebel Iraqi cleric Moqtada al-Sadr  on Friday ordered his men inside Najaf's Imam Ali mosque to lay  down their weapons and join thousands of Shi'ite pilgrims  outside the shrine.",World,1,1.0996939
720,"One of two Russian airliners that crashed nearly simultaneously was brought down by a terrorist act, officials said Friday, after finding traces of explosives in the plane's wreckage. A Web site connected to Islamic militants claimed the action was connected to Russia's fight against Chechen separatists.",World,1,1.0932499
725,Nepalese Prime Minister has rejected the UN offer of mediating in talks with Maoist rebels. But Sher Bahadur Deuba has not ruled out an expanded role for India to resolve the conflict in the Himalayan kingdom.,World,1,1.1003001
775,"KHARTOUM, Sudan -- Armed with knives, Eritrean deportees hijacked a plane that left Libya carrying about 80 fellow Eritreans and forced it to land yesterday in the Sudanese capital before surrendering to security forces, officials said.",World,1,1.1530716
780,A Yemeni court jailed five al Qaeda supporters for 10 years Saturday for the bombing of the French supertanker Limburg and sentenced to death another militant who plotted to kill the US ambassador to the Arab state.,World,1,1.1519536
792,AFP - Sudanese rebels walked away from African Union peace talks to hold a 24-hour boycott in protest at alleged government attacks on civilians in the war-torn western province of Darfur.,World,1,1.283061
818,Tuesday: A Shiite insurgency appeared to be weakening as Iraqi forces moved to within 200 yards of the Imam Ali Shrine. Wednesday: Iraq #39;s top Shiite cleric returned home with a peace initiative demanding an end to the fighting in Najaf.,World,1,1.0951422
831, PARIS (Reuters) - France's government and leaders of its  Muslim minority urged Iraqi militants Sunday to free two French  journalists they were holding hostage in a bid to force Paris  to revoke its ban on Muslim headscarves in schools.,World,1,1.1308581
832," BASRA, Iraq (Reuters) - Oil and gas spilled during recent  sabotage attacks on Iraq's southern oil pipelines ignited  Sunday and firefighters battled to douse the flames.",World,1,1.1445681
846,Peace talks between Darfur rebels and the Sudanese Government have resumed after a 24-hour boycott by rebels who accused Khartoum of violating a ceasefire by killing 75 civilians in six villages.,World,1,1.1256762
860,At least seven people have been killed in a bomb blast in central Kabul - the second deadly explosion in Afghanistan over the weekend.,World,1,1.2030171
868,The American military met for five hours on Sunday with representatives of the rebellious cleric Moktada al-Sadr in the volatile Baghdad Shiite neighborhood of Sadr ,World,1,1.2847118
869,"Iraq's interim prime minister said that he had held private meetings with representatives of insurgent groups from Fallujah, Ramadi and Samarra to  persuade them to accept a government amnesty offer.",World,1,1.1477422
879,"Islamabad, :A new Cabinet in Pakistan is likely to be sworn in on Monday, two days after Finance Minister Shaukat Aziz was made the country #39;s 23rd Prime Minister.",World,1,1.0797036
948,"Former Yugoslav President Slobodan Milosevic opened his long-delayed defense at the Yugoslav war crimes tribunal Tuesday, describing the battles of his Serbian people as self defense against internal rebellions and external attacks by Islamic warriors.",World,1,1.0929133
962,"Canadian Press - CANBERRA, Australia (AP) - Diplomats investigated Tuesday a report that an Australian oil engineer had been abducted in Yemen by armed tribesmen, but a conflicting report from Yemen said there was no kidnapping.",World,1,1.1129291
986,"Protesters in Kathmandu have expressed disbelief and frustration after learning of the deaths of 12 Nepalese hostages in Iraq. Nepal #39;s ambassador to Qatar, Somananda Suman, confirmed ",World,1,1.1201886
993,"Gunmen opened fire Wednesday on a convoy carrying former Iraqi Governing Council member Ahmad Chalabi in an apparent assassination attempt that wounded two of his bodyguards, Chalabi #39;s spokesman said.",World,1,1.1073703
999,"BAGHDAD - Gunmen ambushed the convoy of former Iraqi governing council president Ahmed Chalabi on Wednesday, wounding two of his bodyguards, aides said.",World,1,1.259243
1047, THE HAGUE (Reuters) - Judges at The Hague tribunal on  Thursday imposed a defense counsel on former Yugoslav President  Slobodan Milosevic to avoid further delays in his war crimes  trial.,World,1,1.1059401
1058,"Israeli forces destroyed two five-story apartment buildings in a Gaza refugee camp early Thursday after evacuating thousands of Palestinians from a neighborhood, said residents and the military.",World,1,1.2483711
1090,AP - A group of congressional Democrats is asking President Bush to dismiss a senior military intelligence officer who made church speeches that included inflammatory religious remarks while discussing the war on terrorism.,World,1,1.1281139
1105,"A shoot-on-sight curfew imposed to prevent riots and violent protests over the killing of 12 Nepalese workers in Iraq entered its third day Friday, while officials said they were trying to recover the bodies of the slain hostages.",World,1,1.0750936
1109,"One Saudi policeman was killed and three others were wounded in clashes with militants in a town northeast of Riyadh. A number of suspects were arrested in the battles, officials said.",World,1,1.1482564
1130,"AP - Israeli troops killed two Palestinians in two separate incidents Friday, and Israeli helicopters fired three missiles at a Gaza warehouse the army said was used for making weapons.",World,1,1.1112
1146,"Israeli military helicopters yesterday evening bombarded by missiles a building in one of the refugee camps in the downtown of Gaza, while two Palestinians were killed and other three injured in the sector by the Israeli bullets.",World,1,1.155924
1180," LORETO, Italy (Reuters) - Pope John Paul prayed for the  victims of the ""inhumane violence"" of Russia's Beslan school  tragedy as he said Mass on Sunday before 200,000 people in  central Italy.",World,1,1.1020154
1185,Reuters - France remained hopeful on Sunday that\two French hostages in Iraq would be freed and a religious\fatwa issued in Iraq demanded their release.,World,1,1.1886117
1186,"Iraq #39;s toppled leader Saddam Hussein and his top aides will go on trial within weeks, Iraqi Minister of State Kasim Daoud said on Sunday.",World,1,1.1359147
1199,"South Africa has canceled a meeting with prosecutors from Equatorial Guinea who had hoped to interview Mark Thatcher on his suspected links to a coup plot in the oil-rich country, officials said on Sunday.",World,1,1.1473038
1224,"AFP - The foreign ministers of India and Pakistan held a closing round of talks amid reports of progress on peripheral issues, but the nuclear rivals remained deadlocked on Kashmir.",World,1,1.1438242
1239,"BAGHDAD, Iraq -- A US military official in Iraq said seven American marines have been killed Monday in a car-bomb explosion. Several other Marines have been wounded in the attack.",World,1,1.1859235
1263,"A massive car bomb exploded on the outskirts of the Iraqi city of Fallujah, killing seven United States Marines and wounding several others, a US military official said.",World,1,1.1862394
1298," BAGHDAD (Reuters) - Iraqi fighters battled U.S. troops in a  Baghdad slum district Tuesday, raising the death toll to 22  Iraqis and one U.S. soldier and threatening to wreck a  cease-fire called by rebel Shi'ite cleric Moqtada al-Sadr.",World,1,1.1418641
1299,"BAGHDAD, Iraq - U.S. forces battled insurgents loyal to Shiite cleric Muqtada al-Sadr in the Baghdad slum of Sadr City on Tuesday, in clashes that left at least 34 people dead, including one American soldier, and 193 people injured, U.S...",World,1,1.0775754
1316,"US troops battled Shiite militiamen loyal to rebel cleric Muqtada al-Sadr in the Baghdad slum of Sadr City on Tuesday in fierce fighting that killed 36 people, including ",World,1,1.2110362
1329,"AP - Afghanistan's historic election campaign got under way Tuesday, pitting 17 hopefuls against interim leader Hamid Karzai in the race to become the impoverished country's first popularly elected president.",World,1,1.1797743
1352,"Baghdad, Sept. 8 (NNN): Bloody clashes on Tuesday between US forces and Shia militiamen left more than 46 persons, including six US soldiers, dead across Iraq during the past 24 hours, officials said here on Wednesday.",World,1,1.0831472
1386,Reuters - Israeli forces thrust into the outskirts\of the Jabalya refugee camp in the northern Gaza Strip on\Thursday in what the military said was an effort to stop\Palestinians firing rockets into Israel.,World,1,1.1994169
1399,"Egypt took a step back from plans to help the Palestinians prepare for an Israeli withdrawal from Gaza on Wednesday, saying it could not play its role in full as long as Israeli attacks on Palestinians continue.",World,1,1.0904802
1445,"JAKARTA, Indonesia - Suspected Muslim militants detonated a car bomb Thursday outside the Australian Embassy in Jakarta, killing nine people and wounding 173 in a bloody strike at a key U.S. ally in the war in Iraq...",World,1,1.1974334
1472,"GAZA CITY -- Palestinian gunmen and Israeli troops fought pitched battles Thursday on the outskirts of the largest refugee camp in the Gaza Strip, with schoolchildren scampering through sandy alleyways just yards from the fighting.",World,1,1.1154882
1490,Rebel leaders from Sudan #39;s Darfur region called on Thursday on Nigeria to intervene and kickstart African Union-sponsored talks on the crisis in the west of Sudan ,World,1,1.1927422
1504, HARARE (Reuters) - A Zimbabwe court jailed British former  special services officer Simon Mann for seven years on Friday  in a case prosecutors had linked to a foiled coup plot in  oil-rich Equatorial Guinea.,World,1,1.1225989
1517,AP - U.S. troops handed over medical supplies to Iraqi relief workers Friday amid a siege of a northeastern ethnic Turkish city where Iraqi and American forces are trying to root out hundreds of militants.,World,1,1.1254643
1519,"AP - Accused U.S. Army deserter Charles Jenkins left his Tokyo hospital for an American military base to surrender to military authorities Saturday, nearly 40 years after he allegedly defected to North Korea.",World,1,1.1038433
1521,"TOKYO - Accused U.S. Army deserter Charles Jenkins left his Tokyo hospital for an American military base to surrender to military authorities Saturday, nearly 40 years after he allegedly defected to North Korea...",World,1,1.0936415
1529,The British leader of a group of 67 alleged mercenaries accused of plotting a coup in Equatorial Guinea has been sentenced to seven years in jail.,World,1,1.1297549
1544,A US military intelligence soldier in Iraq has been sentenced to 8 months in prison for taking part in torturing detainees in Abu Ghraib prison.,World,1,1.1867315
1545,At least two protesters were killed when supporters of a sacked Afghan governor clashed with US and Afghan security forces in the western city of Herat.,World,1,1.2352598
1593," BAGHDAD (Reuters) - At least 110 people were killed across  Iraq on Sunday in a sharp escalation of violence that saw gun  battles, car bombs and bombardments rock the capital.",World,1,1.1603522
1598,"BAGHDAD, Sept 12: At least 45 people died in a wave of bombings and battles between US troops and militants on Sunday, as Iraq #39;s US-installed prime minister said over 3,000 had perished in the  #39;terrorism #39; washing over the country.",World,1,1.1235075
1649,VIENNA (MNA) - A United States official confirmed to AFP news agency on Friday that Washington fails to take Irans nuclear issue to the United Nations Security Council for possible sanctions against Tehran.,World,1,1.1199108
1739,"Pakistani forces have been battling al Qaeda fighters in an ongoing operation to rout terrorists in a tribal area near the border with Afghanistan, Pakistani intelligence sources said.",World,1,1.1685127
1760,"At least 69 people have been killed and scores wounded during a day of carnage in Iraq. In Baghdad, 47 Iraqis died and over 120 were injured in a massive explosion near a police station.",World,1,1.0938095
1808,"Three suspected Muslim militants gunned down a Briton in the Saudi capital Riyadh on Wednesday, security sources and diplomats said.",World,1,1.2342004
1828,"For the first time in 41 years, Saudi Arabia is allowing local elections. The ruling family's goal, political analysts and diplomats say, is to determine whether a more open government might help defuse a rising armed threat by Muslim  militants in the kingdom.",World,1,1.1474332
1846,"AFP - Two Americans and a Briton were abducted from their home in a plush Baghdad district at dawn, in the latest blow in Iraq's five-month-old foreign hostage crisis, the interior ministry said.",World,1,1.110458
1850,: An Indonesian court sentenced a Muslim militant to 12 years in jail on Thursday after finding him guilty of involvement in last year #39;s JW Marriott hotel bombing in Jakarta.,World,1,1.1413839
1877,"Prime Minister Ariel Sharon acknowledged that Israel was not following the moribund Mideast peace plan, and said an Israeli pullout from the Gaza Strip was unlikely to revive it, according ",World,1,1.1103792
1925,The Bush administration reached a tentative deal yesterday with three European nations at the UN nuclear watchdog agency on the next step in confronting Iran over its suspected nuclear weapons program.,World,1,1.0890177
1933,"BAGHDAD -- Kidnappers seized two Americans and a Briton from their central Baghdad villa at dawn yesterday, in a bold raid that could further limit the mobility of foreigners in the Iraqi capital.",World,1,1.1325076
1939,"A Chechen rebel commander has claimed responsibility for the school hostage siege in southern Russia earlier this month, during which more than 320 hostages were killed, half of them children.",World,1,1.1329484
1966,"AP - An American jet fired a missile at a house where about 10 members of an al-Qaida-linked group were believed to be meeting in the Sunni insurgent stronghold of Fallujah on Friday, police and the U.S. military said. At least three people were killed.",World,1,1.1198548
1980,BAGHDAD : At least six people were killed in two suicide car bombings in Baghdad while another 47 people died in a series of US air strikes around the Iraqi insurgent bastion of Fallujah.,World,1,1.2572267
1994,"Violence raged on in Iraq on Friday, with five Iraqis killed in a suicide car bombing in Baghdad and three more Turkish drivers reportedly kidnapped.",World,1,1.260692
2020,"AFP - Pakistani troops have hemmed in Al-Qaeda-linked foreign fighters and their local allies hiding in tribal border regions with a series of military assaults, a top Pakistani general said.",World,1,1.1780263
2021, UNITED NATIONS (Reuters) - The United States and China held  last-minute talks on Saturday before the U.N. Security Council  was to vote on a resolution that would consider oil sanctions  against Sudan if it did not stop atrocities in the Darfur  region.,World,1,1.1056554
2027," KHARTOUM (Reuters) - Sudan said Saturday that U.N.  sanctions, threatened over atrocities in the Darfur region,  would lead ""this society to a complete destruction.""",World,1,1.1010774
2037,"A suicide attacker detonated a car bomb near a crowd of people waiting to apply for jobs with the Iraqi National Guard in the northern city of Kirkuk on yesterday, killing at least 20 people and wounding 16, officials said.",World,1,1.0958849
2042,"AFP - Japan's army has worked out a secret plan to deal with possible large-scale terror attacks by North Korea, a press report said.",World,1,1.0817691
2055,"A suicide attacker detonated a car bomb Sunday near a joint US-Iraqi checkpoint, killing three people and wounding seven, including four US soldiers in the northern city of Samarra, the military said.",World,1,1.196651
2056,"KHARTOUM, Sudan Sept. 19, 2004 - A US-backed United Nations resolution threatening oil sanctions for the violence in Sudan #39;s Darfur region will only make it harder for the government to calm the insurrection there, a Sudanese official said Sunday.",World,1,1.093806
2108,"AP - A car bomb exploded in the northern Iraq city of Mosul on Monday, killing three people, hospital police said.",World,1,1.200596
2125,"Tropical Storm Jeanne killed at least 250 people and injured at least 380 in northern Haiti, the United Nations said. UN spokeswoman Denise Cook said the bodies of 250 people were in ",World,1,1.0842363
2249,"Los Angeles Times - BAGHDAD  #8212; Militants said Tuesday that they had beheaded a second American hostage in as many days and threatened to kill a British captive, increasing pressure on President Bush and British Prime Minister Tony Blair to confront a recent wave of kidnappings of foreigners in the Iraqi capital.",World,1,1.1305264
2276, UNITED NATIONS (Reuters) - Israel urged the United Nations  on Wednesday to move toward sanctions against Iran because  Tehran is never going to abandon its alleged quest for nuclear  weapons.,World,1,1.1237593
2325,"GAZA -- Palestinian security forces know who was behind the killing of three Americans in Gaza nearly a year ago but cannot act against the factions while fighting with Israel continues, a top Palestinian security official said.",World,1,1.179373
2339,"UN peacekeepers hand control of security in the Sierra Leone capital, Freetown, to local forces after the end of a brutal war.",World,1,1.0991931
2340,"Offering a simple, ""Thank you America,"" Iraqi interim Prime Minister Ayad Allawi declared Thursday that his country is succeeding in its effort to move past the war that ousted Saddam Hussein.",World,1,1.0783231
2360,"AFP - The Nigerian army killed 24 Islamic militants who had taken refuge in the mountainous northeastern region bordering Cameroon, the spokesman for the northeastern state of Borno said.",World,1,1.1334364
2369,A high-ranking Palestinian Liberation Organization delegation led by Chairman Mahmoud Abbas held landmark talks with the Syrian leaders in Damascus Monday.,World,1,1.2248192
2370,"BAGHDAD US warplanes fired on targets in the east Baghdad slum of Sadr City on Thursday, the second day of fighting in the Shiite militia stronghold.",World,1,1.2045947
2426,The United Nations High Commissioner for Refugees says granting more autonomy to southern Sudan could help end the bloody conflict there.,World,1,1.1019502
2463,"Sudan says it has foiled a coup plot by backers of detained Islamist leader, Hassan al-Turabi.",World,1,1.230453
2476,The leaders of India and Pakistan promised Friday to work together to  quot;restore normalcy and cooperation quot; between their countries and seek peace in the disputed Himalayan territory of Kashmir.,World,1,1.215632
2482,"GAZA CITY, Gaza Strip - A day after a mortar round killed an Israeli-American woman in a nearby settlement, the Israeli army charged into a Palestinian refugee camp Saturday, killing one person and tearing down 35 homes, witnesses and a U.N. aid official said...",World,1,1.1588521
2486,"The top United Nation refugee official is in Chad, where Saturday, he toured a camp for Sudanese refugees who have fled violence in the western Darfur region.",World,1,1.2327924
2507,"UN Secretary-General Kofi An nan meets with visiting Iraqi Prime Minister Iyad Allawi at UN headquarters in New York, Sep 24. (Xinhua Photo).",World,1,1.0911452
2512,Efforts to secure the release of Iraq hostage Ken Bigley are being stepped up as a delegation from the Muslim Council of Britain #39; heads to Baghdad for talks.,World,1,1.1737205
2514,"AFP - A French national shot dead in the Saudi Red Sea city of Jeddah overnight was the target of a  quot;terrorist attack quot; according to initial investigations, an interior ministry spokesman told AFP.",World,1,1.074815
2528,"Widening its pursuit of Hamas beyond the occupied territories, Israel reached into Damascus Sunday, dealing a blow to both Hamas and Syria.",World,1,1.1352365
2564,"JERUSALEM -- A Hamas official was killed Sunday when his sport utility vehicle exploded in a neighborhood of Damascus, Syria, seconds after he started the engine, according to witnesses and the Palestinian militant group #39;s leaders, who accused Israel of ",World,1,1.1365564
2587," KAMMENA VOURLA, Greece (Reuters) - A bus carrying school  students and teachers to the Athens Paralympic Games collided  with a truck in central Greece on Monday killing at least seven  people and injuring 24, officials said.",World,1,1.1231132
