,Original_Text,Class_String,Class_Number,Neuron_37
2103,"Verity this week will unwrap a software add-on to its search system, designed to make unstructured content more usable in corporate applications. The announcement follows activity from ClearForest, which last month introduced Version 6.0 of its Text Analytics platform for systematically structuring unstructured data so it can be processed with enterprise data in business intelligence systems.",Sci/Tech,4,0.8643071
2106,"&lt;p&gt;\&lt;/p&gt;&lt;p&gt; SAN FRANCISCO (Reuters) - The number of new viruses and\worms aimed at Microsoft Corp.'s &lt;MSFT.O&gt; ubiquitous Windows\operating system rose 400 percent between January and June from\the same year-earlier period, leading computer security company\Symantec said on Sunday.&lt;/p&gt;",Sci/Tech,4,0.90899086
2128,"MOSCOW (AP) -- The replacement crew for the International Space Station started two days of preflight exams Monday, part of final preparations to relieve the two-man Russian-American crew finishing a six-month mission.    Russian cosmonaut Salizhan Sharipov and U.S...",Sci/Tech,4,0.9011233
2139,The chipmaker announces a chip that combines VoIP (voice over Internet Protocol) and Wi-Fi into a single chip.,Sci/Tech,4,0.87147033
2149,"Water vapour and methane gas have been found in the same places on Mars, strengthening speculation that the Red Planet could be a haven for microbial life, space scientists say.",Sci/Tech,4,1.012537
2166,Fujitsu has joined the networking parade by agreeing to sell Cisco #39;s high-end routers and switches in Japan. It should come as no surprise as the market for high-end routers heats up.,Sci/Tech,4,0.9183647
2196,"Ask Jeeves Search Engine Gets Slim and Personal\\Ask Jeeves has introduced new changes which have totally made over the search engine which hopes to give Yahoo, MSN and Google a run for their money. The new changes at Ask.com include MyJeeves personal search, a revamped local search, and an update ...",Sci/Tech,4,0.9110097
2217,"National Science Foundation grants \$12.6 million to university scientists to study worms, viruses and the Net's ecology.",Sci/Tech,4,0.87910324
2266,"When Vittorio Formisano, the principal investigator for the Planetary Fourier Spectrometer (PFS) aboard the European Space Agency #39;s Mars Express, announced Monday that his team found that concentrations ",Sci/Tech,4,0.8662381
2269,Cape Clear Software and Neon Systems Inc. on Wednesday announced they are working together to integrate their respective technologies and allow users to quickly integrate mainframe applications and data through the use of Web services.,Sci/Tech,4,0.9023222
2335,"Reuters - Southern Africa faces major\challenges to feed its swelling populations and to keep its\wells from running dry, a study showed Wednesday.",Sci/Tech,4,0.8482575
2353," NEW YORK (Reuters) - Take-Two Interactive Software Inc.  &lt;A HREF=""http://www.reuters.co.uk/financeQuoteLookup.jhtml?ticker=TTWO.O qtype=sym infotype=info qcat=news""&gt;TTWO.O&lt;/A&gt; on Monday said that prices for its sports video games  will likely return to higher levels once new game consoles  arrive in late 2005 or 2006.",Sci/Tech,4,0.87669235
2358," WASHINGTON (Reuters) - VeriSign Inc. &lt;A HREF=""http://www.reuters.co.uk/financeQuoteLookup.jhtml?ticker=VRSN.O qtype=sym infotype=info qcat=news""&gt;VRSN.O&lt;/A&gt; and a  children's safety group unveiled a new technology on Thursday  that they said would make it easier for children to avoid child  predators online.",Sci/Tech,4,0.8657184
2382,Microsoft may find the burden of securing older versions of Windows browsers a burden. Tough. But its neglect hurts the entire Internetand leaves and opening for open-source replacement.,Sci/Tech,4,0.8477323
2414,AP - The first solar-wind samples recovered from the crashed Genesis space capsule have been sent to researchers in California.,Sci/Tech,4,0.93360895
2436,"p2pnet.net News:- A European consortium, including Linux-distributor Mandrakesoft, has won an \$8.6 million contract to boost Linux #39; security, says a TechWeb story, going on that the French Ministry of Defense is,  quot;expected to make the operating system ",Sci/Tech,4,0.9077747
2441,Microsoft Watch: Redmond had told developers privately earlier this year of plans to port some SP2 fixes to older versions of Windows.,Sci/Tech,4,0.8639613
2447,"Due to lack of demand, the chipmaker postpones plans to build Wi-Fi access points into desktop PCs this year.",Sci/Tech,4,0.8856491
2508,washingtonpost.com - The Intuit-Microsoft battle for supremacy in the personal-finance software market is as long-running as some sports rivalries -- except that few users seem to care all that much about the outcome of this contest.,Sci/Tech,4,0.8848402
2522,"Every time a new IE security flaw is announced, or whenever someone gets fed up with hackers manipulating their Web browser, Firefox and other Mozilla-based browsers get a bump in the marketplace.",Sci/Tech,4,0.9306822
2533,"AP - Taran Rampersad didn't complain when he failed to find anything on his hometown in the online encyclopedia Wikipedia. Instead, he simply wrote his own entry for San Fernando, Trinidad and Tobago. Wikipedia is unique for an encyclopedia because anybody can add, edit and even erase. And the Wikipedia is just one  #151; albeit the best known  #151; of a growing breed of Internet knowledge-sharing communities called Wikis.",Sci/Tech,4,0.87027997
2534,"AFP - Riding on the global success of PlayStation 2 (PS2), Sony has launched its first hand-held game console to challenge rival Nintendo, whose Game Boy Advance monopolizes the worldwide portable game market.",Sci/Tech,4,0.8632204
2601,"SEPTEMBER 27, 2004 (COMPUTERWORLD) - Betrusted Holdings Inc. in New York and TruSecure Corp. in Herndon, Va., last week said they #39;re merging to form a single IT security services vendor.",Sci/Tech,4,0.91913986
2608,"IronPort Systems has launched the latest version of its IronPort C-Series E-mail Security Appliance, adding Virus Outbreak Filters that the company said could respond to new virus outbreaks within minutes.",Sci/Tech,4,0.86742026
2650,"SEPTEMBER 28, 2004 -- London -- The ultimate high-end incentive trip took another step closer to reality yesterday when Richard Branson, head of the Virgin Group, announced plans to launch commercial space flights by 2007.",Sci/Tech,4,0.8450092
2682,"Scientists say a DNA map of Africa #39;s elephant herds will help combat the illegal trade in ivory. The map is a genetic profile of elephant groupings across the continent, from the dense forests of western and central Africa to the vast eastern savanna.",Sci/Tech,4,0.8678003
2693,"Freescale Semiconductor Inc. took some of the wraps off of its dual-core microprocessor design, which the company said would be tailored to embedded applications.",Sci/Tech,4,0.97178537
2708,"NEW YORK (AP) -- In a harbinger of security threats to come, hackers have exploited a newly announced flaw in Microsoft Corp. (MSFT) programs and begun circulating malicious code hidden in images that use the popular JPEG format...",Sci/Tech,4,1.0052137
2722,THE scientist who made his name by cloning Dolly the sheep said yesterday that he was  quot;very optimistic quot; about gaining a licence to clone human embryos to aid understanding of motor neurone disease.,Sci/Tech,4,0.8721265
2732,"NEW YORK - In a harbinger of security threats to come, hackers have exploited a newly announced flaw in Microsoft Corp. programs and begun circulating malicious code hidden in images that use the popular JPEG format.",Sci/Tech,4,0.9174786
2748,In the beginning there was Darwin. And then there was intelligent design. How the next generation of 'creation science' is invading America's classrooms. By Evan Ratliff from Wired magazine.,Sci/Tech,4,0.95522714
2753,"Aimed at making cheaper PCs, Microsoft on Wednesday unveiled low-cost Windows XP Starter Edition operating systems in India in Hindi targetting the first-time home users.",Sci/Tech,4,0.86621493
2754,"Duke University -- A Supernova Early Warning System (SNEWS) that detects ghostlike neutrino particles that are the earliest emanations from the immense, explosive death throes of large stars will alert astronomers of the blasts before they can see the flash.     SNEWS ""could allow astronomers a chance to make unprecedented observations of the very early turn-on of the supernova,"" wrote the authors of an article about the new system in the September issue of the ""New Journal of Physics.""     They also noted that ""no supernova has ever been observed soon after its birth.""     Big stars end their lives in explosive gravitational collapses so complete that even the brilliant flashes of light usually announcing these extremely rare ""supernova"" events stay trapped inside, unseen by astronomers, for the first hours or days...",Sci/Tech,4,0.85853463
2756,"The Redmond, Wash.-based software giant today announced a year-long pilot program to start shipping the Windows XP Starter Edition to India in early 2005.",Sci/Tech,4,0.89139634
2785,Company's third open-source contribution is the first time it has shared code for actual application.,Sci/Tech,4,0.8658996
2799,InfoWorld - Security experts have spotted the first attempts to create an Internet worm that propagates using instant messages and exploits a recently disclosed flaw in Microsoft software.,Sci/Tech,4,0.9306256
2842,"A flurry of space tourism milestones and announcements in recent days signals that human spaceflight is shifting from governments to the private sector, space experts say.",Sci/Tech,4,0.90307033
2864,BALTIMORE--Proponents of radio frequency identification used to have a quick and easy response to consumer advocates charging that the technology posed an alarming threat to privacy.,Sci/Tech,4,0.8818175
2902,"The SpaceShipOne team will attempt to win the \$10 million Ansari X Prize on Monday, the 47th anniversary of the start of the first space race when the Soviet Union launched its Sputnik satellite.",Sci/Tech,4,0.904442
2915,"US scientists have charted the genetic map of a microscopic algae that absorbs huge amounts of greenhouse gases.  quot;These organisms are incredibly important in the global carbon cycle, quot; said Virginia Armbrust ",Sci/Tech,4,0.88071036
2918,"Some of the net's biggest players such as AOL, Hotmail and Yahoo are stepping up efforts to combat spam.",Sci/Tech,4,0.96951985
2929,"Designer Burt Rutan #39;s SpaceShipOne cracked through Earth #39;s atmosphere and into outer space Sept. 29. Pilot Mike Mevill guided the aircraft to an altitude of 102,870 meters.",Sci/Tech,4,0.8928379
2931,"SPACE.com - The second attempt by the rocketplane SpaceShipOne to soar into space and snag \  the  #36;10 million Ansari X Prize is planned for Monday, officials announced last \  night.",Sci/Tech,4,0.8698751
2936,"OCTOBER 01, 2004 (COMPUTERWORLD) - Sun Microsystems Inc. this week released Java 2 Platform Standard Edition (J2SE) 5.0, an upgrade of its programming language with more than 100 new features designed to bolster ",Sci/Tech,4,0.87462825
2941,"Despite a seemingly calamitous crash to Earth last month by the Genesis spacecraft, large portions of the solar wind samples it had gathered in space appear to be salvageable, NASA scientists announced on Sept.",Sci/Tech,4,1.0131786
2946,THE future of the world #39;s large wild mammals is threatened by pressures similar to those that caused the extinction of two-thirds of such species at the end of the most recent Ice Age.,Sci/Tech,4,0.85091573
2965,"Amit Yoran, the government's cybersecurity chief, abruptly resigned yesterday after a year at the Department of Homeland Security, a move that raised questions about the Bush administration's ability to quickly improve cybersecurity.",Sci/Tech,4,0.85055083
3004,"WASHINGTON: The US space agency NASA has put off resumption of space shuttle flights from March until at least May, the agency has said.",Sci/Tech,4,0.8832909
3034,"Comprehensive security programs that include firewall software, spyware defenses and diagnostic and repair tools are necessay to keep a PC in good health these days. &lt;FONT face=""verdana,MS Sans Serif,arial,helvetica"" size=""-2"" color=""#666666""&gt;&lt;B&gt;-The Washington Post&lt;/B&gt;&lt;/FONT&gt;",Sci/Tech,4,0.95510393
3038,"An Australian open-source industry group on Friday took exception to a Gartner report that pre-loading PCs with Linux is often a precursor to adding a pirated copy of Windows, calling the research  quot;farcical.",Sci/Tech,4,0.9273166
3087,Red Hat chairman and chief executive Matthew Szulik said in a statement:  quot;Directory Server and Certificate Management System have already been widely deployed in the enterprise and are mature ,Sci/Tech,4,0.92419875
3100,"InfoWorld - Hoping to put in place the last missing piece of the Java stack, Gluecode Software and the Apache Software Foundation this week unwrapped Project Agila, which the companies claim is the first embeddable open source BPM engine.",Sci/Tech,4,0.8461116
3136,"MacCentral - Apple on Monday released Security Update 2004-09-30, which fixes two AFP Server and CUPS issues as well as problems with NetInfoManager, postfix and the ServerAdmin component in Mac OS X Server v10.2.8 and v10.3.5. In addition, a QuickTime heap buffer overflow problem that could allow someone to execute code hidden in a BMP has been repaired. The CUPS and QuickTime fixes apply to Mac OS X v10.3.5 and v10.2.8 as well as the Server versions of each while the others apply only to the user and Server editions of v10.3.5.",Sci/Tech,4,0.96375734
3159,"update PalmOne on Monday introduced a handheld computer that holds on to data even when the battery runs down, as part of a revamping of its mobile-device lineup.",Sci/Tech,4,0.8763765
3185,"US scientists David Gross, David Politzer and Frank Wilczeck win the Nobel physics prize for their insights into the deep structure of matter.",Sci/Tech,4,0.8671079
3221,"In New York, San Francisco, and Washington, D.C., National Geographic's Photo Camps this summer paired underprivileged students with seasoned photogropaphers. &lt;i&gt;With photo gallery.&lt;/i&gt;",Sci/Tech,4,0.88179505
3229,"Yahoo launched a new service designed to let users of its search engine save and manage their query results for accessing later and sharing with others, the company said Tuesday.",Sci/Tech,4,0.9188411
3262,"IBM on Wednesday formally announced the next major release of WebSphere, code-named Vela, which company officials see as an integral building block for both its ongoing SOA (service-oriented architecture) and On Demand strategies.",Sci/Tech,4,0.8734265
3285,Whatever pleasantries once existed between Sun Microsystems and Red Hat have vanished. This won #39;t come as a shock to many of you.,Sci/Tech,4,0.85127705
3291,"AP - Japan's Sony Corp. will begin selling a computer and home-server system in Japan with 1,000 gigabytes of hard-drive storage  #151; enough to record six TV channels for a week straight  #151; the company said.",Sci/Tech,4,0.9170284
3292,"The Department of Homeland Security has filled the nation's top cyber-security post after the previous chief abruptly resigned last week, choosing the former director's deputy to take over the position. &lt;FONT face=""verdana,MS Sans Serif,arial,helvetica"" size=""-2"" color=""#666666""&gt;&lt;B&gt;-washingtonpost.com&lt;/B&gt;&lt;/FONT&gt;",Sci/Tech,4,1.0067679
3342,"Monday was a big day in Mojave. Tens of thousands of spectators showed up to see Burt Rutans SpaceShipOne make its second flight from below sea level to the edge of space, and in doing so ",Sci/Tech,4,0.9011587
3364,"TOKYO (AFX) - Firms that are supporting one of the next-generation optical DVD formats, the Blu-ray Disc, plan to release camcorders that record on smaller versions of the discs as early as 2005, the Nihon Keizai Shimbun reported, without citing sources.",Sci/Tech,4,0.8712106
3382,"NewsFactor - Microsoft (Nasdaq: MSFT) has released a Windows XP Service Pack 2 update to fix an installation problem that was caused by a third-party adware program named ""T.V. Media.""",Sci/Tech,4,0.87928915
3383,"The number of homes using Net telephony should reach 12 million by 2009, but existing VoIP players could face hurdles.",Sci/Tech,4,0.8805191
3394,"LOS ANGELES As a teenager, Shawn Fanning brought free music to the masses, creating the Napster file-swapping program and unleashing a technological genie that granted the wishes of fans seeking virtually any song at any time - gratis.",Sci/Tech,4,0.84851754
3402,"AP - Not so long ago, in a galaxy not so far away, Chip Collier was on a mission. ""I really gotta stop bleeding and dying,"" the 24-year old said as he slouched in front of his computer in his ninth-floor Chicago apartment. ""I'm really horrible about not paying attention to my battle fatigue.""",Sci/Tech,4,0.8517044
3421,PROGRESS: Many students eagerly await the final version of Mozilla #39;s Firefox Internet browser that will be released later this month.,Sci/Tech,4,0.90505344
3438,"Curious polygon shapes on the surface of Mars are among the latest evidence clearly suggesting the presence of water, and some of it may have appeared there even after the surface was bombarded by objects from distant space.",Sci/Tech,4,0.8986638
3441,Dell today asked 4.4m notebook users to return their power adaptors after it admitted these peripherals pose both a fire and electric shock hazard.,Sci/Tech,4,0.89229023
3456,Yesterday we covered the news that Google is expanding their search to the mobile arena with their new Google SMS service which lets you search by sending text messages from your cellphone.,Sci/Tech,4,0.86345625
3472,"LOS ANGELES - NASA #39;s Mars rover, Opportunity, has found more signs that rocks on the Red Planet were once submerged in water. Data sent by Opportunity suggest a crater was drenched a second time after drying out, scientists said.",Sci/Tech,4,0.8979091
3486,"I applaud Burt Rutan and the SpaceShipOne team for their miraculous achievement of winning the Ansari X Prize. As an astronaut, I understand well the challenges they faced in reaching suborbital space.",Sci/Tech,4,0.94202274
3501,How did the first amino acids form the first peptides? It is the important question that may point the pathway towards understanding the primordial soup. Researchers now suggest that the binder for linking together building blocks may have been volcanic gases -- or carbonyl sulfide.,Sci/Tech,4,0.84540594
3512,"The Department of Homeland Security has named an acting US cybersecurity chief as Congress weighed whether to give the position greater clout to fight hackers, viruses and other online threats.",Sci/Tech,4,0.8659761
3535,"Microsoft has suspended the beta testing of the next version of its MSN Messenger client because of a potential security problem, a company spokesperson says.",Sci/Tech,4,0.8637847
3567,"A leading researcher of marine mammal acoustics, William A. Watkins created a database of thousands of underwater calls from more than 70 species.",Sci/Tech,4,0.85245955
3588,"Putting some truth to the rampant rumours that Google was getting into the instant messaging business, the company has announced the beta test release of Google SMS, the mobile phone equivalent of IM.",Sci/Tech,4,0.8547438
3602,"Computer users could stop most viruses and cyber attacks by fixing a small number of common flaws, according to new research. Viruses, spam and distributed denial of service attacks could ",Sci/Tech,4,0.8448093
3610,"About 4.4 million AC adapters sold worldwide with Dell notebooks between September 1998 and February 2002 were recalled on Friday because of a risk of overheating, which could lead to a fire or electrical shock, according to Dell.",Sci/Tech,4,0.8909509
3623,Ziff Davis - Silicon Graphics Inc. will ship a new ultra high performance Intel Itanium-based Linux workstation designed for scientific and medical applications.,Sci/Tech,4,0.8877342
3642,"AP - While earthquakes, steam and magma are getting all the attention on Mount St. Helens these days, the volcano's most unique feature could be the icy epitome of slow motion that has sprouted on its flanks in the last two decades: its glacier.",Sci/Tech,4,0.8482833
3651,"US authorities, participating in an international investigation, have shut down 20 independent news Web sites run by the Independent Media Center (Indymedia) by seizing two UK-based Web servers, the group said on Friday.",Sci/Tech,4,0.84332305
3668," quot;SGI is pushing the limits of how many processors can run on a single version of Linux, quot; says IDC #39;s Dan Kusnetzky.  quot;The intersection of these different technologies makes it much easier to ",Sci/Tech,4,0.9001684
3706,The Federal Trade Commission formally announced yesterday its first assault against spyware - bits of computer code that surreptitiously install themselves on the computers of Internet users ,Sci/Tech,4,0.8426388
3731,"Hackers are trying to trick computer users into downloading damaging software by claiming to have sleazy photographs of football star David Beckham, experts warned today.",Sci/Tech,4,0.94218993
3739,"Expedition 10, the next crew to live on the International Space Station (ISS), is set to launch from Kazakhstan. US astronaut Leroy Chiao and Russian cosmonaut Salizhan Sharipov will leave the Baikonur Cosmodrome on a Soyuz rocket at 0306GMT on Thursday.",Sci/Tech,4,0.8927275
3788,"USATODAY.com - Dell will set out Thursday to conquer markets dominated by Apple, Hewlett-Packard and others with products that include its first small digital music player, photo printer and plasma TV.",Sci/Tech,4,0.93988633
3793,"In search of the ultimate lie detector, researchers turn to thermal facial scans, brain wiring and eyeball tracking. But deception still, well, deceives. By Randy Dotinga.",Sci/Tech,4,0.90727633
3802,"Users of the increasingly popular, open-source MySQL database may be at risk from remote attacks due to a bug in phpMyAdmin, a widely used Web-based MySQL administration tool.",Sci/Tech,4,0.9131744
3818,An administrator with the Los Angeles municipal government explains how his department was able to turn user resistance from the police and fire departments among others into an \$11 million purchasing and accounts payable system.,Sci/Tech,4,0.85988617
3827,"Amphibians such as leopard frogs and salamanders are threatened with extinction as their homes dry up and a new disease spreads, possibly as a result of global warming, according to a new study in Science magazine.",Sci/Tech,4,0.89219815
3849,IBM has expanded the top end of its eServer range with three multiple-processor systems aimed at datacentres and large enterprise clients.,Sci/Tech,4,0.84401006
3853,"UC Berkeley -- On Jan. 14, 2005, the Huygens probe will plow into the orange atmosphere of Saturn's moon, Titan, becoming the first spacecraft to attempt to land on a moon in our solar system since the Soviet Union's Luna 24 touched down on Earth's moon in 1976...",Sci/Tech,4,0.97310597
3872,"OCTOBER 15, 2004 (IDG NEWS SERVICE) - Dell Inc. took the wraps off its holiday lineup on Thursday, showing new printers, plasma televisions and music players that will soon be available through its Web site.",Sci/Tech,4,0.8873499
3879,"(Article Central) Microsoft released its October batch of security advisories this week, with a number of  quot;critical quot; patches, including a significant fix for the Internet Explorer browser.",Sci/Tech,4,0.9421181
3922,"A RUSSIAN spacecraft has delivered three astronauts to the International Space Station, overcoming docking system problems which had delayed its launch.",Sci/Tech,4,0.8493538
3970,"SAN FRANCISCO -- At virtually every turn, Intel Corp. executives are heaping praise on an emerging long-range wireless technology known as WiMAX, which can blanket entire cities with high-speed Internet access.",Business,3,0.8431976
3991,"Tough times often make for strange bedfellows, and the explosion of viruses, computer worms and spyware programs on the Internet is producing unique alliances among top technology firms. &lt;FONT face=""verdana,MS Sans Serif,arial,helvetica"" size=""-2"" color=""#666666""&gt;&lt;B&gt;-washingtonpost.com&lt;/B&gt;&lt;/FONT&gt;",Sci/Tech,4,0.99600387
4009,"The links between Apple and U2 grow stronger, with Apple #39;s announcement that it will hold a special music event next week on October 26.",Sci/Tech,4,0.89867115
4012,"p2pnet.net News:-  quot;Select quot; members of the press on Monday have received an invitation to a special Apple iTunes / iPod promo slated for October 16, says MacCentral.",Sci/Tech,4,0.9007138
4016,PC World has posted a news article claiming that the highly anticipated game Halo 2 for the Xbox has been released on the net.  quot;Microsoft confirms that a pirated copy of Halo 2 for Xbox in the PAL video format ,Sci/Tech,4,0.867418
4081,"Something strange happened on the sun last week: all the sunspots vanished. This is a sign, say scientists, that solar minimum is coming sooner than expected.",Sci/Tech,4,0.8609027
4115,"roundup Plus: Good Technology supported by HP, Samsung...RIM touts BlackBerry with Wi-Fi...HP to sell Voltaire's InfiniBand switch.",Sci/Tech,4,0.9052139
4120,"p2pnet.net News:- If you #39;re in Britain and you see people peering intently at their mobile phones, tapping their feet and snapping their fingers at the same time, they might be checking out the new Robbie Williams Greatest Hits album.",Sci/Tech,4,0.89543563
4121,"As expected, Advanced Micro Devices, on Tuesday officially released its new microprocessors aimed at high-end desktop computers. The new chips set the new records in a variety of industrial benchmarks and ",Sci/Tech,4,0.9086343
