,Original_Text,Class_String,Class_Number,Neuron_42
3579," GAZA (Reuters) - Several explosions rocked the house of an  Islamic Jihad militant leader in a Palestinian refugee camp in  the southern Gaza Strip on Monday, witnesses said.",World,1,0.95420027
3594,"Israel #39;s Ariel Sharon has rejected his army #39;s request to scale back its Gaza offensive, seeking to avoid any show of weakness after deadly bombings in Egyptian resorts crowded with Israelis, security sources said.",World,1,0.7711909
3705,"US forces stepped up operations yesterday across a wide swath of the Sunni insurgent strongholds northwest of the capital, pounding targets in three urban centers from the air and supporting Iraqi troops in raids on mosques suspected of harboring ",World,1,0.84569895
3749,"Reuters - Israel dealt a double blow to the\Palestinian Islamic group Hamas on Wednesday, arresting a West\Bank leader held responsible for a twin suicide bus bombing\that killed 16 and killing two militants in Gaza air strikes.",World,1,0.9299475
3782,"In southeast Pakistan one of two Chinese hostages injured during a rescue operation died of his injuries, military sources said Thursday.",World,1,0.77577156
3844,"KABUL, Afghanistan -- Vote counting started yesterday in Afghanistan's landmark election, widely expected to install US-backed interim leader Hamid Karzai as the war-ravaged country's first popularly chosen president.",World,1,0.91550124
3878,Pakistani President General Pervez Musharraf has arrived in Britain for a visit which will include talks with Prime Minister Tony Blair.,World,1,0.7738987
3886,THE federal government has welcomed the bringing of formal terrorism charges against Indonesian militant cleric Abu Bakar Bashir. A spokesman for Foreign Minister Alexander Downer said the charges reflected ,World,1,0.81757563
3893,"PORT-AU-PRINCE, Haiti - Heavy gunfire erupted yesterday when police streamed into a slum stronghold of ousted President Jean-Bertrand Aristide.",World,1,0.8425995
3931,Critics of the Iraq war have slammed the prime minister following a decision to allow British troops to move into dangerous territory around Baghdad under US military command.,World,1,0.8192763
3958,"LONDON, Oct. 17 -- The US-led war in Iraq has not made the world any safer, UN Secretary General Kofi Annan said in a British television interview aired on Sunday.",World,1,0.7844778
3960,AFP - Australia has turned down a diplomatic plea for a contribution to a military force to protect United Nations (UN) personnel in Iraq.,World,1,0.85994935
4076,"AFP - Myanmar's Prime Minister General Khin Nyunt -- among the most reformist of the military regime's leaders -- has been sacked and placed under house arrest for alleged corruption, a Thai government spokesman said.",World,1,0.82225925
4095,"A mortar attack on an Iraqi National Guard headquarters north of Baghdad killed at least four National Guards and injured 80 others, officials said Tuesday.",World,1,0.77645075
4104,"Supporters of Afghan President Hamid Karzai say he is on course to win the presidential elections, with about one-quarter of the votes counted.",World,1,0.79617393
4108,BAGHDAD - Iraqi militants threatened to kill an Australian journalist and interrogated him for more than 20 hours after kidnapping him outside a Baghdad hotel.,World,1,0.8925816
4183, JERUSALEM (Reuters) - Israel's parliament took  extraordinary security steps Wednesday for a vote next week on  a Gaza pullout plan expected to spark Jewish settler protests  and heighten death threats against Prime Minister Ariel Sharon.,World,1,0.8229346
4229,At least one Palestinian is shot dead by Israeli troops as he attacked a checkpoint near Gaza City.,World,1,0.8678634
4251,Sudan #39;s government and Darfur rebels are likely to restart talks Thursday as the African Union said it would increase its forces in the restive region.,World,1,0.7763024
4282,"GAZA CITY: One of the leaders of Hamas #39; military wing was killed in an Israeli airstrike in Gaza City early today, a Hamas spokesman said.",World,1,0.9544531
4307,AP - A military judge ordered a U.S. Army reservist on Friday to stand trial Jan. 7 in Baghdad for allegedly abusing Iraq inmates at the Abu Ghraib prison outside Baghdad.,World,1,0.93926424
4315,"Religious and political leaders gather at the Umm al-Qura Sunni Muslim mosque outside Baghdad, where clerics called for their followers to boycott Iraq #39;s January elections.",World,1,0.91622835
4344,"In line with his pledge made during the election campaign, Indonesian new President Susilo Bambang Yudhoyono stressed the importance of fighting corruption and terror while ",World,1,0.7875948
4353,"AP - A roadside bomb exploded near an American military patrol in Baghdad Saturday, injuring six soldiers, the U.S. command said.",World,1,0.8025914
4358,"Reuters - U.S. planes bombed targets in\Iraq's rebel-held city of Falluja, killing two people, and the\U.S. military said it had captured a lieutenant of its\deadliest Islamist enemy in Iraq in a raid early on Saturday.",World,1,0.7849684
4374,"Insurgents launched strikes on Saturday at United States and Iraqi outposts across Iraq, killing at least a dozen Iraqi police officers and national guardsmen ",World,1,0.85931575
4380,"AP - The United States could cut its forces in Afghanistan next summer if Taliban militants accept an amnesty to be drawn up by President Hamid Karzai and neighboring Pakistan, the senior U.S. commander here said Sunday.",World,1,0.83920974
4385,Suicide bombers killed at least 22 members of Iraq #39;s fledgling security forces yesterday amid a spate of insurgent attacks across the country that also ,World,1,0.7785954
4403,"KABUL, Afghanistan -- A Taliban suicide fighter killed himself and wounded at least seven others, including three members of a NATO-led peacekeeping force, in a grenade attack on a busy shopping street in central Kabul yesterday.",World,1,0.7934373
4414,ISRAEL killed two Islamic Jihad militants in the Gaza Strip yesterday as Ariel Sharon and his cabinet finalised a bill to withdraw from Gaza.,World,1,0.88504845
4416,"An American woman, believed to be a civilian, and a young Afghan girl died from their wounds after a suicide bomb attack in a busy shopping street in the Afghan capital.",World,1,0.8171406
4419,"Two Iraqis were killed and four others wounded in clashes that broke out between US troops and insurgents in Samarra, north of Baghdad, police said on Sunday.",World,1,0.8915315
4422,"A US security official, assigned to the US Embassy in Baghdad, was killed on Sunday by a mortar attack on a US Army base near Baghdad International Airport, US Secretary of State Colin Powell said.",World,1,0.8000354
4452,The corpses of 50 soldiers of Iraq #39;s new army have been discovered northeast of the capital Baghdad. Interim Iraqi interior ministry spokesman Adnan Abd al-Rahman said the troops were believed to have been ,World,1,0.7830145
4463," GAZA (Reuters) - Israeli tanks and troops backed by  helicopter gunships stormed Khan Younis refugee camp, a Gaza  militant stronghold, on Monday, killing 10 Palestinians  including an 11-year-old boy, medics and witnesses said.",World,1,0.8825091
4541,"Israeli MPs have resumed a debate on Prime Minister Ariel Sharon #39;s disengagement plan, which is expected to culminate in a historic vote in favour of a pull-out of troops and settlers from the Gaza Strip.",World,1,0.89705193
4570,"AFP - Germany and France both support inviting to European Union membership talks at a summit in December in Brussels, Chancellor Gerhard Schroeder said.",World,1,0.7699914
4589, JERUSALEM (Reuters) - Israeli Finance Minister Benjamin  Netanyahu said on Tuesday he and three other cabinet members  from Ariel Sharon's Likud would quit unless the prime minister  agreed to hold a referendum on a pullout from Gaza.,World,1,0.8717361
4616,The group led by wanted terrorist Abu Musab al-Zarqawi has said it has abducted a member of Japan #39;s armed forces and is threatening to behead him if the Japanese government does not withdraw its troops from Iraq within 48 hours.,World,1,0.7742656
4639, JERUSALEM (Reuters) - Israeli leader Ariel Sharon rejected  calls from within his divided cabinet on Wednesday for a  referendum on leaving Gaza after winning parliament's support  to uproot settlements from land claimed by Palestinians.,World,1,0.7820676
4647," THE HAGUE (Reuters) - Former Yugoslav President Slobodan  Milosevic's two court-assigned defense lawyers have asked to be  withdrawn from his case, The Hague war crimes tribunal said  Wednesday.",World,1,0.80335003
4654,"_ Nearly 800 British forces left their base in southern Iraq on Wednesday, heading north toward Baghdad to replace US troops who are expected to take part in an offensive against insurgent strongholds.",World,1,0.82582515
4668,British troops have rolled north from Basra to take over a deadly area near Baghdad and free up US troops for a widely expected attack on the rebel-held city of Falluja.,World,1,0.8387743
4736,"An elite contingent of 50 Nigerian soldiers left Nigeria on Thursday for Darfur, the first stage in the deployment of 3,000 extra African Union (AU) troops to monitor a shaky cease-fire in the western Sudanese region.",World,1,0.8184521
4748,"Unknown armed men in military uniform kidnapped three staff of the United Nations in the Afghan capital city at broad daylight Thursday, Afghan officials confirmed.",World,1,0.80842674
4752,"AP - A bomb exploded Thursday evening outside a bar in southern Thailand, the scene of a campaign of violence blamed on Islamic separatists, injuring at least 15 people, police said.",World,1,0.80554515
4761,"JERUSALEM, Oct 28 (AFP) - Israel will not bar ailing Palestinian leader Yasser Arafat from returning to the West Bank if he were to leave for medical treatment, senior government spokesman Raanan Gissin told AFP Thursday.",World,1,0.8279579
4788," BAGHDAD (Reuters) - Militants piled more pressure on  Washington's military allies in Iraq on Thursday, seizing an  Iraqi-Polish woman and holding a Japanese man under threat of  death.",World,1,0.8220116
4812,AP - The militant Palestinian group Hamas said Friday it was setting aside its differences with ailing Palestinian leader Yasser Arafat and called for a united Palestinian leadership to work toward general elections.,World,1,0.91013163
4838,"A French military jet believed to be carrying the Palestinian leader landed today at an airfield outside Paris, witnesses said.",World,1,0.80881566
4841,"Sudanese rebel leaders #39; demand that Islam be kept out of government in the war-torn region of Darfur, has been rejected by government negotiators.",World,1,0.7711173
4873,AFP - President George W. Bush called on the star power of actor-turned-California-governor Arnold Schwarzenegger to boost his campaign appeal as Democratic challenger John Kerry shifted his attack from missing explosives in Iraq to domestic economics.,World,1,0.7754136
4874,"Description: In Cambodia, Norodom Sihamoni who accedes to the throne with an elaborate coronation, following the abdication of his father King Norodom Sihanouk.",World,1,0.8191995
4890,"A militant group is threatening to kill three UN hostages kidnapped in Afghanistan, including a British woman, unless all Taliban prisoners are released.",World,1,0.85371155
4910,"Japan has confirmed that the headless body found in Baghdad on Saturday is of the Japanese being held captive in Iraq. An armed group in Iraq had on Tuesday threatened to behead Shosei Koda, 24, within 48-hours unless Japan pulled its troops out of Iraq.",World,1,0.84698606
4923,Militants holding three UN workers hostage in Afghanistan have offered to consider extending a three-day deadline for their beheading.,World,1,0.8035404
4937,"BAGHDAD: Fifteen people were killed and eight others injured in an explosion that hit a hotel last night in the northern Iraqi city of Tikrit, police and hospital officials said.",World,1,0.7737019
4992,"A car bomb exploded outside the Education Ministry in central Baghdad Tuesday, killing at least six people and wounding about eight, the Interior Ministry said.",World,1,0.80373996
5008,"A car bomb exploded outside the education ministry in central Baghdad on Tuesday, killing at least six people and wounding about eight, the interior ministry said.",World,1,0.8024267
5012,"An unknown militant group holding Iraqi-British hostage Margaret Hassan in Iraq has threatened to turn her over to a group led by al Qaeda ally Abu Musab al-Zarqawi if its demands are not met, Al Jazeera television says.",World,1,0.82311994
5014,"BAGHDAD, Iraq -- The kidnappers of aid worker Margaret Hassan threatened to turn her over to an al-Qaida affiliated group within 48 hours if the British government refuses to pull its troops from Iraq, Al-Jazeera television reported Tuesday.",World,1,0.82716244
5039,"Gunmen abducted a Lebanese-American contractor who worked with the US Army from his Baghdad home, Iraqi officials said Wednesday, while four Jordanian truck drivers were seized by assailants in a separate kidnapping.",World,1,0.7789906
5042,An Iraqi security official said gunmen abducted a Lebanese-American contractor who worked with the US Army in Iraq. Officials said gunmen snatched him when he answered the door at his Baghdad home overnight.,World,1,0.7779369
5082,"Palestinian leader Yasser Arafat has been in a coma for several hours and now in critical condition, Arafat #39;s senior aides said on Thursday.",World,1,0.8488196
5125," CAIRO (Reuters) - Israel released six Egyptian students  from prison on Sunday as part of a deal which includes freedom  for Israeli businessman and convicted spy Azzam Azzam, Egyptian  security sources said.",World,1,0.7866296
5207,Pakistani President General Pervez Musharraf on his visit after the landmark presidential polls in Afghanistan congratulated his Afghan counterpart Hamid Karzai for his victory Saturday afternoon.,World,1,0.84764546
5230,Militants threatening to kill three UN hostages said yesterday that talks with Afghan and UN officials had been postponed for another day.,World,1,0.81430894
5235," KABUL (Reuters) - Afghan militants holding three U.N.  workers hostage began talks with the government and the United  Nations on Sunday and the kidnappers have dropped some of their  demands, a militant spokesman said.",World,1,0.83705133
5243,The Iraqi government declared a state of emergency for 60 days as U.S. and Iraqi forces prepared for an expected assault on rebels in Fallujah.,World,1,0.93007123
5245, BAGHDAD (Reuters) - Iraq's interim government declared a  state of emergency for 60 days on Sunday to quell violence  gripping the country ahead of January elections.,World,1,0.8413157
5247,"JERUSALEM -- Former US envoys say that the passing of Yasser Arafat would open up new opportunities for Mideast peace, especially if new, pragmatic Palestinian leaders emerge.",World,1,0.8472182
5249," PARIS (Reuters) - Yasser Arafat, critically ill in a Paris  hospital, has suffered liver failure, a Palestinian official  said on Sunday as Arafat's subordinates decided in his absence  to enforce a law and order plan in Palestinian areas.",World,1,0.8106095
5255,Militants holding three foreign United Nations workers in Afghanistan said that they had held negotiations with officials from the Afghan government and the United ,World,1,0.78180087
5287, ABIDJAN (Reuters) - Ivory Coast President Laurent Gbagbo  appealed for an end to the anti-French violence which erupted  after France destroyed most of the country's air force in  retaliation for the killing of nine French peacekeepers.,World,1,0.8263098
5358,"U.S. Army and Marine units thrust into the heart of the insurgent stronghold of Fallujah on Tuesday, fighting fierce street battles and conducting house-to-house searches on the second day of a major assault to retake the city from Islamic militants.",World,1,0.8605717
5360," KATHMANDU (Reuters) - A bomb tore through a government  building under construction in the Nepali capital on Tuesday,  wounding at least 38 people in an attack police suspect was  carried out by Maoist rebels.",World,1,0.7961396
5429,"AFP - An Italian aid worker walked free from the southern Philippines jungle, a day after he was abducted by local gunmen.",World,1,0.76945907
5441,"Iran will pull out of the nuclear Non-Proliferation Treaty (NPT) and develop its atomic programme in secret if Western nations threaten or put pressure on Tehran, a senior Iran diplomat was quoted as saying on Wednesday.",World,1,0.7882705
5445,"France and the United Nations began evacuating thousands of French and other expatriates Wednesday trapped at U.N. offices and a French military base amid days of anti-foreigner rampages in Ivory Coast's largest city, French and U.N. officials said.",World,1,0.8173004
5471,"BEIRUT, Lebanon - Yasser Arafat promised Palestinians he would return them to the homes they lost when Israel was founded in 1948.",World,1,0.85392743
5520,"Yasser Arafat, who triumphantly forced his peoples plight into the world spotlight but failed to achieve his lifelong quest for Palestinian statehood, died today, aged 75, Palestinian Cabinet minister Saeb Erekat confirmed.",World,1,0.82670045
5550,AP - Dutch lawmakers accused the government Thursday of underestimating the threat from Islamic terrorists and failing to protect a filmmaker slain by a suspected Muslim radical.,World,1,0.83925116
5564,The death of Palestinian leader Yasser Arafat is deeply dividing an already torn Middle Eastern country. As Palestinians mourn the loss of their leader ,World,1,0.83991444
5566," JAKARTA (Reuters) - An earthquake measuring 6.0 on the  Richter scale shook an island in eastern Indonesia on Friday,  killing six people and injuring at least six more, a government  official said.",World,1,0.78823787
5630,"Tens of thousands of civilians are confined to their houses in Fallujah and may be in need of humanitarian aid as US and Iraqi forces battle insurgents for control of the city, according to Iraq #39;s Islamic Party.",World,1,0.8778515
5655," NANO, Pakistan (Reuters) - Pakistani forces are driving al  Qaeda-linked militants out of mountains near the Afghan border  but attacks such as a bomb that wounded soldiers on Saturday  could not be ruled out, a commander said.",World,1,0.8177159
5710,"AP - Iran has agreed to fully suspend uranium enrichment and linked activities that Washington asserts are part of a nuclear weapons program, diplomats said Sunday.",World,1,0.8125809
5716,"AP - Mahmoud Abbas, the temporary successor to Yasser Arafat, escaped unharmed Sunday when militants firing assault rifles burst into a mourning tent for the deceased Palestinian leader, killing two security guards and wounding six other people.",World,1,0.8242031
5743,"WASHINGTON -- Iran pledged yesterday to temporarily suspend its uranium enrichment program in an attempt to ease suspicions that it is trying to develop nuclear weapons. The move could defuse a longstanding showdown with the United States over Iran's nuclear activities, diplomats said.",World,1,0.78966844
5770,"Iran has agreed to suspend its uranium enrichment programme in an attempt to ease concerns that its nuclear programme is aimed at developing weapons, a Western diplomat close to the United Nations said today.",World,1,0.78359634
5778,Fierce battles between insurgents and US and Iraqi forces killed at least 27 people today in Baqouba and south of Baghdad as US forces move against the last remaining pockets of resistance in Fallujah.,World,1,0.8284478
5805,A rebel counteroffensive swept through central and northern Iraq on Monday as American troops struggled to flush the remaining insurgents from the rubble-strewn streets of Falluja.,World,1,0.8570492
5827,"On the eve of a high-profile UN Security Council visit to Nairobi, members are split over a draft resolution on atrocities in Sudan #39;s western Darfur region.",World,1,0.85855395
5878,"ARIEL SHARON, the Israeli Prime Minister, made his first conciliatory gesture towards Palestinians after the death of Yassir Arafat when he said that he would consider co-ordinating the dismantling of Jewish settlements in the Gaza Strip with a new ",World,1,0.7714531
5897,"Australia #39;s Foreign Minister, Alexander Downer, says the apparent murder in Iraq of aid worker, Margaret Hassan, is a heinous and inexcusable crime.",World,1,0.81161463
5913,"MOSUL, Iraq -- US and Iraqi troops stormed insurgent-held police stations and neighborhoods in this northern city Tuesday, retaking a number of sites seized last week by gunmen who rose up in support of militants in Fallujah.",World,1,0.8307798
5951,"UN Security Council members have arrived in Nairobi for a two-day meeting devoted to the conflicts engulfing Sudan, including the western Darfur region.",World,1,0.78874487
5961,THE Palestinian Authority is to set up an official commission of inquiry into Yasser Arafats death amid increasing rumours among the Palestinian public that he was poisoned by Israel.,World,1,0.86226237
5989,"JERUSALEM A preliminary Israeli army investigation has found that Israeli troops apparently killed three Egyptian soldiers by mistake, thinking they were Palestinian militants along the Gaza-Egypt border.",World,1,0.9231244
5991,"An Israeli tank has opened fire and killed three Egyptian troops in a border zone near the Gaza Strip after mistaking them for Palestinian arms smugglers, Israeli security sources say.",World,1,0.8650075
5992,"AFP - Three Egyptian policemen were killed overnight by Israeli tank fire on the tense border between Egypt and the Gaza Strip when they were mistaken for Palestinian arms smugglers, officials said.",World,1,0.8913079
6002,"President Thabo Mbeki has urged all countries, including Ivory Coast #39;s neighbours, to immediately enforce a United Nations arms embargo on government and rebel forces in Ivory Coast.",World,1,0.7858749
6032,"The Israeli prime minister, Ariel Sharon, apologized to Egypt today after an Israeli army tank crew fired on an Egyptian patrol near the border with Gaza, killing three Egyptian police officers.",World,1,0.88877785
6048,Sponsors of an internationally backed Mideast peace plan will send their foreign ministers to the region next week in hopes of restarting Israeli-Palestinian talks in the wake of Yasser Arafat #39;s death.,World,1,0.79562587
6075,"JERUSALEM -- Israeli troops mistook three Egyptian police officers for Palestinian militants and shot them dead yesterday along the Gaza Strip's border with Egypt, increasing tensions between the neighbors.",World,1,0.8071509
6107,"AFP - Pakistani security forces have arrested a key Al-Qaeda operative wanted in connection with attacks on Christian targets and a failed bid to kill President Pervez Musharraf, an official said.",World,1,0.8857704
6166,"BAGHDAD, IRAQ - Insurgents continued to strike against coalition targets in Iraq Saturday, resulting in the deaths of one US soldier and four government employees in Baghdad.",World,1,0.8357931
6211,"PARIS - Nasser al-Kidwa, nephew of the deceased Palestinian leader Yasser Arafat, arrived in Paris from Cairo Sunday to pick up a copy of Arafat #39;s medical records.",World,1,0.7813604
6213,US Secretary of State Colin Powell has launched a new Middle East peace drive by saying he will press both Israeli and Palestinian leaders for steps to help Palestinians elect a successor to Yasser Arafat.,World,1,0.95209646
6239,\US and Afghan forces raid houses in Kabul as part of a hunt for three UN workers kidnapped last month.,World,1,0.7913044
6254,"CBN.com - (CBN News) -ERUSALEM  -h the death of Yasser Arafat behind them, the Palestinians and Israelis are now facing an historic opportunity to move forward in peace.",World,1,0.81490314
6305," GAZA (Reuters) - Israeli soldiers shot dead five  Palestinians in north Gaza on Tuesday after mortar fire from  Palestinian militants wounded two people in a nearby Jewish  settlement, medics on both sides said.",World,1,0.85264444
6334," SEOUL (Reuters) - North Korea gave a visiting U.N. official  a ""very positive message"" about resuming stalled six-way talks  on its nuclear programs, the South Korean Unification Ministry  said Wednesday.",World,1,0.7722164
6377,"QUETTA, Pakistan - A bomb fixed to a bicycle killed one man and injured 15 people in southwestern Pakistans restive desert province of Baluchistan on Thursday, police said.",World,1,0.78395194
6384,UK Foreign Secretary Jack Straw lays a wreath at the grave of former Palestinian Leader Yasser Arafat.,World,1,0.90338415
6403,Canadian Press - OTTAWA (CP) - Deputy prime minister Anne McLellan has applauded the intervention of Ukraine's supreme court in that country's disputed presidential election.,World,1,0.82930374
6413,"DAMASCUS, Syria - Syrian President Bashar Assad is ready to resume peace talks with Israel  quot;without conditions, quot; a top UN envoy said yesterday.",World,1,0.8385919
6417,"WASHINGTON: A US State Department official who worked with the Iraqi ministers of education and higher education was murdered in Baghdad by a group linked to Abu Musab al-Zarqawi, the group claimed on Thursday.",World,1,0.7844662
6434,"A lieutenant of Iraq's most feared insurgent leader, Abu Musab Zarqawi, was captured this week, the country's national security minister said Thursday.",World,1,0.84745485
6441,Iran #39;s chief negotiator to the United Nations nuclear agency says Tehran is committed to the freeze on uranium enrichment agreed earlier this month.,World,1,0.79933244
6526,"Reuters - The leader of Sinn Fein, Northern\Ireland's main Catholic party and the political ally of the\Irish Republican Army (IRA), said Sunday he believed his\Protestant rivals were ready to agree to a peace deal.",World,1,0.78079
